chapter,verse,text
4,30,ΚΑΙ ΕΛΕΓΕΝ ΠΩΣ ΟΜΟΙΩΣΩΜΕΝ ΤΗΝ ΒΑΣΙΛΕΙΑΝ ΤΟΥ ΘΕΟΥ Η ΕΝ ΤΙΝΙ ΑΥΤΗΝ ΠΑΡΑΒΟΛΗΙ ΘΩΜΕΝ
4,31,ΩΣ ΚΟΚΚΩΙ ΣΙΝΑΠΕΩΣ ΟΣ ΟΤΑΝ ΣΠΑΡΗΙ ΕΠΙ ΤΗΣ ΓΗΣ ΜΙΚΡΟΤΕΡΟΝ ΟΝ ΠΑΝΤΩΝ ΤΩΝ ΣΠΕΡΜΑΤΩΝ ΤΩΝ ΕΠΙ ΤΗΣ ΓΗΣ
4,32,ΚΑΙ ΟΤΑΝ ΣΠΑΡΗΙ ΑΝΑΒΑΙΝΕΙ ΚΑΙ ΓΙΝΕΤΑΙ ΜΕΙΖΟΝ ΠΑΝΤΩΝ ΤΩΝ ΛΑΧΑΝΩΝ ΚΑΙ ΠΟΙΕΙ ΚΛΑΔΟΥΣ ΜΕΓΑΛΟΥΣ ΩΣΤΕ ΔΥΝΑΣΘΑΙ ΥΠΟ ΤΗΝ ΣΚΙΑΝ ΑΥΤΟΥ ΤΑ ΠΕΤΕΙΝΑ ΤΟΥ ΟΥΡΑΝΟΥ ΚΑΤΑΣΚΗΝΟΥΝ
4,33,ΚΑΙ ΤΟΙΑΥΤΑΙΣ ΠΑΡΑΒΟΛΑΙΣ ΠΟΛΛΑΙΣ ΕΛΑΛΕΙ ΑΥΤΟΙΣ ΤΟΝ ΛΟΓΟΝ ΚΑΘΩΣ ΗΔΥΝΑΝΤΟ ΑΚΟΥΕΙΝ
4,34,ΧΩΡΙΣ ΔΕ ΠΑΡΑΒΟΛΗΣ ΟΥΚ ΕΛΑΛΕΙ ΑΥΤΟΙΣ ΚΑΤΑ ΙΔΙΑΝ ΔΕ ΤΟΙΣ ΙΔΙΟΙΣ ΜΑΘΗΤΑΙΣ ΕΠΕΛΥΕΝ ΠΑΝΤΑ
4,35,ΚΑΙ ΛΕΓΕΙ ΑΥΤΟΙΣ ΕΝ ΕΚΕΙΝΗΙ ΤΗΙ ΗΜΕΡΑΙ ΟΨΙΑΣ ΓΕΝΟΜΕΝΗΣ ΔΙΕΛΘΩΜΕΝ ΕΙΣ ΤΟ ΠΕΡΑΝ
4,36,ΚΑΙ ΑΦΕΝΤΕΣ ΤΟΝ ΟΧΛΟΝ ΠΑΡΑΛΑΜΒΑΝΟΥΣΙΝ ΑΥΤΟΝ ΩΣ ΗΝ ΕΝ ΤΩΙ ΠΛΟΙΩΙ ΚΑΙ ΑΛΛΑ ΠΛΟΙΑ ΗΝ ΜΕΤΑ ΑΥΤΟΥ
4,37,ΚΑΙ ΓΙΝΕΤΑΙ ΛΑΙΛΑΨ ΜΕΓΑΛΗ ΑΝΕΜΟΥ ΚΑΙ ΤΑ ΚΥΜΑΤΑ ΕΠΕΒΑΛΛΕΝ ΕΙΣ ΤΟ ΠΛΟΙΟΝ ΩΣΤΕ ΗΔΗ ΓΕΜΙΖΕΣΘΑΙ ΤΟ ΠΛΟΙΟΝ
4,38,ΚΑΙ ΑΥΤΟΣ ΗΝ ΕΝ ΤΗΙ ΠΡΥΜΝΗΙ ΕΠΙ ΤΟ ΠΡΟΣΚΕΦΑΛΑΙΟΝ ΚΑΘΕΥΔΩΝ ΚΑΙ ΕΓΕΙΡΟΥΣΙΝ ΑΥΤΟΝ ΚΑΙ ΛΕΓΟΥΣΙΝ ΑΥΤΩΙ ΔΙΔΑΣΚΑΛΕ ΟΥ ΜΕΛΕΙ ΣΟΙ ΟΤΙ ΑΠΟΛΛΥΜΕΘΑ
4,39,ΚΑΙ ΔΙΕΓΕΡΘΕΙΣ ΕΠΕΤΙΜΗΣΕΝ ΤΩΙ ΑΝΕΜΩΙ ΚΑΙ ΕΙΠΕΝ ΤΗΙ ΘΑΛΑΣΣΗΙ ΣΙΩΠΑ ΠΕΦΙΜΩΣΟ ΚΑΙ ΕΚΟΠΑΣΕΝ Ο ΑΝΕΜΟΣ ΚΑΙ ΕΓΕΝΕΤΟ ΓΑΛΗΝΗ ΜΕΓΑΛΗ
4,40,ΚΑΙ ΕΙΠΕΝ ΑΥΤΟΙΣ ΤΙ ΔΕΙΛΟΙ ΕΣΤΕ ΟΥΠΩ ΕΧΕΤΕ ΠΙΣΤΙΝ
4,41,ΚΑΙ ΕΦΟΒΗΘΗΣΑΝ ΦΟΒΟΝ ΜΕΓΑΝ ΚΑΙ ΕΛΕΓΟΝ ΠΡΟΣ ΑΛΛΗΛΟΥΣ ΤΙΣ ΑΡΑ ΟΥΤΟΣ ΕΣΤΙΝ ΟΤΙ ΚΑΙ Ο ΑΝΕΜΟΣ ΚΑΙ Η ΘΑΛΑΣΣΑ ΥΠΑΚΟΥΕΙ ΑΥΤΩΙ
5,1,ΚΑΙ ΗΛΘΟΝ ΕΙΣ ΤΟ ΠΕΡΑΝ ΤΗΣ ΘΑΛΑΣΣΗΣ ΕΙΣ ΤΗΝ ΧΩΡΑΝ ΤΩΝ ΓΕΡΑΣΗΝΩΝ
5,2,ΚΑΙ ΕΞΕΛΘΟΝΤΟΣ ΑΥΤΟΥ ΕΚ ΤΟΥ ΠΛΟΙΟΥ ΕΥΘΥΣ ΥΠΗΝΤΗΣΕΝ ΑΥΤΩΙ ΕΚ ΤΩΝ ΜΝΗΜΕΙΩΝ ΑΝΘΡΩΠΟΣ ΕΝ ΠΝΕΥΜΑΤΙ ΑΚΑΘΑΡΤΩΙ
5,3,ΟΣ ΤΗΝ ΚΑΤΟΙΚΗΣΙΝ ΕΙΧΕΝ ΕΝ ΤΟΙΣ ΜΝΗΜΑΣΙΝ ΚΑΙ ΟΥΔΕ ΑΛΥΣΕΙ ΟΥΚΕΤΙ ΟΥΔΕΙΣ ΕΔΥΝΑΤΟ ΑΥΤΟΝ ΔΗΣΑΙ
5,4,ΔΙΑ ΤΟ ΑΥΤΟΝ ΠΟΛΛΑΚΙΣ ΠΕΔΑΙΣ ΚΑΙ ΑΛΥΣΕΣΙ ΔΕΔΕΣΘΑΙ ΚΑΙ ΔΙΕΣΠΑΣΘΑΙ ΥΠΟ ΑΥΤΟΥ ΤΑΣ ΑΛΥΣΕΙΣ ΚΑΙ ΤΑΣ ΠΕΔΑΣ ΣΥΝΤΕΤΡΙΦΘΑΙ ΚΑΙ ΟΥΔΕΙΣ ΙΣΧΥΕΝ ΑΥΤΟΝ ΔΑΜΑΣΑΙ
5,5,ΚΑΙ ΔΙΑ ΠΑΝΤΟΣ ΝΥΚΤΟΣ ΚΑΙ ΗΜΕΡΑΣ ΕΝ ΤΟΙΣ ΜΝΗΜΑΣΙΝ ΚΑΙ ΕΝ ΤΟΙΣ ΟΡΕΣΙΝ ΗΝ ΚΡΑΖΩΝ ΚΑΙ ΚΑΤΑΚΟΠΤΩΝ ΕΑΥΤΟΝ ΛΙΘΟΙΣ
5,6,ΚΑΙ ΙΔΩΝ ΤΟΝ ΙΗΣΟΥΝ ΑΠΟ ΜΑΚΡΟΘΕΝ ΕΔΡΑΜΕΝ ΚΑΙ ΠΡΟΣΕΚΥΝΗΣΕΝ ΑΥΤΩΙ
5,7,ΚΑΙ ΚΡΑΞΑΣ ΦΩΝΗΙ ΜΕΓΑΛΗΙ ΛΕΓΕΙ ΤΙ ΕΜΟΙ ΚΑΙ ΣΟΙ ΙΗΣΟΥ ΥΙΕ ΤΟΥ ΘΕΟΥ ΤΟΥ ΥΨΙΣΤΟΥ ΟΡΚΙΖΩ ΣΕ ΤΟΝ ΘΕΟΝ ΜΗ ΜΕ ΒΑΣΑΝΙΣΗΙΣ
5,8,ΕΛΕΓΕΝ ΓΑΡ ΑΥΤΩΙ ΕΞΕΛΘΕ ΤΟ ΠΝΕΥΜΑ ΤΟ ΑΚΑΘΑΡΤΟΝ ΕΚ ΤΟΥ ΑΝΘΡΩΠΟΥ
5,9,ΚΑΙ ΕΠΗΡΩΤΑ ΑΥΤΟΝ ΤΙ ΟΝΟΜΑ ΣΟΙ ΚΑΙ ΛΕΓΕΙ ΑΥΤΩΙ ΛΕΓΙΩΝ ΟΝΟΜΑ ΜΟΙ ΟΤΙ ΠΟΛΛΟΙ ΕΣΜΕΝ
5,10,ΚΑΙ ΠΑΡΕΚΑΛΕΙ ΑΥΤΟΝ ΠΟΛΛΑ ΙΝΑ ΜΗ ΑΥΤΑ ΑΠΟΣΤΕΙΛΗΙ ΕΞΩ ΤΗΣ ΧΩΡΑΣ
5,11,ΗΝ ΔΕ ΕΚΕΙ ΠΡΟΣ ΤΩΙ ΟΡΕΙ ΑΓΕΛΗ ΧΟΙΡΩΝ ΜΕΓΑΛΗ ΒΟΣΚΟΜΕΝΗ
5,12,ΚΑΙ ΠΑΡΕΚΑΛΕΣΑΝ ΑΥΤΟΝ ΛΕΓΟΝΤΕΣ ΠΕΜΨΟΝ ΗΜΑΣ ΕΙΣ ΤΟΥΣ ΧΟΙΡΟΥΣ ΙΝΑ ΕΙΣ ΑΥΤΟΥΣ ΕΙΣΕΛΘΩΜΕΝ
5,13,ΚΑΙ ΕΠΕΤΡΕΨΕΝ ΑΥΤΟΙΣ ΚΑΙ ΕΞΕΛΘΟΝΤΑ ΤΑ ΠΝΕΥΜΑΤΑ ΤΑ ΑΚΑΘΑΡΤΑ ΕΙΣΗΛΘΟΝ ΕΙΣ ΤΟΥΣ ΧΟΙΡΟΥΣ ΚΑΙ ΩΡΜΗΣΕΝ Η ΑΓΕΛΗ ΚΑΤΑ ΤΟΥ ΚΡΗΜΝΟΥ ΕΙΣ ΤΗΝ ΘΑΛΑΣΣΑΝ ΩΣ ΔΙΣΧΙΛΙΟΙ ΚΑΙ ΕΠΝΙΓΟΝΤΟ ΕΝ ΤΗΙ ΘΑΛΑΣΣΗΙ
5,14,ΚΑΙ ΟΙ ΒΟΣΚΟΝΤΕΣ ΑΥΤΟΥΣ ΕΦΥΓΟΝ ΚΑΙ ΑΠΗΓΓΕΙΛΑΝ ΕΙΣ ΤΗΝ ΠΟΛΙΝ ΚΑΙ ΕΙΣ ΤΟΥΣ ΑΓΡΟΥΣ ΚΑΙ ΕΞΗΛΘΟΝ ΙΔΕΙΝ ΤΙ ΕΣΤΙΝ ΤΟ ΓΕΓΟΝΟΣ
5,15,ΚΑΙ ΕΡΧΟΝΤΑΙ ΠΡΟΣ ΤΟΝ ΙΗΣΟΥΝ ΚΑΙ ΘΕΩΡΟΥΣΙΝ ΤΟΝ ΔΑΙΜΟΝΙΖΟΜΕΝΟΝ ΚΑΘΗΜΕΝΟΝ ΙΜΑΤΙΣΜΕΝΟΝ ΚΑΙ ΣΩΦΡΟΝΟΥΝΤΑ ΤΟΝ ΕΣΧΗΚΟΤΑ ΤΟΝ ΛΕΓΕΩΝΑ ΚΑΙ ΕΦΟΒΗΘΗΣΑΝ
5,16,ΚΑΙ ΔΙΗΓΗΣΑΝΤΟ ΑΥΤΟΙΣ ΟΙ ΙΔΟΝΤΕΣ ΠΩΣ ΕΓΕΝΕΤΟ ΤΩΙ ΔΑΙΜΟΝΙΖΟΜΕΝΩΙ ΚΑΙ ΠΕΡΙ ΤΩΝ ΧΟΙΡΩΝ
5,17,ΚΑΙ ΗΡΞΑΝΤΟ ΠΑΡΑΚΑΛΕΙΝ ΑΥΤΟΝ ΑΠΕΛΘΕΙΝ ΑΠΟ ΤΩΝ ΟΡΙΩΝ ΑΥΤΩΝ
5,18,ΚΑΙ ΕΜΒΑΙΝΟΝΤΟΣ ΑΥΤΟΥ ΕΙΣ ΤΟ ΠΛΟΙΟΝ ΠΑΡΕΚΑΛΕΙ ΑΥΤΟΝ Ο ΔΑΙΜΟΝΙΣΘΕΙΣ ΙΝΑ ΜΕΤΑ ΑΥΤΟΥ ΗΙ
5,19,ΚΑΙ ΟΥΚ ΑΦΗΚΕΝ ΑΥΤΟΝ ΑΛΛΑ ΛΕΓΕΙ ΑΥΤΩΙ ΥΠΑΓΕ ΕΙΣ ΤΟΝ ΟΙΚΟΝ ΣΟΥ ΠΡΟΣ ΤΟΥΣ ΣΟΥΣ ΚΑΙ ΑΠΑΓΓΕΙΛΟΝ ΑΥΤΟΙΣ ΟΣΑ Ο ΚΥΡΙΟΣ ΣΟΙ ΠΕΠΟΙΗΚΕΝ ΚΑΙ ΗΛΕΗΣΕΝ ΣΕ
5,20,ΚΑΙ ΑΠΗΛΘΕΝ ΚΑΙ ΗΡΞΑΤΟ ΚΗΡΥΣΣΕΙΝ ΕΝ ΤΗΙ ΔΕΚΑΠΟΛΕΙ ΟΣΑ ΕΠΟΙΗΣΕΝ ΑΥΤΩΙ Ο ΙΗΣΟΥΣ ΚΑΙ ΠΑΝΤΕΣ ΕΘΑΥΜΑΖΟΝ
5,21,ΚΑΙ ΔΙΑΠΕΡΑΣΑΝΤΟΣ ΤΟΥ ΙΗΣΟΥ ΕΝ ΤΩΙ ΠΛΟΙΩΙ ΠΑΛΙΝ ΕΙΣ ΤΟ ΠΕΡΑΝ ΣΥΝΗΧΘΗ ΟΧΛΟΣ ΠΟΛΥΣ ΕΠΙ ΑΥΤΟΝ ΚΑΙ ΗΝ ΠΑΡΑ ΤΗΝ ΘΑΛΑΣΣΑΝ
5,22,ΚΑΙ ΙΔΟΥ ΕΡΧΕΤΑΙ ΕΙΣ ΤΩΝ ΑΡΧΙΣΥΝΑΓΩΓΩΝ ΟΝΟΜΑΤΙ ΙΑΕΙΡΟΣ ΚΑΙ ΙΔΩΝ ΑΥΤΟΝ ΠΙΠΤΕΙ ΠΡΟΣ ΤΟΥΣ ΠΟΔΑΣ ΑΥΤΟΥ
5,23,ΚΑΙ ΠΑΡΑΚΑΛΕΙ ΑΥΤΟΝ ΠΟΛΛΑ ΛΕΓΩΝ ΟΤΙ ΤΟ ΘΥΓΑΤΡΙΟΝ ΜΟΥ ΕΣΧΑΤΩΣ ΕΧΕΙ ΙΝΑ ΕΛΘΩΝ ΕΠΙΘΗΙΣ ΤΑΣ ΧΕΙΡΑΣ ΑΥΤΗΙ ΙΝΑ ΣΩΘΗΙ ΚΑΙ ΖΗΣΗΙ
5,24,ΚΑΙ ΑΠΗΛΘΕΝ ΜΕΤΑ ΑΥΤΟΥ ΚΑΙ ΗΚΟΛΟΥΘΕΙ ΑΥΤΩΙ ΟΧΛΟΣ ΠΟΛΥΣ ΚΑΙ ΣΥΝΕΘΛΙΒΟΝ ΑΥΤΟΝ
5,25,ΚΑΙ ΓΥΝΗ ΟΥΣΑ ΕΝ ΡΥΣΕΙ ΑΙΜΑΤΟΣ ΔΩΔΕΚΑ ΕΤΗ
5,26,ΚΑΙ ΠΟΛΛΑ ΠΑΘΟΥΣΑ ΥΠΟ ΠΟΛΛΩΝ ΙΑΤΡΩΝ ΚΑΙ ΔΑΠΑΝΗΣΑΣΑ ΤΑ ΠΑΡΑ ΕΑΥΤΗΣ ΠΑΝΤΑ ΚΑΙ ΜΗΔΕΝ ΩΦΕΛΗΘΕΙΣΑ ΑΛΛΑ ΜΑΛΛΟΝ ΕΙΣ ΤΟ ΧΕΙΡΟΝ ΕΛΘΟΥΣΑ
5,27,ΑΚΟΥΣΑΣΑ ΤΑ ΠΕΡΙ ΤΟΥ ΙΗΣΟΥ ΕΛΘΟΥΣΑ ΕΝ ΤΩΙ ΟΧΛΩΙ ΟΠΙΣΘΕΝ ΗΨΑΤΟ ΤΟΥ ΙΜΑΤΙΟΥ ΑΥΤΟΥ
5,28,ΕΛΕΓΕΝ ΓΑΡ ΟΤΙ ΕΑΝ ΑΨΩΜΑΙ ΚΑΝ ΤΩΝ ΙΜΑΤΙΩΝ ΑΥΤΟΥ ΣΩΘΗΣΟΜΑΙ
5,29,ΚΑΙ ΕΥΘΥΣ ΕΞΗΡΑΝΘΗ Η ΠΗΓΗ ΤΟΥ ΑΙΜΑΤΟΣ ΑΥΤΗΣ ΚΑΙ ΕΓΝΩ ΤΩΙ ΣΩΜΑΤΙ ΟΤΙ ΙΑΤΑΙ ΑΠΟ ΤΗΣ ΜΑΣΤΙΓΟΣ
5,30,ΚΑΙ ΕΥΘΥΣ Ο ΙΗΣΟΥΣ ΕΠΙΓΝΟΥΣ ΕΝ ΕΑΥΤΩΙ ΤΗΝ ΕΞ ΑΥΤΟΥ ΔΥΝΑΜΙΝ ΕΞΕΛΘΟΥΣΑΝ ΕΠΙΣΤΡΑΦΕΙΣ ΕΝ ΤΩΙ ΟΧΛΩΙ ΕΛΕΓΕΝ ΤΙΣ ΜΟΥ ΗΨΑΤΟ ΤΩΝ ΙΜΑΤΙΩΝ
5,31,ΚΑΙ ΕΛΕΓΟΝ ΑΥΤΩΙ ΟΙ ΜΑΘΗΤΑΙ ΑΥΤΟΥ ΒΛΕΠΕΙΣ ΤΟΝ ΟΧΛΟΝ ΣΥΝΘΛΙΒΟΝΤΑ ΣΕ ΚΑΙ ΛΕΓΕΙΣ ΤΙΣ ΜΟΥ ΗΨΑΤΟ
5,32,ΚΑΙ ΠΕΡΙΕΒΛΕΠΕΤΟ ΙΔΕΙΝ ΤΗΝ ΤΟΥΤΟ ΠΟΙΗΣΑΣΑΝ
5,33,Η ΔΕ ΓΥΝΗ ΦΟΒΗΘΕΙΣΑ ΚΑΙ ΤΡΕΜΟΥΣΑ ΕΙΔΥΙΑ Ο ΓΕΓΟΝΕΝ ΑΥΤΗΙ ΗΛΘΕΝ ΚΑΙ ΠΡΟΣΕΠΕΣΕΝ ΑΥΤΩΙ ΚΑΙ ΕΙΠΕΝ ΑΥΤΩΙ ΠΑΣΑΝ ΤΗΝ ΑΛΗΘΕΙΑΝ
5,34,Ο ΔΕ ΕΙΠΕΝ ΑΥΤΗΙ ΘΥΓΑΤΗΡ Η ΠΙΣΤΙΣ ΣΟΥ ΣΕΣΩΚΕΝ ΣΕ ΥΠΑΓΕ ΕΙΣ ΕΙΡΗΝΗΝ ΚΑΙ ΙΣΘΙ ΥΓΙΗΣ ΑΠΟ ΤΗΣ ΜΑΣΤΙΓΟΣ ΣΟΥ
5,35,ΕΤΙ ΑΥΤΟΥ ΛΑΛΟΥΝΤΟΣ ΕΡΧΟΝΤΑΙ ΑΠΟ ΤΟΥ ΑΡΧΙΣΥΝΑΓΩΓΟΥ ΛΕΓΟΝΤΕΣ ΟΤΙ Η ΘΥΓΑΤΗΡ ΣΟΥ ΑΠΕΘΑΝΕΝ ΤΙ ΕΤΙ ΣΚΥΛΛΕΙΣ ΤΟΝ ΔΙΔΑΣΚΑΛΟΝ
5,36,Ο ΔΕ ΙΗΣΟΥΣ ΠΑΡΑΚΟΥΣΑΣ ΤΟΝ ΛΟΓΟΝ ΛΑΛΟΥΜΕΝΟΝ ΛΕΓΕΙ ΤΩΙ ΑΡΧΙΣΥΝΑΓΩΓΩΙ ΜΗ ΦΟΒΟΥ ΜΟΝΟΝ ΠΙΣΤΕΥΕ
5,37,ΚΑΙ ΟΥΚ ΑΦΗΚΕΝ ΟΥΔΕΝΑ ΜΕΤΑ ΑΥΤΟΥ ΣΥΝΑΚΟΛΟΥΘΗΣΑΙ ΕΙ ΜΗ ΤΟΝ ΠΕΤΡΟΝ ΚΑΙ ΙΑΚΩΒΟΝ ΚΑΙ ΙΩΑΝΝΗΝ ΤΟΝ ΑΔΕΛΦΟΝ ΙΑΚΩΒΟΥ
5,38,ΚΑΙ ΕΡΧΟΝΤΑΙ ΕΙΣ ΤΟΝ ΟΙΚΟΝ ΤΟΥ ΑΡΧΙΣΥΝΑΓΩΓΟΥ ΚΑΙ ΘΕΩΡΕΙ ΘΟΡΥΒΟΝ ΚΑΙ ΚΛΑΙΟΝΤΑΣ ΚΑΙ ΑΛΑΛΑΖΟΝΤΑΣ ΠΟΛΛΑ
5,39,ΚΑΙ ΕΙΣΕΛΘΩΝ ΛΕΓΕΙ ΑΥΤΟΙΣ ΤΙ ΘΟΡΥΒΕΙΣΘΕ ΚΑΙ ΚΛΑΙΕΤΕ ΤΟ ΠΑΙΔΙΟΝ ΟΥΚ ΑΠΕΘΑΝΕΝ ΑΛΛΑ ΚΑΘΕΥΔΕΙ
5,40,ΚΑΙ ΚΑΤΕΓΕΛΩΝ ΑΥΤΟΥ ΑΥΤΟΣ ΔΕ ΕΚΒΑΛΩΝ ΠΑΝΤΑΣ ΠΑΡΑΛΑΜΒΑΝΕΙ ΤΟΝ ΠΑΤΕΡΑ ΤΟΥ ΠΑΙΔΙΟΥ ΚΑΙ ΤΗΝ ΜΗΤΕΡΑ ΚΑΙ ΤΟΥΣ ΜΕΤΑ ΑΥΤΟΥ ΚΑΙ ΕΙΣΠΟΡΕΥΕΤΑΙ ΟΠΟΥ ΗΝ ΤΟ ΠΑΙΔΙΟΝ
5,41,ΚΑΙ ΚΡΑΤΗΣΑΣ ΤΗΣ ΧΕΙΡΟΣ ΤΟΥ ΠΑΙΔΙΟΥ ΛΕΓΕΙ ΑΥΤΗΙ ΤΑΛΙΘΑ ΚΟΥΜ Ο ΕΣΤΙΝ ΜΕΘΕΡΜΗΝΕΥΟΜΕΝΟΝ ΤΟ ΚΟΡΑΣΙΟΝ ΣΟΙ ΛΕΓΩ ΕΓΕΙΡΕ
5,42,ΚΑΙ ΕΥΘΥΣ ΑΝΕΣΤΗ ΤΟ ΚΟΡΑΣΙΟΝ ΚΑΙ ΠΕΡΙΕΠΑΤΕΙ ΗΝ ΓΑΡ ΕΤΩΝ ΔΩΔΕΚΑ ΚΑΙ ΕΞΕΣΤΗΣΑΝ ΕΥΘΥΣ ΕΚΣΤΑΣΕΙ ΜΕΓΑΛΗΙ
5,43,ΚΑΙ ΔΙΕΣΤΕΙΛΑΤΟ ΑΥΤΟΙΣ ΠΟΛΛΑ ΙΝΑ ΜΗΔΕΙΣ ΓΝΟΙ ΤΟΥΤΟ ΚΑΙ ΕΙΠΕΝ ΔΟΘΗΝΑΙ ΑΥΤΗΙ ΦΑΓΕΙΝ
6,1,ΚΑΙ ΕΞΗΛΘΕΝ ΕΚΕΙΘΕΝ ΚΑΙ ΕΡΧΕΤΑΙ ΕΙΣ ΤΗΝ ΠΑΤΡΙΔΑ ΑΥΤΟΥ ΚΑΙ ΑΚΟΛΟΥΘΟΥΣΙΝ ΑΥΤΩΙ ΟΙ ΜΑΘΗΤΑΙ ΑΥΤΟΥ
6,2,ΚΑΙ ΓΕΝΟΜΕΝΟΥ ΣΑΒΒΑΤΟΥ ΗΡΞΑΤΟ ΔΙΔΑΣΚΕΙΝ ΕΝ ΤΗΙ ΣΥΝΑΓΩΓΗΙ ΚΑΙ ΟΙ ΠΟΛΛΟΙ ΑΚΟΥΟΝΤΕΣ ΕΞΕΠΛΗΣΣΟΝΤΟ ΛΕΓΟΝΤΕΣ ΠΟΘΕΝ ΤΟΥΤΩΙ ΤΑΥΤΑ ΚΑΙ ΤΙΣ Η ΣΟΦΙΑ Η ΔΟΘΕΙΣΑ ΤΟΥΤΩΙ ΚΑΙ ΑΙ ΔΥΝΑΜΕΙΣ ΤΟΙΑΥΤΑΙ ΔΙΑ ΤΩΝ ΧΕΙΡΩΝ ΑΥΤΟΥ ΓΙΝΟΜΕΝΑΙ
6,3,ΟΥΧ ΟΥΤΟΣ ΕΣΤΙΝ Ο ΤΕΚΤΩΝ Ο ΥΙΟΣ ΤΗΣ ΜΑΡΙΑΣ ΚΑΙ ΑΔΕΛΦΟΣ ΙΑΚΩΒΟΥ ΚΑΙ ΙΩΣΗΤΟΣ ΚΑΙ ΙΟΥΔΑ ΚΑΙ ΣΙΜΩΝΟΣ ΚΑΙ ΟΥΚ ΕΙΣΙΝ ΑΙ ΑΔΕΛΦΑΙ ΑΥΤΟΥ ΩΔΕ ΠΡΟΣ ΗΜΑΣ ΚΑΙ ΕΣΚΑΝΔΑΛΙΖΟΝΤΟ ΕΝ ΑΥΤΩΙ
6,4,ΚΑΙ ΕΛΕΓΕΝ ΑΥΤΟΙΣ Ο ΙΗΣΟΥΣ ΟΤΙ ΟΥΚ ΕΣΤΙΝ ΠΡΟΦΗΤΗΣ ΑΤΙΜΟΣ ΕΙ ΜΗ ΕΝ ΤΗΙ ΠΑΤΡΙΔΙ ΑΥΤΟΥ ΚΑΙ ΕΝ ΤΟΙΣ ΣΥΓΓΕΝΕΥΣΙΝ ΑΥΤΟΥ ΚΑΙ ΕΝ ΤΗΙ ΟΙΚΙΑΙ ΑΥΤΟΥ
6,5,ΚΑΙ ΟΥΚ ΕΔΥΝΑΤΟ ΕΚΕΙ ΠΟΙΗΣΑΙ ΟΥΔΕΜΙΑΝ ΔΥΝΑΜΙΝ ΕΙ ΜΗ ΟΛΙΓΟΙΣ ΑΡΡΩΣΤΟΙΣ ΕΠΙΘΕΙΣ ΤΑΣ ΧΕΙΡΑΣ ΕΘΕΡΑΠΕΥΣΕΝ
6,6,ΚΑΙ ΕΘΑΥΜΑΣΕΝ ΔΙΑ ΤΗΝ ΑΠΙΣΤΙΑΝ ΑΥΤΩΝ ΚΑΙ ΠΕΡΙΗΓΕΝ ΤΑΣ ΚΩΜΑΣ ΚΥΚΛΩΙ ΔΙΔΑΣΚΩΝ
6,7,ΚΑΙ ΠΡΟΣΚΑΛΕΙΤΑΙ ΤΟΥΣ ΔΩΔΕΚΑ ΚΑΙ ΗΡΞΑΤΟ ΑΥΤΟΥΣ ΑΠΟΣΤΕΛΛΕΙΝ ΔΥΟ ΔΥΟ ΚΑΙ ΕΔΙΔΟΥ ΑΥΤΟΙΣ ΕΞΟΥΣΙΑΝ ΤΩΝ ΠΝΕΥΜΑΤΩΝ ΤΩΝ ΑΚΑΘΑΡΤΩΝ
6,8,ΚΑΙ ΠΑΡΗΓΓΕΙΛΕΝ ΑΥΤΟΙΣ ΙΝΑ ΜΗΔΕΝ ΑΙΡΩΣΙΝ ΕΙΣ ΟΔΟΝ ΕΙ ΜΗ ΡΑΒΔΟΝ ΜΟΝΟΝ ΜΗ ΑΡΤΟΝ ΜΗ ΠΗΡΑΝ ΜΗ ΕΙΣ ΤΗΝ ΖΩΝΗΝ ΧΑΛΚΟΝ
6,9,ΑΛΛΑ ΥΠΟΔΕΔΕΜΕΝΟΥΣ ΣΑΝΔΑΛΙΑ ΚΑΙ ΜΗ ΕΝΔΥΣΗΣΘΕ ΔΥΟ ΧΙΤΩΝΑΣ
6,10,ΚΑΙ ΕΛΕΓΕΝ ΑΥΤΟΙΣ ΟΠΟΥ ΕΑΝ ΕΙΣΕΛΘΗΤΕ ΕΙΣ ΟΙΚΙΑΝ ΕΚΕΙ ΜΕΝΕΤΕ ΕΩΣ ΑΝ ΕΞΕΛΘΗΤΕ ΕΚΕΙΘΕΝ
6,11,ΚΑΙ ΟΣ ΑΝ ΤΟΠΟΣ ΜΗ ΔΕΞΗΤΑΙ ΥΜΑΣ ΜΗΔΕ ΑΚΟΥΣΩΣΙΝ ΥΜΩΝ ΕΚΠΟΡΕΥΟΜΕΝΟΙ ΕΚΕΙΘΕΝ ΕΚΤΙΝΑΞΑΤΕ ΤΟΝ ΧΟΥΝ ΤΟΝ ΥΠΟΚΑΤΩ ΤΩΝ ΠΟΔΩΝ ΥΜΩΝ ΕΙΣ ΜΑΡΤΥΡΙΟΝ ΑΥΤΟΙΣ
6,12,ΚΑΙ ΕΞΕΛΘΟΝΤΕΣ ΕΚΗΡΥΞΑΝ ΙΝΑ ΜΕΤΑΝΟΩΣΙΝ
6,13,ΚΑΙ ΔΑΙΜΟΝΙΑ ΠΟΛΛΑ ΕΞΕΒΑΛΛΟΝ ΚΑΙ ΗΛΕΙΦΟΝ ΕΛΑΙΩΙ ΠΟΛΛΟΥΣ ΑΡΡΩΣΤΟΥΣ ΚΑΙ ΕΘΕΡΑΠΕΥΟΝ
6,14,ΚΑΙ ΗΚΟΥΣΕΝ Ο ΒΑΣΙΛΕΥΣ ΗΡΩΙΔΗΣ ΦΑΝΕΡΟΝ ΓΑΡ ΕΓΕΝΕΤΟ ΤΟ ΟΝΟΜΑ ΑΥΤΟΥ ΚΑΙ ΕΛΕΓΟΝ ΟΤΙ ΙΩΑΝΝΗΣ Ο ΒΑΠΤΙΖΩΝ ΕΓΗΓΕΡΤΑΙ ΕΚ ΝΕΚΡΩΝ ΚΑΙ ΔΙΑ ΤΟΥΤΟ ΕΝΕΡΓΟΥΣΙΝ ΑΙ ΔΥΝΑΜΕΙΣ ΕΝ ΑΥΤΩΙ
6,15,ΑΛΛΟΙ ΔΕ ΕΛΕΓΟΝ ΟΤΙ ΗΛΕΙΑΣ ΕΣΤΙΝ ΑΛΛΟΙ ΔΕ ΕΛΕΓΟΝ ΟΤΙ ΠΡΟΦΗΤΗΣ ΩΣ ΕΙΣ ΤΩΝ ΠΡΟΦΗΤΩΝ
6,16,ΑΚΟΥΣΑΣ ΔΕ Ο ΗΡΩΙΔΗΣ ΕΛΕΓΕΝ ΟΤΙ ΟΝ ΕΓΩ ΑΠΕΚΕΦΑΛΙΣΑ ΙΩΑΝΝΗΝ ΟΥΤΟΣ ΗΓΕΡΘΗ
6,17,ΑΥΤΟΣ ΓΑΡ Ο ΗΡΩΙΔΗΣ ΑΠΟΣΤΕΙΛΑΣ ΕΚΡΑΤΗΣΕΝ ΤΟΝ ΙΩΑΝΝΗΝ ΚΑΙ ΕΔΗΣΕΝ ΑΥΤΟΝ ΕΝ ΦΥΛΑΚΗΙ ΔΙΑ ΗΡΩΙΔΙΑΔΑ ΤΗΝ ΓΥΝΑΙΚΑ ΦΙΛΙΠΠΟΥ ΤΟΥ ΑΔΕΛΦΟΥ ΑΥΤΟΥ ΟΤΙ ΑΥΤΗΝ ΕΓΑΜΗΣΕΝ
6,18,ΕΛΕΓΕΝ ΓΑΡ Ο ΙΩΑΝΝΗΣ ΤΩΙ ΗΡΩΙΔΗΙ ΟΤΙ ΟΥΚ ΕΞΕΣΤΙΝ ΣΟΙ ΕΧΕΙΝ ΤΗΝ ΓΥΝΑΙΚΑ ΤΟΥ ΑΔΕΛΦΟΥ ΣΟΥ
6,19,Η ΔΕ ΗΡΩΙΔΙΑΣ ΕΝΕΙΧΕΝ ΑΥΤΩΙ ΚΑΙ ΗΘΕΛΕΝ ΑΥΤΟΝ ΑΠΟΚΤΕΙΝΑΙ ΚΑΙ ΟΥΚ ΗΔΥΝΑΤΟ
6,20,Ο ΓΑΡ ΗΡΩΙΔΗΣ ΕΦΟΒΕΙΤΟ ΤΟΝ ΙΩΑΝΝΗΝ ΕΙΔΩΣ ΑΥΤΟΝ ΑΝΔΡΑ ΔΙΚΑΙΟΝ ΚΑΙ ΑΓΙΟΝ ΚΑΙ ΣΥΝΕΤΗΡΕΙ ΑΥΤΟΝ ΚΑΙ ΑΚΟΥΣΑΣ ΑΥΤΟΥ ΠΟΛΛΑ ΗΠΟΡΕΙ ΚΑΙ ΗΔΕΩΣ ΑΥΤΟΥ ΗΚΟΥΕΝ
6,21,ΚΑΙ ΓΕΝΟΜΕΝΗΣ ΗΜΕΡΑΣ ΕΥΚΑΙΡΟΥ ΟΤΕ ΗΡΩΙΔΗΣ ΤΟΙΣ ΓΕΝΕΣΙΟΙΣ ΑΥΤΟΥ ΔΕΙΠΝΟΝ ΕΠΟΙΗΣΕΝ ΤΟΙΣ ΜΕΓΙΣΤΑΣΙΝ ΑΥΤΟΥ ΚΑΙ ΤΟΙΣ ΧΙΛΙΑΡΧΟΙΣ ΚΑΙ ΤΟΙΣ ΠΡΩΤΟΙΣ ΤΗΣ ΓΑΛΙΛΑΙΑΣ
6,22,ΚΑΙ ΕΙΣΕΛΘΟΥΣΗΣ ΤΗΣ ΘΥΓΑΤΡΟΣ ΑΥΤΟΥ ΗΡΩΙΔΙΑΔΟΣ ΚΑΙ ΟΡΧΗΣΑΜΕΝΗΣ ΚΑΙ ΑΡΕΣΑΣΗΣ ΤΩΙ ΗΡΩΙΔΗΙ ΚΑΙ ΤΟΙΣ ΣΥΝΑΝΑΚΕΙΜΕΝΟΙΣ ΕΙΠΕΝ Ο ΒΑΣΙΛΕΥΣ ΤΩΙ ΚΟΡΑΣΙΩΙ ΑΙΤΗΣΟΝ ΜΕ Ο ΕΑΝ ΘΕΛΗΙΣ ΚΑΙ ΔΩΣΩ ΣΟΙ
6,23,ΚΑΙ ΩΜΟΣΕΝ ΑΥΤΗΙ ΟΤΙ ΕΑΝ ΜΕ ΑΙΤΗΣΗΙΣ ΔΩΣΩ ΣΟΙ ΕΩΣ ΗΜΙΣΟΥΣ ΤΗΣ ΒΑΣΙΛΕΙΑΣ ΜΟΥ
6,24,ΚΑΙ ΕΞΕΛΘΟΥΣΑ ΕΙΠΕΝ ΤΗΙ ΜΗΤΡΙ ΑΥΤΗΣ ΤΙ ΑΙΤΗΣΩΜΑΙ Η ΔΕ ΕΙΠΕΝ ΤΗΝ ΚΕΦΑΛΗΝ ΙΩΑΝΝΟΥ ΤΟΥ ΒΑΠΤΙΖΟΝΤΟΣ
6,25,ΚΑΙ ΕΙΣΕΛΘΟΥΣΑ ΕΥΘΥΣ ΜΕΤΑ ΣΠΟΥΔΗΣ ΠΡΟΣ ΤΟΝ ΒΑΣΙΛΕΑ ΗΙΤΗΣΑΤΟ ΛΕΓΟΥΣΑ ΘΕΛΩ ΙΝΑ ΕΞΑΥΤΗΣ ΔΩΙΣ ΜΟΙ ΕΠΙ ΠΙΝΑΚΙ ΤΗΝ ΚΕΦΑΛΗΝ ΙΩΑΝΝΟΥ ΤΟΥ ΒΑΠΤΙΣΤΟΥ
6,26,ΚΑΙ ΠΕΡΙΛΥΠΟΣ ΓΕΝΟΜΕΝΟΣ Ο ΒΑΣΙΛΕΥΣ ΔΙΑ ΤΟΥΣ ΟΡΚΟΥΣ ΚΑΙ ΤΟΥΣ ΣΥΝΑΝΑΚΕΙΜΕΝΟΥΣ ΟΥΚ ΗΘΕΛΗΣΕΝ ΑΘΕΤΗΣΑΙ ΑΥΤΗΝ
6,27,ΚΑΙ ΕΥΘΥΣ ΑΠΟΣΤΕΙΛΑΣ Ο ΒΑΣΙΛΕΥΣ ΣΠΕΚΟΥΛΑΤΟΡΑ ΕΠΕΤΑΞΕΝ ΕΝΕΓΚΑΙ ΤΗΝ ΚΕΦΑΛΗΝ ΑΥΤΟΥ ΚΑΙ ΑΠΕΛΘΩΝ ΑΠΕΚΕΦΑΛΙΣΕΝ ΑΥΤΟΝ ΕΝ ΤΗΙ ΦΥΛΑΚΗΙ
6,28,ΚΑΙ ΗΝΕΓΚΕΝ ΤΗΝ ΚΕΦΑΛΗΝ ΑΥΤΟΥ ΕΠΙ ΠΙΝΑΚΙ ΚΑΙ ΕΔΩΚΕΝ ΑΥΤΗΝ ΤΩΙ ΚΟΡΑΣΙΩΙ ΚΑΙ ΤΟ ΚΟΡΑΣΙΟΝ ΕΔΩΚΕΝ ΑΥΤΗΝ ΤΗΙ ΜΗΤΡΙ ΑΥΤΗΣ
6,29,ΚΑΙ ΑΚΟΥΣΑΝΤΕΣ ΟΙ ΜΑΘΗΤΑΙ ΑΥΤΟΥ ΗΛΘΟΝ ΚΑΙ ΗΡΑΝ ΤΟ ΠΤΩΜΑ ΑΥΤΟΥ ΚΑΙ ΕΘΗΚΑΝ ΑΥΤΟ ΕΝ ΜΝΗΜΕΙΩΙ
6,30,ΚΑΙ ΣΥΝΑΓΟΝΤΑΙ ΟΙ ΑΠΟΣΤΟΛΟΙ ΠΡΟΣ ΤΟΝ ΙΗΣΟΥΝ ΚΑΙ ΑΠΗΓΓΕΙΛΑΝ ΑΥΤΩΙ ΠΑΝΤΑ ΟΣΑ ΕΠΟΙΗΣΑΝ ΚΑΙ ΟΣΑ ΕΔΙΔΑΞΑΝ
6,31,ΚΑΙ ΛΕΓΕΙ ΑΥΤΟΙΣ ΔΕΥΤΕ ΥΜΕΙΣ ΑΥΤΟΙ ΚΑΤΑ ΙΔΙΑΝ ΕΙΣ ΕΡΗΜΟΝ ΤΟΠΟΝ ΚΑΙ ΑΝΑΠΑΥΣΑΣΘΕ ΟΛΙΓΟΝ ΗΣΑΝ ΓΑΡ ΟΙ ΕΡΧΟΜΕΝΟΙ ΚΑΙ ΟΙ ΥΠΑΓΟΝΤΕΣ ΠΟΛΛΟΙ ΚΑΙ ΟΥΔΕ ΦΑΓΕΙΝ ΕΥΚΑΙΡΟΥΝ
6,32,ΚΑΙ ΑΠΗΛΘΟΝ ΕΝ ΤΩΙ ΠΛΟΙΩΙ ΕΙΣ ΕΡΗΜΟΝ ΤΟΠΟΝ ΚΑΤΑ ΙΔΙΑΝ
6,33,ΚΑΙ ΕΙΔΟΝ ΑΥΤΟΥΣ ΥΠΑΓΟΝΤΑΣ ΚΑΙ ΕΠΕΓΝΩΣΑΝ ΠΟΛΛΟΙ ΚΑΙ ΠΕΖΗΙ ΑΠΟ ΠΑΣΩΝ ΤΩΝ ΠΟΛΕΩΝ ΣΥΝΕΔΡΑΜΟΝ ΕΚΕΙ ΚΑΙ ΠΡΟΗΛΘΟΝ ΑΥΤΟΥΣ
6,34,ΚΑΙ ΕΞΕΛΘΩΝ ΕΙΔΕΝ ΠΟΛΥΝ ΟΧΛΟΝ ΚΑΙ ΕΣΠΛΑΓΧΝΙΣΘΗ ΕΠΙ ΑΥΤΟΥΣ ΟΤΙ ΗΣΑΝ ΩΣ ΠΡΟΒΑΤΑ ΜΗ ΕΧΟΝΤΑ ΠΟΙΜΕΝΑ ΚΑΙ ΗΡΞΑΤΟ ΔΙΔΑΣΚΕΙΝ ΑΥΤΟΥΣ ΠΟΛΛΑ
6,35,ΚΑΙ ΗΔΗ ΩΡΑΣ ΠΟΛΛΗΣ ΓΕΝΟΜΕΝΗΣ ΠΡΟΣΕΛΘΟΝΤΕΣ ΑΥΤΩΙ ΟΙ ΜΑΘΗΤΑΙ ΑΥΤΟΥ ΕΛΕΓΟΝ ΟΤΙ ΕΡΗΜΟΣ ΕΣΤΙΝ Ο ΤΟΠΟΣ ΚΑΙ ΗΔΗ ΩΡΑ ΠΟΛΛΗ
6,36,ΑΠΟΛΥΣΟΝ ΑΥΤΟΥΣ ΙΝΑ ΑΠΕΛΘΟΝΤΕΣ ΕΙΣ ΤΟΥΣ ΚΥΚΛΩΙ ΑΓΡΟΥΣ ΚΑΙ ΚΩΜΑΣ ΑΓΟΡΑΣΩΣΙΝ ΕΑΥΤΟΙΣ ΤΙ ΦΑΓΩΣΙΝ
6,37,Ο ΔΕ ΑΠΟΚΡΙΘΕΙΣ ΕΙΠΕΝ ΑΥΤΟΙΣ ΔΟΤΕ ΑΥΤΟΙΣ ΥΜΕΙΣ ΦΑΓΕΙΝ ΚΑΙ ΛΕΓΟΥΣΙΝ ΑΥΤΩΙ ΑΠΕΛΘΟΝΤΕΣ ΑΓΟΡΑΣΩΜΕΝ ΔΗΝΑΡΙΩΝ ΔΙΑΚΟΣΙΩΝ ΑΡΤΟΥΣ ΚΑΙ ΔΩΣΟΜΕΝ ΑΥΤΟΙΣ ΦΑΓΕΙΝ
6,38,Ο ΔΕ ΛΕΓΕΙ ΑΥΤΟΙΣ ΠΟΣΟΥΣ ΑΡΤΟΥΣ ΕΧΕΤΕ ΥΠΑΓΕΤΕ ΙΔΕΤΕ ΚΑΙ ΓΝΟΝΤΕΣ ΛΕΓΟΥΣΙΝ ΠΕΝΤΕ ΚΑΙ ΔΥΟ ΙΧΘΥΑΣ
6,39,ΚΑΙ ΕΠΕΤΑΞΕΝ ΑΥΤΟΙΣ ΑΝΑΚΛΙΝΑΙ ΠΑΝΤΑΣ ΣΥΜΠΟΣΙΑ ΣΥΜΠΟΣΙΑ ΕΠΙ ΤΩΙ ΧΛΩΡΩΙ ΧΟΡΤΩΙ
6,40,ΚΑΙ ΑΝΕΠΕΣΑΝ ΠΡΑΣΙΑΙ ΠΡΑΣΙΑΙ ΚΑΤΑ ΕΚΑΤΟΝ ΚΑΙ ΚΑΤΑ ΠΕΝΤΗΚΟΝΤΑ
6,41,ΚΑΙ ΛΑΒΩΝ ΤΟΥΣ ΠΕΝΤΕ ΑΡΤΟΥΣ ΚΑΙ ΤΟΥΣ ΔΥΟ ΙΧΘΥΑΣ ΑΝΑΒΛΕΨΑΣ ΕΙΣ ΤΟΝ ΟΥΡΑΝΟΝ ΕΥΛΟΓΗΣΕΝ ΚΑΙ ΚΑΤΕΚΛΑΣΕΝ ΤΟΥΣ ΑΡΤΟΥΣ ΚΑΙ ΕΔΙΔΟΥ ΤΟΙΣ ΜΑΘΗΤΑΙΣ ΑΥΤΟΥ ΙΝΑ ΠΑΡΑΤΙΘΩΣΙΝ ΑΥΤΟΙΣ ΚΑΙ ΤΟΥΣ ΔΥΟ ΙΧΘΥΑΣ ΕΜΕΡΙΣΕΝ ΠΑΣΙΝ
6,42,ΚΑΙ ΕΦΑΓΟΝ ΠΑΝΤΕΣ ΚΑΙ ΕΧΟΡΤΑΣΘΗΣΑΝ
6,43,ΚΑΙ ΗΡΑΝ ΚΛΑΣΜΑΤΑ ΔΩΔΕΚΑ ΚΟΦΙΝΩΝ ΠΛΗΡΩΜΑΤΑ ΚΑΙ ΑΠΟ ΤΩΝ ΙΧΘΥΩΝ
6,44,ΚΑΙ ΗΣΑΝ ΟΙ ΦΑΓΟΝΤΕΣ ΤΟΥΣ ΑΡΤΟΥΣ ΠΕΝΤΑΚΙΣΧΙΛΙΟΙ ΑΝΔΡΕΣ
6,45,ΚΑΙ ΕΥΘΥΣ ΗΝΑΓΚΑΣΕΝ ΤΟΥΣ ΜΑΘΗΤΑΣ ΑΥΤΟΥ ΕΜΒΗΝΑΙ ΕΙΣ ΤΟ ΠΛΟΙΟΝ ΚΑΙ ΠΡΟΑΓΕΙΝ ΕΙΣ ΤΟ ΠΕΡΑΝ ΠΡΟΣ ΒΗΘΣΑΙΔΑΝ ΕΩΣ ΑΥΤΟΣ ΑΠΟΛΥΕΙ ΤΟΝ ΟΧΛΟΝ
6,46,ΚΑΙ ΑΠΟΤΑΞΑΜΕΝΟΣ ΑΥΤΟΙΣ ΑΠΗΛΘΕΝ ΕΙΣ ΤΟ ΟΡΟΣ ΠΡΟΣΕΥΞΑΣΘΑΙ
6,47,ΚΑΙ ΟΨΙΑΣ ΓΕΝΟΜΕΝΗΣ ΗΝ ΤΟ ΠΛΟΙΟΝ ΕΝ ΜΕΣΩΙ ΤΗΣ ΘΑΛΑΣΣΗΣ ΚΑΙ ΑΥΤΟΣ ΜΟΝΟΣ ΕΠΙ ΤΗΣ ΓΗΣ
6,48,ΚΑΙ ΙΔΩΝ ΑΥΤΟΥΣ ΒΑΣΑΝΙΖΟΜΕΝΟΥΣ ΕΝ ΤΩΙ ΕΛΑΥΝΕΙΝ ΗΝ ΓΑΡ Ο ΑΝΕΜΟΣ ΕΝΑΝΤΙΟΣ ΑΥΤΟΙΣ ΚΑΙ ΠΕΡΙ ΤΕΤΑΡΤΗΝ ΦΥΛΑΚΗΝ ΤΗΣ ΝΥΚΤΟΣ ΕΡΧΕΤΑΙ ΠΡΟΣ ΑΥΤΟΥΣ ΠΕΡΙΠΑΤΩΝ ΕΠΙ ΤΗΣ ΘΑΛΑΣΣΗΣ ΚΑΙ ΗΘΕΛΕΝ ΠΑΡΕΛΘΕΙΝ ΑΥΤΟΥΣ
6,49,ΟΙ ΔΕ ΙΔΟΝΤΕΣ ΑΥΤΟΝ ΕΠΙ ΤΗΣ ΘΑΛΑΣΣΗΣ ΠΕΡΙΠΑΤΟΥΝΤΑ ΕΔΟΞΑΝ ΟΤΙ ΦΑΝΤΑΣΜΑ ΕΣΤΙΝ ΚΑΙ ΑΝΕΚΡΑΞΑΝ
6,50,ΠΑΝΤΕΣ ΓΑΡ ΑΥΤΟΝ ΕΙΔΟΝ ΚΑΙ ΕΤΑΡΑΧΘΗΣΑΝ Ο ΔΕ ΕΥΘΥΣ ΕΛΑΛΗΣΕΝ ΜΕΤΑ ΑΥΤΩΝ ΚΑΙ ΛΕΓΕΙ ΑΥΤΟΙΣ ΘΑΡΣΕΙΤΕ ΕΓΩ ΕΙΜΙ ΜΗ ΦΟΒΕΙΣΘΕ
6,51,ΚΑΙ ΑΝΕΒΗ ΠΡΟΣ ΑΥΤΟΥΣ ΕΙΣ ΤΟ ΠΛΟΙΟΝ ΚΑΙ ΕΚΟΠΑΣΕΝ Ο ΑΝΕΜΟΣ ΚΑΙ ΛΕΙΑΝ ΕΝ ΕΑΥΤΟΙΣ ΕΞΙΣΤΑΝΤΟ
6,52,ΟΥ ΓΑΡ ΣΥΝΗΚΑΝ ΕΠΙ ΤΟΙΣ ΑΡΤΟΙΣ ΑΛΛΑ ΗΝ ΑΥΤΩΝ Η ΚΑΡΔΙΑ ΠΕΠΩΡΩΜΕΝΗ
6,53,ΚΑΙ ΔΙΑΠΕΡΑΣΑΝΤΕΣ ΕΠΙ ΤΗΝ ΓΗΝ ΗΛΘΟΝ ΕΙΣ ΓΕΝΝΗΣΑΡΕΤ ΚΑΙ ΠΡΟΣΩΡΜΙΣΘΗΣΑΝ
6,54,ΚΑΙ ΕΞΕΛΘΟΝΤΩΝ ΑΥΤΩΝ ΕΚ ΤΟΥ ΠΛΟΙΟΥ ΕΥΘΥΣ ΕΠΙΓΝΟΝΤΕΣ ΑΥΤΟΝ
6,55,ΠΕΡΙΕΔΡΑΜΟΝ ΟΛΗΝ ΤΗΝ ΧΩΡΑΝ ΕΚΕΙΝΗΝ ΚΑΙ ΗΡΞΑΝΤΟ ΕΠΙ ΤΟΙΣ ΚΡΑΒΑΤΤΟΙΣ ΤΟΥΣ ΚΑΚΩΣ ΕΧΟΝΤΑΣ ΠΕΡΙΦΕΡΕΙΝ ΟΠΟΥ ΗΚΟΥΟΝ ΟΤΙ ΕΣΤΙΝ
6,56,ΚΑΙ ΟΠΟΥ ΑΝ ΕΙΣΕΠΟΡΕΥΕΤΟ ΕΙΣ ΚΩΜΑΣ Η ΕΙΣ ΠΟΛΕΙΣ Η ΕΙΣ ΑΓΡΟΥΣ ΕΝ ΤΑΙΣ ΑΓΟΡΑΙΣ ΕΤΙΘΕΣΑΝ ΤΟΥΣ ΑΣΘΕΝΟΥΝΤΑΣ ΚΑΙ ΠΑΡΕΚΑΛΟΥΝ ΑΥΤΟΝ ΙΝΑ ΚΑΝ ΤΟΥ ΚΡΑΣΠΕΔΟΥ ΤΟΥ ΙΜΑΤΙΟΥ ΑΥΤΟΥ ΑΨΩΝΤΑΙ ΚΑΙ ΟΣΟΙ ΑΝ ΗΨΑΝΤΟ ΑΥΤΟΥ ΕΣΩΙΖΟΝΤΟ
7,1,ΚΑΙ ΣΥΝΑΓΟΝΤΑΙ ΠΡΟΣ ΑΥΤΟΝ ΟΙ ΦΑΡΙΣΑΙΟΙ ΚΑΙ ΤΙΝΕΣ ΤΩΝ ΓΡΑΜΜΑΤΕΩΝ ΕΛΘΟΝΤΕΣ ΑΠΟ ΙΕΡΟΣΟΛΥΜΩΝ
7,2,ΚΑΙ ΙΔΟΝΤΕΣ ΤΙΝΑΣ ΤΩΝ ΜΑΘΗΤΩΝ ΑΥΤΟΥ ΟΤΙ ΚΟΙΝΑΙΣ ΧΕΡΣΙΝ ΤΟΥΤΟ ΕΣΤΙΝ ΑΝΙΠΤΟΙΣ ΕΣΘΙΟΥΣΙΝ ΤΟΥΣ ΑΡΤΟΥΣ
7,3,ΟΙ ΓΑΡ ΦΑΡΙΣΑΙΟΙ ΚΑΙ ΠΑΝΤΕΣ ΟΙ ΙΟΥΔΑΙΟΙ ΕΑΝ ΜΗ ΠΥΓΜΗΙ ΝΙΨΩΝΤΑΙ ΤΑΣ ΧΕΙΡΑΣ ΟΥΚ ΕΣΘΙΟΥΣΙΝ ΚΡΑΤΟΥΝΤΕΣ ΤΗΝ ΠΑΡΑΔΟΣΙΝ ΤΩΝ ΠΡΕΣΒΥΤΕΡΩΝ
7,4,ΚΑΙ ΑΠΟ ΑΓΟΡΑΣ ΕΑΝ ΜΗ ΒΑΠΤΙΣΩΝΤΑΙ ΟΥΚ ΕΣΘΙΟΥΣΙΝ ΚΑΙ ΑΛΛΑ ΠΟΛΛΑ ΕΣΤΙΝ Α ΠΑΡΕΛΑΒΟΝ ΚΡΑΤΕΙΝ ΒΑΠΤΙΣΜΟΥΣ ΠΟΤΗΡΙΩΝ ΚΑΙ ΞΕΣΤΩΝ ΚΑΙ ΧΑΛΚΙΩΝ
7,5,ΚΑΙ ΕΠΕΡΩΤΩΣΙΝ ΑΥΤΟΝ ΟΙ ΦΑΡΙΣΑΙΟΙ ΚΑΙ ΟΙ ΓΡΑΜΜΑΤΕΙΣ ΔΙΑ ΤΙ ΟΥ ΠΕΡΙΠΑΤΟΥΣΙΝ ΟΙ ΜΑΘΗΤΑΙ ΣΟΥ ΚΑΤΑ ΤΗΝ ΠΑΡΑΔΟΣΙΝ ΤΩΝ ΠΡΕΣΒΥΤΕΡΩΝ ΑΛΛΑ ΚΟΙΝΑΙΣ ΧΕΡΣΙΝ ΕΣΘΙΟΥΣΙΝ ΤΟΝ ΑΡΤΟΝ
7,6,Ο ΔΕ ΑΠΟΚΡΙΘΕΙΣ ΕΙΠΕΝ ΑΥΤΟΙΣ ΟΤΙ ΚΑΛΩΣ ΕΠΡΟΦΗΤΕΥΣΕΝ ΗΣΑΙΑΣ ΠΕΡΙ ΥΜΩΝ ΤΩΝ ΥΠΟΚΡΙΤΩΝ ΩΣ ΓΕΓΡΑΠΤΑΙ ΟΤΙ ΟΥΤΟΣ Ο ΛΑΟΣ ΤΟΙΣ ΧΕΙΛΕΣΙΝ ΜΕ ΤΙΜΑΙ Η ΔΕ ΚΑΡΔΙΑ ΑΥΤΩΝ ΠΟΡΡΩ ΑΠΕΧΕΙ ΑΠΟ ΕΜΟΥ
7,7,ΜΑΤΗΝ ΔΕ ΣΕΒΟΝΤΑΙ ΜΕ ΔΙΔΑΣΚΟΝΤΕΣ ΔΙΔΑΣΚΑΛΙΑΣ ΕΝΤΑΛΜΑΤΑ ΑΝΘΡΩΠΩΝ
7,8,ΑΦΕΝΤΕΣ ΤΗΝ ΕΝΤΟΛΗΝ ΤΟΥ ΘΕΟΥ ΚΡΑΤΕΙΤΕ ΤΗΝ ΠΑΡΑΔΟΣΙΝ ΤΩΝ ΑΝΘΡΩΠΩΝ
7,9,ΚΑΙ ΕΛΕΓΕΝ ΑΥΤΟΙΣ ΚΑΛΩΣ ΑΘΕΤΕΙΤΕ ΤΗΝ ΕΝΤΟΛΗΝ ΤΟΥ ΘΕΟΥ ΙΝΑ ΤΗΝ ΠΑΡΑΔΟΣΙΝ ΥΜΩΝ ΤΗΡΗΣΗΤΕ
7,10,ΜΩΥΣΗΣ ΓΑΡ ΕΙΠΕΝ ΤΙΜΑ ΤΟΝ ΠΑΤΕΡΑ ΣΟΥ ΚΑΙ ΤΗΝ ΜΗΤΕΡΑ ΣΟΥ ΚΑΙ Ο ΚΑΚΟΛΟΓΩΝ ΠΑΤΕΡΑ Η ΜΗΤΕΡΑ ΘΑΝΑΤΩΙ ΤΕΛΕΥΤΑΤΩ
7,11,ΥΜΕΙΣ ΔΕ ΛΕΓΕΤΕ ΕΑΝ ΕΙΠΗΙ ΑΝΘΡΩΠΟΣ ΤΩΙ ΠΑΤΡΙ Η ΤΗΙ ΜΗΤΡΙ ΚΟΡΒΑΝ Ο ΕΣΤΙΝ ΔΩΡΟΝ Ο ΕΑΝ ΕΞ ΕΜΟΥ ΩΦΕΛΗΘΗΙΣ
7,12,ΟΥΚΕΤΙ ΑΦΙΕΤΕ ΑΥΤΟΝ ΟΥΔΕΝ ΠΟΙΗΣΑΙ ΤΩΙ ΠΑΤΡΙ Η ΤΗΙ ΜΗΤΡΙ
7,13,ΑΚΥΡΟΥΝΤΕΣ ΤΟΝ ΛΟΓΟΝ ΤΟΥ ΘΕΟΥ ΤΗΙ ΠΑΡΑΔΟΣΕΙ ΥΜΩΝ ΗΙ ΠΑΡΕΔΩΚΑΤΕ ΚΑΙ ΠΑΡΟΜΟΙΑ ΤΟΙΑΥΤΑ ΠΟΛΛΑ ΠΟΙΕΙΤΕ
7,14,ΚΑΙ ΠΡΟΣΚΑΛΕΣΑΜΕΝΟΣ ΠΑΛΙΝ ΤΟΝ ΟΧΛΟΝ ΕΛΕΓΕΝ ΑΥΤΟΙΣ ΑΚΟΥΣΑΤΕ ΜΟΥ ΠΑΝΤΕΣ ΚΑΙ ΣΥΝΕΤΕ
7,15,ΟΥΔΕΝ ΕΣΤΙΝ ΕΞΩΘΕΝ ΤΟΥ ΑΝΘΡΩΠΟΥ ΕΙΣΠΟΡΕΥΟΜΕΝΟΝ ΕΙΣ ΑΥΤΟΝ Ο ΔΥΝΑΤΑΙ ΚΟΙΝΩΣΑΙ ΑΥΤΟΝ ΑΛΛΑ ΤΑ ΕΚ ΤΟΥ ΑΝΘΡΩΠΟΥ ΕΚΠΟΡΕΥΟΜΕΝΑ ΕΣΤΙΝ ΤΑ ΚΟΙΝΟΥΝΤΑ ΤΟΝ ΑΝΘΡΩΠΟΝ
7,17,ΚΑΙ ΟΤΕ ΕΙΣΗΛΘΕΝ ΕΙΣ ΟΙΚΟΝ ΑΠΟ ΤΟΥ ΟΧΛΟΥ ΕΠΗΡΩΤΩΝ ΑΥΤΟΝ ΟΙ ΜΑΘΗΤΑΙ ΑΥΤΟΥ ΤΗΝ ΠΑΡΑΒΟΛΗΝ
7,18,ΚΑΙ ΛΕΓΕΙ ΑΥΤΟΙΣ ΟΥΤΩΣ ΚΑΙ ΥΜΕΙΣ ΑΣΥΝΕΤΟΙ ΕΣΤΕ ΟΥ ΝΟΕΙΤΕ ΟΤΙ ΠΑΝ ΤΟ ΕΞΩΘΕΝ ΕΙΣΠΟΡΕΥΟΜΕΝΟΝ ΕΙΣ ΤΟΝ ΑΝΘΡΩΠΟΝ ΟΥ ΔΥΝΑΤΑΙ ΑΥΤΟΝ ΚΟΙΝΩΣΑΙ
7,19,ΟΤΙ ΟΥΚ ΕΙΣΠΟΡΕΥΕΤΑΙ ΑΥΤΟΥ ΕΙΣ ΤΗΝ ΚΑΡΔΙΑΝ ΑΛΛΑ ΕΙΣ ΤΗΝ ΚΟΙΛΙΑΝ ΚΑΙ ΕΙΣ ΤΟΝ ΑΦΕΔΡΩΝΑ ΕΚΠΟΡΕΥΕΤΑΙ ΚΑΘΑΡΙΖΩΝ ΠΑΝΤΑ ΤΑ ΒΡΩΜΑΤΑ
7,20,ΕΛΕΓΕΝ ΔΕ ΟΤΙ ΤΟ ΕΚ ΤΟΥ ΑΝΘΡΩΠΟΥ ΕΚΠΟΡΕΥΟΜΕΝΟΝ ΕΚΕΙΝΟ ΚΟΙΝΟΙ ΤΟΝ ΑΝΘΡΩΠΟΝ
7,21,ΕΣΩΘΕΝ ΓΑΡ ΕΚ ΤΗΣ ΚΑΡΔΙΑΣ ΤΩΝ ΑΝΘΡΩΠΩΝ ΟΙ ΔΙΑΛΟΓΙΣΜΟΙ ΟΙ ΚΑΚΟΙ ΕΚΠΟΡΕΥΟΝΤΑΙ ΠΟΡΝΕΙΑΙ ΚΛΟΠΑΙ ΦΟΝΟΙ
7,22,ΜΟΙΧΕΙΑΙ ΠΛΕΟΝΕΞΙΑΙ ΠΟΝΗΡΙΑΙ ΔΟΛΟΣ ΑΣΕΛΓΕΙΑ ΟΦΘΑΛΜΟΣ ΠΟΝΗΡΟΣ ΒΛΑΣΦΗΜΙΑ ΥΠΕΡΗΦΑΝΙΑ ΑΦΡΟΣΥΝΗ
7,23,ΠΑΝΤΑ ΤΑΥΤΑ ΤΑ ΠΟΝΗΡΑ ΕΣΩΘΕΝ ΕΚΠΟΡΕΥΕΤΑΙ ΚΑΙ ΚΟΙΝΟΙ ΤΟΝ ΑΝΘΡΩΠΟΝ
