chapter,verse,text
10,33,ΟΤΙ ΙΔΟΥ ΑΝΑΒΑΙΝΟΜΕΝ ΕΙΣ ΙΕΡΟΣΟΛΥΜΑ ΚΑΙ Ο ΥΙΟΣ ΤΟΥ ΑΝΘΡΩΠΟΥ ΠΑΡΑΔΟΘΗΣΕΤΑΙ ΤΟΙΣ ΑΡΧΙΕΡΕΥΣΙΝ ΚΑΙ ΓΡΑΜΜΑΤΕΥΣΙΝ ΚΑΙ ΚΑΤΑΚΡΙΝΟΥΣΙΝ ΑΥΤΟΝ ΘΑΝΑΤΩΙ ΚΑΙ ΠΑΡΑΔΩΣΟΥΣΙΝ ΑΥΤΟΝ ΤΟΙΣ ΕΘΝΕΣΙΝ
10,34,ΚΑΙ ΕΜΠΑΙΞΟΥΣΙΝ ΑΥΤΩΙ ΚΑΙ ΕΜΠΤΥΣΟΥΣΙΝ ΑΥΤΩΙ ΚΑΙ ΜΑΣΤΙΓΩΣΟΥΣΙΝ ΑΥΤΟΝ ΚΑΙ ΑΠΟΚΤΕΝΟΥΣΙΝ ΚΑΙ ΜΕΤΑ ΤΡΕΙΣ ΗΜΕΡΑΣ ΑΝΑΣΤΗΣΕΤΑΙ
10,35,ΚΑΙ ΠΡΟΣΠΟΡΕΥΟΝΤΑΙ ΑΥΤΩΙ ΙΑΚΩΒΟΣ ΚΑΙ ΙΩΑΝΝΗΣ ΟΙ ΥΙΟΙ ΖΕΒΕΔΑΙΟΥ ΛΕΓΟΝΤΕΣ ΑΥΤΩΙ ΔΙΔΑΣΚΑΛΕ ΘΕΛΟΜΕΝ ΙΝΑ Ο ΕΑΝ ΑΙΤΗΣΩΜΕΝ ΣΕ ΠΟΙΗΣΗΙΣ ΗΜΙΝ
10,36,Ο ΔΕ ΕΙΠΕΝ ΑΥΤΟΙΣ ΤΙ ΘΕΛΕΤΕ ΠΟΙΗΣΩ ΥΜΙΝ
10,37,ΟΙ ΔΕ ΕΙΠΑΝ ΑΥΤΩΙ ΔΟΣ ΗΜΙΝ ΙΝΑ ΕΙΣ ΣΟΥ ΕΚ ΔΕΞΙΩΝ ΚΑΙ ΕΙΣ ΕΞ ΕΥΩΝΥΜΩΝ ΣΟΥ ΚΑΘΙΣΩΜΕΝ ΕΝ ΤΗΙ ΔΟΞΗΙ ΣΟΥ
10,38,Ο ΔΕ ΙΗΣΟΥΣ ΕΙΠΕΝ ΑΥΤΟΙΣ ΟΥΚ ΟΙΔΑΤΕ ΤΙ ΑΙΤΕΙΣΘΕ ΔΥΝΑΣΘΕ ΠΙΕΙΝ ΤΟ ΠΟΤΗΡΙΟΝ Ο ΕΓΩ ΠΙΝΩ Η ΤΟ ΒΑΠΤΙΣΜΑ Ο ΕΓΩ ΒΑΠΤΙΖΟΜΑΙ ΒΑΠΤΙΣΘΗΝΑΙ
10,39,ΟΙ ΔΕ ΕΙΠΑΝ ΑΥΤΩΙ ΔΥΝΑΜΕΘΑ Ο ΔΕ ΙΗΣΟΥΣ ΕΙΠΕΝ ΑΥΤΟΙΣ ΤΟ ΠΟΤΗΡΙΟΝ Ο ΕΓΩ ΠΙΝΩ ΠΙΕΣΘΕ ΚΑΙ ΤΟ ΒΑΠΤΙΣΜΑ Ο ΕΓΩ ΒΑΠΤΙΖΟΜΑΙ ΒΑΠΤΙΣΘΗΣΕΣΘΕ
10,40,ΤΟ ΔΕ ΚΑΘΙΣΑΙ ΕΚ ΔΕΞΙΩΝ ΜΟΥ Η ΕΞ ΕΥΩΝΥΜΩΝ ΟΥΚ ΕΣΤΙΝ ΕΜΟΝ ΔΟΥΝΑΙ ΑΛΛΑ ΟΙΣ ΗΤΟΙΜΑΣΤΑΙ
10,41,ΚΑΙ ΑΚΟΥΣΑΝΤΕΣ ΟΙ ΔΕΚΑ ΗΡΞΑΝΤΟ ΑΓΑΝΑΚΤΕΙΝ ΠΕΡΙ ΙΑΚΩΒΟΥ ΚΑΙ ΙΩΑΝΝΟΥ
10,42,ΚΑΙ ΠΡΟΣΚΑΛΕΣΑΜΕΝΟΣ ΑΥΤΟΥΣ Ο ΙΗΣΟΥΣ ΛΕΓΕΙ ΑΥΤΟΙΣ ΟΙΔΑΤΕ ΟΤΙ ΟΙ ΔΟΚΟΥΝΤΕΣ ΑΡΧΕΙΝ ΤΩΝ ΕΘΝΩΝ ΚΑΤΑΚΥΡΙΕΥΟΥΣΙΝ ΑΥΤΩΝ ΚΑΙ ΟΙ ΜΕΓΑΛΟΙ ΑΥΤΩΝ ΚΑΤΕΞΟΥΣΙΑΖΟΥΣΙΝ ΑΥΤΩΝ
10,43,ΟΥΧ ΟΥΤΩΣ ΔΕ ΕΣΤΙΝ ΕΝ ΥΜΙΝ ΑΛΛΑ ΟΣ ΑΝ ΘΕΛΗΙ ΜΕΓΑΣ ΓΕΝΕΣΘΑΙ ΕΝ ΥΜΙΝ ΕΣΤΑΙ ΥΜΩΝ ΔΙΑΚΟΝΟΣ
10,44,ΚΑΙ ΟΣ ΑΝ ΘΕΛΗΙ ΕΝ ΥΜΙΝ ΕΙΝΑΙ ΠΡΩΤΟΣ ΕΣΤΑΙ ΠΑΝΤΩΝ ΔΟΥΛΟΣ
10,45,ΚΑΙ ΓΑΡ Ο ΥΙΟΣ ΤΟΥ ΑΝΘΡΩΠΟΥ ΟΥΚ ΗΛΘΕΝ ΔΙΑΚΟΝΗΘΗΝΑΙ ΑΛΛΑ ΔΙΑΚΟΝΗΣΑΙ ΚΑΙ ΔΟΥΝΑΙ ΤΗΝ ΨΥΧΗΝ ΑΥΤΟΥ ΛΥΤΡΟΝ ΑΝΤΙ ΠΟΛΛΩΝ
10,46,ΚΑΙ ΕΡΧΟΝΤΑΙ ΕΙΣ ΙΕΡΕΙΧΩ ΚΑΙ ΕΚΠΟΡΕΥΟΜΕΝΟΥ ΑΥΤΟΥ ΑΠΟ ΙΕΡΕΙΧΩ ΚΑΙ ΤΩΝ ΜΑΘΗΤΩΝ ΑΥΤΟΥ ΚΑΙ ΟΧΛΟΥ ΙΚΑΝΟΥ Ο ΥΙΟΣ ΤΙΜΑΙΟΥ ΒΑΡΤΙΜΑΙΟΣ ΤΥΦΛΟΣ ΠΡΟΣΑΙΤΗΣ ΕΚΑΘΗΤΟ ΠΑΡΑ ΤΗΝ ΟΔΟΝ
10,47,ΚΑΙ ΑΚΟΥΣΑΣ ΟΤΙ ΙΗΣΟΥΣ Ο ΝΑΖΑΡΗΝΟΣ ΕΣΤΙΝ ΗΡΞΑΤΟ ΚΡΑΖΕΙΝ ΚΑΙ ΛΕΓΕΙΝ ΥΙΕ ΔΑΥΕΙΔ ΙΗΣΟΥ ΕΛΕΗΣΟΝ ΜΕ
10,48,ΚΑΙ ΕΠΕΤΙΜΩΝ ΑΥΤΩΙ ΠΟΛΛΟΙ ΙΝΑ ΣΙΩΠΗΣΗΙ Ο ΔΕ ΠΟΛΛΩΙ ΜΑΛΛΟΝ ΕΚΡΑΖΕΝ ΥΙΕ ΔΑΥΕΙΔ ΕΛΕΗΣΟΝ ΜΕ
10,49,ΚΑΙ ΣΤΑΣ Ο ΙΗΣΟΥΣ ΕΙΠΕΝ ΦΩΝΗΣΑΤΕ ΑΥΤΟΝ ΚΑΙ ΦΩΝΟΥΣΙ ΤΟΝ ΤΥΦΛΟΝ ΛΕΓΟΝΤΕΣ ΑΥΤΩΙ ΘΑΡΣΕΙ ΕΓΕΙΡΕ ΦΩΝΕΙ ΣΕ
10,50,Ο ΔΕ ΑΠΟΒΑΛΩΝ ΤΟ ΙΜΑΤΙΟΝ ΑΥΤΟΥ ΑΝΑΠΗΔΗΣΑΣ ΗΛΘΕΝ ΠΡΟΣ ΤΟΝ ΙΗΣΟΥΝ
10,51,ΚΑΙ ΑΠΟΚΡΙΘΕΙΣ ΑΥΤΩΙ Ο ΙΗΣΟΥΣ ΕΙΠΕΝ ΤΙ ΣΟΙ ΘΕΛΕΙΣ ΠΟΙΗΣΩ Ο ΔΕ ΤΥΦΛΟΣ ΕΙΠΕΝ ΑΥΤΩΙ ΡΑΒΒΟΥΝΕΙ ΙΝΑ ΑΝΑΒΛΕΨΩ
10,52,Ο ΔΕ ΙΗΣΟΥΣ ΕΙΠΕΝ ΑΥΤΩΙ ΥΠΑΓΕ Η ΠΙΣΤΙΣ ΣΟΥ ΣΕΣΩΚΕΝ ΣΕ ΚΑΙ ΕΥΘΥΣ ΑΝΕΒΛΕΨΕΝ ΚΑΙ ΗΚΟΛΟΥΘΕΙ ΑΥΤΩΙ ΕΝ ΤΗΙ ΟΔΩΙ
11,1,ΚΑΙ ΟΤΕ ΕΓΓΙΖΟΥΣΙΝ ΕΙΣ ΙΕΡΟΣΟΛΥΜΑ ΕΙΣ ΒΗΘΦΑΓΗ ΚΑΙ ΒΗΘΑΝΙΑΝ ΠΡΟΣ ΤΟ ΟΡΟΣ ΤΩΝ ΕΛΑΙΩΝ ΑΠΟΣΤΕΛΛΕΙ ΔΥΟ ΤΩΝ ΜΑΘΗΤΩΝ ΑΥΤΟΥ
11,2,ΚΑΙ ΛΕΓΕΙ ΑΥΤΟΙΣ ΥΠΑΓΕΤΕ ΕΙΣ ΤΗΝ ΚΩΜΗΝ ΤΗΝ ΚΑΤΕΝΑΝΤΙ ΥΜΩΝ ΚΑΙ ΕΥΘΥΣ ΕΙΣΠΟΡΕΥΟΜΕΝΟΙ ΕΙΣ ΑΥΤΗΝ ΕΥΡΗΣΕΤΕ ΠΩΛΟΝ ΔΕΔΕΜΕΝΟΝ ΕΠΙ ΟΝ ΟΥΔΕΙΣ ΑΝΘΡΩΠΩΝ ΟΥΠΩ ΕΚΑΘΙΣΕΝ ΛΥΣΑΤΕ ΑΥΤΟΝ ΚΑΙ ΦΕΡΕΤΕ
11,3,ΚΑΙ ΕΑΝ ΤΙΣ ΥΜΙΝ ΕΙΠΗΙ ΤΙ ΠΟΙΕΙΤΕ ΤΟΥΤΟ ΕΙΠΑΤΕ ΟΤΙ Ο ΚΥΡΙΟΣ ΑΥΤΟΥ ΧΡΕΙΑΝ ΕΧΕΙ ΚΑΙ ΕΥΘΥΣ ΑΥΤΟΝ ΑΠΟΣΤΕΛΛΕΙ ΠΑΛΙΝ ΩΔΕ
11,4,ΚΑΙ ΑΠΗΛΘΟΝ ΚΑΙ ΕΥΡΟΝ ΠΩΛΟΝ ΔΕΔΕΜΕΝΟΝ ΠΡΟΣ ΤΗΝ ΘΥΡΑΝ ΕΞΩ ΕΠΙ ΤΟΥ ΑΜΦΟΔΟΥ ΚΑΙ ΛΥΟΥΣΙΝ ΑΥΤΟΝ
11,5,ΚΑΙ ΤΙΝΕΣ ΤΩΝ ΕΚΕΙ ΕΣΤΗΚΟΤΩΝ ΕΛΕΓΟΝ ΑΥΤΟΙΣ ΤΙ ΠΟΙΕΙΤΕ ΛΥΟΝΤΕΣ ΤΟΝ ΠΩΛΟΝ
11,6,ΟΙ ΔΕ ΕΙΠΟΝ ΑΥΤΟΙΣ ΚΑΘΩΣ ΕΙΠΕΝ Ο ΙΗΣΟΥΣ ΚΑΙ ΑΦΗΚΑΝ ΑΥΤΟΥΣ
11,7,ΚΑΙ ΗΓΑΓΟΝ ΤΟΝ ΠΩΛΟΝ ΠΡΟΣ ΤΟΝ ΙΗΣΟΥΝ ΚΑΙ ΕΠΙΒΑΛΛΟΥΣΙΝ ΑΥΤΩΙ ΤΑ ΙΜΑΤΙΑ ΑΥΤΩΝ ΚΑΙ ΕΚΑΘΙΣΕΝ ΕΠΙ ΑΥΤΟΝ
11,8,ΚΑΙ ΠΟΛΛΟΙ ΤΑ ΙΜΑΤΙΑ ΑΥΤΩΝ ΕΣΤΡΩΣΑΝ ΕΙΣ ΤΗΝ ΟΔΟΝ ΑΛΛΟΙ ΔΕ ΣΤΙΒΑΔΑΣ ΚΟΨΑΝΤΕΣ ΕΚ ΤΩΝ ΑΓΡΩΝ
11,9,ΚΑΙ ΟΙ ΠΡΟΑΓΟΝΤΕΣ ΚΑΙ ΟΙ ΑΚΟΛΟΥΘΟΥΝΤΕΣ ΕΚΡΑΖΟΝ ΩΣΑΝΝΑ ΕΥΛΟΓΗΜΕΝΟΣ Ο ΕΡΧΟΜΕΝΟΣ ΕΝ ΟΝΟΜΑΤΙ ΚΥΡΙΟΥ
11,10,ΕΥΛΟΓΗΜΕΝΗ Η ΕΡΧΟΜΕΝΗ ΒΑΣΙΛΕΙΑ ΤΟΥ ΠΑΤΡΟΣ ΗΜΩΝ ΔΑΥΕΙΔ ΩΣΑΝΝΑ ΕΝ ΤΟΙΣ ΥΨΙΣΤΟΙΣ
11,11,ΚΑΙ ΕΙΣΗΛΘΕΝ ΕΙΣ ΙΕΡΟΣΟΛΥΜΑ ΕΙΣ ΤΟ ΙΕΡΟΝ ΚΑΙ ΠΕΡΙΒΛΕΨΑΜΕΝΟΣ ΠΑΝΤΑ ΟΨΙΑΣ ΗΔΗ ΟΥΣΗΣ ΤΗΣ ΩΡΑΣ ΕΞΗΛΘΕΝ ΕΙΣ ΒΗΘΑΝΙΑΝ ΜΕΤΑ ΤΩΝ ΔΩΔΕΚΑ
11,12,ΚΑΙ ΤΗΙ ΕΠΑΥΡΙΟΝ ΕΞΕΛΘΟΝΤΩΝ ΑΥΤΩΝ ΑΠΟ ΒΗΘΑΝΙΑΣ ΕΠΕΙΝΑΣΕΝ
11,13,ΚΑΙ ΙΔΩΝ ΣΥΚΗΝ ΑΠΟ ΜΑΚΡΟΘΕΝ ΕΧΟΥΣΑΝ ΦΥΛΛΑ ΗΛΘΕΝ ΕΙ ΑΡΑ ΤΙ ΕΥΡΗΣΕΙ ΕΝ ΑΥΤΗΙ ΚΑΙ ΕΛΘΩΝ ΕΠΙ ΑΥΤΗΝ ΟΥΔΕΝ ΕΥΡΕΝ ΕΙ ΜΗ ΦΥΛΛΑ Ο ΓΑΡ ΚΑΙΡΟΣ ΟΥΚ ΗΝ ΣΥΚΩΝ
11,14,ΚΑΙ ΑΠΟΚΡΙΘΕΙΣ ΕΙΠΕΝ ΑΥΤΗΙ ΜΗΚΕΤΙ ΕΙΣ ΤΟΝ ΑΙΩΝΑ ΕΚ ΣΟΥ ΜΗΔΕΙΣ ΚΑΡΠΟΝ ΦΑΓΟΙ ΚΑΙ ΗΚΟΥΟΝ ΟΙ ΜΑΘΗΤΑΙ ΑΥΤΟΥ
11,15,ΚΑΙ ΕΡΧΟΝΤΑΙ ΕΙΣ ΙΕΡΟΣΟΛΥΜΑ ΚΑΙ ΕΙΣΕΛΘΩΝ ΕΙΣ ΤΟ ΙΕΡΟΝ ΗΡΞΑΤΟ ΕΚΒΑΛΛΕΙΝ ΤΟΥΣ ΠΩΛΟΥΝΤΑΣ ΚΑΙ ΤΟΥΣ ΑΓΟΡΑΖΟΝΤΑΣ ΕΝ ΤΩΙ ΙΕΡΩΙ ΚΑΙ ΤΑΣ ΤΡΑΠΕΖΑΣ ΤΩΝ ΚΟΛΛΥΒΙΣΤΩΝ ΚΑΙ ΤΑΣ ΚΑΘΕΔΡΑΣ ΤΩΝ ΠΩΛΟΥΝΤΩΝ ΤΑΣ ΠΕΡΙΣΤΕΡΑΣ ΚΑΤΕΣΤΡΕΨΕΝ
11,16,ΚΑΙ ΟΥΚ ΗΦΙΕΝ ΙΝΑ ΤΙΣ ΔΙΕΝΕΓΚΗΙ ΣΚΕΥΟΣ ΔΙΑ ΤΟΥ ΙΕΡΟΥ
11,17,ΚΑΙ ΕΔΙΔΑΣΚΕΝ ΚΑΙ ΕΛΕΓΕΝ ΑΥΤΟΙΣ ΟΥ ΓΕΓΡΑΠΤΑΙ ΟΤΙ Ο ΟΙΚΟΣ ΜΟΥ ΟΙΚΟΣ ΠΡΟΣΕΥΧΗΣ ΚΛΗΘΗΣΕΤΑΙ ΠΑΣΙΝ ΤΟΙΣ ΕΘΝΕΣΙΝ ΥΜΕΙΣ ΔΕ ΕΠΟΙΗΣΑΤΕ ΑΥΤΟΝ ΣΠΗΛΑΙΟΝ ΛΗΙΣΤΩΝ
11,18,ΚΑΙ ΗΚΟΥΣΑΝ ΟΙ ΑΡΧΙΕΡΕΙΣ ΚΑΙ ΟΙ ΓΡΑΜΜΑΤΕΙΣ ΚΑΙ ΕΖΗΤΟΥΝ ΠΩΣ ΑΥΤΟΝ ΑΠΟΛΕΣΩΣΙΝ ΕΦΟΒΟΥΝΤΟ ΓΑΡ ΑΥΤΟΝ ΠΑΣ ΓΑΡ Ο ΟΧΛΟΣ ΕΞΕΠΛΗΣΣΕΤΟ ΕΠΙ ΤΗΙ ΔΙΔΑΧΗΙ ΑΥΤΟΥ
11,19,ΚΑΙ ΟΤΑΝ ΟΨΕ ΕΓΕΝΕΤΟ ΕΞΕΠΟΡΕΥΟΝΤΟ ΕΞΩ ΤΗΣ ΠΟΛΕΩΣ
11,20,ΚΑΙ ΠΑΡΑΠΟΡΕΥΟΜΕΝΟΙ ΠΡΩΙ ΕΙΔΟΝ ΤΗΝ ΣΥΚΗΝ ΕΞΗΡΑΜΜΕΝΗΝ ΕΚ ΡΙΖΩΝ
11,21,ΚΑΙ ΑΝΑΜΝΗΣΘΕΙΣ Ο ΠΕΤΡΟΣ ΛΕΓΕΙ ΑΥΤΩΙ ΡΑΒΒΕΙ ΙΔΕ Η ΣΥΚΗ ΗΝ ΚΑΤΗΡΑΣΩ ΕΞΗΡΑΝΤΑΙ
11,22,ΚΑΙ ΑΠΟΚΡΙΘΕΙΣ Ο ΙΗΣΟΥΣ ΛΕΓΕΙ ΑΥΤΟΙΣ ΕΧΕΤΕ ΠΙΣΤΙΝ ΘΕΟΥ
11,23,ΑΜΗΝ ΛΕΓΩ ΥΜΙΝ ΟΤΙ ΟΣ ΑΝ ΕΙΠΗΙ ΤΩΙ ΟΡΕΙ ΤΟΥΤΩΙ ΑΡΘΗΤΙ ΚΑΙ ΒΛΗΘΗΤΙ ΕΙΣ ΤΗΝ ΘΑΛΑΣΣΑΝ ΚΑΙ ΜΗ ΔΙΑΚΡΙΘΗΙ ΕΝ ΤΗΙ ΚΑΡΔΙΑΙ ΑΥΤΟΥ ΑΛΛΑ ΠΙΣΤΕΥΗΙ ΟΤΙ Ο ΛΑΛΕΙ ΓΙΝΕΤΑΙ ΕΣΤΑΙ ΑΥΤΩΙ
11,24,ΔΙΑ ΤΟΥΤΟ ΛΕΓΩ ΥΜΙΝ ΠΑΝΤΑ ΟΣΑ ΠΡΟΣΕΥΧΕΣΘΕ ΚΑΙ ΑΙΤΕΙΣΘΕ ΠΙΣΤΕΥΕΤΕ ΟΤΙ ΕΛΑΒΕΤΕ ΚΑΙ ΕΣΤΑΙ ΥΜΙΝ
11,25,ΚΑΙ ΟΤΑΝ ΣΤΗΚΕΤΕ ΠΡΟΣΕΥΧΟΜΕΝΟΙ ΑΦΙΕΤΕ ΕΙ ΤΙ ΕΧΕΤΕ ΚΑΤΑ ΤΙΝΟΣ ΙΝΑ ΚΑΙ Ο ΠΑΤΗΡ ΥΜΩΝ Ο ΕΝ ΤΟΙΣ ΟΥΡΑΝΟΙΣ ΑΦΗΙ ΥΜΙΝ ΤΑ ΠΑΡΑΠΤΩΜΑΤΑ ΥΜΩΝ
11,27,ΚΑΙ ΕΡΧΟΝΤΑΙ ΠΑΛΙΝ ΕΙΣ ΙΕΡΟΣΟΛΥΜΑ ΚΑΙ ΕΝ ΤΩΙ ΙΕΡΩΙ ΠΕΡΙΠΑΤΟΥΝΤΟΣ ΑΥΤΟΥ ΕΡΧΟΝΤΑΙ ΠΡΟΣ ΑΥΤΟΝ ΟΙ ΑΡΧΙΕΡΕΙΣ ΚΑΙ ΟΙ ΓΡΑΜΜΑΤΕΙΣ ΚΑΙ ΟΙ ΠΡΕΣΒΥΤΕΡΟΙ
11,28,ΚΑΙ ΕΛΕΓΟΝ ΑΥΤΩΙ ΕΝ ΠΟΙΑΙ ΕΞΟΥΣΙΑΙ ΤΑΥΤΑ ΠΟΙΕΙΣ Η ΤΙΣ ΣΟΙ ΕΔΩΚΕΝ ΤΗΝ ΕΞΟΥΣΙΑΝ ΤΑΥΤΗΝ ΙΝΑ ΤΑΥΤΑ ΠΟΙΗΙΣ
11,29,Ο ΔΕ ΙΗΣΟΥΣ ΕΙΠΕΝ ΑΥΤΟΙΣ ΕΠΕΡΩΤΗΣΩ ΥΜΑΣ ΚΑΓΩ ΕΝΑ ΛΟΓΟΝ ΚΑΙ ΑΠΟΚΡΙΘΗΤΕ ΜΟΙ ΚΑΙ ΕΡΩ ΥΜΙΝ ΕΝ ΠΟΙΑΙ ΕΞΟΥΣΙΑΙ ΤΑΥΤΑ ΠΟΙΩ
11,30,ΤΟ ΒΑΠΤΙΣΜΑ ΤΟ ΙΩΑΝΝΟΥ ΕΞ ΟΥΡΑΝΟΥ ΗΝ Η ΕΞ ΑΝΘΡΩΠΩΝ ΑΠΟΚΡΙΘΗΤΕ ΜΟΙ
11,31,ΚΑΙ ΔΙΕΛΟΓΙΖΟΝΤΟ ΠΡΟΣ ΕΑΥΤΟΥΣ ΛΕΓΟΝΤΕΣ ΤΙ ΕΙΠΩΜΕΝ ΕΑΝ ΕΙΠΩΜΕΝ ΕΞ ΟΥΡΑΝΟΥ ΕΡΕΙ ΔΙΑ ΤΙ ΟΥΝ ΟΥΚ ΕΠΙΣΤΕΥΣΑΤΕ ΑΥΤΩΙ
11,32,ΑΛΛΑ ΕΙΠΩΜΕΝ ΕΞ ΑΝΘΡΩΠΩΝ ΕΦΟΒΟΥΝΤΟ ΤΟΝ ΟΧΛΟΝ ΑΠΑΝΤΕΣ ΓΑΡ ΕΙΧΟΝ ΤΟΝ ΙΩΑΝΝΗΝ ΟΝΤΩΣ ΟΤΙ ΠΡΟΦΗΤΗΣ ΗΝ
11,33,ΚΑΙ ΑΠΟΚΡΙΘΕΝΤΕΣ ΤΩΙ ΙΗΣΟΥ ΛΕΓΟΥΣΙΝ ΟΥΚ ΟΙΔΑΜΕΝ ΚΑΙ Ο ΙΗΣΟΥΣ ΛΕΓΕΙ ΑΥΤΟΙΣ ΟΥΔΕ ΕΓΩ ΛΕΓΩ ΥΜΙΝ ΕΝ ΠΟΙΑΙ ΕΞΟΥΣΙΑΙ ΤΑΥΤΑ ΠΟΙΩ
12,1,ΚΑΙ ΗΡΞΑΤΟ ΑΥΤΟΙΣ ΕΝ ΠΑΡΑΒΟΛΑΙΣ ΛΑΛΕΙΝ ΑΜΠΕΛΩΝΑ ΑΝΘΡΩΠΟΣ ΕΦΥΤΕΥΣΕΝ ΚΑΙ ΠΕΡΙΕΘΗΚΕΝ ΦΡΑΓΜΟΝ ΚΑΙ ΩΡΥΞΕΝ ΥΠΟΛΗΝΙΟΝ ΚΑΙ ΩΙΚΟΔΟΜΗΣΕΝ ΠΥΡΓΟΝ ΚΑΙ ΕΞΕΔΕΤΟ ΑΥΤΟΝ ΓΕΩΡΓΟΙΣ ΚΑΙ ΑΠΕΔΗΜΗΣΕΝ
12,2,ΚΑΙ ΑΠΕΣΤΕΙΛΕΝ ΠΡΟΣ ΤΟΥΣ ΓΕΩΡΓΟΥΣ ΤΩΙ ΚΑΙΡΩΙ ΔΟΥΛΟΝ ΙΝΑ ΠΑΡΑ ΤΩΝ ΓΕΩΡΓΩΝ ΛΑΒΗΙ ΑΠΟ ΤΩΝ ΚΑΡΠΩΝ ΤΟΥ ΑΜΠΕΛΩΝΟΣ
12,3,ΚΑΙ ΛΑΒΟΝΤΕΣ ΑΥΤΟΝ ΕΔΕΙΡΑΝ ΚΑΙ ΑΠΕΣΤΕΙΛΑΝ ΚΕΝΟΝ
12,4,ΚΑΙ ΠΑΛΙΝ ΑΠΕΣΤΕΙΛΕΝ ΠΡΟΣ ΑΥΤΟΥΣ ΑΛΛΟΝ ΔΟΥΛΟΝ ΚΑΚΕΙΝΟΝ ΕΚΕΦΑΛΙΩΣΑΝ ΚΑΙ ΗΤΙΜΑΣΑΝ
12,5,ΚΑΙ ΑΛΛΟΝ ΑΠΕΣΤΕΙΛΕΝ ΚΑΚΕΙΝΟΝ ΑΠΕΚΤΕΙΝΑΝ ΚΑΙ ΠΟΛΛΟΥΣ ΑΛΛΟΥΣ ΟΥΣ ΜΕΝ ΔΕΡΟΝΤΕΣ ΟΥΣ ΔΕ ΑΠΟΚΤΕΝΝΟΝΤΕΣ
12,6,ΕΤΙ ΕΝΑ ΕΙΧΕΝ ΥΙΟΝ ΑΓΑΠΗΤΟΝ ΑΠΕΣΤΕΙΛΕΝ ΑΥΤΟΝ ΕΣΧΑΤΟΝ ΠΡΟΣ ΑΥΤΟΥΣ ΛΕΓΩΝ ΟΤΙ ΕΝΤΡΑΠΗΣΟΝΤΑΙ ΤΟΝ ΥΙΟΝ ΜΟΥ
12,7,ΕΚΕΙΝΟΙ ΔΕ ΟΙ ΓΕΩΡΓΟΙ ΠΡΟΣ ΕΑΥΤΟΥΣ ΕΙΠΑΝ ΟΤΙ ΟΥΤΟΣ ΕΣΤΙΝ Ο ΚΛΗΡΟΝΟΜΟΣ ΔΕΥΤΕ ΑΠΟΚΤΕΙΝΩΜΕΝ ΑΥΤΟΝ ΚΑΙ ΗΜΩΝ ΕΣΤΑΙ Η ΚΛΗΡΟΝΟΜΙΑ
12,8,ΚΑΙ ΛΑΒΟΝΤΕΣ ΑΠΕΚΤΕΙΝΑΝ ΑΥΤΟΝ ΚΑΙ ΕΞΕΒΑΛΟΝ ΑΥΤΟΝ ΕΞΩ ΤΟΥ ΑΜΠΕΛΩΝΟΣ
12,9,ΤΙ ΟΥΝ ΠΟΙΗΣΕΙ Ο ΚΥΡΙΟΣ ΤΟΥ ΑΜΠΕΛΩΝΟΣ ΕΛΕΥΣΕΤΑΙ ΚΑΙ ΑΠΟΛΕΣΕΙ ΤΟΥΣ ΓΕΩΡΓΟΥΣ ΚΑΙ ΔΩΣΕΙ ΤΟΝ ΑΜΠΕΛΩΝΑ ΑΛΛΟΙΣ
12,10,ΟΥΔΕ ΤΗΝ ΓΡΑΦΗΝ ΤΑΥΤΗΝ ΑΝΕΓΝΩΤΕ ΛΙΘΟΝ ΟΝ ΑΠΕΔΟΚΙΜΑΣΑΝ ΟΙ ΟΙΚΟΔΟΜΟΥΝΤΕΣ ΟΥΤΟΣ ΕΓΕΝΗΘΗ ΕΙΣ ΚΕΦΑΛΗΝ ΓΩΝΙΑΣ
12,11,ΠΑΡΑ ΚΥΡΙΟΥ ΕΓΕΝΕΤΟ ΑΥΤΗ ΚΑΙ ΕΣΤΙΝ ΘΑΥΜΑΣΤΗ ΕΝ ΟΦΘΑΛΜΟΙΣ ΗΜΩΝ
12,12,ΚΑΙ ΕΖΗΤΟΥΝ ΑΥΤΟΝ ΚΡΑΤΗΣΑΙ ΚΑΙ ΕΦΟΒΗΘΗΣΑΝ ΤΟΝ ΟΧΛΟΝ ΕΓΝΩΣΑΝ ΓΑΡ ΟΤΙ ΠΡΟΣ ΑΥΤΟΥΣ ΤΗΝ ΠΑΡΑΒΟΛΗΝ ΕΙΠΕΝ ΚΑΙ ΑΦΕΝΤΕΣ ΑΥΤΟΝ ΑΠΗΛΘΟΝ
12,13,ΚΑΙ ΑΠΟΣΤΕΛΛΟΥΣΙΝ ΠΡΟΣ ΑΥΤΟΝ ΤΙΝΑΣ ΤΩΝ ΦΑΡΙΣΑΙΩΝ ΚΑΙ ΤΩΝ ΗΡΩΙΔΙΑΝΩΝ ΙΝΑ ΑΥΤΟΝ ΑΓΡΕΥΣΩΣΙΝ ΛΟΓΩΙ
12,14,ΚΑΙ ΕΛΘΟΝΤΕΣ ΛΕΓΟΥΣΙΝ ΑΥΤΩΙ ΔΙΔΑΣΚΑΛΕ ΟΙΔΑΜΕΝ ΟΤΙ ΑΛΗΘΗΣ ΕΙ ΚΑΙ ΟΥ ΜΕΛΕΙ ΣΟΙ ΠΕΡΙ ΟΥΔΕΝΟΣ ΟΥ ΓΑΡ ΒΛΕΠΕΙΣ ΕΙΣ ΠΡΟΣΩΠΟΝ ΑΝΘΡΩΠΩΝ ΑΛΛΑ ΕΠΙ ΑΛΗΘΕΙΑΣ ΤΗΝ ΟΔΟΝ ΤΟΥ ΘΕΟΥ ΔΙΔΑΣΚΕΙΣ ΕΞΕΣΤΙΝ ΔΟΥΝΑΙ ΚΗΝΣΟΝ ΚΑΙΣΑΡΙ Η ΟΥ ΔΩΜΕΝ Η ΜΗ ΔΩΜΕΝ
12,15,Ο ΔΕ ΕΙΔΩΣ ΑΥΤΩΝ ΤΗΝ ΥΠΟΚΡΙΣΙΝ ΕΙΠΕΝ ΑΥΤΟΙΣ ΤΙ ΜΕ ΠΕΙΡΑΖΕΤΕ ΦΕΡΕΤΕ ΜΟΙ ΔΗΝΑΡΙΟΝ ΙΝΑ ΙΔΩ
12,16,ΟΙ ΔΕ ΗΝΕΓΚΑΝ ΚΑΙ ΛΕΓΕΙ ΑΥΤΟΙΣ ΤΙΝΟΣ Η ΕΙΚΩΝ ΑΥΤΗ ΚΑΙ Η ΕΠΙΓΡΑΦΗ ΟΙ ΔΕ ΕΙΠΑΝ ΑΥΤΩΙ ΚΑΙΣΑΡΟΣ
12,17,Ο ΔΕ ΙΗΣΟΥΣ ΕΙΠΕΝ ΑΥΤΟΙΣ ΤΑ ΚΑΙΣΑΡΟΣ ΑΠΟΔΟΤΕ ΚΑΙΣΑΡΙ ΚΑΙ ΤΑ ΤΟΥ ΘΕΟΥ ΤΩΙ ΘΕΩΙ ΚΑΙ ΕΞΕΘΑΥΜΑΖΟΝ ΕΠΙ ΑΥΤΩΙ
12,18,ΚΑΙ ΕΡΧΟΝΤΑΙ ΣΑΔΔΟΥΚΑΙΟΙ ΠΡΟΣ ΑΥΤΟΝ ΟΙΤΙΝΕΣ ΛΕΓΟΥΣΙΝ ΑΝΑΣΤΑΣΙΝ ΜΗ ΕΙΝΑΙ ΚΑΙ ΕΠΗΡΩΤΩΝ ΑΥΤΟΝ ΛΕΓΟΝΤΕΣ
12,19,ΔΙΔΑΣΚΑΛΕ ΜΩΥΣΗΣ ΕΓΡΑΨΕΝ ΗΜΙΝ ΟΤΙ ΕΑΝ ΤΙΝΟΣ ΑΔΕΛΦΟΣ ΑΠΟΘΑΝΗΙ ΚΑΙ ΚΑΤΑΛΙΠΗΙ ΓΥΝΑΙΚΑ ΚΑΙ ΜΗ ΑΦΗΙ ΤΕΚΝΟΝ ΙΝΑ ΛΑΒΗΙ Ο ΑΔΕΛΦΟΣ ΑΥΤΟΥ ΤΗΝ ΓΥΝΑΙΚΑ ΚΑΙ ΕΞΑΝΑΣΤΗΣΗΙ ΣΠΕΡΜΑ ΤΩΙ ΑΔΕΛΦΩΙ ΑΥΤΟΥ
12,20,ΕΠΤΑ ΑΔΕΛΦΟΙ ΗΣΑΝ ΚΑΙ Ο ΠΡΩΤΟΣ ΕΛΑΒΕΝ ΓΥΝΑΙΚΑ ΚΑΙ ΑΠΟΘΝΗΙΣΚΩΝ ΟΥΚ ΑΦΗΚΕΝ ΣΠΕΡΜΑ
12,21,ΚΑΙ Ο ΔΕΥΤΕΡΟΣ ΕΛΑΒΕΝ ΑΥΤΗΝ ΚΑΙ ΑΠΕΘΑΝΕΝ ΜΗ ΚΑΤΑΛΙΠΩΝ ΣΠΕΡΜΑ ΚΑΙ Ο ΤΡΙΤΟΣ ΩΣΑΥΤΩΣ
12,22,ΚΑΙ ΟΙ ΕΠΤΑ ΟΥΚ ΑΦΗΚΑΝ ΣΠΕΡΜΑ ΕΣΧΑΤΟΝ ΠΑΝΤΩΝ ΚΑΙ Η ΓΥΝΗ ΑΠΕΘΑΝΕΝ
12,23,ΕΝ ΤΗΙ ΑΝΑΣΤΑΣΕΙ ΟΤΑΝ ΑΝΑΣΤΩΣΙΝ ΤΙΝΟΣ ΑΥΤΩΝ ΕΣΤΑΙ ΓΥΝΗ ΟΙ ΓΑΡ ΕΠΤΑ ΕΣΧΟΝ ΑΥΤΗΝ ΓΥΝΑΙΚΑ
12,24,ΕΦΗ ΑΥΤΟΙΣ Ο ΙΗΣΟΥΣ ΟΥ ΔΙΑ ΤΟΥΤΟ ΠΛΑΝΑΣΘΕ ΜΗ ΕΙΔΟΤΕΣ ΤΑΣ ΓΡΑΦΑΣ ΜΗΔΕ ΤΗΝ ΔΥΝΑΜΙΝ ΤΟΥ ΘΕΟΥ
12,25,ΟΤΑΝ ΓΑΡ ΕΚ ΝΕΚΡΩΝ ΑΝΑΣΤΩΣΙΝ ΟΥΤΕ ΓΑΜΟΥΣΙΝ ΟΥΤΕ ΓΑΜΙΖΟΝΤΑΙ ΑΛΛΑ ΕΙΣΙΝ ΩΣ ΑΓΓΕΛΟΙ ΕΝ ΤΟΙΣ ΟΥΡΑΝΟΙΣ
12,26,ΠΕΡΙ ΔΕ ΤΩΝ ΝΕΚΡΩΝ ΟΤΙ ΕΓΕΙΡΟΝΤΑΙ ΟΥΚ ΑΝΕΓΝΩΤΕ ΕΝ ΤΗΙ ΒΙΒΛΩΙ ΜΩΥΣΕΩΣ ΕΠΙ ΤΟΥ ΒΑΤΟΥ ΠΩΣ ΕΙΠΕΝ ΑΥΤΩΙ Ο ΘΕΟΣ ΛΕΓΩΝ ΕΓΩ Ο ΘΕΟΣ ΑΒΡΑΑΜ ΚΑΙ Ο ΘΕΟΣ ΙΣΑΑΚ ΚΑΙ Ο ΘΕΟΣ ΙΑΚΩΒ
12,27,ΟΥΚ ΕΣΤΙΝ ΘΕΟΣ ΝΕΚΡΩΝ ΑΛΛΑ ΖΩΝΤΩΝ ΠΟΛΥ ΠΛΑΝΑΣΘΕ
12,28,ΚΑΙ ΠΡΟΣΕΛΘΩΝ ΕΙΣ ΤΩΝ ΓΡΑΜΜΑΤΕΩΝ ΑΚΟΥΣΑΣ ΑΥΤΩΝ ΣΥΝΖΗΤΟΥΝΤΩΝ ΙΔΩΝ ΟΤΙ ΚΑΛΩΣ ΑΠΕΚΡΙΘΗ ΑΥΤΟΙΣ ΕΠΗΡΩΤΗΣΕΝ ΑΥΤΟΝ ΠΟΙΑ ΕΣΤΙΝ ΕΝΤΟΛΗ ΠΡΩΤΗ ΠΑΝΤΩΝ
12,29,ΑΠΕΚΡΙΘΗ Ο ΙΗΣΟΥΣ ΟΤΙ ΠΡΩΤΗ ΕΣΤΙΝ ΑΚΟΥΕ ΙΣΡΑΗΛ ΚΥΡΙΟΣ Ο ΘΕΟΣ ΗΜΩΝ ΚΥΡΙΟΣ ΕΙΣ ΕΣΤΙΝ
12,30,ΚΑΙ ΑΓΑΠΗΣΕΙΣ ΚΥΡΙΟΝ ΤΟΝ ΘΕΟΝ ΣΟΥ ΕΞ ΟΛΗΣ ΤΗΣ ΚΑΡΔΙΑΣ ΣΟΥ ΚΑΙ ΕΞ ΟΛΗΣ ΤΗΣ ΨΥΧΗΣ ΣΟΥ ΚΑΙ ΕΞ ΟΛΗΣ ΤΗΣ ΔΙΑΝΟΙΑΣ ΣΟΥ ΚΑΙ ΕΞ ΟΛΗΣ ΤΗΣ ΙΣΧΥΟΣ ΣΟΥ
12,31,ΔΕΥΤΕΡΑ ΑΥΤΗ ΑΓΑΠΗΣΕΙΣ ΤΟΝ ΠΛΗΣΙΟΝ ΣΟΥ ΩΣ ΣΕΑΥΤΟΝ ΜΕΙΖΩΝ ΤΟΥΤΩΝ ΑΛΛΗ ΕΝΤΟΛΗ ΟΥΚ ΕΣΤΙΝ
12,32,ΚΑΙ ΕΙΠΕΝ ΑΥΤΩΙ Ο ΓΡΑΜΜΑΤΕΥΣ ΚΑΛΩΣ ΔΙΔΑΣΚΑΛΕ ΕΠΙ ΑΛΗΘΕΙΑΣ ΕΙΠΑΣ ΟΤΙ ΕΙΣ ΕΣΤΙΝ ΚΑΙ ΟΥΚ ΕΣΤΙΝ ΑΛΛΟΣ ΠΛΗΝ ΑΥΤΟΥ
12,33,ΚΑΙ ΤΟ ΑΓΑΠΑΝ ΑΥΤΟΝ ΕΞ ΟΛΗΣ ΤΗΣ ΚΑΡΔΙΑΣ ΚΑΙ ΕΞ ΟΛΗΣ ΤΗΣ ΣΥΝΕΣΕΩΣ ΚΑΙ ΕΞ ΟΛΗΣ ΤΗΣ ΙΣΧΥΟΣ ΚΑΙ ΤΟ ΑΓΑΠΑΝ ΤΟΝ ΠΛΗΣΙΟΝ ΩΣ ΕΑΥΤΟΝ ΠΕΡΙΣΣΟΤΕΡΟΝ ΕΣΤΙΝ ΠΑΝΤΩΝ ΤΩΝ ΟΛΟΚΑΥΤΩΜΑΤΩΝ ΚΑΙ ΘΥΣΙΩΝ
12,34,ΚΑΙ Ο ΙΗΣΟΥΣ ΙΔΩΝ ΑΥΤΟΝ ΟΤΙ ΝΟΥΝΕΧΩΣ ΑΠΕΚΡΙΘΗ ΕΙΠΕΝ ΑΥΤΩΙ ΟΥ ΜΑΚΡΑΝ ΕΙ ΑΠΟ ΤΗΣ ΒΑΣΙΛΕΙΑΣ ΤΟΥ ΘΕΟΥ ΚΑΙ ΟΥΔΕΙΣ ΟΥΚΕΤΙ ΕΤΟΛΜΑ ΑΥΤΟΝ ΕΠΕΡΩΤΗΣΑΙ
12,35,ΚΑΙ ΑΠΟΚΡΙΘΕΙΣ Ο ΙΗΣΟΥΣ ΕΛΕΓΕΝ ΔΙΔΑΣΚΩΝ ΕΝ ΤΩΙ ΙΕΡΩΙ ΠΩΣ ΛΕΓΟΥΣΙΝ ΟΙ ΓΡΑΜΜΑΤΕΙΣ ΟΤΙ Ο ΧΡΙΣΤΟΣ ΥΙΟΣ ΔΑΥΕΙΔ ΕΣΤΙΝ
12,36,ΑΥΤΟΣ ΔΑΥΕΙΔ ΕΙΠΕΝ ΕΝ ΤΩΙ ΠΝΕΥΜΑΤΙ ΤΩΙ ΑΓΙΩΙ ΕΙΠΕΝ Ο ΚΥΡΙΟΣ ΤΩΙ ΚΥΡΙΩΙ ΜΟΥ ΚΑΘΟΥ ΕΚ ΔΕΞΙΩΝ ΜΟΥ ΕΩΣ ΑΝ ΘΩ ΤΟΥΣ ΕΧΘΡΟΥΣ ΣΟΥ ΥΠΟΚΑΤΩ ΤΩΝ ΠΟΔΩΝ ΣΟΥ
12,37,ΑΥΤΟΣ ΔΑΥΕΙΔ ΛΕΓΕΙ ΑΥΤΟΝ ΚΥΡΙΟΝ ΚΑΙ ΠΟΘΕΝ ΥΙΟΣ ΑΥΤΟΥ ΕΣΤΙΝ ΚΑΙ ΠΟΛΥΣ ΟΧΛΟΣ ΗΚΟΥΕΝ ΑΥΤΟΥ ΗΔΕΩΣ
12,38,ΚΑΙ ΕΝ ΤΗΙ ΔΙΔΑΧΗΙ ΑΥΤΟΥ ΕΛΕΓΕΝ ΒΛΕΠΕΤΕ ΑΠΟ ΤΩΝ ΓΡΑΜΜΑΤΕΩΝ ΤΩΝ ΘΕΛΟΝΤΩΝ ΕΝ ΣΤΟΛΑΙΣ ΠΕΡΙΠΑΤΕΙΝ ΚΑΙ ΑΣΠΑΣΜΟΥΣ ΕΝ ΤΑΙΣ ΑΓΟΡΑΙΣ
12,39,ΚΑΙ ΠΡΩΤΟΚΑΘΕΔΡΙΑΣ ΕΝ ΤΑΙΣ ΣΥΝΑΓΩΓΑΙΣ ΚΑΙ ΠΡΩΤΟΚΛΙΣΙΑΣ ΕΝ ΤΟΙΣ ΔΕΙΠΝΟΙΣ
12,40,ΟΙ ΚΑΤΕΣΘΙΟΝΤΕΣ ΤΑΣ ΟΙΚΙΑΣ ΤΩΝ ΧΗΡΩΝ ΚΑΙ ΠΡΟΦΑΣΕΙ ΜΑΚΡΑ ΠΡΟΣΕΥΧΟΜΕΝΟΙ ΟΥΤΟΙ ΛΗΜΨΟΝΤΑΙ ΠΕΡΙΣΣΟΤΕΡΟΝ ΚΡΙΜΑ
12,41,ΚΑΙ ΚΑΘΙΣΑΣ ΚΑΤΕΝΑΝΤΙ ΤΟΥ ΓΑΖΟΦΥΛΑΚΙΟΥ ΕΘΕΩΡΕΙ ΠΩΣ Ο ΟΧΛΟΣ ΒΑΛΛΕΙ ΧΑΛΚΟΝ ΕΙΣ ΤΟ ΓΑΖΟΦΥΛΑΚΙΟΝ ΚΑΙ ΠΟΛΛΟΙ ΠΛΟΥΣΙΟΙ ΕΒΑΛΛΟΝ ΠΟΛΛΑ
12,42,ΚΑΙ ΕΛΘΟΥΣΑ ΜΙΑ ΧΗΡΑ ΠΤΩΧΗ ΕΒΑΛΕΝ ΛΕΠΤΑ ΔΥΟ Ο ΕΣΤΙΝ ΚΟΔΡΑΝΤΗΣ
12,43,ΚΑΙ ΠΡΟΣΚΑΛΕΣΑΜΕΝΟΣ ΤΟΥΣ ΜΑΘΗΤΑΣ ΑΥΤΟΥ ΕΙΠΕΝ ΑΥΤΟΙΣ ΑΜΗΝ ΛΕΓΩ ΥΜΙΝ ΟΤΙ Η ΧΗΡΑ ΑΥΤΗ Η ΠΤΩΧΗ ΠΛΕΙΟΝ ΠΑΝΤΩΝ ΕΒΑΛΕΝ ΤΩΝ ΒΑΛΛΟΝΤΩΝ ΕΙΣ ΤΟ ΓΑΖΟΦΥΛΑΚΙΟΝ
12,44,ΠΑΝΤΕΣ ΓΑΡ ΕΚ ΤΟΥ ΠΕΡΙΣΣΕΥΟΝΤΟΣ ΑΥΤΟΙΣ ΕΒΑΛΟΝ ΑΥΤΗ ΔΕ ΕΚ ΤΗΣ ΥΣΤΕΡΗΣΕΩΣ ΑΥΤΗΣ ΠΑΝΤΑ ΟΣΑ ΕΙΧΕΝ ΕΒΑΛΕΝ ΟΛΟΝ ΤΟΝ ΒΙΟΝ ΑΥΤΗΣ
13,1,ΚΑΙ ΕΚΠΟΡΕΥΟΜΕΝΟΥ ΑΥΤΟΥ ΕΚ ΤΟΥ ΙΕΡΟΥ ΛΕΓΕΙ ΑΥΤΩΙ ΕΙΣ ΤΩΝ ΜΑΘΗΤΩΝ ΑΥΤΟΥ ΔΙΔΑΣΚΑΛΕ ΙΔΕ ΠΟΤΑΠΟΙ ΛΙΘΟΙ ΚΑΙ ΠΟΤΑΠΑΙ ΟΙΚΟΔΟΜΑΙ
13,2,ΚΑΙ Ο ΙΗΣΟΥΣ ΕΙΠΕΝ ΑΥΤΩΙ ΒΛΕΠΕΙΣ ΤΑΥΤΑΣ ΤΑΣ ΜΕΓΑΛΑΣ ΟΙΚΟΔΟΜΑΣ ΟΥ ΜΗ ΑΦΕΘΗΙ ΩΔΕ ΛΙΘΟΣ ΕΠΙ ΛΙΘΟΝ ΟΣ ΟΥ ΜΗ ΚΑΤΑΛΥΘΗΙ
13,3,ΚΑΙ ΚΑΘΗΜΕΝΟΥ ΑΥΤΟΥ ΕΙΣ ΤΟ ΟΡΟΣ ΤΩΝ ΕΛΑΙΩΝ ΚΑΤΕΝΑΝΤΙ ΤΟΥ ΙΕΡΟΥ ΕΠΗΡΩΤΑ ΑΥΤΟΝ ΚΑΤΑ ΙΔΙΑΝ ΠΕΤΡΟΣ ΚΑΙ ΙΑΚΩΒΟΣ ΚΑΙ ΙΩΑΝΝΗΣ ΚΑΙ ΑΝΔΡΕΑΣ
13,4,ΕΙΠΟΝ ΗΜΙΝ ΠΟΤΕ ΤΑΥΤΑ ΕΣΤΑΙ ΚΑΙ ΤΙ ΤΟ ΣΗΜΕΙΟΝ ΟΤΑΝ ΜΕΛΛΗΙ ΤΑΥΤΑ ΣΥΝΤΕΛΕΙΣΘΑΙ ΠΑΝΤΑ
13,5,Ο ΔΕ ΙΗΣΟΥΣ ΗΡΞΑΤΟ ΛΕΓΕΙΝ ΑΥΤΟΙΣ ΒΛΕΠΕΤΕ ΜΗ ΤΙΣ ΥΜΑΣ ΠΛΑΝΗΣΗΙ
13,6,ΠΟΛΛΟΙ ΕΛΕΥΣΟΝΤΑΙ ΕΠΙ ΤΩΙ ΟΝΟΜΑΤΙ ΜΟΥ ΛΕΓΟΝΤΕΣ ΟΤΙ ΕΓΩ ΕΙΜΙ ΚΑΙ ΠΟΛΛΟΥΣ ΠΛΑΝΗΣΟΥΣΙΝ
13,7,ΟΤΑΝ ΔΕ ΑΚΟΥΣΗΤΕ ΠΟΛΕΜΟΥΣ ΚΑΙ ΑΚΟΑΣ ΠΟΛΕΜΩΝ ΜΗ ΘΡΟΕΙΣΘΕ ΔΕΙ ΓΕΝΕΣΘΑΙ ΑΛΛΑ ΟΥΠΩ ΤΟ ΤΕΛΟΣ
13,8,ΕΓΕΡΘΗΣΕΤΑΙ ΓΑΡ ΕΘΝΟΣ ΕΠΙ ΕΘΝΟΣ ΚΑΙ ΒΑΣΙΛΕΙΑ ΕΠΙ ΒΑΣΙΛΕΙΑΝ ΕΣΟΝΤΑΙ ΣΕΙΣΜΟΙ ΚΑΤΑ ΤΟΠΟΥΣ ΕΣΟΝΤΑΙ ΛΙΜΟΙ ΑΡΧΗ ΩΔΙΝΩΝ ΤΑΥΤΑ
13,9,ΒΛΕΠΕΤΕ ΔΕ ΥΜΕΙΣ ΕΑΥΤΟΥΣ ΠΑΡΑΔΩΣΟΥΣΙΝ ΥΜΑΣ ΕΙΣ ΣΥΝΕΔΡΙΑ ΚΑΙ ΕΙΣ ΣΥΝΑΓΩΓΑΣ ΔΑΡΗΣΕΣΘΕ ΚΑΙ ΕΠΙ ΗΓΕΜΟΝΩΝ ΚΑΙ ΒΑΣΙΛΕΩΝ ΣΤΑΘΗΣΕΣΘΕ ΕΝΕΚΕΝ ΕΜΟΥ ΕΙΣ ΜΑΡΤΥΡΙΟΝ ΑΥΤΟΙΣ
13,10,ΚΑΙ ΕΙΣ ΠΑΝΤΑ ΤΑ ΕΘΝΗ ΠΡΩΤΟΝ ΔΕΙ ΚΗΡΥΧΘΗΝΑΙ ΤΟ ΕΥΑΓΓΕΛΙΟΝ
13,11,ΚΑΙ ΟΤΑΝ ΑΓΩΣΙΝ ΥΜΑΣ ΠΑΡΑΔΙΔΟΝΤΕΣ ΜΗ ΠΡΟΜΕΡΙΜΝΑΤΕ ΤΙ ΛΑΛΗΣΗΤΕ ΑΛΛΑ Ο ΕΑΝ ΔΟΘΗΙ ΥΜΙΝ ΕΝ ΕΚΕΙΝΗΙ ΤΗΙ ΩΡΑΙ ΤΟΥΤΟ ΛΑΛΕΙΤΕ ΟΥ ΓΑΡ ΕΣΤΕ ΥΜΕΙΣ ΟΙ ΛΑΛΟΥΝΤΕΣ ΑΛΛΑ ΤΟ ΠΝΕΥΜΑ ΤΟ ΑΓΙΟΝ
13,12,ΚΑΙ ΠΑΡΑΔΩΣΕΙ ΑΔΕΛΦΟΣ ΑΔΕΛΦΟΝ ΕΙΣ ΘΑΝΑΤΟΝ ΚΑΙ ΠΑΤΗΡ ΤΕΚΝΟΝ ΚΑΙ ΕΠΑΝΑΣΤΗΣΟΝΤΑΙ ΤΕΚΝΑ ΕΠΙ ΓΟΝΕΙΣ ΚΑΙ ΘΑΝΑΤΩΣΟΥΣΙΝ ΑΥΤΟΥΣ
13,13,ΚΑΙ ΕΣΕΣΘΕ ΜΙΣΟΥΜΕΝΟΙ ΥΠΟ ΠΑΝΤΩΝ ΔΙΑ ΤΟ ΟΝΟΜΑ ΜΟΥ Ο ΔΕ ΥΠΟΜΕΙΝΑΣ ΕΙΣ ΤΕΛΟΣ ΟΥΤΟΣ ΣΩΘΗΣΕΤΑΙ
13,14,ΟΤΑΝ ΔΕ ΙΔΗΤΕ ΤΟ ΒΔΕΛΥΓΜΑ ΤΗΣ ΕΡΗΜΩΣΕΩΣ ΕΣΤΗΚΟΤΑ ΟΠΟΥ ΟΥ ΔΕΙ Ο ΑΝΑΓΙΝΩΣΚΩΝ ΝΟΕΙΤΩ ΤΟΤΕ ΟΙ ΕΝ ΤΗΙ ΙΟΥΔΑΙΑΙ ΦΕΥΓΕΤΩΣΑΝ ΕΙΣ ΤΑ ΟΡΗ
13,15,Ο ΔΕ ΕΠΙ ΤΟΥ ΔΩΜΑΤΟΣ ΜΗ ΚΑΤΑΒΑΤΩ ΜΗΔΕ ΕΙΣΕΛΘΑΤΩ ΑΡΑΙ ΤΙ ΕΚ ΤΗΣ ΟΙΚΙΑΣ ΑΥΤΟΥ
13,16,ΚΑΙ Ο ΕΙΣ ΤΟΝ ΑΓΡΟΝ ΜΗ ΕΠΙΣΤΡΕΨΑΤΩ ΕΙΣ ΤΑ ΟΠΙΣΩ ΑΡΑΙ ΤΟ ΙΜΑΤΙΟΝ ΑΥΤΟΥ
13,17,ΟΥΑΙ ΔΕ ΤΑΙΣ ΕΝ ΓΑΣΤΡΙ ΕΧΟΥΣΑΙΣ ΚΑΙ ΤΑΙΣ ΘΗΛΑΖΟΥΣΑΙΣ ΕΝ ΕΚΕΙΝΑΙΣ ΤΑΙΣ ΗΜΕΡΑΙΣ
13,18,ΠΡΟΣΕΥΧΕΣΘΕ ΔΕ ΙΝΑ ΜΗ ΓΕΝΗΤΑΙ ΧΕΙΜΩΝΟΣ
13,19,ΕΣΟΝΤΑΙ ΓΑΡ ΑΙ ΗΜΕΡΑΙ ΕΚΕΙΝΑΙ ΘΛΙΨΙΣ ΟΙΑ ΟΥ ΓΕΓΟΝΕΝ ΤΟΙΑΥΤΗ ΑΠΟ ΑΡΧΗΣ ΚΤΙΣΕΩΣ ΗΝ ΕΚΤΙΣΕΝ Ο ΘΕΟΣ ΕΩΣ ΤΟΥ ΝΥΝ ΚΑΙ ΟΥ ΜΗ ΓΕΝΗΤΑΙ
13,20,ΚΑΙ ΕΙ ΜΗ ΕΚΟΛΟΒΩΣΕΝ ΚΥΡΙΟΣ ΤΑΣ ΗΜΕΡΑΣ ΟΥΚ ΑΝ ΕΣΩΘΗ ΠΑΣΑ ΣΑΡΞ ΑΛΛΑ ΔΙΑ ΤΟΥΣ ΕΚΛΕΚΤΟΥΣ ΟΥΣ ΕΞΕΛΕΞΑΤΟ ΕΚΟΛΟΒΩΣΕΝ ΤΑΣ ΗΜΕΡΑΣ
13,21,ΚΑΙ ΤΟΤΕ ΕΑΝ ΤΙΣ ΥΜΙΝ ΕΙΠΗΙ ΙΔΕ ΩΔΕ Ο ΧΡΙΣΤΟΣ ΙΔΕ ΕΚΕΙ ΜΗ ΠΙΣΤΕΥΕΤΕ
13,22,ΕΓΕΡΘΗΣΟΝΤΑΙ ΓΑΡ ΨΕΥΔΟΧΡΙΣΤΟΙ ΚΑΙ ΨΕΥΔΟΠΡΟΦΗΤΑΙ ΚΑΙ ΔΩΣΟΥΣΙΝ ΣΗΜΕΙΑ ΚΑΙ ΤΕΡΑΤΑ ΠΡΟΣ ΤΟ ΑΠΟΠΛΑΝΑΝ ΕΙ ΔΥΝΑΤΟΝ ΤΟΥΣ ΕΚΛΕΚΤΟΥΣ
13,23,ΥΜΕΙΣ ΔΕ ΒΛΕΠΕΤΕ ΙΔΟΥ ΠΡΟΕΙΡΗΚΑ ΥΜΙΝ ΠΑΝΤΑ
13,24,ΑΛΛΑ ΕΝ ΕΚΕΙΝΑΙΣ ΤΑΙΣ ΗΜΕΡΑΙΣ ΜΕΤΑ ΤΗΝ ΘΛΙΨΙΝ ΕΚΕΙΝΗΝ Ο ΗΛΙΟΣ ΣΚΟΤΙΣΘΗΣΕΤΑΙ ΚΑΙ Η ΣΕΛΗΝΗ ΟΥ ΔΩΣΕΙ ΤΟ ΦΕΓΓΟΣ ΑΥΤΗΣ
13,25,ΚΑΙ ΟΙ ΑΣΤΕΡΕΣ ΕΣΟΝΤΑΙ ΕΚ ΤΟΥ ΟΥΡΑΝΟΥ ΠΙΠΤΟΝΤΕΣ ΚΑΙ ΑΙ ΔΥΝΑΜΕΙΣ ΑΙ ΕΝ ΤΟΙΣ ΟΥΡΑΝΟΙΣ ΣΑΛΕΥΘΗΣΟΝΤΑΙ
13,26,ΚΑΙ ΤΟΤΕ ΟΨΟΝΤΑΙ ΤΟΝ ΥΙΟΝ ΤΟΥ ΑΝΘΡΩΠΟΥ ΕΡΧΟΜΕΝΟΝ ΕΝ ΝΕΦΕΛΑΙΣ ΜΕΤΑ ΔΥΝΑΜΕΩΣ ΠΟΛΛΗΣ ΚΑΙ ΔΟΞΗΣ
13,27,ΚΑΙ ΤΟΤΕ ΑΠΟΣΤΕΛΕΙ ΤΟΥΣ ΑΓΓΕΛΟΥΣ ΚΑΙ ΕΠΙΣΥΝΑΞΕΙ ΤΟΥΣ ΕΚΛΕΚΤΟΥΣ ΑΥΤΟΥ ΕΚ ΤΩΝ ΤΕΣΣΑΡΩΝ ΑΝΕΜΩΝ ΑΠΟ ΑΚΡΟΥ ΓΗΣ ΕΩΣ ΑΚΡΟΥ ΟΥΡΑΝΟΥ
13,28,ΑΠΟ ΔΕ ΤΗΣ ΣΥΚΗΣ ΜΑΘΕΤΕ ΤΗΝ ΠΑΡΑΒΟΛΗΝ ΟΤΑΝ ΗΔΗ Ο ΚΛΑΔΟΣ ΑΥΤΗΣ ΑΠΑΛΟΣ ΓΕΝΗΤΑΙ ΚΑΙ ΕΚΦΥΗΙ ΤΑ ΦΥΛΛΑ ΓΙΝΩΣΚΕΤΕ ΟΤΙ ΕΓΓΥΣ ΤΟ ΘΕΡΟΣ ΕΣΤΙΝ
13,29,ΟΥΤΩΣ ΚΑΙ ΥΜΕΙΣ ΟΤΑΝ ΙΔΗΤΕ ΤΑΥΤΑ ΓΙΝΟΜΕΝΑ ΓΙΝΩΣΚΕΤΕ ΟΤΙ ΕΓΓΥΣ ΕΣΤΙΝ ΕΠΙ ΘΥΡΑΙΣ
13,30,ΑΜΗΝ ΛΕΓΩ ΥΜΙΝ ΟΤΙ ΟΥ ΜΗ ΠΑΡΕΛΘΗΙ Η ΓΕΝΕΑ ΑΥΤΗ ΜΕΧΡΙΣ ΟΥ ΤΑΥΤΑ ΠΑΝΤΑ ΓΕΝΗΤΑΙ
13,31,Ο ΟΥΡΑΝΟΣ ΚΑΙ Η ΓΗ ΠΑΡΕΛΕΥΣΟΝΤΑΙ ΟΙ ΔΕ ΛΟΓΟΙ ΜΟΥ ΟΥ ΜΗ ΠΑΡΕΛΕΥΣΟΝΤΑΙ
13,32,ΠΕΡΙ ΔΕ ΤΗΣ ΗΜΕΡΑΣ ΕΚΕΙΝΗΣ Η ΤΗΣ ΩΡΑΣ ΟΥΔΕΙΣ ΟΙΔΕΝ ΟΥΔΕ ΟΙ ΑΓΓΕΛΟΙ ΕΝ ΟΥΡΑΝΩΙ ΟΥΔΕ Ο ΥΙΟΣ ΕΙ ΜΗ Ο ΠΑΤΗΡ
13,33,ΒΛΕΠΕΤΕ ΑΓΡΥΠΝΕΙΤΕ ΚΑΙ ΠΡΟΣΕΥΧΕΣΘΕ ΟΥΚ ΟΙΔΑΤΕ ΓΑΡ ΠΟΤΕ Ο ΚΑΙΡΟΣ ΕΣΤΙΝ
13,34,ΩΣ ΑΝΘΡΩΠΟΣ ΑΠΟΔΗΜΟΣ ΑΦΕΙΣ ΤΗΝ ΟΙΚΙΑΝ ΑΥΤΟΥ ΚΑΙ ΔΟΥΣ ΤΟΙΣ ΔΟΥΛΟΙΣ ΑΥΤΟΥ ΤΗΝ ΕΞΟΥΣΙΑΝ ΕΚΑΣΤΩΙ ΤΟ ΕΡΓΟΝ ΑΥΤΟΥ ΚΑΙ ΤΩΙ ΘΥΡΩΡΩΙ ΕΝΕΤΕΙΛΑΤΟ ΙΝΑ ΓΡΗΓΟΡΗΙ
13,35,ΓΡΗΓΟΡΕΙΤΕ ΟΥΝ ΟΥΚ ΟΙΔΑΤΕ ΓΑΡ ΠΟΤΕ Ο ΚΥΡΙΟΣ ΤΗΣ ΟΙΚΙΑΣ ΕΡΧΕΤΑΙ Η ΟΨΕ Η ΜΕΣΟΝΥΚΤΙΟΝ Η ΑΛΕΚΤΟΡΟΦΩΝΙΑΣ Η ΠΡΩΙ
