chapter,verse,text
1,1,ΑΡΧΗ ΤΟΥ ΕΥΑΓΓΕΛΙΟΥ ΙΗΣΟΥ ΧΡΙΣΤΟΥ ΥΙΟΥ ΘΕΟΥ
1,2,ΚΑΘΩΣ ΓΕΓΡΑΠΤΑΙ ΕΝ ΤΩΙ ΗΣΑΙΑΙ ΤΩΙ ΠΡΟΦΗΤΗΙ ΙΔΟΥ ΑΠΟΣΤΕΛΛΩ ΤΟΝ ΑΓΓΕΛΟΝ ΜΟΥ ΠΡΟ ΠΡΟΣΩΠΟΥ ΣΟΥ ΟΣ ΚΑΤΑΣΚΕΥΑΣΕΙ ΤΗΝ ΟΔΟΝ ΣΟΥ
1,3,ΦΩΝΗ ΒΟΩΝΤΟΣ ΕΝ ΤΗΙ ΕΡΗΜΩΙ ΕΤΟΙΜΑΣΑΤΕ ΤΗΝ ΟΔΟΝ ΚΥΡΙΟΥ ΕΥΘΕΙΑΣ ΠΟΙΕΙΤΕ ΤΑΣ ΤΡΙΒΟΥΣ ΑΥΤΟΥ
1,4,ΕΓΕΝΕΤΟ ΙΩΑΝΝΗΣ Ο ΒΑΠΤΙΖΩΝ ΕΝ ΤΗΙ ΕΡΗΜΩΙ ΚΑΙ ΚΗΡΥΣΣΩΝ ΒΑΠΤΙΣΜΑ ΜΕΤΑΝΟΙΑΣ ΕΙΣ ΑΦΕΣΙΝ ΑΜΑΡΤΙΩΝ
1,5,ΚΑΙ ΕΞΕΠΟΡΕΥΕΤΟ ΠΡΟΣ ΑΥΤΟΝ ΠΑΣΑ Η ΙΟΥΔΑΙΑ ΧΩΡΑ ΚΑΙ ΟΙ ΙΕΡΟΣΟΛΥΜΕΙΤΑΙ ΠΑΝΤΕΣ ΚΑΙ ΕΒΑΠΤΙΖΟΝΤΟ ΥΠΟ ΑΥΤΟΥ ΕΝ ΤΩΙ ΙΟΡΔΑΝΗΙ ΠΟΤΑΜΩΙ ΕΞΟΜΟΛΟΓΟΥΜΕΝΟΙ ΤΑΣ ΑΜΑΡΤΙΑΣ ΑΥΤΩΝ
1,6,ΚΑΙ ΗΝ Ο ΙΩΑΝΝΗΣ ΕΝΔΕΔΥΜΕΝΟΣ ΤΡΙΧΑΣ ΚΑΜΗΛΟΥ ΚΑΙ ΖΩΝΗΝ ΔΕΡΜΑΤΙΝΗΝ ΠΕΡΙ ΤΗΝ ΟΣΦΥΝ ΑΥΤΟΥ ΚΑΙ ΕΣΘΩΝ ΑΚΡΙΔΑΣ ΚΑΙ ΜΕΛΙ ΑΓΡΙΟΝ
1,7,ΚΑΙ ΕΚΗΡΥΣΣΕΝ ΛΕΓΩΝ ΕΡΧΕΤΑΙ Ο ΙΣΧΥΡΟΤΕΡΟΣ ΜΟΥ ΟΠΙΣΩ ΜΟΥ ΟΥ ΟΥΚ ΕΙΜΙ ΙΚΑΝΟΣ ΚΥΨΑΣ ΛΥΣΑΙ ΤΟΝ ΙΜΑΝΤΑ ΤΩΝ ΥΠΟΔΗΜΑΤΩΝ ΑΥΤΟΥ
1,8,ΕΓΩ ΕΒΑΠΤΙΣΑ ΥΜΑΣ ΥΔΑΤΙ ΑΥΤΟΣ ΔΕ ΒΑΠΤΙΣΕΙ ΥΜΑΣ ΕΝ ΠΝΕΥΜΑΤΙ ΑΓΙΩΙ
1,9,ΚΑΙ ΕΓΕΝΕΤΟ ΕΝ ΕΚΕΙΝΑΙΣ ΤΑΙΣ ΗΜΕΡΑΙΣ ΗΛΘΕΝ ΙΗΣΟΥΣ ΑΠΟ ΝΑΖΑΡΕΤ ΤΗΣ ΓΑΛΙΛΑΙΑΣ ΚΑΙ ΕΒΑΠΤΙΣΘΗ ΕΙΣ ΤΟΝ ΙΟΡΔΑΝΗΝ ΥΠΟ ΙΩΑΝΝΟΥ
1,10,ΚΑΙ ΕΥΘΥΣ ΑΝΑΒΑΙΝΩΝ ΕΚ ΤΟΥ ΥΔΑΤΟΣ ΕΙΔΕΝ ΣΧΙΖΟΜΕΝΟΥΣ ΤΟΥΣ ΟΥΡΑΝΟΥΣ ΚΑΙ ΤΟ ΠΝΕΥΜΑ ΩΣ ΠΕΡΙΣΤΕΡΑΝ ΚΑΤΑΒΑΙΝΟΝ ΕΠΙ ΑΥΤΟΝ
1,11,ΚΑΙ ΦΩΝΗ ΕΓΕΝΕΤΟ ΕΚ ΤΩΝ ΟΥΡΑΝΩΝ ΣΥ ΕΙ Ο ΥΙΟΣ ΜΟΥ Ο ΑΓΑΠΗΤΟΣ ΕΝ ΣΟΙ ΕΥΔΟΚΗΣΑ
1,12,ΚΑΙ ΕΥΘΥΣ ΤΟ ΠΝΕΥΜΑ ΑΥΤΟΝ ΕΚΒΑΛΛΕΙ ΕΙΣ ΤΗΝ ΕΡΗΜΟΝ
1,13,ΚΑΙ ΗΝ ΕΝ ΤΗΙ ΕΡΗΜΩΙ ΤΕΣΣΕΡΑΚΟΝΤΑ ΗΜΕΡΑΣ ΠΕΙΡΑΖΟΜΕΝΟΣ ΥΠΟ ΤΟΥ ΣΑΤΑΝΑ ΚΑΙ ΗΝ ΜΕΤΑ ΤΩΝ ΘΗΡΙΩΝ ΚΑΙ ΟΙ ΑΓΓΕΛΟΙ ΔΙΗΚΟΝΟΥΝ ΑΥΤΩΙ
1,14,ΜΕΤΑ ΔΕ ΤΟ ΠΑΡΑΔΟΘΗΝΑΙ ΤΟΝ ΙΩΑΝΝΗΝ ΗΛΘΕΝ Ο ΙΗΣΟΥΣ ΕΙΣ ΤΗΝ ΓΑΛΙΛΑΙΑΝ ΚΗΡΥΣΣΩΝ ΤΟ ΕΥΑΓΓΕΛΙΟΝ ΤΟΥ ΘΕΟΥ
1,15,ΚΑΙ ΛΕΓΩΝ ΟΤΙ ΠΕΠΛΗΡΩΤΑΙ Ο ΚΑΙΡΟΣ ΚΑΙ ΗΓΓΙΚΕΝ Η ΒΑΣΙΛΕΙΑ ΤΟΥ ΘΕΟΥ ΜΕΤΑΝΟΕΙΤΕ ΚΑΙ ΠΙΣΤΕΥΕΤΕ ΕΝ ΤΩΙ ΕΥΑΓΓΕΛΙΩΙ
1,16,ΚΑΙ ΠΑΡΑΓΩΝ ΠΑΡΑ ΤΗΝ ΘΑΛΑΣΣΑΝ ΤΗΣ ΓΑΛΙΛΑΙΑΣ ΕΙΔΕΝ ΣΙΜΩΝΑ ΚΑΙ ΑΝΔΡΕΑΝ ΤΟΝ ΑΔΕΛΦΟΝ ΣΙΜΩΝΟΣ ΑΜΦΙΒΑΛΛΟΝΤΑΣ ΕΝ ΤΗΙ ΘΑΛΑΣΣΗΙ ΗΣΑΝ ΓΑΡ ΑΛΙΕΙΣ
1,17,ΚΑΙ ΕΙΠΕΝ ΑΥΤΟΙΣ Ο ΙΗΣΟΥΣ ΔΕΥΤΕ ΟΠΙΣΩ ΜΟΥ ΚΑΙ ΠΟΙΗΣΩ ΥΜΑΣ ΓΕΝΕΣΘΑΙ ΑΛΙΕΙΣ ΑΝΘΡΩΠΩΝ
1,18,ΚΑΙ ΕΥΘΕΩΣ ΑΦΕΝΤΕΣ ΤΑ ΔΙΚΤΥΑ ΗΚΟΛΟΥΘΗΣΑΝ ΑΥΤΩΙ
1,19,ΚΑΙ ΠΡΟΒΑΣ ΟΛΙΓΟΝ ΕΙΔΕΝ ΙΑΚΩΒΟΝ ΤΟΝ ΤΟΥ ΖΕΒΕΔΑΙΟΥ ΚΑΙ ΙΩΑΝΝΗΝ ΤΟΝ ΑΔΕΛΦΟΝ ΑΥΤΟΥ ΚΑΙ ΑΥΤΟΥΣ ΕΝ ΤΩΙ ΠΛΟΙΩΙ ΚΑΤΑΡΤΙΖΟΝΤΑΣ ΤΑ ΔΙΚΤΥΑ
1,20,ΚΑΙ ΕΥΘΥΣ ΕΚΑΛΕΣΕΝ ΑΥΤΟΥΣ ΚΑΙ ΑΦΕΝΤΕΣ ΤΟΝ ΠΑΤΕΡΑ ΑΥΤΩΝ ΖΕΒΕΔΑΙΟΝ ΕΝ ΤΩΙ ΠΛΟΙΩΙ ΜΕΤΑ ΤΩΝ ΜΙΣΘΩΤΩΝ ΑΠΗΛΘΟΝ ΟΠΙΣΩ ΑΥΤΟΥ
1,21,ΚΑΙ ΕΙΣΠΟΡΕΥΟΝΤΑΙ ΕΙΣ ΚΑΦΑΡΝΑΟΥΜ ΚΑΙ ΕΥΘΕΩΣ ΤΟΙΣ ΣΑΒΒΑΣΙΝ ΕΙΣΕΛΘΩΝ ΕΙΣ ΤΗΝ ΣΥΝΑΓΩΓΗΝ ΕΔΙΔΑΣΚΕΝ
1,22,ΚΑΙ ΕΞΕΠΛΗΣΣΟΝΤΟ ΕΠΙ ΤΗΙ ΔΙΔΑΧΗΙ ΑΥΤΟΥ ΗΝ ΓΑΡ ΔΙΔΑΣΚΩΝ ΑΥΤΟΥΣ ΩΣ ΕΞΟΥΣΙΑΝ ΕΧΩΝ ΚΑΙ ΟΥΧ ΩΣ ΟΙ ΓΡΑΜΜΑΤΕΙΣ
1,23,ΚΑΙ ΕΥΘΥΣ ΗΝ ΕΝ ΤΗΙ ΣΥΝΑΓΩΓΗΙ ΑΥΤΩΝ ΑΝΘΡΩΠΟΣ ΕΝ ΠΝΕΥΜΑΤΙ ΑΚΑΘΑΡΤΩΙ ΚΑΙ ΑΝΕΚΡΑΞΕΝ
1,24,ΛΕΓΩΝ ΤΙ ΗΜΙΝ ΚΑΙ ΣΟΙ ΙΗΣΟΥ ΝΑΖΑΡΗΝΕ ΗΛΘΕΣ ΑΠΟΛΕΣΑΙ ΗΜΑΣ ΟΙΔΑ ΣΕ ΤΙΣ ΕΙ Ο ΑΓΙΟΣ ΤΟΥ ΘΕΟΥ
1,25,ΚΑΙ ΕΠΕΤΙΜΗΣΕΝ ΑΥΤΩΙ Ο ΙΗΣΟΥΣ ΛΕΓΩΝ ΦΙΜΩΘΗΤΙ ΚΑΙ ΕΞΕΛΘΕ ΕΞ ΑΥΤΟΥ
1,26,ΚΑΙ ΣΠΑΡΑΞΑΝ ΑΥΤΟΝ ΤΟ ΠΝΕΥΜΑ ΤΟ ΑΚΑΘΑΡΤΟΝ ΚΑΙ ΦΩΝΗΣΑΝ ΦΩΝΗΙ ΜΕΓΑΛΗΙ ΕΞΗΛΘΕΝ ΕΞ ΑΥΤΟΥ
1,27,ΚΑΙ ΕΘΑΜΒΗΘΗΣΑΝ ΑΠΑΝΤΕΣ ΩΣΤΕ ΣΥΝΖΗΤΕΙΝ ΠΡΟΣ ΑΥΤΟΥΣ ΛΕΓΟΝΤΑΣ ΤΙ ΕΣΤΙΝ ΤΟΥΤΟ ΔΙΔΑΧΗ ΚΑΙΝΗ ΚΑΤΑ ΕΞΟΥΣΙΑΝ ΚΑΙ ΤΟΙΣ ΠΝΕΥΜΑΣΙ ΤΟΙΣ ΑΚΑΘΑΡΤΟΙΣ ΕΠΙΤΑΣΣΕΙ ΚΑΙ ΥΠΑΚΟΥΟΥΣΙΝ ΑΥΤΩΙ
1,28,ΚΑΙ ΕΞΗΛΘΕΝ Η ΑΚΟΗ ΑΥΤΟΥ ΕΥΘΥΣ ΠΑΝΤΑΧΟΥ ΕΙΣ ΟΛΗΝ ΤΗΝ ΠΕΡΙΧΩΡΟΝ ΤΗΣ ΓΑΛΙΛΑΙΑΣ
1,29,ΚΑΙ ΕΥΘΥΣ ΕΚ ΤΗΣ ΣΥΝΑΓΩΓΗΣ ΕΞΕΛΘΟΝΤΕΣ ΗΛΘΟΝ ΕΙΣ ΤΗΝ ΟΙΚΙΑΝ ΣΙΜΩΝΟΣ ΚΑΙ ΑΝΔΡΕΟΥ ΜΕΤΑ ΙΑΚΩΒΟΥ ΚΑΙ ΙΩΑΝΝΟΥ
1,30,Η ΔΕ ΠΕΝΘΕΡΑ ΣΙΜΩΝΟΣ ΚΑΤΕΚΕΙΤΟ ΠΥΡΕΣΣΟΥΣΑ ΚΑΙ ΕΥΘΥΣ ΛΕΓΟΥΣΙΝ ΑΥΤΩΙ ΠΕΡΙ ΑΥΤΗΣ
1,31,ΚΑΙ ΠΡΟΣΕΛΘΩΝ ΗΓΕΙΡΕΝ ΑΥΤΗΝ ΚΡΑΤΗΣΑΣ ΤΗΣ ΧΕΙΡΟΣ ΚΑΙ ΑΦΗΚΕΝ ΑΥΤΗΝ Ο ΠΥΡΕΤΟΣ ΚΑΙ ΔΙΗΚΟΝΕΙ ΑΥΤΟΙΣ
1,32,ΟΨΙΑΣ ΔΕ ΓΕΝΟΜΕΝΗΣ ΟΤΕ ΕΔΥ Ο ΗΛΙΟΣ ΕΦΕΡΟΝ ΠΡΟΣ ΑΥΤΟΝ ΠΑΝΤΑΣ ΤΟΥΣ ΚΑΚΩΣ ΕΧΟΝΤΑΣ ΚΑΙ ΤΟΥΣ ΔΑΙΜΟΝΙΖΟΜΕΝΟΥΣ
1,33,ΚΑΙ ΗΝ ΟΛΗ Η ΠΟΛΙΣ ΕΠΙΣΥΝΗΓΜΕΝΗ ΠΡΟΣ ΤΗΝ ΘΥΡΑΝ
1,34,ΚΑΙ ΕΘΕΡΑΠΕΥΣΕΝ ΠΟΛΛΟΥΣ ΚΑΚΩΣ ΕΧΟΝΤΑΣ ΠΟΙΚΙΛΑΙΣ ΝΟΣΟΙΣ ΚΑΙ ΔΑΙΜΟΝΙΑ ΠΟΛΛΑ ΕΞΕΒΑΛΕΝ ΚΑΙ ΟΥΚ ΗΦΙΕΝ ΛΑΛΕΙΝ ΤΑ ΔΑΙΜΟΝΙΑ ΟΤΙ ΗΙΔΕΙΣΑΝ ΑΥΤΟΝ
1,35,ΚΑΙ ΠΡΩΙ ΕΝΝΥΧΑ ΛΕΙΑΝ ΑΝΑΣΤΑΣ ΕΞΗΛΘΕΝ ΚΑΙ ΑΠΗΛΘΕΝ ΕΙΣ ΕΡΗΜΟΝ ΤΟΠΟΝ ΚΑΚΕΙ ΠΡΟΣΗΥΧΕΤΟ
1,36,ΚΑΙ ΚΑΤΕΔΙΩΞΕΝ ΑΥΤΟΝ ΣΙΜΩΝ ΚΑΙ ΟΙ ΜΕΤΑ ΑΥΤΟΥ
1,37,ΚΑΙ ΕΥΡΟΝ ΑΥΤΟΝ ΚΑΙ ΛΕΓΟΥΣΙΝ ΑΥΤΩΙ ΟΤΙ ΠΑΝΤΕΣ ΖΗΤΟΥΣΙΝ ΣΕ
1,38,ΚΑΙ ΛΕΓΕΙ ΑΥΤΟΙΣ ΑΓΩΜΕΝ ΑΛΛΑΧΟΥ ΕΙΣ ΤΑΣ ΕΧΟΜΕΝΑΣ ΚΩΜΟΠΟΛΕΙΣ ΙΝΑ ΚΑΙ ΕΚΕΙ ΚΗΡΥΞΩ ΕΙΣ ΤΟΥΤΟ ΓΑΡ ΕΞΗΛΘΟΝ
1,39,ΚΑΙ ΗΛΘΕΝ ΚΗΡΥΣΣΩΝ ΕΙΣ ΤΑΣ ΣΥΝΑΓΩΓΑΣ ΑΥΤΩΝ ΕΙΣ ΟΛΗΝ ΤΗΝ ΓΑΛΙΛΑΙΑΝ ΚΑΙ ΤΑ ΔΑΙΜΟΝΙΑ ΕΚΒΑΛΛΩΝ
1,40,ΚΑΙ ΕΡΧΕΤΑΙ ΠΡΟΣ ΑΥΤΟΝ ΛΕΠΡΟΣ ΠΑΡΑΚΑΛΩΝ ΑΥΤΟΝ ΚΑΙ ΓΟΝΥΠΕΤΩΝ ΛΕΓΩΝ ΑΥΤΩΙ ΟΤΙ ΕΑΝ ΘΕΛΗΙΣ ΔΥΝΑΣΑΙ ΜΕ ΚΑΘΑΡΙΣΑΙ
1,41,ΚΑΙ ΣΠΛΑΓΧΝΙΣΘΕΙΣ ΕΚΤΕΙΝΑΣ ΤΗΝ ΧΕΙΡΑ ΑΥΤΟΥ ΗΨΑΤΟ ΚΑΙ ΛΕΓΕΙ ΑΥΤΩΙ ΘΕΛΩ ΚΑΘΑΡΙΣΘΗΤΙ
1,42,ΚΑΙ ΕΥΘΥΣ ΑΠΗΛΘΕΝ ΑΠΟ ΑΥΤΟΥ Η ΛΕΠΡΑ ΚΑΙ ΕΚΑΘΕΡΙΣΘΗ
1,43,ΚΑΙ ΕΜΒΡΙΜΗΣΑΜΕΝΟΣ ΑΥΤΩΙ ΕΥΘΥΣ ΕΞΕΒΑΛΕΝ ΑΥΤΟΝ
1,44,ΚΑΙ ΛΕΓΕΙ ΑΥΤΩΙ ΟΡΑ ΜΗΔΕΝΙ ΜΗΔΕΝ ΕΙΠΗΙΣ ΑΛΛΑ ΥΠΑΓΕ ΣΕΑΥΤΟΝ ΔΕΙΞΟΝ ΤΩΙ ΙΕΡΕΙ ΚΑΙ ΠΡΟΣΕΝΕΓΚΕ ΠΕΡΙ ΤΟΥ ΚΑΘΑΡΙΣΜΟΥ ΣΟΥ Α ΠΡΟΣΕΤΑΞΕΝ ΜΩΥΣΗΣ ΕΙΣ ΜΑΡΤΥΡΙΟΝ ΑΥΤΟΙΣ
1,45,Ο ΔΕ ΕΞΕΛΘΩΝ ΗΡΞΑΤΟ ΚΗΡΥΣΣΕΙΝ ΠΟΛΛΑ ΚΑΙ ΔΙΑΦΗΜΙΖΕΙΝ ΤΟΝ ΛΟΓΟΝ ΩΣΤΕ ΜΗΚΕΤΙ ΑΥΤΟΝ ΔΥΝΑΣΘΑΙ ΦΑΝΕΡΩΣ ΕΙΣ ΠΟΛΙΝ ΕΙΣΕΛΘΕΙΝ ΑΛΛΑ ΕΞΩ ΕΠΙ ΕΡΗΜΟΙΣ ΤΟΠΟΙΣ ΗΝ ΚΑΙ ΗΡΧΟΝΤΟ ΠΡΟΣ ΑΥΤΟΝ ΠΑΝΤΟΘΕΝ
2,1,ΚΑΙ ΕΙΣΕΛΘΩΝ ΠΑΛΙΝ ΕΙΣ ΚΑΦΑΡΝΑΟΥΜ ΔΙΑ ΗΜΕΡΩΝ ΗΚΟΥΣΘΗ ΟΤΙ ΕΝ ΟΙΚΩΙ ΕΣΤΙΝ
2,2,ΚΑΙ ΣΥΝΗΧΘΗΣΑΝ ΠΟΛΛΟΙ ΩΣΤΕ ΜΗΚΕΤΙ ΧΩΡΕΙΝ ΜΗΔΕ ΤΑ ΠΡΟΣ ΤΗΝ ΘΥΡΑΝ ΚΑΙ ΕΛΑΛΕΙ ΑΥΤΟΙΣ ΤΟΝ ΛΟΓΟΝ
2,3,ΚΑΙ ΕΡΧΟΝΤΑΙ ΦΕΡΟΝΤΕΣ ΠΡΟΣ ΑΥΤΟΝ ΠΑΡΑΛΥΤΙΚΟΝ ΑΙΡΟΜΕΝΟΝ ΥΠΟ ΤΕΣΣΑΡΩΝ
2,4,ΚΑΙ ΜΗ ΔΥΝΑΜΕΝΟΙ ΠΡΟΣΕΝΕΓΚΑΙ ΑΥΤΩΙ ΔΙΑ ΤΟΝ ΟΧΛΟΝ ΑΠΕΣΤΕΓΑΣΑΝ ΤΗΝ ΣΤΕΓΗΝ ΟΠΟΥ ΗΝ ΚΑΙ ΕΞΟΡΥΞΑΝΤΕΣ ΧΑΛΩΣΙ ΤΟΝ ΚΡΑΒΑΤΤΟΝ ΟΠΟΥ Ο ΠΑΡΑΛΥΤΙΚΟΣ ΚΑΤΕΚΕΙΤΟ
2,5,ΚΑΙ ΙΔΩΝ Ο ΙΗΣΟΥΣ ΤΗΝ ΠΙΣΤΙΝ ΑΥΤΩΝ ΛΕΓΕΙ ΤΩΙ ΠΑΡΑΛΥΤΙΚΩΙ ΤΕΚΝΟΝ ΑΦΕΩΝΤΑΙ ΣΟΥ ΑΙ ΑΜΑΡΤΙΑΙ
2,6,ΗΣΑΝ ΔΕ ΤΙΝΕΣ ΤΩΝ ΓΡΑΜΜΑΤΕΩΝ ΕΚΕΙ ΚΑΘΗΜΕΝΟΙ ΚΑΙ ΔΙΑΛΟΓΙΖΟΜΕΝΟΙ ΕΝ ΤΑΙΣ ΚΑΡΔΙΑΙΣ ΑΥΤΩΝ
2,7,ΤΙ ΟΥΤΟΣ ΟΥΤΩΣ ΛΑΛΕΙ ΒΛΑΣΦΗΜΕΙ ΤΙΣ ΔΥΝΑΤΑΙ ΑΦΙΕΝΑΙ ΑΜΑΡΤΙΑΣ ΕΙ ΜΗ ΕΙΣ Ο ΘΕΟΣ
2,8,ΚΑΙ ΕΥΘΥΣ ΕΠΙΓΝΟΥΣ Ο ΙΗΣΟΥΣ ΤΩΙ ΠΝΕΥΜΑΤΙ ΑΥΤΟΥ ΟΤΙ ΟΥΤΩΣ ΔΙΑΛΟΓΙΖΟΝΤΑΙ ΕΝ ΕΑΥΤΟΙΣ ΛΕΓΕΙ ΑΥΤΟΙΣ ΤΙ ΤΑΥΤΑ ΔΙΑΛΟΓΙΖΕΣΘΕ ΕΝ ΤΑΙΣ ΚΑΡΔΙΑΙΣ ΥΜΩΝ
2,9,ΤΙ ΕΣΤΙΝ ΕΥΚΟΠΩΤΕΡΟΝ ΕΙΠΕΙΝ ΤΩΙ ΠΑΡΑΛΥΤΙΚΩΙ ΑΦΙΕΝΤΑΙ ΣΟΥ ΑΙ ΑΜΑΡΤΙΑΙ Η ΕΙΠΕΙΝ ΕΓΕΙΡΕ ΚΑΙ ΑΡΟΝ ΤΟΝ ΚΡΑΒΑΤΤΟΝ ΣΟΥ ΚΑΙ ΠΕΡΙΠΑΤΕΙ
2,10,ΙΝΑ ΔΕ ΕΙΔΗΤΕ ΟΤΙ ΕΞΟΥΣΙΑΝ ΕΧΕΙ Ο ΥΙΟΣ ΤΟΥ ΑΝΘΡΩΠΟΥ ΕΠΙ ΤΗΣ ΓΗΣ ΑΦΙΕΝΑΙ ΑΜΑΡΤΙΑΣ ΛΕΓΕΙ ΤΩΙ ΠΑΡΑΛΥΤΙΚΩΙ
2,11,ΣΟΙ ΛΕΓΩ ΕΓΕΙΡΕ ΑΡΟΝ ΤΟΝ ΚΡΑΒΑΤΤΟΝ ΣΟΥ ΚΑΙ ΥΠΑΓΕ ΕΙΣ ΤΟΝ ΟΙΚΟΝ ΣΟΥ
2,12,ΚΑΙ ΗΓΕΡΘΗ ΚΑΙ ΕΥΘΥΣ ΑΡΑΣ ΤΟΝ ΚΡΑΒΑΤΤΟΝ ΕΞΗΛΘΕΝ ΕΜΠΡΟΣΘΕΝ ΠΑΝΤΩΝ ΩΣΤΕ ΕΞΙΣΤΑΣΘΑΙ ΠΑΝΤΑΣ ΚΑΙ ΔΟΞΑΖΕΙΝ ΤΟΝ ΘΕΟΝ ΛΕΓΟΝΤΑΣ ΟΤΙ ΟΥΤΩΣ ΟΥΔΕΠΟΤΕ ΕΙΔΟΜΕΝ
2,13,ΚΑΙ ΕΞΗΛΘΕΝ ΠΑΛΙΝ ΠΑΡΑ ΤΗΝ ΘΑΛΑΣΣΑΝ ΚΑΙ ΠΑΣ Ο ΟΧΛΟΣ ΗΡΧΕΤΟ ΠΡΟΣ ΑΥΤΟΝ ΚΑΙ ΕΔΙΔΑΣΚΕΝ ΑΥΤΟΥΣ
2,14,ΚΑΙ ΠΑΡΑΓΩΝ ΕΙΔΕΝ ΛΕΥΕΙΝ ΤΟΝ ΤΟΥ ΑΛΦΑΙΟΥ ΚΑΘΗΜΕΝΟΝ ΕΠΙ ΤΟ ΤΕΛΩΝΙΟΝ ΚΑΙ ΛΕΓΕΙ ΑΥΤΩΙ ΑΚΟΛΟΥΘΕΙ ΜΟΙ ΚΑΙ ΑΝΑΣΤΑΣ ΗΚΟΛΟΥΘΗΣΕΝ ΑΥΤΩΙ
2,15,ΚΑΙ ΓΙΝΕΤΑΙ ΚΑΤΑΚΕΙΣΘΑΙ ΑΥΤΟΝ ΕΝ ΤΗΙ ΟΙΚΙΑΙ ΑΥΤΟΥ ΚΑΙ ΠΟΛΛΟΙ ΤΕΛΩΝΑΙ ΚΑΙ ΑΜΑΡΤΩΛΟΙ ΣΥΝΑΝΕΚΕΙΝΤΟ ΤΩΙ ΙΗΣΟΥ ΚΑΙ ΤΟΙΣ ΜΑΘΗΤΑΙΣ ΑΥΤΟΥ ΗΣΑΝ ΓΑΡ ΠΟΛΛΟΙ ΚΑΙ ΗΚΟΛΟΥΘΟΥΝ ΑΥΤΩΙ
2,16,ΚΑΙ ΟΙ ΓΡΑΜΜΑΤΕΙΣ ΤΩΝ ΦΑΡΙΣΑΙΩΝ ΙΔΟΝΤΕΣ ΟΤΙ ΕΣΘΙΕΙ ΜΕΤΑ ΤΩΝ ΑΜΑΡΤΩΛΩΝ ΚΑΙ ΤΕΛΩΝΩΝ ΕΛΕΓΟΝ ΤΟΙΣ ΜΑΘΗΤΑΙΣ ΑΥΤΟΥ ΟΤΙ ΜΕΤΑ ΤΩΝ ΤΕΛΩΝΩΝ ΚΑΙ ΑΜΑΡΤΩΛΩΝ ΕΣΘΙΕΙ
2,17,ΚΑΙ ΑΚΟΥΣΑΣ Ο ΙΗΣΟΥΣ ΛΕΓΕΙ ΑΥΤΟΙΣ ΟΥ ΧΡΕΙΑΝ ΕΧΟΥΣΙΝ ΟΙ ΙΣΧΥΟΝΤΕΣ ΙΑΤΡΟΥ ΑΛΛΑ ΟΙ ΚΑΚΩΣ ΕΧΟΝΤΕΣ ΟΥΚ ΗΛΘΟΝ ΚΑΛΕΣΑΙ ΔΙΚΑΙΟΥΣ ΑΛΛΑ ΑΜΑΡΤΩΛΟΥΣ
2,18,ΚΑΙ ΗΣΑΝ ΟΙ ΜΑΘΗΤΑΙ ΙΩΑΝΝΟΥ ΚΑΙ ΟΙ ΦΑΡΙΣΑΙΟΙ ΝΗΣΤΕΥΟΝΤΕΣ ΚΑΙ ΕΡΧΟΝΤΑΙ ΚΑΙ ΛΕΓΟΥΣΙΝ ΑΥΤΩΙ ΔΙΑ ΤΙ ΟΙ ΜΑΘΗΤΑΙ ΙΩΑΝΝΟΥ ΚΑΙ ΟΙ ΜΑΘΗΤΑΙ ΤΩΝ ΦΑΡΙΣΑΙΩΝ ΝΗΣΤΕΥΟΥΣΙΝ ΟΙ ΔΕ ΣΟΙ ΜΑΘΗΤΑΙ ΟΥ ΝΗΣΤΕΥΟΥΣΙΝ
2,19,ΚΑΙ ΕΙΠΕΝ ΑΥΤΟΙΣ Ο ΙΗΣΟΥΣ ΜΗ ΔΥΝΑΝΤΑΙ ΟΙ ΥΙΟΙ ΤΟΥ ΝΥΜΦΩΝΟΣ ΕΝ ΩΙ Ο ΝΥΜΦΙΟΣ ΜΕΤΑ ΑΥΤΩΝ ΕΣΤΙΝ ΝΗΣΤΕΥΕΙΝ ΟΣΟΝ ΧΡΟΝΟΝ ΕΧΟΥΣΙΝ ΤΟΝ ΝΥΜΦΙΟΝ ΜΕΤΑ ΑΥΤΩΝ ΟΥ ΔΥΝΑΝΤΑΙ ΝΗΣΤΕΥΕΙΝ
2,20,ΕΛΕΥΣΟΝΤΑΙ ΔΕ ΗΜΕΡΑΙ ΟΤΑΝ ΑΠΑΡΘΗΙ ΑΠΟ ΑΥΤΩΝ Ο ΝΥΜΦΙΟΣ ΚΑΙ ΤΟΤΕ ΝΗΣΤΕΥΣΟΥΣΙΝ ΕΝ ΕΚΕΙΝΗΙ ΤΗΙ ΗΜΕΡΑΙ
2,21,ΟΥΔΕΙΣ ΕΠΙΒΛΗΜΑ ΡΑΚΟΥΣ ΑΓΝΑΦΟΥ ΕΠΙΡΑΠΤΕΙ ΕΠΙ ΙΜΑΤΙΟΝ ΠΑΛΑΙΟΝ ΕΙ ΔΕ ΜΗ ΑΙΡΕΙ ΤΟ ΠΛΗΡΩΜΑ ΑΠΟ ΑΥΤΟΥ ΤΟ ΚΑΙΝΟΝ ΤΟΥ ΠΑΛΑΙΟΥ ΚΑΙ ΧΕΙΡΟΝ ΣΧΙΣΜΑ ΓΙΝΕΤΑΙ
2,22,ΚΑΙ ΟΥΔΕΙΣ ΒΑΛΛΕΙ ΟΙΝΟΝ ΝΕΟΝ ΕΙΣ ΑΣΚΟΥΣ ΠΑΛΑΙΟΥΣ ΕΙ ΔΕ ΜΗ ΡΗΞΕΙ Ο ΟΙΝΟΣ ΤΟΥΣ ΑΣΚΟΥΣ ΚΑΙ Ο ΟΙΝΟΣ ΑΠΟΛΛΥΤΑΙ ΚΑΙ ΟΙ ΑΣΚΟΙ ΑΛΛΑ ΟΙΝΟΝ ΝΕΟΝ ΕΙΣ ΑΣΚΟΥΣ ΚΑΙΝΟΥΣ
2,23,ΚΑΙ ΕΓΕΝΕΤΟ ΑΥΤΟΝ ΕΝ ΤΟΙΣ ΣΑΒΒΑΣΙΝ ΠΑΡΑΠΟΡΕΥΕΣΘΑΙ ΔΙΑ ΤΩΝ ΣΠΟΡΙΜΩΝ ΚΑΙ ΟΙ ΜΑΘΗΤΑΙ ΑΥΤΟΥ ΗΡΞΑΝΤΟ ΟΔΟΝ ΠΟΙΕΙΝ ΤΙΛΛΟΝΤΕΣ ΤΟΥΣ ΣΤΑΧΥΑΣ
2,24,ΚΑΙ ΟΙ ΦΑΡΙΣΑΙΟΙ ΕΛΕΓΟΝ ΑΥΤΩΙ ΙΔΕ ΤΙ ΠΟΙΟΥΣΙΝ ΤΟΙΣ ΣΑΒΒΑΣΙΝ Ο ΟΥΚ ΕΞΕΣΤΙΝ
2,25,ΚΑΙ ΛΕΓΕΙ ΑΥΤΟΙΣ ΟΥΔΕΠΟΤΕ ΑΝΕΓΝΩΤΕ ΤΙ ΕΠΟΙΗΣΕΝ ΔΑΥΕΙΔ ΟΤΕ ΧΡΕΙΑΝ ΕΣΧΕΝ ΚΑΙ ΕΠΕΙΝΑΣΕΝ ΑΥΤΟΣ ΚΑΙ ΟΙ ΜΕΤΑ ΑΥΤΟΥ
2,26,ΠΩΣ ΕΙΣΗΛΘΕΝ ΕΙΣ ΤΟΝ ΟΙΚΟΝ ΤΟΥ ΘΕΟΥ ΕΠΙ ΑΒΙΑΘΑΡ ΑΡΧΙΕΡΕΩΣ ΚΑΙ ΤΟΥΣ ΑΡΤΟΥΣ ΤΗΣ ΠΡΟΘΕΣΕΩΣ ΕΦΑΓΕΝ ΟΥΣ ΟΥΚ ΕΞΕΣΤΙΝ ΦΑΓΕΙΝ ΕΙ ΜΗ ΤΟΥΣ ΙΕΡΕΙΣ ΚΑΙ ΕΔΩΚΕΝ ΚΑΙ ΤΟΙΣ ΣΥΝ ΑΥΤΩΙ ΟΥΣΙΝ
2,27,ΚΑΙ ΕΛΕΓΕΝ ΑΥΤΟΙΣ ΤΟ ΣΑΒΒΑΤΟΝ ΔΙΑ ΤΟΝ ΑΝΘΡΩΠΟΝ ΕΓΕΝΕΤΟ ΚΑΙ ΟΥΧ Ο ΑΝΘΡΩΠΟΣ ΔΙΑ ΤΟ ΣΑΒΒΑΤΟΝ
2,28,ΩΣΤΕ ΚΥΡΙΟΣ ΕΣΤΙΝ Ο ΥΙΟΣ ΤΟΥ ΑΝΘΡΩΠΟΥ ΚΑΙ ΤΟΥ ΣΑΒΒΑΤΟΥ
3,1,ΚΑΙ ΕΙΣΗΛΘΕΝ ΠΑΛΙΝ ΕΙΣ ΣΥΝΑΓΩΓΗΝ ΚΑΙ ΗΝ ΕΚΕΙ ΑΝΘΡΩΠΟΣ ΕΞΗΡΑΜΜΕΝΗΝ ΕΧΩΝ ΤΗΝ ΧΕΙΡΑ
3,2,ΚΑΙ ΠΑΡΕΤΗΡΟΥΝ ΑΥΤΟΝ ΕΙ ΤΟΙΣ ΣΑΒΒΑΣΙΝ ΘΕΡΑΠΕΥΣΕΙ ΑΥΤΟΝ ΙΝΑ ΚΑΤΗΓΟΡΗΣΩΣΙΝ ΑΥΤΟΥ
3,3,ΚΑΙ ΛΕΓΕΙ ΤΩΙ ΑΝΘΡΩΠΩΙ ΤΩΙ ΤΗΝ ΧΕΙΡΑ ΕΧΟΝΤΙ ΞΗΡΑΝ ΕΓΕΙΡΕ ΕΙΣ ΤΟ ΜΕΣΟΝ
3,4,ΚΑΙ ΛΕΓΕΙ ΑΥΤΟΙΣ ΕΞΕΣΤΙΝ ΤΟΙΣ ΣΑΒΒΑΣΙΝ ΑΓΑΘΟΠΟΙΗΣΑΙ Η ΚΑΚΟΠΟΙΗΣΑΙ ΨΥΧΗΝ ΣΩΣΑΙ Η ΑΠΟΚΤΕΙΝΑΙ ΟΙ ΔΕ ΕΣΙΩΠΩΝ
3,5,ΚΑΙ ΠΕΡΙΒΛΕΨΑΜΕΝΟΣ ΑΥΤΟΥΣ ΜΕΤΑ ΟΡΓΗΣ ΣΥΝΛΥΠΟΥΜΕΝΟΣ ΕΠΙ ΤΗΙ ΠΩΡΩΣΕΙ ΤΗΣ ΚΑΡΔΙΑΣ ΑΥΤΩΝ ΛΕΓΕΙ ΤΩΙ ΑΝΘΡΩΠΩΙ ΕΚΤΕΙΝΟΝ ΤΗΝ ΧΕΙΡΑ ΣΟΥ ΚΑΙ ΕΞΕΤΕΙΝΕΝ ΚΑΙ ΑΠΕΚΑΤΕΣΤΑΘΗ Η ΧΕΙΡ ΑΥΤΟΥ
3,6,ΚΑΙ ΕΞΕΛΘΟΝΤΕΣ ΟΙ ΦΑΡΙΣΑΙΟΙ ΕΥΘΥΣ ΜΕΤΑ ΤΩΝ ΗΡΩΙΔΙΑΝΩΝ ΣΥΜΒΟΥΛΙΟΝ ΕΠΟΙΟΥΝ ΚΑΤΑ ΑΥΤΟΥ ΟΠΩΣ ΑΥΤΟΝ ΑΠΟΛΕΣΩΣΙΝ
3,7,ΚΑΙ Ο ΙΗΣΟΥΣ ΜΕΤΑ ΤΩΝ ΜΑΘΗΤΩΝ ΑΥΤΟΥ ΑΝΕΧΩΡΗΣΕΝ ΠΡΟΣ ΤΗΝ ΘΑΛΑΣΣΑΝ ΚΑΙ ΠΟΛΥ ΠΛΗΘΟΣ ΑΠΟ ΤΗΣ ΓΑΛΙΛΑΙΑΣ ΗΚΟΛΟΥΘΗΣΕΝ ΚΑΙ ΑΠΟ ΤΗΣ ΙΟΥΔΑΙΑΣ
3,8,ΚΑΙ ΑΠΟ ΙΕΡΟΣΟΛΥΜΩΝ ΚΑΙ ΑΠΟ ΤΗΣ ΙΔΟΥΜΑΙΑΣ ΚΑΙ ΠΕΡΑΝ ΤΟΥ ΙΟΡΔΑΝΟΥ ΚΑΙ ΠΕΡΙ ΤΥΡΟΝ ΚΑΙ ΣΙΔΩΝΑ ΠΛΗΘΟΣ ΠΟΛΥ ΑΚΟΥΟΝΤΕΣ ΟΣΑ ΕΠΟΙΕΙ ΗΛΘΟΝ ΠΡΟΣ ΑΥΤΟΝ
3,9,ΚΑΙ ΕΙΠΕΝ ΤΟΙΣ ΜΑΘΗΤΑΙΣ ΑΥΤΟΥ ΙΝΑ ΠΛΟΙΑΡΙΟΝ ΠΡΟΣΚΑΡΤΕΡΗΙ ΑΥΤΩΙ ΔΙΑ ΤΟΝ ΟΧΛΟΝ ΙΝΑ ΜΗ ΘΛΙΒΩΣΙΝ ΑΥΤΟΝ
3,10,ΠΟΛΛΟΥΣ ΓΑΡ ΕΘΕΡΑΠΕΥΣΕΝ ΩΣΤΕ ΕΠΙΠΙΠΤΕΙΝ ΑΥΤΩΙ ΙΝΑ ΑΥΤΟΥ ΑΨΩΝΤΑΙ ΟΣΟΙ ΕΙΧΟΝ ΜΑΣΤΙΓΑΣ
3,11,ΚΑΙ ΤΑ ΠΝΕΥΜΑΤΑ ΤΑ ΑΚΑΘΑΡΤΑ ΟΤΑΝ ΑΥΤΟΝ ΕΘΕΩΡΟΥΝ ΠΡΟΣΕΠΙΠΤΟΝ ΑΥΤΩΙ ΚΑΙ ΕΚΡΑΖΟΝ ΛΕΓΟΝΤΑ ΟΤΙ ΣΥ ΕΙ Ο ΥΙΟΣ ΤΟΥ ΘΕΟΥ
3,12,ΚΑΙ ΠΟΛΛΑ ΕΠΕΤΙΜΑ ΑΥΤΟΙΣ ΙΝΑ ΜΗ ΑΥΤΟΝ ΦΑΝΕΡΟΝ ΠΟΙΗΣΩΣΙΝ
3,13,ΚΑΙ ΑΝΑΒΑΙΝΕΙ ΕΙΣ ΤΟ ΟΡΟΣ ΚΑΙ ΠΡΟΣΚΑΛΕΙΤΑΙ ΟΥΣ ΗΘΕΛΕΝ ΑΥΤΟΣ ΚΑΙ ΑΠΗΛΘΟΝ ΠΡΟΣ ΑΥΤΟΝ
3,14,ΚΑΙ ΕΠΟΙΗΣΕΝ ΔΩΔΕΚΑ ΟΥΣ ΚΑΙ ΑΠΟΣΤΟΛΟΥΣ ΩΝΟΜΑΣΕΝ ΙΝΑ ΩΣΙΝ ΜΕΤΑ ΑΥΤΟΥ ΚΑΙ ΙΝΑ ΑΠΟΣΤΕΛΛΗΙ ΑΥΤΟΥΣ ΚΗΡΥΣΣΕΙΝ
3,15,ΚΑΙ ΕΧΕΙΝ ΕΞΟΥΣΙΑΝ ΕΚΒΑΛΛΕΙΝ ΤΑ ΔΑΙΜΟΝΙΑ
3,16,ΚΑΙ ΕΠΟΙΗΣΕΝ ΤΟΥΣ ΔΩΔΕΚΑ ΚΑΙ ΕΠΕΘΗΚΕΝ ΟΝΟΜΑ ΤΩΙ ΣΙΜΩΝΙ ΠΕΤΡΟΝ
3,17,ΚΑΙ ΙΑΚΩΒΟΝ ΤΟΝ ΤΟΥ ΖΕΒΕΔΑΙΟΥ ΚΑΙ ΙΩΑΝΝΗΝ ΤΟΝ ΑΔΕΛΦΟΝ ΤΟΥ ΙΑΚΩΒΟΥ ΚΑΙ ΕΠΕΘΗΚΕΝ ΑΥΤΟΙΣ ΟΝΟΜΑΤΑ ΒΟΑΝΗΡΓΕΣ Ο ΕΣΤΙΝ ΥΙΟΙ ΒΡΟΝΤΗΣ
3,18,ΚΑΙ ΑΝΔΡΕΑΝ ΚΑΙ ΦΙΛΙΠΠΟΝ ΚΑΙ ΒΑΡΘΟΛΟΜΑΙΟΝ ΚΑΙ ΜΑΘΘΑΙΟΝ ΚΑΙ ΘΩΜΑΝ ΚΑΙ ΙΑΚΩΒΟΝ ΤΟΝ ΤΟΥ ΑΛΦΑΙΟΥ ΚΑΙ ΘΑΔΔΑΙΟΝ ΚΑΙ ΣΙΜΩΝΑ ΤΟΝ ΚΑΝΑΝΑΙΟΝ
3,19,ΚΑΙ ΙΟΥΔΑΝ ΙΣΚΑΡΙΩΘ ΟΣ ΚΑΙ ΠΑΡΕΔΩΚΕΝ ΑΥΤΟΝ
3,20,ΚΑΙ ΕΡΧΕΤΑΙ ΕΙΣ ΟΙΚΟΝ ΚΑΙ ΣΥΝΕΡΧΕΤΑΙ ΠΑΛΙΝ Ο ΟΧΛΟΣ ΩΣΤΕ ΜΗ ΔΥΝΑΣΘΑΙ ΑΥΤΟΥΣ ΜΗΔΕ ΑΡΤΟΝ ΦΑΓΕΙΝ
3,21,ΚΑΙ ΑΚΟΥΣΑΝΤΕΣ ΟΙ ΠΑΡΑ ΑΥΤΟΥ ΕΞΗΛΘΟΝ ΚΡΑΤΗΣΑΙ ΑΥΤΟΝ ΕΛΕΓΟΝ ΓΑΡ ΟΤΙ ΕΞΕΣΤΗ
3,22,ΚΑΙ ΟΙ ΓΡΑΜΜΑΤΕΙΣ ΟΙ ΑΠΟ ΙΕΡΟΣΟΛΥΜΩΝ ΚΑΤΑΒΑΝΤΕΣ ΕΛΕΓΟΝ ΟΤΙ ΒΕΕΛΖΕΒΟΥΛ ΕΧΕΙ ΚΑΙ ΟΤΙ ΕΝ ΤΩΙ ΑΡΧΟΝΤΙ ΤΩΝ ΔΑΙΜΟΝΙΩΝ ΕΚΒΑΛΛΕΙ ΤΑ ΔΑΙΜΟΝΙΑ
3,23,ΚΑΙ ΠΡΟΣΚΑΛΕΣΑΜΕΝΟΣ ΑΥΤΟΥΣ ΕΝ ΠΑΡΑΒΟΛΑΙΣ ΕΛΕΓΕΝ ΑΥΤΟΙΣ ΠΩΣ ΔΥΝΑΤΑΙ ΣΑΤΑΝΑΣ ΣΑΤΑΝΑΝ ΕΚΒΑΛΛΕΙΝ
3,24,ΚΑΙ ΕΑΝ ΒΑΣΙΛΕΙΑ ΕΠΙ ΕΑΥΤΗΝ ΜΕΡΙΣΘΗΙ ΟΥ ΔΥΝΑΤΑΙ ΣΤΑΘΗΝΑΙ Η ΒΑΣΙΛΕΙΑ ΕΚΕΙΝΗ
3,25,ΚΑΙ ΕΑΝ ΟΙΚΙΑ ΕΠΙ ΕΑΥΤΗΝ ΜΕΡΙΣΘΗΙ ΟΥ ΔΥΝΗΣΕΤΑΙ Η ΟΙΚΙΑ ΕΚΕΙΝΗ ΣΤΑΘΗΝΑΙ
3,26,ΚΑΙ ΕΙ Ο ΣΑΤΑΝΑΣ ΑΝΕΣΤΗ ΕΠΙ ΕΑΥΤΟΝ ΚΑΙ ΕΜΕΡΙΣΘΗ ΟΥ ΔΥΝΑΤΑΙ ΣΤΗΝΑΙ ΑΛΛΑ ΤΕΛΟΣ ΕΧΕΙ
3,27,ΑΛΛΑ ΟΥ ΔΥΝΑΤΑΙ ΟΥΔΕΙΣ ΕΙΣ ΤΗΝ ΟΙΚΙΑΝ ΤΟΥ ΙΣΧΥΡΟΥ ΕΙΣΕΛΘΩΝ ΤΑ ΣΚΕΥΗ ΑΥΤΟΥ ΔΙΑΡΠΑΣΑΙ ΕΑΝ ΜΗ ΠΡΩΤΟΝ ΤΟΝ ΙΣΧΥΡΟΝ ΔΗΣΗΙ ΚΑΙ ΤΟΤΕ ΤΗΝ ΟΙΚΙΑΝ ΑΥΤΟΥ ΔΙΑΡΠΑΣΕΙ
3,28,ΑΜΗΝ ΛΕΓΩ ΥΜΙΝ ΟΤΙ ΠΑΝΤΑ ΑΦΕΘΗΣΕΤΑΙ ΤΟΙΣ ΥΙΟΙΣ ΤΩΝ ΑΝΘΡΩΠΩΝ ΤΑ ΑΜΑΡΤΗΜΑΤΑ ΚΑΙ ΑΙ ΒΛΑΣΦΗΜΙΑΙ ΟΣΑ ΕΑΝ ΒΛΑΣΦΗΜΗΣΩΣΙΝ
3,29,ΟΣ ΔΕ ΑΝ ΒΛΑΣΦΗΜΗΣΗΙ ΕΙΣ ΤΟ ΠΝΕΥΜΑ ΤΟ ΑΓΙΟΝ ΟΥΚ ΕΧΕΙ ΑΦΕΣΙΝ ΕΙΣ ΤΟΝ ΑΙΩΝΑ ΑΛΛΑ ΕΝΟΧΟΣ ΕΣΤΙΝ ΑΙΩΝΙΟΥ ΑΜΑΡΤΗΜΑΤΟΣ
3,30,ΟΤΙ ΕΛΕΓΟΝ ΠΝΕΥΜΑ ΑΚΑΘΑΡΤΟΝ ΕΧΕΙ
3,31,ΚΑΙ ΕΡΧΟΝΤΑΙ Η ΜΗΤΗΡ ΑΥΤΟΥ ΚΑΙ ΟΙ ΑΔΕΛΦΟΙ ΑΥΤΟΥ ΚΑΙ ΕΞΩ ΣΤΗΚΟΝΤΕΣ ΑΠΕΣΤΕΙΛΑΝ ΠΡΟΣ ΑΥΤΟΝ ΚΑΛΟΥΝΤΕΣ ΑΥΤΟΝ
3,32,ΚΑΙ ΕΚΑΘΗΤΟ ΠΕΡΙ ΑΥΤΟΝ ΟΧΛΟΣ ΚΑΙ ΛΕΓΟΥΣΙΝ ΑΥΤΩΙ ΙΔΟΥ Η ΜΗΤΗΡ ΣΟΥ ΚΑΙ ΟΙ ΑΔΕΛΦΟΙ ΣΟΥ ΕΞΩ ΖΗΤΟΥΣΙΝ ΣΕ
3,33,ΚΑΙ ΑΠΟΚΡΙΘΕΙΣ ΑΥΤΟΙΣ ΛΕΓΕΙ ΤΙΣ ΕΣΤΙΝ Η ΜΗΤΗΡ ΜΟΥ ΚΑΙ ΟΙ ΑΔΕΛΦΟΙ ΜΟΥ
3,34,ΚΑΙ ΠΕΡΙΒΛΕΨΑΜΕΝΟΣ ΤΟΥΣ ΠΕΡΙ ΑΥΤΟΝ ΚΥΚΛΩΙ ΚΑΘΗΜΕΝΟΥΣ ΛΕΓΕΙ ΙΔΕ Η ΜΗΤΗΡ ΜΟΥ ΚΑΙ ΟΙ ΑΔΕΛΦΟΙ ΜΟΥ
3,35,ΟΣ ΓΑΡ ΑΝ ΠΟΙΗΣΗΙ ΤΟ ΘΕΛΗΜΑ ΤΟΥ ΘΕΟΥ ΟΥΤΟΣ ΑΔΕΛΦΟΣ ΜΟΥ ΚΑΙ ΑΔΕΛΦΗ ΚΑΙ ΜΗΤΗΡ ΕΣΤΙΝ
4,1,ΚΑΙ ΠΑΛΙΝ ΗΡΞΑΤΟ ΔΙΔΑΣΚΕΙΝ ΠΑΡΑ ΤΗΝ ΘΑΛΑΣΣΑΝ ΚΑΙ ΣΥΝΑΓΕΤΑΙ ΠΡΟΣ ΑΥΤΟΝ ΟΧΛΟΣ ΠΛΕΙΣΤΟΣ ΩΣΤΕ ΑΥΤΟΝ ΕΙΣ ΤΟ ΠΛΟΙΟΝ ΕΜΒΑΝΤΑ ΚΑΘΗΣΘΑΙ ΕΝ ΤΗΙ ΘΑΛΑΣΣΗΙ ΚΑΙ ΠΑΣ Ο ΟΧΛΟΣ ΠΡΟΣ ΤΗΝ ΘΑΛΑΣΣΑΝ ΕΠΙ ΤΗΣ ΓΗΣ ΗΣΑΝ
4,2,ΚΑΙ ΕΔΙΔΑΣΚΕΝ ΑΥΤΟΥΣ ΕΝ ΠΑΡΑΒΟΛΑΙΣ ΠΟΛΛΑ ΚΑΙ ΕΛΕΓΕΝ ΑΥΤΟΙΣ ΕΝ ΤΗΙ ΔΙΔΑΧΗΙ ΑΥΤΟΥ
4,3,ΑΚΟΥΕΤΕ ΙΔΟΥ ΕΞΗΛΘΕΝ Ο ΣΠΕΙΡΩΝ ΣΠΕΙΡΑΙ
4,4,ΚΑΙ ΕΓΕΝΕΤΟ ΕΝ ΤΩΙ ΣΠΕΙΡΕΙΝ Ο ΜΕΝ ΕΠΕΣΕΝ ΠΑΡΑ ΤΗΝ ΟΔΟΝ ΚΑΙ ΗΛΘΕΝ ΤΑ ΠΕΤΕΙΝΑ ΚΑΙ ΚΑΤΕΦΑΓΕΝ ΑΥΤΟ
4,5,ΚΑΙ ΑΛΛΟ ΕΠΕΣΕΝ ΕΠΙ ΤΟ ΠΕΤΡΩΔΕΣ ΟΠΟΥ ΟΥΚ ΕΙΧΕΝ ΓΗΝ ΠΟΛΛΗΝ ΚΑΙ ΕΥΘΥΣ ΕΞΑΝΕΤΕΙΛΕΝ ΔΙΑ ΤΟ ΜΗ ΕΧΕΙΝ ΒΑΘΟΣ ΓΗΣ
4,6,ΚΑΙ ΟΤΕ ΑΝΕΤΕΙΛΕΝ Ο ΗΛΙΟΣ ΕΚΑΥΜΑΤΙΣΘΗ ΚΑΙ ΔΙΑ ΤΟ ΜΗ ΕΧΕΙΝ ΡΙΖΑΝ ΕΞΗΡΑΝΘΗ
4,7,ΚΑΙ ΑΛΛΟ ΕΠΕΣΕΝ ΕΙΣ ΤΑΣ ΑΚΑΝΘΑΣ ΚΑΙ ΑΝΕΒΗΣΑΝ ΑΙ ΑΚΑΝΘΑΙ ΚΑΙ ΣΥΝΕΠΝΙΞΑΝ ΑΥΤΟ ΚΑΙ ΚΑΡΠΟΝ ΟΥΚ ΕΔΩΚΕΝ
4,8,ΚΑΙ ΑΛΛΑ ΕΠΕΣΕΝ ΕΙΣ ΤΗΝ ΓΗΝ ΤΗΝ ΚΑΛΗΝ ΚΑΙ ΕΔΙΔΟΥ ΚΑΡΠΟΝ ΑΝΑΒΑΙΝΟΝΤΑ ΚΑΙ ΑΥΞΑΝΟΜΕΝΑ ΚΑΙ ΕΦΕΡΕΝ ΕΙΣ ΤΡΙΑΚΟΝΤΑ ΚΑΙ ΕΝ ΕΞΗΚΟΝΤΑ ΚΑΙ ΕΝ ΕΚΑΤΟΝ
4,9,ΚΑΙ ΕΛΕΓΕΝ ΟΣ ΕΧΕΙ ΩΤΑ ΑΚΟΥΕΙΝ ΑΚΟΥΕΤΩ
4,10,ΚΑΙ ΟΤΕ ΕΓΕΝΕΤΟ ΚΑΤΑ ΜΟΝΑΣ ΗΡΩΤΩΝ ΑΥΤΟΝ ΟΙ ΠΕΡΙ ΑΥΤΟΝ ΣΥΝ ΤΟΙΣ ΔΩΔΕΚΑ ΤΑΣ ΠΑΡΑΒΟΛΑΣ
4,11,ΚΑΙ ΕΛΕΓΕΝ ΑΥΤΟΙΣ ΥΜΙΝ ΤΟ ΜΥΣΤΗΡΙΟΝ ΔΕΔΟΤΑΙ ΤΗΣ ΒΑΣΙΛΕΙΑΣ ΤΟΥ ΘΕΟΥ ΕΚΕΙΝΟΙΣ ΔΕ ΤΟΙΣ ΕΞΩ ΕΝ ΠΑΡΑΒΟΛΑΙΣ ΤΑ ΠΑΝΤΑ ΓΙΝΕΤΑΙ
4,12,ΙΝΑ ΒΛΕΠΟΝΤΕΣ ΒΛΕΠΩΣΙ ΚΑΙ ΜΗ ΙΔΩΣΙΝ ΚΑΙ ΑΚΟΥΟΝΤΕΣ ΑΚΟΥΩΣΙ ΚΑΙ ΜΗ ΣΥΝΙΩΣΙΝ ΜΗΠΟΤΕ ΕΠΙΣΤΡΕΨΩΣΙΝ ΚΑΙ ΑΦΕΘΗΙ ΑΥΤΟΙΣ
4,13,ΚΑΙ ΛΕΓΕΙ ΑΥΤΟΙΣ ΟΥΚ ΟΙΔΑΤΕ ΤΗΝ ΠΑΡΑΒΟΛΗΝ ΤΑΥΤΗΝ ΚΑΙ ΠΩΣ ΠΑΣΑΣ ΤΑΣ ΠΑΡΑΒΟΛΑΣ ΓΝΩΣΕΣΘΕ
4,14,Ο ΣΠΕΙΡΩΝ ΤΟΝ ΛΟΓΟΝ ΣΠΕΙΡΕΙ
4,15,ΟΥΤΟΙ ΔΕ ΕΙΣΙΝ ΟΙ ΠΑΡΑ ΤΗΝ ΟΔΟΝ ΟΠΟΥ ΣΠΕΙΡΕΤΑΙ Ο ΛΟΓΟΣ ΚΑΙ ΟΤΑΝ ΑΚΟΥΣΩΣΙΝ ΕΥΘΥΣ ΕΡΧΕΤΑΙ Ο ΣΑΤΑΝΑΣ ΚΑΙ ΑΙΡΕΙ ΤΟΝ ΛΟΓΟΝ ΤΟΝ ΕΣΠΑΡΜΕΝΟΝ ΕΙΣ ΑΥΤΟΥΣ
4,16,ΚΑΙ ΟΥΤΟΙ ΕΙΣΙΝ ΟΜΟΙΩΣ ΟΙ ΕΠΙ ΤΑ ΠΕΤΡΩΔΗ ΣΠΕΙΡΟΜΕΝΟΙ ΟΙ ΟΤΑΝ ΑΚΟΥΣΩΣΙΝ ΤΟΝ ΛΟΓΟΝ ΕΥΘΥΣ ΜΕΤΑ ΧΑΡΑΣ ΛΑΜΒΑΝΟΥΣΙΝ ΑΥΤΟΝ
4,17,ΚΑΙ ΟΥΚ ΕΧΟΥΣΙΝ ΡΙΖΑΝ ΕΝ ΕΑΥΤΟΙΣ ΑΛΛΑ ΠΡΟΣΚΑΙΡΟΙ ΕΙΣΙΝ ΕΙΤΑ ΓΕΝΟΜΕΝΗΣ ΘΛΙΨΕΩΣ Η ΔΙΩΓΜΟΥ ΔΙΑ ΤΟΝ ΛΟΓΟΝ ΕΥΘΥΣ ΣΚΑΝΔΑΛΙΖΟΝΤΑΙ
4,18,ΚΑΙ ΑΛΛΟΙ ΕΙΣΙΝ ΟΙ ΕΙΣ ΤΑΣ ΑΚΑΝΘΑΣ ΣΠΕΙΡΟΜΕΝΟΙ ΟΥΤΟΙ ΕΙΣΙΝ ΟΙ ΤΟΝ ΛΟΓΟΝ ΑΚΟΥΣΑΝΤΕΣ
4,19,ΚΑΙ ΑΙ ΜΕΡΙΜΝΑΙ ΤΟΥ ΑΙΩΝΟΣ ΚΑΙ Η ΑΠΑΤΗ ΤΟΥ ΠΛΟΥΤΟΥ ΚΑΙ ΑΙ ΠΕΡΙ ΤΑ ΛΟΙΠΑ ΕΠΙΘΥΜΙΑΙ ΕΙΣΠΟΡΕΥΟΜΕΝΑΙ ΣΥΝΠΝΙΓΟΥΣΙΝ ΤΟΝ ΛΟΓΟΝ ΚΑΙ ΑΚΑΡΠΟΣ ΓΙΝΕΤΑΙ
4,20,ΚΑΙ ΕΚΕΙΝΟΙ ΕΙΣΙΝ ΟΙ ΕΠΙ ΤΗΝ ΓΗΝ ΤΗΝ ΚΑΛΗΝ ΣΠΑΡΕΝΤΕΣ ΟΙΤΙΝΕΣ ΑΚΟΥΟΥΣΙΝ ΤΟΝ ΛΟΓΟΝ ΚΑΙ ΠΑΡΑΔΕΧΟΝΤΑΙ ΚΑΙ ΚΑΡΠΟΦΟΡΟΥΣΙΝ ΕΝ ΤΡΙΑΚΟΝΤΑ ΚΑΙ ΕΝ ΕΞΗΚΟΝΤΑ ΚΑΙ ΕΝ ΕΚΑΤΟΝ
4,21,ΚΑΙ ΕΛΕΓΕΝ ΑΥΤΟΙΣ ΜΗΤΙ ΕΡΧΕΤΑΙ Ο ΛΥΧΝΟΣ ΙΝΑ ΥΠΟ ΤΟΝ ΜΟΔΙΟΝ ΤΕΘΗΙ Η ΥΠΟ ΤΗΝ ΚΛΙΝΗΝ ΟΥΧ ΙΝΑ ΕΠΙ ΤΗΝ ΛΥΧΝΙΑΝ ΤΕΘΗΙ
4,22,ΟΥ ΓΑΡ ΕΣΤΙΝ ΚΡΥΠΤΟΝ ΕΑΝ ΜΗ ΙΝΑ ΦΑΝΕΡΩΘΗΙ ΟΥΔΕ ΕΓΕΝΕΤΟ ΑΠΟΚΡΥΦΟΝ ΑΛΛΑ ΙΝΑ ΕΛΘΗΙ ΕΙΣ ΦΑΝΕΡΟΝ
4,23,ΕΙ ΤΙΣ ΕΧΕΙ ΩΤΑ ΑΚΟΥΕΙΝ ΑΚΟΥΕΤΩ
4,24,ΚΑΙ ΕΛΕΓΕΝ ΑΥΤΟΙΣ ΒΛΕΠΕΤΕ ΤΙ ΑΚΟΥΕΤΕ ΕΝ ΩΙ ΜΕΤΡΩΙ ΜΕΤΡΕΙΤΕ ΜΕΤΡΗΘΗΣΕΤΑΙ ΥΜΙΝ ΚΑΙ ΠΡΟΣΤΕΘΗΣΕΤΑΙ ΥΜΙΝ
4,25,ΟΣ ΓΑΡ ΕΧΕΙ ΔΟΘΗΣΕΤΑΙ ΑΥΤΩΙ ΚΑΙ ΟΣ ΟΥΚ ΕΧΕΙ ΚΑΙ Ο ΕΧΕΙ ΑΡΘΗΣΕΤΑΙ ΑΠΟ ΑΥΤΟΥ
4,26,ΚΑΙ ΕΛΕΓΕΝ ΟΥΤΩΣ ΕΣΤΙΝ Η ΒΑΣΙΛΕΙΑ ΤΟΥ ΘΕΟΥ ΩΣ ΑΝΘΡΩΠΟΣ ΒΑΛΗΙ ΤΟΝ ΣΠΟΡΟΝ ΕΠΙ ΤΗΣ ΓΗΣ
4,27,ΚΑΙ ΚΑΘΕΥΔΗΙ ΚΑΙ ΕΓΕΙΡΗΤΑΙ ΝΥΚΤΑ ΚΑΙ ΗΜΕΡΑΝ ΚΑΙ Ο ΣΠΟΡΟΣ ΒΛΑΣΤΑΙ ΚΑΙ ΜΗΚΥΝΗΤΑΙ ΩΣ ΟΥΚ ΟΙΔΕΝ ΑΥΤΟΣ
4,28,ΑΥΤΟΜΑΤΗ Η ΓΗ ΚΑΡΠΟΦΟΡΕΙ ΠΡΩΤΟΝ ΧΟΡΤΟΝ ΕΙΤΑ ΣΤΑΧΥΝ ΕΙΤΑ ΠΛΗΡΗΣ ΣΙΤΟΝ ΕΝ ΤΩΙ ΣΤΑΧΥΙ
4,29,ΟΤΑΝ ΔΕ ΠΑΡΑΔΟΙ Ο ΚΑΡΠΟΣ ΕΥΘΥΣ ΑΠΟΣΤΕΛΛΕΙ ΤΟ ΔΡΕΠΑΝΟΝ ΟΤΙ ΠΑΡΕΣΤΗΚΕΝ Ο ΘΕΡΙΣΜΟΣ
