chapter,verse,text
7,24,ΕΚΕΙΘΕΝ ΔΕ ΑΝΑΣΤΑΣ ΑΠΗΛΘΕΝ ΕΙΣ ΤΑ ΟΡΙΑ ΤΥΡΟΥ ΚΑΙ ΣΙΔΩΝΟΣ ΚΑΙ ΕΙΣΕΛΘΩΝ ΕΙΣ ΟΙΚΙΑΝ ΟΥΔΕΝΑ ΗΘΕΛΕΝ ΓΝΩΝΑΙ ΚΑΙ ΟΥΚ ΗΔΥΝΑΣΘΗ ΛΑΘΕΙΝ
7,25,ΑΛΛΑ ΕΥΘΥΣ ΑΚΟΥΣΑΣΑ ΓΥΝΗ ΠΕΡΙ ΑΥΤΟΥ ΗΣ ΕΙΧΕΝ ΤΟ ΘΥΓΑΤΡΙΟΝ ΑΥΤΗΣ ΠΝΕΥΜΑ ΑΚΑΘΑΡΤΟΝ ΕΛΘΟΥΣΑ ΠΡΟΣΕΠΕΣΕΝ ΠΡΟΣ ΤΟΥΣ ΠΟΔΑΣ ΑΥΤΟΥ
7,26,Η ΔΕ ΓΥΝΗ ΗΝ ΕΛΛΗΝΙΣ ΣΥΡΟΦΟΙΝΙΚΙΣΣΑ ΤΩΙ ΓΕΝΕΙ ΚΑΙ ΗΡΩΤΑ ΑΥΤΟΝ ΙΝΑ ΤΟ ΔΑΙΜΟΝΙΟΝ ΕΚΒΑΛΗΙ ΕΚ ΤΗΣ ΘΥΓΑΤΡΟΣ ΑΥΤΗΣ
7,27,ΚΑΙ ΕΛΕΓΕΝ ΑΥΤΗΙ ΑΦΕΣ ΠΡΩΤΟΝ ΧΟΡΤΑΣΘΗΝΑΙ ΤΑ ΤΕΚΝΑ ΟΥ ΓΑΡ ΕΣΤΙΝ ΚΑΛΟΝ ΛΑΒΕΙΝ ΤΟΝ ΑΡΤΟΝ ΤΩΝ ΤΕΚΝΩΝ ΚΑΙ ΤΟΙΣ ΚΥΝΑΡΙΟΙΣ ΒΑΛΕΙΝ
7,28,Η ΔΕ ΑΠΕΚΡΙΘΗ ΚΑΙ ΛΕΓΕΙ ΑΥΤΩΙ ΝΑΙ ΚΥΡΙΕ ΚΑΙ ΤΑ ΚΥΝΑΡΙΑ ΥΠΟΚΑΤΩ ΤΗΣ ΤΡΑΠΕΖΗΣ ΕΣΘΙΟΥΣΙΝ ΑΠΟ ΤΩΝ ΨΙΧΙΩΝ ΤΩΝ ΠΑΙΔΙΩΝ
7,29,ΚΑΙ ΕΙΠΕΝ ΑΥΤΗΙ ΔΙΑ ΤΟΥΤΟΝ ΤΟΝ ΛΟΓΟΝ ΥΠΑΓΕ ΕΞΕΛΗΛΥΘΕΝ ΤΟ ΔΑΙΜΟΝΙΟΝ ΕΚ ΤΗΣ ΘΥΓΑΤΡΟΣ ΣΟΥ
7,30,ΚΑΙ ΑΠΕΛΘΟΥΣΑ ΕΙΣ ΤΟΝ ΟΙΚΟΝ ΑΥΤΗΣ ΕΥΡΕΝ ΤΟ ΠΑΙΔΙΟΝ ΒΕΒΛΗΜΕΝΟΝ ΕΠΙ ΤΗΝ ΚΛΙΝΗΝ ΚΑΙ ΤΟ ΔΑΙΜΟΝΙΟΝ ΕΞΕΛΗΛΥΘΟΣ
7,31,ΚΑΙ ΠΑΛΙΝ ΕΞΕΛΘΩΝ ΕΚ ΤΩΝ ΟΡΙΩΝ ΤΥΡΟΥ ΗΛΘΕΝ ΔΙΑ ΣΙΔΩΝΟΣ ΕΙΣ ΤΗΝ ΘΑΛΑΣΣΑΝ ΤΗΣ ΓΑΛΙΛΑΙΑΣ ΑΝΑ ΜΕΣΟΝ ΤΩΝ ΟΡΙΩΝ ΔΕΚΑΠΟΛΕΩΣ
7,32,ΚΑΙ ΦΕΡΟΥΣΙΝ ΑΥΤΩΙ ΚΩΦΟΝ ΚΑΙ ΜΟΓΙΛΑΛΟΝ ΚΑΙ ΠΑΡΑΚΑΛΟΥΣΙΝ ΑΥΤΟΝ ΙΝΑ ΕΠΙΘΗΙ ΑΥΤΩΙ ΤΗΝ ΧΕΙΡΑ
7,33,ΚΑΙ ΑΠΟΛΑΒΟΜΕΝΟΣ ΑΥΤΟΝ ΑΠΟ ΤΟΥ ΟΧΛΟΥ ΚΑΤΑ ΙΔΙΑΝ ΕΒΑΛΕΝ ΤΟΥΣ ΔΑΚΤΥΛΟΥΣ ΑΥΤΟΥ ΕΙΣ ΤΑ ΩΤΑ ΑΥΤΟΥ ΚΑΙ ΠΤΥΣΑΣ ΗΨΑΤΟ ΤΗΣ ΓΛΩΣΣΗΣ ΑΥΤΟΥ
7,34,ΚΑΙ ΑΝΑΒΛΕΨΑΣ ΕΙΣ ΤΟΝ ΟΥΡΑΝΟΝ ΕΣΤΕΝΑΞΕΝ ΚΑΙ ΛΕΓΕΙ ΑΥΤΩΙ ΕΦΦΑΘΑ Ο ΕΣΤΙΝ ΔΙΑΝΟΙΧΘΗΤΙ
7,35,ΚΑΙ ΗΝΟΙΓΗΣΑΝ ΑΥΤΟΥ ΑΙ ΑΚΟΑΙ ΚΑΙ ΕΛΥΘΗ Ο ΔΕΣΜΟΣ ΤΗΣ ΓΛΩΣΣΗΣ ΑΥΤΟΥ ΚΑΙ ΕΛΑΛΕΙ ΟΡΘΩΣ
7,36,ΚΑΙ ΔΙΕΣΤΕΙΛΑΤΟ ΑΥΤΟΙΣ ΙΝΑ ΜΗΔΕΝΙ ΛΕΓΩΣΙΝ ΟΣΟΝ ΔΕ ΑΥΤΟΙΣ ΔΙΕΣΤΕΛΛΕΤΟ ΑΥΤΟΙ ΜΑΛΛΟΝ ΠΕΡΙΣΣΟΤΕΡΟΝ ΕΚΗΡΥΣΣΟΝ
7,37,ΚΑΙ ΥΠΕΡ ΠΕΡΙΣΣΩΣ ΕΞΕΠΛΗΣΣΟΝΤΟ ΛΕΓΟΝΤΕΣ ΚΑΛΩΣ ΠΑΝΤΑ ΠΕΠΟΙΗΚΕΝ ΚΑΙ ΤΟΥΣ ΚΩΦΟΥΣ ΠΟΙΕΙ ΑΚΟΥΕΙΝ ΚΑΙ ΑΛΑΛΟΥΣ ΛΑΛΕΙΝ
8,1,ΕΝ ΕΚΕΙΝΑΙΣ ΤΑΙΣ ΗΜΕΡΑΙΣ ΠΑΛΙΝ ΠΟΛΛΟΥ ΟΧΛΟΥ ΟΝΤΟΣ ΚΑΙ ΜΗ ΕΧΟΝΤΩΝ ΤΙ ΦΑΓΩΣΙΝ ΠΡΟΣΚΑΛΕΣΑΜΕΝΟΣ ΤΟΥΣ ΜΑΘΗΤΑΣ ΑΥΤΟΥ ΛΕΓΕΙ ΑΥΤΟΙΣ
8,2,ΣΠΛΑΓΧΝΙΖΟΜΑΙ ΕΠΙ ΤΟΝ ΟΧΛΟΝ ΟΤΙ ΗΔΗ ΗΜΕΡΑΙ ΤΡΕΙΣ ΠΡΟΣΜΕΝΟΥΣΙΝ ΜΟΙ ΚΑΙ ΟΥΚ ΕΧΟΥΣΙΝ ΤΙ ΦΑΓΩΣΙΝ
8,3,ΚΑΙ ΕΑΝ ΑΠΟΛΥΣΩ ΑΥΤΟΥΣ ΝΗΣΤΕΙΣ ΕΙΣ ΟΙΚΟΝ ΑΥΤΩΝ ΕΚΛΥΘΗΣΟΝΤΑΙ ΕΝ ΤΗΙ ΟΔΩΙ ΚΑΙ ΤΙΝΕΣ ΑΥΤΩΝ ΑΠΟ ΜΑΚΡΟΘΕΝ ΗΚΑΣΙΝ
8,4,ΚΑΙ ΑΠΕΚΡΙΘΗΣΑΝ ΑΥΤΩΙ ΟΙ ΜΑΘΗΤΑΙ ΑΥΤΟΥ ΠΟΘΕΝ ΤΟΥΤΟΥΣ ΔΥΝΗΣΕΤΑΙ ΤΙΣ ΩΔΕ ΧΟΡΤΑΣΑΙ ΑΡΤΩΝ ΕΠΙ ΕΡΗΜΙΑΣ
8,5,ΚΑΙ ΗΡΩΤΑ ΑΥΤΟΥΣ ΠΟΣΟΥΣ ΕΧΕΤΕ ΑΡΤΟΥΣ ΟΙ ΔΕ ΕΙΠΑΝ ΕΠΤΑ
8,6,ΚΑΙ ΠΑΡΑΓΓΕΛΛΕΙ ΤΩΙ ΟΧΛΩΙ ΑΝΑΠΕΣΕΙΝ ΕΠΙ ΤΗΣ ΓΗΣ ΚΑΙ ΛΑΒΩΝ ΤΟΥΣ ΕΠΤΑ ΑΡΤΟΥΣ ΕΥΧΑΡΙΣΤΗΣΑΣ ΕΚΛΑΣΕΝ ΚΑΙ ΕΔΙΔΟΥ ΤΟΙΣ ΜΑΘΗΤΑΙΣ ΑΥΤΟΥ ΙΝΑ ΠΑΡΑΤΙΘΩΣΙΝ ΚΑΙ ΠΑΡΕΘΗΚΑΝ ΤΩΙ ΟΧΛΩΙ
8,7,ΚΑΙ ΕΙΧΑΝ ΙΧΘΥΔΙΑ ΟΛΙΓΑ ΚΑΙ ΕΥΛΟΓΗΣΑΣ ΑΥΤΑ ΕΙΠΕΝ ΚΑΙ ΤΑΥΤΑ ΠΑΡΑΤΙΘΕΝΑΙ
8,8,ΚΑΙ ΕΦΑΓΟΝ ΚΑΙ ΕΧΟΡΤΑΣΘΗΣΑΝ ΚΑΙ ΗΡΑΝ ΠΕΡΙΣΣΕΥΜΑΤΑ ΚΛΑΣΜΑΤΩΝ ΕΠΤΑ ΣΠΥΡΙΔΑΣ
8,9,ΗΣΑΝ ΔΕ ΩΣ ΤΕΤΡΑΚΙΣΧΙΛΙΟΙ ΚΑΙ ΑΠΕΛΥΣΕΝ ΑΥΤΟΥΣ
8,10,ΚΑΙ ΕΥΘΥΣ ΕΜΒΑΣ ΕΙΣ ΤΟ ΠΛΟΙΟΝ ΜΕΤΑ ΤΩΝ ΜΑΘΗΤΩΝ ΑΥΤΟΥ ΗΛΘΕΝ ΕΙΣ ΤΑ ΜΕΡΗ ΔΑΛΜΑΝΟΥΘΑ
8,11,ΚΑΙ ΕΞΗΛΘΟΝ ΟΙ ΦΑΡΙΣΑΙΟΙ ΚΑΙ ΗΡΞΑΝΤΟ ΣΥΝΖΗΤΕΙΝ ΑΥΤΩΙ ΖΗΤΟΥΝΤΕΣ ΠΑΡΑ ΑΥΤΟΥ ΣΗΜΕΙΟΝ ΑΠΟ ΤΟΥ ΟΥΡΑΝΟΥ ΠΕΙΡΑΖΟΝΤΕΣ ΑΥΤΟΝ
8,12,ΚΑΙ ΑΝΑΣΤΕΝΑΞΑΣ ΤΩΙ ΠΝΕΥΜΑΤΙ ΑΥΤΟΥ ΛΕΓΕΙ ΤΙ Η ΓΕΝΕΑ ΑΥΤΗ ΖΗΤΕΙ ΣΗΜΕΙΟΝ ΑΜΗΝ ΛΕΓΩ ΥΜΙΝ ΕΙ ΔΟΘΗΣΕΤΑΙ ΤΗΙ ΓΕΝΕΑΙ ΤΑΥΤΗΙ ΣΗΜΕΙΟΝ
8,13,ΚΑΙ ΑΦΕΙΣ ΑΥΤΟΥΣ ΠΑΛΙΝ ΕΜΒΑΣ ΑΠΗΛΘΕΝ ΕΙΣ ΤΟ ΠΕΡΑΝ
8,14,ΚΑΙ ΕΠΕΛΑΘΟΝΤΟ ΛΑΒΕΙΝ ΑΡΤΟΥΣ ΚΑΙ ΕΙ ΜΗ ΕΝΑ ΑΡΤΟΝ ΟΥΚ ΕΙΧΟΝ ΜΕΤΑ ΕΑΥΤΩΝ ΕΝ ΤΩΙ ΠΛΟΙΩΙ
8,15,ΚΑΙ ΔΙΕΣΤΕΛΛΕΤΟ ΑΥΤΟΙΣ ΛΕΓΩΝ ΟΡΑΤΕ ΒΛΕΠΕΤΕ ΑΠΟ ΤΗΣ ΖΥΜΗΣ ΤΩΝ ΦΑΡΙΣΑΙΩΝ ΚΑΙ ΤΗΣ ΖΥΜΗΣ ΗΡΩΙΔΟΥ
8,16,ΚΑΙ ΔΙΕΛΟΓΙΖΟΝΤΟ ΠΡΟΣ ΑΛΛΗΛΟΥΣ ΟΤΙ ΑΡΤΟΥΣ ΟΥΚ ΕΧΟΥΣΙΝ
8,17,ΚΑΙ ΓΝΟΥΣ Ο ΙΗΣΟΥΣ ΛΕΓΕΙ ΑΥΤΟΙΣ ΤΙ ΔΙΑΛΟΓΙΖΕΣΘΕ ΟΤΙ ΑΡΤΟΥΣ ΟΥΚ ΕΧΕΤΕ ΟΥΠΩ ΝΟΕΙΤΕ ΟΥΔΕ ΣΥΝΙΕΤΕ ΠΕΠΩΡΩΜΕΝΗΝ ΕΧΕΤΕ ΤΗΝ ΚΑΡΔΙΑΝ ΥΜΩΝ
8,18,ΟΦΘΑΛΜΟΥΣ ΕΧΟΝΤΕΣ ΟΥ ΒΛΕΠΕΤΕ ΚΑΙ ΩΤΑ ΕΧΟΝΤΕΣ ΟΥΚ ΑΚΟΥΕΤΕ ΚΑΙ ΟΥ ΜΝΗΜΟΝΕΥΕΤΕ
8,19,ΟΤΕ ΤΟΥΣ ΠΕΝΤΕ ΑΡΤΟΥΣ ΕΚΛΑΣΑ ΕΙΣ ΤΟΥΣ ΠΕΝΤΑΚΙΣΧΙΛΙΟΥΣ ΠΟΣΟΥΣ ΚΟΦΙΝΟΥΣ ΚΛΑΣΜΑΤΩΝ ΠΛΗΡΕΙΣ ΗΡΑΤΕ ΛΕΓΟΥΣΙΝ ΑΥΤΩΙ ΔΩΔΕΚΑ
8,20,ΟΤΕ ΚΑΙ ΤΟΥΣ ΕΠΤΑ ΕΙΣ ΤΟΥΣ ΤΕΤΡΑΚΙΣΧΙΛΙΟΥΣ ΠΟΣΩΝ ΣΠΥΡΙΔΩΝ ΠΛΗΡΩΜΑΤΑ ΚΛΑΣΜΑΤΩΝ ΗΡΑΤΕ ΚΑΙ ΛΕΓΟΥΣΙΝ ΑΥΤΩΙ ΕΠΤΑ
8,21,ΚΑΙ ΕΛΕΓΕΝ ΑΥΤΟΙΣ ΠΩΣ ΟΥΠΩ ΣΥΝΙΕΤΕ
8,22,ΚΑΙ ΕΡΧΟΝΤΑΙ ΕΙΣ ΒΗΘΣΑΙΔΑΝ ΚΑΙ ΦΕΡΟΥΣΙΝ ΑΥΤΩΙ ΤΥΦΛΟΝ ΚΑΙ ΠΑΡΑΚΑΛΟΥΣΙΝ ΑΥΤΟΝ ΙΝΑ ΑΥΤΟΥ ΑΨΗΤΑΙ
8,23,ΚΑΙ ΕΠΙΛΑΒΟΜΕΝΟΣ ΤΗΣ ΧΕΙΡΟΣ ΤΟΥ ΤΥΦΛΟΥ ΕΞΗΝΕΓΚΕΝ ΑΥΤΟΝ ΕΞΩ ΤΗΣ ΚΩΜΗΣ ΚΑΙ ΠΤΥΣΑΣ ΕΙΣ ΤΑ ΟΜΜΑΤΑ ΑΥΤΟΥ ΕΠΙΘΕΙΣ ΤΑΣ ΧΕΙΡΑΣ ΑΥΤΩΙ ΕΠΗΡΩΤΑ ΑΥΤΟΝ ΕΙ ΤΙ ΒΛΕΠΕΙΣ
8,24,ΚΑΙ ΑΝΑΒΛΕΨΑΣ ΕΛΕΓΕΝ ΒΛΕΠΩ ΤΟΥΣ ΑΝΘΡΩΠΟΥΣ ΟΤΙ ΩΣ ΔΕΝΔΡΑ ΟΡΩ ΠΕΡΙΠΑΤΟΥΝΤΑΣ
8,25,ΕΙΤΑ ΠΑΛΙΝ ΕΠΕΘΗΚΕΝ ΤΑΣ ΧΕΙΡΑΣ ΕΠΙ ΤΟΥΣ ΟΦΘΑΛΜΟΥΣ ΑΥΤΟΥ ΚΑΙ ΔΙΕΒΛΕΨΕΝ ΚΑΙ ΑΠΕΚΑΤΕΣΤΗ ΚΑΙ ΕΝΕΒΛΕΠΕΝ ΤΗΛΑΥΓΩΣ ΑΠΑΝΤΑ
8,26,ΚΑΙ ΑΠΕΣΤΕΙΛΕΝ ΑΥΤΟΝ ΕΙΣ ΟΙΚΟΝ ΑΥΤΟΥ ΛΕΓΩΝ ΜΗΔΕ ΕΙΣ ΤΗΝ ΚΩΜΗΝ ΕΙΣΕΛΘΗΙΣ
8,27,ΚΑΙ ΕΞΗΛΘΕΝ Ο ΙΗΣΟΥΣ ΚΑΙ ΟΙ ΜΑΘΗΤΑΙ ΑΥΤΟΥ ΕΙΣ ΤΑΣ ΚΩΜΑΣ ΚΑΙΣΑΡΕΙΑΣ ΤΗΣ ΦΙΛΙΠΠΟΥ ΚΑΙ ΕΝ ΤΗΙ ΟΔΩΙ ΕΠΗΡΩΤΑ ΤΟΥΣ ΜΑΘΗΤΑΣ ΑΥΤΟΥ ΛΕΓΩΝ ΑΥΤΟΙΣ ΤΙΝΑ ΜΕ ΛΕΓΟΥΣΙΝ ΟΙ ΑΝΘΡΩΠΟΙ ΕΙΝΑΙ
8,28,ΟΙ ΔΕ ΕΙΠΑΝ ΑΥΤΩΙ ΛΕΓΟΝΤΕΣ ΟΤΙ ΙΩΑΝΝΗΝ ΤΟΝ ΒΑΠΤΙΣΤΗΝ ΚΑΙ ΑΛΛΟΙ ΗΛΕΙΑΝ ΑΛΛΟΙ ΔΕ ΟΤΙ ΕΙΣ ΤΩΝ ΠΡΟΦΗΤΩΝ
8,29,ΚΑΙ ΑΥΤΟΣ ΕΠΗΡΩΤΑ ΑΥΤΟΥΣ ΥΜΕΙΣ ΔΕ ΤΙΝΑ ΜΕ ΛΕΓΕΤΕ ΕΙΝΑΙ ΑΠΟΚΡΙΘΕΙΣ ΔΕ Ο ΠΕΤΡΟΣ ΛΕΓΕΙ ΑΥΤΩΙ ΣΥ ΕΙ Ο ΧΡΙΣΤΟΣ
8,30,ΚΑΙ ΕΠΕΤΙΜΗΣΕΝ ΑΥΤΟΙΣ ΙΝΑ ΜΗΔΕΝΙ ΛΕΓΩΣΙΝ ΠΕΡΙ ΑΥΤΟΥ
8,31,ΚΑΙ ΗΡΞΑΤΟ ΔΙΔΑΣΚΕΙΝ ΑΥΤΟΥΣ ΟΤΙ ΔΕΙ ΤΟΝ ΥΙΟΝ ΤΟΥ ΑΝΘΡΩΠΟΥ ΠΟΛΛΑ ΠΑΘΕΙΝ ΚΑΙ ΑΠΟΔΟΚΙΜΑΣΘΗΝΑΙ ΥΠΟ ΤΩΝ ΠΡΕΣΒΥΤΕΡΩΝ ΚΑΙ ΤΩΝ ΑΡΧΙΕΡΕΩΝ ΚΑΙ ΤΩΝ ΓΡΑΜΜΑΤΕΩΝ ΚΑΙ ΑΠΟΚΤΑΝΘΗΝΑΙ ΚΑΙ ΜΕΤΑ ΤΡΕΙΣ ΗΜΕΡΑΣ ΑΝΑΣΤΗΝΑΙ
8,32,ΚΑΙ ΠΑΡΡΗΣΙΑΙ ΤΟΝ ΛΟΓΟΝ ΕΛΑΛΕΙ ΚΑΙ ΠΡΟΣΛΑΒΟΜΕΝΟΣ ΑΥΤΟΝ Ο ΠΕΤΡΟΣ ΗΡΞΑΤΟ ΕΠΙΤΙΜΑΝ ΑΥΤΩΙ
8,33,Ο ΔΕ ΕΠΙΣΤΡΑΦΕΙΣ ΚΑΙ ΙΔΩΝ ΤΟΥΣ ΜΑΘΗΤΑΣ ΑΥΤΟΥ ΕΠΕΤΙΜΗΣΕΝ ΠΕΤΡΩΙ ΚΑΙ ΛΕΓΕΙ ΥΠΑΓΕ ΟΠΙΣΩ ΜΟΥ ΣΑΤΑΝΑ ΟΤΙ ΟΥ ΦΡΟΝΕΙΣ ΤΑ ΤΟΥ ΘΕΟΥ ΑΛΛΑ ΤΑ ΤΩΝ ΑΝΘΡΩΠΩΝ
8,34,ΚΑΙ ΠΡΟΣΚΑΛΕΣΑΜΕΝΟΣ ΤΟΝ ΟΧΛΟΝ ΣΥΝ ΤΟΙΣ ΜΑΘΗΤΑΙΣ ΑΥΤΟΥ ΕΙΠΕΝ ΑΥΤΟΙΣ ΕΙ ΤΙΣ ΘΕΛΕΙ ΟΠΙΣΩ ΜΟΥ ΑΚΟΛΟΥΘΕΙΝ ΑΠΑΡΝΗΣΑΣΘΩ ΕΑΥΤΟΝ ΚΑΙ ΑΡΑΤΩ ΤΟΝ ΣΤΑΥΡΟΝ ΑΥΤΟΥ ΚΑΙ ΑΚΟΛΟΥΘΕΙΤΩ ΜΟΙ
8,35,ΟΣ ΓΑΡ ΕΑΝ ΘΕΛΗΙ ΤΗΝ ΨΥΧΗΝ ΑΥΤΟΥ ΣΩΣΑΙ ΑΠΟΛΕΣΕΙ ΑΥΤΗΝ ΟΣ ΔΕ ΑΝ ΑΠΟΛΕΣΕΙ ΤΗΝ ΨΥΧΗΝ ΑΥΤΟΥ ΕΝΕΚΕΝ ΕΜΟΥ ΚΑΙ ΤΟΥ ΕΥΑΓΓΕΛΙΟΥ ΣΩΣΕΙ ΑΥΤΗΝ
8,36,ΤΙ ΓΑΡ ΩΦΕΛΕΙ ΑΝΘΡΩΠΟΝ ΚΕΡΔΗΣΗΙ ΤΟΝ ΚΟΣΜΟΝ ΟΛΟΝ ΚΑΙ ΖΗΜΙΩΘΗΝΑΙ ΤΗΝ ΨΥΧΗΝ ΑΥΤΟΥ
8,37,ΤΙ ΓΑΡ ΔΟΙ ΑΝΘΡΩΠΟΣ ΑΝΤΑΛΛΑΓΜΑ ΤΗΣ ΨΥΧΗΣ ΑΥΤΟΥ
8,38,ΟΣ ΓΑΡ ΕΑΝ ΕΠΑΙΣΧΥΝΘΗΙ ΜΕ ΚΑΙ ΤΟΥΣ ΕΜΟΥΣ ΛΟΓΟΥΣ ΕΝ ΤΗΙ ΓΕΝΕΑΙ ΤΑΥΤΗΙ ΤΗΙ ΜΟΙΧΑΛΙΔΙ ΚΑΙ ΑΜΑΡΤΩΛΩΙ ΚΑΙ Ο ΥΙΟΣ ΤΟΥ ΑΝΘΡΩΠΟΥ ΕΠΑΙΣΧΥΝΘΗΣΕΤΑΙ ΑΥΤΟΝ ΟΤΑΝ ΕΛΘΗΙ ΕΝ ΤΗΙ ΔΟΞΗΙ ΤΟΥ ΠΑΤΡΟΣ ΑΥΤΟΥ ΜΕΤΑ ΤΩΝ ΑΓΓΕΛΩΝ ΤΩΝ ΑΓΙΩΝ
9,1,ΚΑΙ ΕΛΕΓΕΝ ΑΥΤΟΙΣ ΑΜΗΝ ΛΕΓΩ ΥΜΙΝ ΟΤΙ ΕΙΣΙΝ ΤΙΝΕΣ ΤΩΝ ΩΔΕ ΕΣΤΗΚΟΤΩΝ ΟΙΤΙΝΕΣ ΟΥ ΜΗ ΓΕΥΣΩΝΤΑΙ ΘΑΝΑΤΟΥ ΕΩΣ ΑΝ ΙΔΩΣΙΝ ΤΗΝ ΒΑΣΙΛΕΙΑΝ ΤΟΥ ΘΕΟΥ ΕΛΗΛΥΘΥΙΑΝ ΕΝ ΔΥΝΑΜΕΙ
9,2,ΚΑΙ ΜΕΤΑ ΗΜΕΡΑΣ ΕΞ ΠΑΡΑΛΑΜΒΑΝΕΙ Ο ΙΗΣΟΥΣ ΤΟΝ ΠΕΤΡΟΝ ΚΑΙ ΤΟΝ ΙΑΚΩΒΟΝ ΚΑΙ ΤΟΝ ΙΩΑΝΝΗΝ ΚΑΙ ΑΝΑΦΕΡΕΙ ΑΥΤΟΥΣ ΕΙΣ ΟΡΟΣ ΥΨΗΛΟΝ ΚΑΤΑ ΙΔΙΑΝ ΜΟΝΟΥΣ ΚΑΙ ΜΕΤΕΜΟΡΦΩΘΗ ΕΜΠΡΟΣΘΕΝ ΑΥΤΩΝ
9,3,ΚΑΙ ΤΑ ΙΜΑΤΙΑ ΑΥΤΟΥ ΕΓΕΝΕΤΟ ΣΤΙΛΒΟΝΤΑ ΛΕΥΚΑ ΛΕΙΑΝ ΟΙΑ ΓΝΑΦΕΥΣ ΕΠΙ ΤΗΣ ΓΗΣ ΟΥ ΔΥΝΑΤΑΙ ΟΥΤΩΣ ΛΕΥΚΑΝΑΙ
9,4,ΚΑΙ ΩΦΘΗ ΑΥΤΟΙΣ ΗΛΕΙΑΣ ΣΥΝ ΜΩΥΣΕΙ ΚΑΙ ΗΣΑΝ ΣΥΝΛΑΛΟΥΝΤΕΣ ΤΩΙ ΙΗΣΟΥ
9,5,ΚΑΙ ΑΠΟΚΡΙΘΕΙΣ Ο ΠΕΤΡΟΣ ΛΕΓΕΙ ΤΩΙ ΙΗΣΟΥ ΡΑΒΒΕΙ ΚΑΛΟΝ ΕΣΤΙΝ ΗΜΑΣ ΩΔΕ ΕΙΝΑΙ ΚΑΙ ΠΟΙΗΣΩΜΕΝ ΤΡΕΙΣ ΣΚΗΝΑΣ ΣΟΙ ΜΙΑΝ ΚΑΙ ΜΩΥΣΕΙ ΜΙΑΝ ΚΑΙ ΗΛΕΙΑΙ ΜΙΑΝ
9,6,ΟΥ ΓΑΡ ΗΙΔΕΙ ΤΙ ΑΠΟΚΡΙΘΗΙ ΕΚΦΟΒΟΙ ΓΑΡ ΕΓΕΝΟΝΤΟ
9,7,ΚΑΙ ΕΓΕΝΕΤΟ ΝΕΦΕΛΗ ΕΠΙΣΚΙΑΖΟΥΣΑ ΑΥΤΟΙΣ ΚΑΙ ΕΓΕΝΕΤΟ ΦΩΝΗ ΕΚ ΤΗΣ ΝΕΦΕΛΗΣ ΟΥΤΟΣ ΕΣΤΙΝ Ο ΥΙΟΣ ΜΟΥ Ο ΑΓΑΠΗΤΟΣ ΑΚΟΥΕΤΕ ΑΥΤΟΥ
9,8,ΚΑΙ ΕΞΑΠΙΝΑ ΠΕΡΙΒΛΕΨΑΜΕΝΟΙ ΟΥΚΕΤΙ ΟΥΔΕΝΑ ΕΙΔΟΝ ΑΛΛΑ ΤΟΝ ΙΗΣΟΥΝ ΜΟΝΟΝ ΜΕΤΑ ΕΑΥΤΩΝ
9,9,ΚΑΙ ΚΑΤΑΒΑΙΝΟΝΤΩΝ ΑΥΤΩΝ ΕΚ ΤΟΥ ΟΡΟΥΣ ΔΙΕΣΤΕΙΛΑΤΟ ΑΥΤΟΙΣ ΙΝΑ ΜΗΔΕΝΙ Α ΕΙΔΟΝ ΔΙΗΓΗΣΩΝΤΑΙ ΕΙ ΜΗ ΟΤΑΝ Ο ΥΙΟΣ ΤΟΥ ΑΝΘΡΩΠΟΥ ΕΚ ΝΕΚΡΩΝ ΑΝΑΣΤΗΙ
9,10,ΚΑΙ ΤΟΝ ΛΟΓΟΝ ΕΚΡΑΤΗΣΑΝ ΠΡΟΣ ΕΑΥΤΟΥΣ ΣΥΝΖΗΤΟΥΝΤΕΣ ΤΙ ΕΣΤΙΝ ΤΟ ΕΚ ΝΕΚΡΩΝ ΑΝΑΣΤΗΝΑΙ
9,11,ΚΑΙ ΕΠΗΡΩΤΩΝ ΑΥΤΟΝ ΛΕΓΟΝΤΕΣ ΟΤΙ ΛΕΓΟΥΣΙΝ ΟΙ ΓΡΑΜΜΑΤΕΙΣ ΟΤΙ ΗΛΕΙΑΝ ΔΕΙ ΕΛΘΕΙΝ ΠΡΩΤΟΝ
9,12,Ο ΔΕ ΕΦΗ ΑΥΤΟΙΣ ΗΛΕΙΑΣ ΜΕΝ ΕΛΘΩΝ ΠΡΩΤΟΝ ΑΠΟΚΑΤΙΣΤΑΝΕΙ ΠΑΝΤΑ ΚΑΙ ΠΩΣ ΓΕΓΡΑΠΤΑΙ ΕΠΙ ΤΟΝ ΥΙΟΝ ΤΟΥ ΑΝΘΡΩΠΟΥ ΙΝΑ ΠΟΛΛΑ ΠΑΘΗΙ ΚΑΙ ΕΞΟΥΔΕΝΗΘΗΙ
9,13,ΑΛΛΑ ΛΕΓΩ ΥΜΙΝ ΟΤΙ ΚΑΙ ΗΛΕΙΑΣ ΕΛΗΛΥΘΕΝ ΚΑΙ ΕΠΟΙΗΣΑΝ ΑΥΤΩΙ ΟΣΑ ΗΘΕΛΟΝ ΚΑΘΩΣ ΓΕΓΡΑΠΤΑΙ ΕΠΙ ΑΥΤΟΝ
9,14,ΚΑΙ ΕΛΘΟΝΤΕΣ ΠΡΟΣ ΤΟΥΣ ΜΑΘΗΤΑΣ ΕΙΔΟΝ ΟΧΛΟΝ ΠΟΛΥΝ ΠΕΡΙ ΑΥΤΟΥΣ ΚΑΙ ΓΡΑΜΜΑΤΕΙΣ ΣΥΝΖΗΤΟΥΝΤΑΣ ΠΡΟΣ ΑΥΤΟΥΣ
9,15,ΚΑΙ ΕΥΘΥΣ ΠΑΣ Ο ΟΧΛΟΣ ΙΔΟΝΤΕΣ ΑΥΤΟΝ ΕΞΕΘΑΜΒΗΘΗΣΑΝ ΚΑΙ ΠΡΟΣΤΡΕΧΟΝΤΕΣ ΗΣΠΑΖΟΝΤΟ ΑΥΤΟΝ
9,16,ΚΑΙ ΕΠΗΡΩΤΗΣΕΝ ΑΥΤΟΥΣ ΤΙ ΣΥΝΖΗΤΕΙΤΕ ΠΡΟΣ ΑΥΤΟΥΣ
9,17,ΚΑΙ ΑΠΕΚΡΙΘΗ ΑΥΤΩΙ ΕΙΣ ΕΚ ΤΟΥ ΟΧΛΟΥ ΔΙΔΑΣΚΑΛΕ ΗΝΕΓΚΑ ΤΟΝ ΥΙΟΝ ΜΟΥ ΠΡΟΣ ΣΕ ΕΧΟΝΤΑ ΠΝΕΥΜΑ ΑΛΑΛΟΝ
9,18,ΚΑΙ ΟΠΟΥ ΕΑΝ ΑΥΤΟΝ ΚΑΤΑΛΑΒΗΙ ΡΗΣΣΕΙ ΑΥΤΟΝ ΚΑΙ ΑΦΡΙΖΕΙ ΚΑΙ ΤΡΙΖΕΙ ΤΟΥΣ ΟΔΟΝΤΑΣ ΚΑΙ ΞΗΡΑΙΝΕΤΑΙ ΚΑΙ ΕΙΠΑ ΤΟΙΣ ΜΑΘΗΤΑΙΣ ΣΟΥ ΙΝΑ ΑΥΤΟ ΕΚΒΑΛΩΣΙΝ ΚΑΙ ΟΥΚ ΙΣΧΥΣΑΝ
9,19,Ο ΔΕ ΑΠΟΚΡΙΘΕΙΣ ΑΥΤΟΙΣ ΛΕΓΕΙ Ω ΓΕΝΕΑ ΑΠΙΣΤΟΣ ΕΩΣ ΠΟΤΕ ΠΡΟΣ ΥΜΑΣ ΕΣΟΜΑΙ ΕΩΣ ΠΟΤΕ ΑΝΕΞΟΜΑΙ ΥΜΩΝ ΦΕΡΕΤΕ ΑΥΤΟΝ ΠΡΟΣ ΜΕ
9,20,ΚΑΙ ΗΝΕΓΚΑΝ ΑΥΤΟΝ ΠΡΟΣ ΑΥΤΟΝ ΚΑΙ ΙΔΩΝ ΑΥΤΟΝ ΤΟ ΠΝΕΥΜΑ ΕΥΘΥΣ ΣΥΝΕΣΠΑΡΑΞΕΝ ΑΥΤΟΝ ΚΑΙ ΠΕΣΩΝ ΕΠΙ ΤΗΣ ΓΗΣ ΕΚΥΛΙΕΤΟ ΑΦΡΙΖΩΝ
9,21,ΚΑΙ ΕΠΗΡΩΤΗΣΕΝ ΤΟΝ ΠΑΤΕΡΑ ΑΥΤΟΥ ΠΟΣΟΣ ΧΡΟΝΟΣ ΕΣΤΙΝ ΩΣ ΤΟΥΤΟ ΓΕΓΟΝΕΝ ΑΥΤΩΙ Ο ΔΕ ΕΙΠΕΝ ΕΚ ΠΑΙΔΙΟΘΕΝ
9,22,ΚΑΙ ΠΟΛΛΑΚΙΣ ΚΑΙ ΕΙΣ ΠΥΡ ΑΥΤΟΝ ΕΒΑΛΕΝ ΚΑΙ ΕΙΣ ΥΔΑΤΑ ΙΝΑ ΑΠΟΛΕΣΗΙ ΑΥΤΟΝ ΑΛΛΑ ΕΙ ΤΙ ΔΥΝΗΙ ΒΟΗΘΗΣΟΝ ΗΜΙΝ ΣΠΛΑΓΧΝΙΣΘΕΙΣ ΕΠΙ ΗΜΑΣ
9,23,Ο ΔΕ ΙΗΣΟΥΣ ΕΙΠΕΝ ΑΥΤΩΙ ΤΟ ΕΙ ΔΥΝΗΙ ΠΑΝΤΑ ΔΥΝΑΤΑ ΤΩΙ ΠΙΣΤΕΥΟΝΤΙ
9,24,ΚΑΙ ΕΥΘΥΣ ΚΡΑΞΑΣ Ο ΠΑΤΗΡ ΤΟΥ ΠΑΙΔΙΟΥ ΕΛΕΓΕΝ ΠΙΣΤΕΥΩ ΒΟΗΘΕΙ ΜΟΥ ΤΗΙ ΑΠΙΣΤΙΑΙ
9,25,ΙΔΩΝ ΔΕ Ο ΙΗΣΟΥΣ ΟΤΙ ΕΠΙΣΥΝΤΡΕΧΕΙ ΟΧΛΟΣ ΕΠΕΤΙΜΗΣΕΝ ΤΩΙ ΠΝΕΥΜΑΤΙ ΤΩΙ ΑΚΑΘΑΡΤΩΙ ΛΕΓΩΝ ΑΥΤΩΙ ΤΟ ΑΛΑΛΟΝ ΚΑΙ ΚΩΦΟΝ ΠΝΕΥΜΑ ΕΓΩ ΕΠΙΤΑΣΣΩ ΣΟΙ ΕΞΕΛΘΕ ΕΞ ΑΥΤΟΥ ΚΑΙ ΜΗΚΕΤΙ ΕΙΣΕΛΘΗΙΣ ΕΙΣ ΑΥΤΟΝ
9,26,ΚΑΙ ΚΡΑΞΑΣ ΚΑΙ ΠΟΛΛΑ ΣΠΑΡΑΞΑΣ ΑΥΤΟΝ ΕΞΗΛΘΕΝ ΚΑΙ ΕΓΕΝΕΤΟ ΩΣΕΙ ΝΕΚΡΟΣ ΩΣΤΕ ΤΟΥΣ ΠΟΛΛΟΥΣ ΛΕΓΕΙΝ ΟΤΙ ΑΠΕΘΑΝΕΝ
9,27,Ο ΔΕ ΙΗΣΟΥΣ ΚΡΑΤΗΣΑΣ ΤΗΣ ΧΕΙΡΟΣ ΑΥΤΟΥ ΗΓΕΙΡΕΝ ΑΥΤΟΝ ΚΑΙ ΑΝΕΣΤΗ
9,28,ΚΑΙ ΕΙΣΕΛΘΟΝΤΟΣ ΑΥΤΟΥ ΕΙΣ ΟΙΚΟΝ ΟΙ ΜΑΘΗΤΑΙ ΑΥΤΟΥ ΚΑΤΑ ΙΔΙΑΝ ΕΠΗΡΩΤΩΝ ΑΥΤΟΝ ΟΤΙ ΗΜΕΙΣ ΟΥΚ ΗΔΥΝΗΘΗΜΕΝ ΕΚΒΑΛΕΙΝ ΑΥΤΟ
9,29,ΚΑΙ ΕΙΠΕΝ ΑΥΤΟΙΣ ΤΟΥΤΟ ΤΟ ΓΕΝΟΣ ΕΝ ΟΥΔΕΝΙ ΔΥΝΑΤΑΙ ΕΞΕΛΘΕΙΝ ΕΙ ΜΗ ΕΝ ΠΡΟΣΕΥΧΗΙ ΚΑΙ ΝΗΣΤΕΙΑ
9,30,ΚΑΚΕΙΘΕΝ ΕΞΕΛΘΟΝΤΕΣ ΠΑΡΕΠΟΡΕΥΟΝΤΟ ΔΙΑ ΤΗΣ ΓΑΛΙΛΑΙΑΣ ΚΑΙ ΟΥΚ ΗΘΕΛΕΝ ΙΝΑ ΤΙΣ ΓΝΟΙ
9,31,ΕΔΙΔΑΣΚΕΝ ΓΑΡ ΤΟΥΣ ΜΑΘΗΤΑΣ ΑΥΤΟΥ ΚΑΙ ΕΛΕΓΕΝ ΑΥΤΟΙΣ ΟΤΙ Ο ΥΙΟΣ ΤΟΥ ΑΝΘΡΩΠΟΥ ΠΑΡΑΔΙΔΟΤΑΙ ΕΙΣ ΧΕΙΡΑΣ ΑΝΘΡΩΠΩΝ ΚΑΙ ΑΠΟΚΤΕΝΟΥΣΙΝ ΑΥΤΟΝ ΚΑΙ ΑΠΟΚΤΑΝΘΕΙΣ ΜΕΤΑ ΤΡΕΙΣ ΗΜΕΡΑΣ ΑΝΑΣΤΗΣΕΤΑΙ
9,32,ΟΙ ΔΕ ΗΓΝΟΟΥΝ ΤΟ ΡΗΜΑ ΚΑΙ ΕΦΟΒΟΥΝΤΟ ΑΥΤΟΝ ΕΠΕΡΩΤΗΣΑΙ
9,33,ΚΑΙ ΗΛΘΟΝ ΕΙΣ ΚΑΦΑΡΝΑΟΥΜ ΚΑΙ ΕΝ ΤΗΙ ΟΙΚΙΑΙ ΓΕΝΟΜΕΝΟΣ ΕΠΗΡΩΤΑ ΑΥΤΟΥΣ ΤΙ ΕΝ ΤΗΙ ΟΔΩΙ ΔΙΕΛΟΓΙΖΕΣΘΕ
9,34,ΟΙ ΔΕ ΕΣΙΩΠΩΝ ΠΡΟΣ ΑΛΛΗΛΟΥΣ ΓΑΡ ΔΙΕΛΕΧΘΗΣΑΝ ΕΝ ΤΗΙ ΟΔΩΙ ΤΙΣ ΜΕΙΖΩΝ
9,35,ΚΑΙ ΚΑΘΙΣΑΣ ΕΦΩΝΗΣΕΝ ΤΟΥΣ ΔΩΔΕΚΑ ΚΑΙ ΛΕΓΕΙ ΑΥΤΟΙΣ ΕΙ ΤΙΣ ΘΕΛΕΙ ΠΡΩΤΟΣ ΕΙΝΑΙ ΕΣΤΑΙ ΠΑΝΤΩΝ ΕΣΧΑΤΟΣ ΚΑΙ ΠΑΝΤΩΝ ΔΙΑΚΟΝΟΣ
9,36,ΚΑΙ ΛΑΒΩΝ ΠΑΙΔΙΟΝ ΕΣΤΗΣΕΝ ΑΥΤΟ ΕΝ ΜΕΣΩΙ ΑΥΤΩΝ ΚΑΙ ΕΝΑΓΚΑΛΙΣΑΜΕΝΟΣ ΑΥΤΟ ΕΙΠΕΝ ΑΥΤΟΙΣ
9,37,ΟΣ ΑΝ ΕΝ ΤΩΝ ΤΟΙΟΥΤΩΝ ΠΑΙΔΙΩΝ ΔΕΞΗΤΑΙ ΕΠΙ ΤΩΙ ΟΝΟΜΑΤΙ ΜΟΥ ΕΜΕ ΔΕΧΕΤΑΙ ΚΑΙ ΟΣ ΑΝ ΕΜΕ ΔΕΧΗΤΑΙ ΟΥΚ ΕΜΕ ΔΕΧΕΤΑΙ ΑΛΛΑ ΤΟΝ ΑΠΟΣΤΕΙΛΑΝΤΑ ΜΕ
9,38,ΕΦΗ ΑΥΤΩΙ Ο ΙΩΑΝΝΗΣ ΔΙΔΑΣΚΑΛΕ ΕΙΔΟΜΕΝ ΤΙΝΑ ΕΝ ΤΩΙ ΟΝΟΜΑΤΙ ΣΟΥ ΕΚΒΑΛΛΟΝΤΑ ΔΑΙΜΟΝΙΑ ΚΑΙ ΕΚΩΛΥΟΜΕΝ ΑΥΤΟΝ ΟΤΙ ΟΥΚ ΗΚΟΛΟΥΘΕΙ ΗΜΙΝ
9,39,Ο ΔΕ ΙΗΣΟΥΣ ΕΙΠΕΝ ΜΗ ΚΩΛΥΕΤΕ ΑΥΤΟΝ ΟΥΔΕΙΣ ΓΑΡ ΕΣΤΙΝ ΟΣ ΠΟΙΗΣΕΙ ΔΥΝΑΜΙΝ ΕΠΙ ΤΩΙ ΟΝΟΜΑΤΙ ΜΟΥ ΚΑΙ ΔΥΝΗΣΕΤΑΙ ΤΑΧΥ ΚΑΚΟΛΟΓΗΣΑΙ ΜΕ
9,40,ΟΣ ΓΑΡ ΟΥΚ ΕΣΤΙΝ ΚΑΤΑ ΗΜΩΝ ΥΠΕΡ ΗΜΩΝ ΕΣΤΙΝ
9,41,ΟΣ ΓΑΡ ΑΝ ΠΟΤΙΣΗΙ ΥΜΑΣ ΠΟΤΗΡΙΟΝ ΥΔΑΤΟΣ ΕΝ ΟΝΟΜΑΤΙ ΟΤΙ ΧΡΙΣΤΟΥ ΕΣΤΕ ΑΜΗΝ ΛΕΓΩ ΥΜΙΝ ΟΤΙ ΟΥ ΜΗ ΑΠΟΛΕΣΗΙ ΤΟΝ ΜΙΣΘΟΝ ΑΥΤΟΥ
9,42,ΚΑΙ ΟΣ ΑΝ ΣΚΑΝΔΑΛΙΣΗΙ ΕΝΑ ΤΩΝ ΜΙΚΡΩΝ ΤΟΥΤΩΝ ΤΩΝ ΠΙΣΤΕΥΟΝΤΩΝ ΕΙΣ ΕΜΕ ΚΑΛΟΝ ΕΣΤΙΝ ΑΥΤΩΙ ΜΑΛΛΟΝ ΕΙ ΠΕΡΙΚΕΙΤΑΙ ΜΥΛΟΣ ΟΝΙΚΟΣ ΠΕΡΙ ΤΟΝ ΤΡΑΧΗΛΟΝ ΑΥΤΟΥ ΚΑΙ ΒΕΒΛΗΤΑΙ ΕΙΣ ΤΗΝ ΘΑΛΑΣΣΑΝ
9,43,ΚΑΙ ΕΑΝ ΣΚΑΝΔΑΛΙΣΗΙ ΣΕ Η ΧΕΙΡ ΣΟΥ ΑΠΟΚΟΨΟΝ ΑΥΤΗΝ ΚΑΛΟΝ ΕΣΤΙΝ ΣΕ ΚΥΛΛΟΝ ΕΙΣΕΛΘΕΙΝ ΕΙΣ ΤΗΝ ΖΩΗΝ Η ΤΑΣ ΔΥΟ ΧΕΙΡΑΣ ΕΧΟΝΤΑ ΑΠΕΛΘΕΙΝ ΕΙΣ ΤΗΝ ΓΕΕΝΝΑΝ ΕΙΣ ΤΟ ΠΥΡ ΤΟ ΑΣΒΕΣΤΟΝ
9,45,ΚΑΙ ΕΑΝ Ο ΠΟΥΣ ΣΟΥ ΣΚΑΝΔΑΛΙΖΗΙ ΣΕ ΑΠΟΚΟΨΟΝ ΑΥΤΟΝ ΚΑΛΟΝ ΕΣΤΙΝ ΣΕ ΕΙΣΕΛΘΕΙΝ ΕΙΣ ΤΗΝ ΖΩΗΝ ΧΩΛΟΝ Η ΤΟΥΣ ΔΥΟ ΠΟΔΑΣ ΕΧΟΝΤΑ ΒΛΗΘΗΝΑΙ ΕΙΣ ΤΗΝ ΓΕΕΝΝΑΝ
9,47,ΚΑΙ ΕΑΝ Ο ΟΦΘΑΛΜΟΣ ΣΟΥ ΣΚΑΝΔΑΛΙΖΗΙ ΣΕ ΕΚΒΑΛΕ ΑΥΤΟΝ ΚΑΛΟΝ ΣΕ ΕΣΤΙΝ ΜΟΝΟΦΘΑΛΜΟΝ ΕΙΣΕΛΘΕΙΝ ΕΙΣ ΤΗΝ ΒΑΣΙΛΕΙΑΝ ΤΟΥ ΘΕΟΥ Η ΔΥΟ ΟΦΘΑΛΜΟΥΣ ΕΧΟΝΤΑ ΒΛΗΘΗΝΑΙ ΕΙΣ ΤΗΝ ΓΕΕΝΝΑΝ
9,48,ΟΠΟΥ Ο ΣΚΩΛΗΞ ΑΥΤΩΝ ΟΥ ΤΕΛΕΥΤΑΙ ΚΑΙ ΤΟ ΠΥΡ ΟΥ ΣΒΕΝΝΥΤΑΙ
9,49,ΠΑΣ ΓΑΡ ΠΥΡΙ ΑΛΙΣΘΗΣΕΤΑΙ
9,50,ΚΑΛΟΝ ΤΟ ΑΛΑΣ ΕΑΝ ΔΕ ΤΟ ΑΛΑΣ ΑΝΑΛΟΝ ΓΕΝΗΤΑΙ ΕΝ ΤΙΝΙ ΑΥΤΟ ΑΡΤΥΣΕΤΕ ΕΧΕΤΕ ΕΝ ΕΑΥΤΟΙΣ ΑΛΑ ΚΑΙ ΕΙΡΗΝΕΥΕΤΕ ΕΝ ΑΛΛΗΛΟΙΣ
10,1,ΚΑΙ ΕΚΕΙΘΕΝ ΑΝΑΣΤΑΣ ΕΡΧΕΤΑΙ ΕΙΣ ΤΑ ΟΡΙΑ ΤΗΣ ΙΟΥΔΑΙΑΣ ΚΑΙ ΠΕΡΑΝ ΤΟΥ ΙΟΡΔΑΝΟΥ ΚΑΙ ΣΥΝΠΟΡΕΥΟΝΤΑΙ ΠΑΛΙΝ ΟΧΛΟΙ ΠΡΟΣ ΑΥΤΟΝ ΚΑΙ ΩΣ ΕΙΩΘΕΙ ΠΑΛΙΝ ΕΔΙΔΑΣΚΕΝ ΑΥΤΟΥΣ
10,2,ΚΑΙ ΠΡΟΣΕΛΘΟΝΤΕΣ ΦΑΡΙΣΑΙΟΙ ΕΠΗΡΩΤΩΝ ΑΥΤΟΝ ΕΙ ΕΞΕΣΤΙΝ ΑΝΔΡΙ ΓΥΝΑΙΚΑ ΑΠΟΛΥΣΑΙ ΠΕΙΡΑΖΟΝΤΕΣ ΑΥΤΟΝ
10,3,Ο ΔΕ ΑΠΟΚΡΙΘΕΙΣ ΕΙΠΕΝ ΑΥΤΟΙΣ ΤΙ ΥΜΙΝ ΕΝΕΤΕΙΛΑΤΟ ΜΩΥΣΗΣ
10,4,ΟΙ ΔΕ ΕΙΠΑΝ ΕΠΕΤΡΕΨΕΝ ΜΩΥΣΗΣ ΒΙΒΛΙΟΝ ΑΠΟΣΤΑΣΙΟΥ ΓΡΑΨΑΙ ΚΑΙ ΑΠΟΛΥΣΑΙ
10,5,Ο ΔΕ ΙΗΣΟΥΣ ΕΙΠΕΝ ΑΥΤΟΙΣ ΠΡΟΣ ΤΗΝ ΣΚΛΗΡΟΚΑΡΔΙΑΝ ΥΜΩΝ ΕΓΡΑΨΕΝ ΥΜΙΝ ΤΗΝ ΕΝΤΟΛΗΝ ΤΑΥΤΗΝ
10,6,ΑΠΟ ΔΕ ΑΡΧΗΣ ΚΤΙΣΕΩΣ ΑΡΣΕΝ ΚΑΙ ΘΗΛΥ ΕΠΟΙΗΣΕΝ ΑΥΤΟΥΣ
10,7,ΕΝΕΚΕΝ ΤΟΥΤΟΥ ΚΑΤΑΛΕΙΨΕΙ ΑΝΘΡΩΠΟΣ ΤΟΝ ΠΑΤΕΡΑ ΑΥΤΟΥ ΚΑΙ ΤΗΝ ΜΗΤΕΡΑ
10,8,ΚΑΙ ΕΣΟΝΤΑΙ ΟΙ ΔΥΟ ΕΙΣ ΣΑΡΚΑ ΜΙΑΝ ΩΣΤΕ ΟΥΚΕΤΙ ΕΙΣΙΝ ΔΥΟ ΑΛΛΑ ΜΙΑ ΣΑΡΞ
10,9,Ο ΟΥΝ Ο ΘΕΟΣ ΣΥΝΕΖΕΥΞΕΝ ΑΝΘΡΩΠΟΣ ΜΗ ΧΩΡΙΖΕΤΩ
10,10,ΚΑΙ ΕΙΣ ΤΗΝ ΟΙΚΙΑΝ ΠΑΛΙΝ ΟΙ ΜΑΘΗΤΑΙ ΠΕΡΙ ΤΟΥΤΟΥ ΕΠΗΡΩΤΩΝ ΑΥΤΟΝ
10,11,ΚΑΙ ΛΕΓΕΙ ΑΥΤΟΙΣ ΟΣ ΑΝ ΑΠΟΛΥΣΗΙ ΤΗΝ ΓΥΝΑΙΚΑ ΑΥΤΟΥ ΚΑΙ ΓΑΜΗΣΗΙ ΑΛΛΗΝ ΜΟΙΧΑΤΑΙ ΕΠΙ ΑΥΤΗΝ
10,12,ΚΑΙ ΕΑΝ ΑΥΤΗ ΑΠΟΛΥΣΑΣΑ ΤΟΝ ΑΝΔΡΑ ΑΥΤΗΣ ΓΑΜΗΣΗΙ ΑΛΛΟΝ ΜΟΙΧΑΤΑΙ
10,13,ΚΑΙ ΠΡΟΣΕΦΕΡΟΝ ΑΥΤΩΙ ΠΑΙΔΙΑ ΙΝΑ ΑΥΤΩΝ ΑΨΗΤΑΙ ΟΙ ΔΕ ΜΑΘΗΤΑΙ ΕΠΕΤΙΜΗΣΑΝ ΑΥΤΟΙΣ
10,14,ΙΔΩΝ ΔΕ Ο ΙΗΣΟΥΣ ΗΓΑΝΑΚΤΗΣΕΝ ΚΑΙ ΕΙΠΕΝ ΑΥΤΟΙΣ ΑΦΕΤΕ ΤΑ ΠΑΙΔΙΑ ΕΡΧΕΣΘΑΙ ΠΡΟΣ ΜΕ ΚΑΙ ΜΗ ΚΩΛΥΕΤΕ ΑΥΤΑ ΤΩΝ ΓΑΡ ΤΟΙΟΥΤΩΝ ΕΣΤΙΝ Η ΒΑΣΙΛΕΙΑ ΤΟΥ ΘΕΟΥ
10,15,ΑΜΗΝ ΛΕΓΩ ΥΜΙΝ ΟΣ ΑΝ ΜΗ ΔΕΞΗΤΑΙ ΤΗΝ ΒΑΣΙΛΕΙΑΝ ΤΟΥ ΘΕΟΥ ΩΣ ΠΑΙΔΙΟΝ ΟΥ ΜΗ ΕΙΣΕΛΘΗΙ ΕΙΣ ΑΥΤΗΝ
10,16,ΚΑΙ ΕΝΑΓΚΑΛΙΣΑΜΕΝΟΣ ΑΥΤΑ ΚΑΤΕΥΛΟΓΕΙ ΤΙΘΕΙΣ ΤΑΣ ΧΕΙΡΑΣ ΕΠΙ ΑΥΤΑ
10,17,ΚΑΙ ΕΚΠΟΡΕΥΟΜΕΝΟΥ ΑΥΤΟΥ ΕΙΣ ΟΔΟΝ ΠΡΟΣΔΡΑΜΩΝ ΕΙΣ ΚΑΙ ΓΟΝΥΠΕΤΗΣΑΣ ΑΥΤΟΝ ΕΠΗΡΩΤΑ ΑΥΤΟΝ ΔΙΔΑΣΚΑΛΕ ΑΓΑΘΕ ΤΙ ΠΟΙΗΣΩ ΙΝΑ ΖΩΗΝ ΑΙΩΝΙΟΝ ΚΛΗΡΟΝΟΜΗΣΩ
10,18,Ο ΔΕ ΙΗΣΟΥΣ ΕΙΠΕΝ ΑΥΤΩΙ ΤΙ ΜΕ ΛΕΓΕΙΣ ΑΓΑΘΟΝ ΟΥΔΕΙΣ ΑΓΑΘΟΣ ΕΙ ΜΗ ΕΙΣ Ο ΘΕΟΣ
10,19,ΤΑΣ ΕΝΤΟΛΑΣ ΟΙΔΑΣ ΜΗ ΦΟΝΕΥΣΗΙΣ ΜΗ ΜΟΙΧΕΥΣΗΙΣ ΜΗ ΚΛΕΨΗΙΣ ΜΗ ΨΕΥΔΟΜΑΡΤΥΡΗΣΗΙΣ ΜΗ ΑΠΟΣΤΕΡΗΣΗΙΣ ΤΙΜΑ ΤΟΝ ΠΑΤΕΡΑ ΣΟΥ ΚΑΙ ΤΗΝ ΜΗΤΕΡΑ
10,20,Ο ΔΕ ΕΦΗ ΑΥΤΩΙ ΔΙΔΑΣΚΑΛΕ ΤΑΥΤΑ ΠΑΝΤΑ ΕΦΥΛΑΞΑΜΗΝ ΕΚ ΝΕΟΤΗΤΟΣ ΜΟΥ
10,21,Ο ΔΕ ΙΗΣΟΥΣ ΕΜΒΛΕΨΑΣ ΑΥΤΩΙ ΗΓΑΠΗΣΕΝ ΑΥΤΟΝ ΚΑΙ ΕΙΠΕΝ ΑΥΤΩΙ ΕΝ ΣΕ ΥΣΤΕΡΕΙ ΥΠΑΓΕ ΟΣΑ ΕΧΕΙΣ ΠΩΛΗΣΟΝ ΚΑΙ ΔΟΣ ΤΟΙΣ ΠΤΩΧΟΙΣ ΚΑΙ ΕΞΕΙΣ ΘΗΣΑΥΡΟΝ ΕΝ ΟΥΡΑΝΩΙ ΚΑΙ ΔΕΥΡΟ ΑΚΟΛΟΥΘΕΙ ΜΟΙ
10,22,Ο ΔΕ ΣΤΥΓΝΑΣΑΣ ΕΠΙ ΤΩΙ ΛΟΓΩΙ ΑΠΗΛΘΕΝ ΛΥΠΟΥΜΕΝΟΣ ΗΝ ΓΑΡ ΕΧΩΝ ΚΤΗΜΑΤΑ ΠΟΛΛΑ
10,23,ΚΑΙ ΠΕΡΙΒΛΕΨΑΜΕΝΟΣ Ο ΙΗΣΟΥΣ ΛΕΓΕΙ ΤΟΙΣ ΜΑΘΗΤΑΙΣ ΑΥΤΟΥ ΠΩΣ ΔΥΣΚΟΛΩΣ ΟΙ ΤΑ ΧΡΗΜΑΤΑ ΕΧΟΝΤΕΣ ΕΙΣ ΤΗΝ ΒΑΣΙΛΕΙΑΝ ΤΟΥ ΘΕΟΥ ΕΙΣΕΛΕΥΣΟΝΤΑΙ
10,24,ΟΙ ΔΕ ΜΑΘΗΤΑΙ ΕΘΑΜΒΟΥΝΤΟ ΕΠΙ ΤΟΙΣ ΛΟΓΟΙΣ ΑΥΤΟΥ Ο ΔΕ ΙΗΣΟΥΣ ΠΑΛΙΝ ΑΠΟΚΡΙΘΕΙΣ ΛΕΓΕΙ ΑΥΤΟΙΣ ΤΕΚΝΑ ΠΩΣ ΔΥΣΚΟΛΟΝ ΕΣΤΙΝ ΕΙΣ ΤΗΝ ΒΑΣΙΛΕΙΑΝ ΤΟΥ ΘΕΟΥ ΕΙΣΕΛΘΕΙΝ
10,25,ΕΥΚΟΠΩΤΕΡΟΝ ΕΣΤΙΝ ΚΑΜΗΛΟΝ ΔΙΑ ΤΡΥΜΑΛΙΑΣ ΡΑΦΙΔΟΣ ΔΙΕΛΘΕΙΝ Η ΠΛΟΥΣΙΟΝ ΕΙΣ ΤΗΝ ΒΑΣΙΛΕΙΑΝ ΤΟΥ ΘΕΟΥ ΕΙΣΕΛΘΕΙΝ
10,26,ΟΙ ΔΕ ΠΕΡΙΣΣΩΣ ΕΞΕΠΛΗΣΣΟΝΤΟ ΛΕΓΟΝΤΕΣ ΠΡΟΣ ΑΥΤΟΝ ΚΑΙ ΤΙΣ ΔΥΝΑΤΑΙ ΣΩΘΗΝΑΙ
10,27,ΕΜΒΛΕΨΑΣ ΑΥΤΟΙΣ Ο ΙΗΣΟΥΣ ΛΕΓΕΙ ΠΑΡΑ ΑΝΘΡΩΠΟΙΣ ΑΔΥΝΑΤΟΝ ΑΛΛΑ ΟΥ ΠΑΡΑ ΘΕΩΙ ΠΑΝΤΑ ΓΑΡ ΔΥΝΑΤΑ ΠΑΡΑ ΤΩΙ ΘΕΩΙ
10,28,ΗΡΞΑΤΟ ΛΕΓΕΙΝ Ο ΠΕΤΡΟΣ ΑΥΤΩΙ ΙΔΟΥ ΗΜΕΙΣ ΑΦΗΚΑΜΕΝ ΠΑΝΤΑ ΚΑΙ ΗΚΟΛΟΥΘΗΚΑΜΕΝ ΣΟΙ
10,29,ΕΦΗ Ο ΙΗΣΟΥΣ ΑΜΗΝ ΛΕΓΩ ΥΜΙΝ ΟΥΔΕΙΣ ΕΣΤΙΝ ΟΣ ΑΦΗΚΕΝ ΟΙΚΙΑΝ Η ΑΔΕΛΦΟΥΣ Η ΑΔΕΛΦΑΣ Η ΜΗΤΕΡΑ Η ΠΑΤΕΡΑ Η ΤΕΚΝΑ Η ΑΓΡΟΥΣ ΕΝΕΚΕΝ ΕΜΟΥ ΚΑΙ ΤΟΥ ΕΥΑΓΓΕΛΙΟΥ
10,30,ΕΑΝ ΜΗ ΛΑΒΗΙ ΕΚΑΤΟΝΤΑΠΛΑΣΙΟΝΑ ΝΥΝ ΕΝ ΤΩΙ ΚΑΙΡΩΙ ΤΟΥΤΩΙ ΟΙΚΙΑΣ ΚΑΙ ΑΔΕΛΦΟΥΣ ΚΑΙ ΑΔΕΛΦΑΣ ΚΑΙ ΜΗΤΕΡΑΣ ΚΑΙ ΤΕΚΝΑ ΚΑΙ ΑΓΡΟΥΣ ΜΕΤΑ ΔΙΩΓΜΩΝ ΚΑΙ ΕΝ ΤΩΙ ΑΙΩΝΙ ΤΩΙ ΕΡΧΟΜΕΝΩΙ ΖΩΗΝ ΑΙΩΝΙΟΝ
10,31,ΠΟΛΛΟΙ ΔΕ ΕΣΟΝΤΑΙ ΠΡΩΤΟΙ ΕΣΧΑΤΟΙ ΚΑΙ ΕΣΧΑΤΟΙ ΠΡΩΤΟΙ
10,32,ΗΣΑΝ ΔΕ ΕΝ ΤΗΙ ΟΔΩΙ ΑΝΑΒΑΙΝΟΝΤΕΣ ΕΙΣ ΙΕΡΟΣΟΛΥΜΑ ΚΑΙ ΗΝ ΠΡΟΑΓΩΝ ΑΥΤΟΥΣ Ο ΙΗΣΟΥΣ ΚΑΙ ΕΘΑΜΒΟΥΝΤΟ ΟΙ ΔΕ ΑΚΟΛΟΥΘΟΥΝΤΕΣ ΕΦΟΒΟΥΝΤΟ ΚΑΙ ΠΑΡΑΛΑΒΩΝ ΠΑΛΙΝ ΤΟΥΣ ΔΩΔΕΚΑ ΗΡΞΑΤΟ ΑΥΤΟΙΣ ΛΕΓΕΙΝ ΤΑ ΜΕΛΛΟΝΤΑ ΑΥΤΩΙ ΣΥΜΒΑΙΝΕΙΝ
