chapter,verse,text
6,24,ΠΛΗΝ ΟΥΑΙ ΥΜΙΝ ΤΟΙΣ ΠΛΟΥΣΙΟΙΣ ΟΤΙ ΑΠΕΧΕΤΕ ΤΗΝ ΠΑΡΑΚΛΗΣΙΝ ΥΜΩΝ
6,25,ΟΥΑΙ ΥΜΙΝ ΟΙ ΕΜΠΕΠΛΗΣΜΕΝΟΙ ΝΥΝ ΟΤΙ ΠΕΙΝΑΣΕΤΕ ΟΥΑΙ ΟΙ ΓΕΛΩΝΤΕΣ ΝΥΝ ΟΤΙ ΠΕΝΘΗΣΕΤΕ ΚΑΙ ΚΛΑΥΣΕΤΕ
6,26,ΟΥΑΙ ΟΤΑΝ ΥΜΑΣ ΚΑΛΩΣ ΕΙΠΩΣΙΝ ΠΑΝΤΕΣ ΟΙ ΑΝΘΡΩΠΟΙ ΚΑΤΑ ΤΑ ΑΥΤΑ ΓΑΡ ΕΠΟΙΟΥΝ ΤΟΙΣ ΨΕΥΔΟΠΡΟΦΗΤΑΙΣ ΟΙ ΠΑΤΕΡΕΣ ΑΥΤΩΝ
6,27,ΑΛΛΑ ΥΜΙΝ ΛΕΓΩ ΤΟΙΣ ΑΚΟΥΟΥΣΙΝ ΑΓΑΠΑΤΕ ΤΟΥΣ ΕΧΘΡΟΥΣ ΥΜΩΝ ΚΑΛΩΣ ΠΟΙΕΙΤΕ ΤΟΙΣ ΜΙΣΟΥΣΙΝ ΥΜΑΣ
6,28,ΕΥΛΟΓΕΙΤΕ ΤΟΥΣ ΚΑΤΑΡΩΜΕΝΟΥΣ ΥΜΑΣ ΠΡΟΣΕΥΧΕΣΘΕ ΠΕΡΙ ΤΩΝ ΕΠΗΡΕΑΖΟΝΤΩΝ ΥΜΑΣ
6,29,ΤΩΙ ΤΥΠΤΟΝΤΙ ΣΕ ΕΠΙ ΤΗΝ ΣΙΑΓΟΝΑ ΠΑΡΕΧΕ ΚΑΙ ΤΗΝ ΑΛΛΗΝ ΚΑΙ ΑΠΟ ΤΟΥ ΑΙΡΟΝΤΟΣ ΣΟΥ ΤΟ ΙΜΑΤΙΟΝ ΚΑΙ ΤΟΝ ΧΙΤΩΝΑ ΜΗ ΚΩΛΥΣΗΙΣ
6,30,ΠΑΝΤΙ ΑΙΤΟΥΝΤΙ ΣΕ ΔΙΔΟΥ ΚΑΙ ΑΠΟ ΤΟΥ ΑΙΡΟΝΤΟΣ ΤΑ ΣΑ ΜΗ ΑΠΑΙΤΕΙ
6,31,ΚΑΙ ΚΑΘΩΣ ΘΕΛΕΤΕ ΙΝΑ ΠΟΙΩΣΙΝ ΥΜΙΝ ΟΙ ΑΝΘΡΩΠΟΙ ΠΟΙΕΙΤΕ ΑΥΤΟΙΣ ΟΜΟΙΩΣ
6,32,ΚΑΙ ΕΙ ΑΓΑΠΑΤΕ ΤΟΥΣ ΑΓΑΠΩΝΤΑΣ ΥΜΑΣ ΠΟΙΑ ΥΜΙΝ ΧΑΡΙΣ ΕΣΤΙΝ ΚΑΙ ΓΑΡ ΟΙ ΑΜΑΡΤΩΛΟΙ ΤΟΥΣ ΑΓΑΠΩΝΤΑΣ ΑΥΤΟΥΣ ΑΓΑΠΩΣΙΝ
6,33,ΚΑΙ ΓΑΡ ΕΑΝ ΑΓΑΘΟΠΟΙΗΤΕ ΤΟΥΣ ΑΓΑΘΟΠΟΙΟΥΝΤΑΣ ΥΜΑΣ ΠΟΙΑ ΥΜΙΝ ΧΑΡΙΣ ΕΣΤΙΝ ΚΑΙ ΟΙ ΑΜΑΡΤΩΛΟΙ ΤΟ ΑΥΤΟ ΠΟΙΟΥΣΙΝ
6,34,ΚΑΙ ΕΑΝ ΔΑΝΙΣΗΤΕ ΠΑΡΑ ΩΝ ΕΛΠΙΖΕΤΕ ΛΑΒΕΙΝ ΠΟΙΑ ΥΜΙΝ ΧΑΡΙΣ ΕΣΤΙΝ ΚΑΙ ΑΜΑΡΤΩΛΟΙ ΑΜΑΡΤΩΛΟΙΣ ΔΑΝΙΖΟΥΣΙΝ ΙΝΑ ΑΠΟΛΑΒΩΣΙΝ ΤΑ ΙΣΑ
6,35,ΠΛΗΝ ΑΓΑΠΑΤΕ ΤΟΥΣ ΕΧΘΡΟΥΣ ΥΜΩΝ ΚΑΙ ΑΓΑΘΟΠΟΙΕΙΤΕ ΚΑΙ ΔΑΝΙΖΕΤΕ ΜΗΔΕΝ ΑΠΕΛΠΙΖΟΝΤΕΣ ΚΑΙ ΕΣΤΑΙ Ο ΜΙΣΘΟΣ ΥΜΩΝ ΠΟΛΥΣ ΚΑΙ ΕΣΕΣΘΕ ΥΙΟΙ ΥΨΙΣΤΟΥ ΟΤΙ ΑΥΤΟΣ ΧΡΗΣΤΟΣ ΕΣΤΙΝ ΕΠΙ ΤΟΥΣ ΑΧΑΡΙΣΤΟΥΣ ΚΑΙ ΠΟΝΗΡΟΥΣ
6,36,ΓΙΝΕΣΘΕ ΟΙΚΤΙΡΜΟΝΕΣ ΚΑΘΩΣ Ο ΠΑΤΗΡ ΥΜΩΝ ΟΙΚΤΙΡΜΩΝ ΕΣΤΙΝ
6,37,ΚΑΙ ΜΗ ΚΡΙΝΕΤΕ ΚΑΙ ΟΥ ΜΗ ΚΡΙΘΗΤΕ ΚΑΙ ΜΗ ΚΑΤΑΔΙΚΑΖΕΤΕ ΚΑΙ ΟΥ ΜΗ ΚΑΤΑΔΙΚΑΣΘΗΤΕ ΑΠΟΛΥΕΤΕ ΚΑΙ ΑΠΟΛΥΘΗΣΕΣΘΕ
6,38,ΔΙΔΟΤΕ ΚΑΙ ΔΟΘΗΣΕΤΑΙ ΥΜΙΝ ΜΕΤΡΟΝ ΚΑΛΟΝ ΠΕΠΙΕΣΜΕΝΟΝ ΣΕΣΑΛΕΥΜΕΝΟΝ ΥΠΕΡΕΚΧΥΝΝΟΜΕΝΟΝ ΔΩΣΟΥΣΙΝ ΕΙΣ ΤΟΝ ΚΟΛΠΟΝ ΥΜΩΝ ΩΙ ΓΑΡ ΜΕΤΡΩΙ ΜΕΤΡΕΙΤΕ ΑΝΤΙΜΕΤΡΗΘΗΣΕΤΑΙ ΥΜΙΝ
6,39,ΕΙΠΕΝ ΔΕ ΚΑΙ ΠΑΡΑΒΟΛΗΝ ΑΥΤΟΙΣ ΜΗΤΙ ΔΥΝΑΤΑΙ ΤΥΦΛΟΣ ΤΥΦΛΟΝ ΟΔΗΓΕΙΝ ΟΥΧΙ ΑΜΦΟΤΕΡΟΙ ΕΙΣ ΒΟΘΥΝΟΝ ΕΜΠΕΣΟΥΝΤΑΙ
6,40,ΟΥΚ ΕΣΤΙΝ ΜΑΘΗΤΗΣ ΥΠΕΡ ΤΟΝ ΔΙΔΑΣΚΑΛΟΝ ΚΑΤΗΡΤΙΣΜΕΝΟΣ ΔΕ ΠΑΣ ΕΣΤΑΙ ΩΣ Ο ΔΙΔΑΣΚΑΛΟΣ ΑΥΤΟΥ
6,41,ΤΙ ΔΕ ΒΛΕΠΕΙΣ ΤΟ ΚΑΡΦΟΣ ΤΟ ΕΝ ΤΩΙ ΟΦΘΑΛΜΩΙ ΤΟΥ ΑΔΕΛΦΟΥ ΣΟΥ ΤΗΝ ΔΕ ΔΟΚΟΝ ΤΗΝ ΕΝ ΤΩΙ ΙΔΙΩΙ ΟΦΘΑΛΜΩΙ ΟΥ ΚΑΤΑΝΟΕΙΣ
6,42,ΠΩΣ ΔΥΝΑΣΑΙ ΛΕΓΕΙΝ ΤΩΙ ΑΔΕΛΦΩΙ ΣΟΥ ΑΔΕΛΦΕ ΑΦΕΣ ΕΚΒΑΛΩ ΤΟ ΚΑΡΦΟΣ ΤΟ ΕΝ ΤΩΙ ΟΦΘΑΛΜΩΙ ΣΟΥ ΑΥΤΟΣ ΤΗΝ ΕΝ ΤΩΙ ΟΦΘΑΛΜΩΙ ΣΟΥ ΔΟΚΟΝ ΟΥ ΒΛΕΠΩΝ ΥΠΟΚΡΙΤΑ ΕΚΒΑΛΕ ΠΡΩΤΟΝ ΤΗΝ ΔΟΚΟΝ ΕΚ ΤΟΥ ΟΦΘΑΛΜΟΥ ΣΟΥ ΚΑΙ ΤΟΤΕ ΔΙΑΒΛΕΨΕΙΣ ΤΟ ΚΑΡΦΟΣ ΤΟ ΕΝ ΤΩΙ ΟΦΘΑΛΜΩΙ ΤΟΥ ΑΔΕΛΦΟΥ ΣΟΥ ΕΚΒΑΛΕΙΝ
6,43,ΟΥ ΓΑΡ ΕΣΤΙΝ ΔΕΝΔΡΟΝ ΚΑΛΟΝ ΠΟΙΟΥΝ ΚΑΡΠΟΝ ΣΑΠΡΟΝ ΟΥΔΕ ΠΑΛΙΝ ΔΕΝΔΡΟΝ ΣΑΠΡΟΝ ΠΟΙΟΥΝ ΚΑΡΠΟΝ ΚΑΛΟΝ
6,44,ΕΚΑΣΤΟΝ ΓΑΡ ΔΕΝΔΡΟΝ ΕΚ ΤΟΥ ΙΔΙΟΥ ΚΑΡΠΟΥ ΓΙΝΩΣΚΕΤΑΙ ΟΥ ΓΑΡ ΕΞ ΑΚΑΝΘΩΝ ΣΥΛΛΕΓΟΥΣΙΝ ΣΥΚΑ ΟΥΔΕ ΕΚ ΒΑΤΟΥ ΣΤΑΦΥΛΗΝ ΤΡΥΓΩΣΙΝ
6,45,Ο ΑΓΑΘΟΣ ΑΝΘΡΩΠΟΣ ΕΚ ΤΟΥ ΑΓΑΘΟΥ ΘΗΣΑΥΡΟΥ ΤΗΣ ΚΑΡΔΙΑΣ ΠΡΟΦΕΡΕΙ ΤΟ ΑΓΑΘΟΝ ΚΑΙ Ο ΠΟΝΗΡΟΣ ΕΚ ΤΟΥ ΠΟΝΗΡΟΥ ΠΡΟΦΕΡΕΙ ΤΟ ΠΟΝΗΡΟΝ ΕΚ ΓΑΡ ΠΕΡΙΣΣΕΥΜΑΤΟΣ ΚΑΡΔΙΑΣ ΛΑΛΕΙ ΤΟ ΣΤΟΜΑ ΑΥΤΟΥ
6,46,ΤΙ ΔΕ ΜΕ ΚΑΛΕΙΤΕ ΚΥΡΙΕ ΚΥΡΙΕ ΚΑΙ ΟΥ ΠΟΙΕΙΤΕ Α ΛΕΓΩ
6,47,ΠΑΣ Ο ΕΡΧΟΜΕΝΟΣ ΠΡΟΣ ΜΕ ΚΑΙ ΑΚΟΥΩΝ ΜΟΥ ΤΩΝ ΛΟΓΩΝ ΚΑΙ ΠΟΙΩΝ ΑΥΤΟΥΣ ΥΠΟΔΕΙΞΩ ΥΜΙΝ ΤΙΝΙ ΕΣΤΙΝ ΟΜΟΙΟΣ
6,48,ΟΜΟΙΟΣ ΕΣΤΙΝ ΑΝΘΡΩΠΩΙ ΟΙΚΟΔΟΜΟΥΝΤΙ ΟΙΚΙΑΝ ΟΣ ΕΣΚΑΨΕΝ ΚΑΙ ΕΒΑΘΥΝΕΝ ΚΑΙ ΕΘΗΚΕΝ ΘΕΜΕΛΙΟΝ ΕΠΙ ΤΗΝ ΠΕΤΡΑΝ ΠΛΗΜΜΥΡΗΣ ΔΕ ΓΕΝΟΜΕΝΗΣ ΠΡΟΣΕΡΗΞΕΝ Ο ΠΟΤΑΜΟΣ ΤΗΙ ΟΙΚΙΑΙ ΕΚΕΙΝΗΙ ΚΑΙ ΟΥΚ ΙΣΧΥΣΕΝ ΣΑΛΕΥΣΑΙ ΑΥΤΗΝ ΔΙΑ ΤΟ ΚΑΛΩΣ ΟΙΚΟΔΟΜΗΣΘΑΙ ΑΥΤΗΝ
6,49,Ο ΔΕ ΑΚΟΥΣΑΣ ΚΑΙ ΜΗ ΠΟΙΗΣΑΣ ΟΜΟΙΟΣ ΕΣΤΙΝ ΑΝΘΡΩΠΩΙ ΟΙΚΟΔΟΜΗΣΑΝΤΙ ΟΙΚΙΑΝ ΕΠΙ ΤΗΝ ΓΗΝ ΧΩΡΙΣ ΘΕΜΕΛΙΟΥ ΗΙ ΠΡΟΣΕΡΡΗΞΕΝ Ο ΠΟΤΑΜΟΣ ΚΑΙ ΕΥΘΥΣ ΣΥΝΕΠΕΣΕΝ ΚΑΙ ΕΓΕΝΕΤΟ ΤΟ ΡΗΓΜΑ ΤΗΣ ΟΙΚΙΑΣ ΕΚΕΙΝΗΣ ΜΕΓΑ
7,1,ΕΠΕΙΔΗ ΕΠΛΗΡΩΣΕΝ ΠΑΝΤΑ ΤΑ ΡΗΜΑΤΑ ΑΥΤΟΥ ΕΙΣ ΤΑΣ ΑΚΟΑΣ ΤΟΥ ΛΑΟΥ ΕΙΣΗΛΘΕΝ ΕΙΣ ΚΑΦΑΡΝΑΟΥΜ
7,2,ΕΚΑΤΟΝΤΑΡΧΟΥ ΔΕ ΤΙΝΟΣ ΔΟΥΛΟΣ ΚΑΚΩΣ ΕΧΩΝ ΗΜΕΛΛΕΝ ΤΕΛΕΥΤΑΝ ΟΣ ΗΝ ΑΥΤΩΙ ΕΝΤΙΜΟΣ
7,3,ΑΚΟΥΣΑΣ ΔΕ ΠΕΡΙ ΤΟΥ ΙΗΣΟΥ ΑΠΕΣΤΕΙΛΕΝ ΠΡΟΣ ΑΥΤΟΝ ΠΡΕΣΒΥΤΕΡΟΥΣ ΤΩΝ ΙΟΥΔΑΙΩΝ ΕΡΩΤΩΝ ΑΥΤΟΝ ΟΠΩΣ ΕΛΘΩΝ ΔΙΑΣΩΣΗΙ ΤΟΝ ΔΟΥΛΟΝ ΑΥΤΟΥ
7,4,ΟΙ ΔΕ ΠΑΡΑΓΕΝΟΜΕΝΟΙ ΠΡΟΣ ΤΟΝ ΙΗΣΟΥΝ ΠΑΡΕΚΑΛΟΥΝ ΑΥΤΟΝ ΣΠΟΥΔΑΙΩΣ ΛΕΓΟΝΤΕΣ ΟΤΙ ΑΞΙΟΣ ΕΣΤΙΝ ΩΙ ΠΑΡΕΞΗΙ ΤΟΥΤΟ
7,5,ΑΓΑΠΑΙ ΓΑΡ ΤΟ ΕΘΝΟΣ ΗΜΩΝ ΚΑΙ ΤΗΝ ΣΥΝΑΓΩΓΗΝ ΑΥΤΟΣ ΩΙΚΟΔΟΜΗΣΕΝ ΗΜΙΝ
7,6,Ο ΔΕ ΙΗΣΟΥΣ ΕΠΟΡΕΥΕΤΟ ΣΥΝ ΑΥΤΟΙΣ ΗΔΗ ΔΕ ΑΥΤΟΥ ΟΥ ΜΑΚΡΑΝ ΑΠΕΧΟΝΤΟΣ ΑΠΟ ΤΗΣ ΟΙΚΙΑΣ ΕΠΕΜΨΕΝ ΦΙΛΟΥΣ Ο ΕΚΑΤΟΝΤΑΡΧΗΣ ΛΕΓΩΝ ΑΥΤΩΙ ΚΥΡΙΕ ΜΗ ΣΚΥΛΛΟΥ ΟΥ ΓΑΡ ΙΚΑΝΟΣ ΕΙΜΙ ΙΝΑ ΥΠΟ ΤΗΝ ΣΤΕΓΗΝ ΜΟΥ ΕΙΣΕΛΘΗΙΣ
7,7,ΔΙΟ ΟΥΔΕ ΕΜΑΥΤΟΝ ΗΞΙΩΣΑ ΠΡΟΣ ΣΕ ΕΛΘΕΙΝ ΑΛΛΑ ΕΙΠΕ ΛΟΓΩΙ ΚΑΙ ΙΑΘΗΤΩ Ο ΠΑΙΣ ΜΟΥ
7,8,ΚΑΙ ΓΑΡ ΕΓΩ ΑΝΘΡΩΠΟΣ ΕΙΜΙ ΥΠΟ ΕΞΟΥΣΙΑΝ ΤΑΣΣΟΜΕΝΟΣ ΕΧΩΝ ΥΠΟ ΕΜΑΥΤΟΝ ΣΤΡΑΤΙΩΤΑΣ ΚΑΙ ΛΕΓΩ ΤΟΥΤΩΙ ΠΟΡΕΥΘΗΤΙ ΚΑΙ ΠΟΡΕΥΕΤΑΙ ΚΑΙ ΑΛΛΩΙ ΕΡΧΟΥ ΚΑΙ ΕΡΧΕΤΑΙ ΚΑΙ ΤΩΙ ΔΟΥΛΩΙ ΜΟΥ ΠΟΙΗΣΟΝ ΤΟΥΤΟ ΚΑΙ ΠΟΙΕΙ
7,9,ΑΚΟΥΣΑΣ ΔΕ ΤΑΥΤΑ Ο ΙΗΣΟΥΣ ΕΘΑΥΜΑΣΕΝ ΑΥΤΟΝ ΚΑΙ ΣΤΡΑΦΕΙΣ ΤΩΙ ΑΚΟΛΟΥΘΟΥΝΤΙ ΑΥΤΩΙ ΟΧΛΩΙ ΕΙΠΕΝ ΛΕΓΩ ΥΜΙΝ ΟΥΔΕ ΕΝ ΤΩΙ ΙΣΡΑΗΛ ΤΟΣΑΥΤΗΝ ΠΙΣΤΙΝ ΕΥΡΟΝ
7,10,ΚΑΙ ΥΠΟΣΤΡΕΨΑΝΤΕΣ ΕΙΣ ΤΟΝ ΟΙΚΟΝ ΟΙ ΠΕΜΦΘΕΝΤΕΣ ΕΥΡΟΝ ΤΟΝ ΔΟΥΛΟΝ ΥΓΙΑΙΝΟΝΤΑ
7,11,ΚΑΙ ΕΓΕΝΕΤΟ ΕΝ ΤΩΙ ΕΞΗΣ ΕΠΟΡΕΥΘΗ ΕΙΣ ΠΟΛΙΝ ΚΑΛΟΥΜΕΝΗΝ ΝΑΙΝ ΚΑΙ ΣΥΝΕΠΟΡΕΥΟΝΤΟ ΑΥΤΩΙ ΟΙ ΜΑΘΗΤΑΙ ΑΥΤΟΥ ΚΑΙ ΟΧΛΟΣ ΠΟΛΥΣ
7,12,ΩΣ ΔΕ ΗΓΓΙΣΕΝ ΤΗΙ ΠΥΛΗΙ ΤΗΣ ΠΟΛΕΩΣ ΚΑΙ ΙΔΟΥ ΕΞΕΚΟΜΙΖΕΤΟ ΤΕΘΝΗΚΩΣ ΜΟΝΟΓΕΝΗΣ ΥΙΟΣ ΤΗΙ ΜΗΤΡΙ ΑΥΤΟΥ ΚΑΙ ΑΥΤΗ ΗΝ ΧΗΡΑ ΚΑΙ ΟΧΛΟΣ ΤΗΣ ΠΟΛΕΩΣ ΙΚΑΝΟΣ ΗΝ ΣΥΝ ΑΥΤΗΙ
7,13,ΚΑΙ ΙΔΩΝ ΑΥΤΗΝ Ο ΚΥΡΙΟΣ ΕΣΠΛΑΓΧΝΙΣΘΗ ΕΠΙ ΑΥΤΗΙ ΚΑΙ ΕΙΠΕΝ ΑΥΤΗΙ ΜΗ ΚΛΑΙΕ
7,14,ΚΑΙ ΠΡΟΣΕΛΘΩΝ ΗΨΑΤΟ ΤΗΣ ΣΟΡΟΥ ΟΙ ΔΕ ΒΑΣΤΑΖΟΝΤΕΣ ΕΣΤΗΣΑΝ ΚΑΙ ΕΙΠΕΝ ΝΕΑΝΙΣΚΕ ΣΟΙ ΛΕΓΩ ΕΓΕΡΘΗΤΙ
7,15,ΚΑΙ ΑΝΕΚΑΘΙΣΕΝ Ο ΝΕΚΡΟΣ ΚΑΙ ΗΡΞΑΤΟ ΛΑΛΕΙΝ ΚΑΙ ΕΔΩΚΕΝ ΑΥΤΟΝ ΤΗΙ ΜΗΤΡΙ ΑΥΤΟΥ
7,16,ΕΛΑΒΕΝ ΔΕ ΦΟΒΟΣ ΠΑΝΤΑΣ ΚΑΙ ΕΔΟΞΑΖΟΝ ΤΟΝ ΘΕΟΝ ΛΕΓΟΝΤΕΣ ΟΤΙ ΠΡΟΦΗΤΗΣ ΜΕΓΑΣ ΗΓΕΡΘΗ ΕΝ ΗΜΙΝ ΚΑΙ ΟΤΙ ΕΠΕΣΚΕΨΑΤΟ Ο ΘΕΟΣ ΤΟΝ ΛΑΟΝ ΑΥΤΟΥ
7,17,ΚΑΙ ΕΞΗΛΘΕΝ Ο ΛΟΓΟΣ ΟΥΤΟΣ ΕΝ ΟΛΗΙ ΤΗΙ ΙΟΥΔΑΙΑΙ ΠΕΡΙ ΑΥΤΟΥ ΚΑΙ ΠΑΣΗΙ ΤΗΙ ΠΕΡΙΧΩΡΩΙ
7,18,ΚΑΙ ΑΠΗΓΓΕΙΛΑΝ ΙΩΑΝΝΗΙ ΟΙ ΜΑΘΗΤΑΙ ΑΥΤΟΥ ΠΕΡΙ ΠΑΝΤΩΝ ΤΟΥΤΩΝ ΚΑΙ ΠΡΟΣΚΑΛΕΣΑΜΕΝΟΣ ΔΥΟ ΤΙΝΑΣ ΤΩΝ ΜΑΘΗΤΩΝ ΑΥΤΟΥ Ο ΙΩΑΝΝΗΣ
7,19,ΕΠΕΜΨΕΝ ΠΡΟΣ ΤΟΝ ΚΥΡΙΟΝ ΛΕΓΩΝ ΣΥ ΕΙ Ο ΕΡΧΟΜΕΝΟΣ Η ΑΛΛΟΝ ΠΡΟΣΔΟΚΩΜΕΝ
7,20,ΠΑΡΑΓΕΝΟΜΕΝΟΙ ΔΕ ΠΡΟΣ ΑΥΤΟΝ ΟΙ ΑΝΔΡΕΣ ΕΙΠΑΝ ΙΩΑΝΝΗΣ Ο ΒΑΠΤΙΣΤΗΣ ΑΠΕΣΤΕΙΛΕΝ ΗΜΑΣ ΠΡΟΣ ΣΕ ΛΕΓΩΝ ΣΥ ΕΙ Ο ΕΡΧΟΜΕΝΟΣ Η ΑΛΛΟΝ ΠΡΟΣΔΟΚΩΜΕΝ
7,21,ΕΝ ΕΚΕΙΝΗΙ ΤΗΙ ΩΡΑΙ ΕΘΕΡΑΠΕΥΣΕΝ ΠΟΛΛΟΥΣ ΑΠΟ ΝΟΣΩΝ ΚΑΙ ΜΑΣΤΙΓΩΝ ΚΑΙ ΠΝΕΥΜΑΤΩΝ ΠΟΝΗΡΩΝ ΚΑΙ ΤΥΦΛΟΙΣ ΠΟΛΛΟΙΣ ΕΧΑΡΙΣΑΤΟ ΒΛΕΠΕΙΝ
7,22,ΚΑΙ ΑΠΟΚΡΙΘΕΙΣ ΕΙΠΕΝ ΑΥΤΟΙΣ ΠΟΡΕΥΘΕΝΤΕΣ ΑΠΑΓΓΕΙΛΑΤΕ ΙΩΑΝΝΗΙ Α ΕΙΔΕΤΕ ΚΑΙ ΗΚΟΥΣΑΤΕ ΤΥΦΛΟΙ ΑΝΑΒΛΕΠΟΥΣΙΝ ΧΩΛΟΙ ΠΕΡΙΠΑΤΟΥΣΙΝ ΛΕΠΡΟΙ ΚΑΘΑΡΙΖΟΝΤΑΙ ΚΑΙ ΚΩΦΟΙ ΑΚΟΥΟΥΣΙΝ ΝΕΚΡΟΙ ΕΓΕΙΡΟΝΤΑΙ ΠΤΩΧΟΙ ΕΥΑΓΓΕΛΙΖΟΝΤΑΙ
7,23,ΚΑΙ ΜΑΚΑΡΙΟΣ ΕΣΤΙΝ ΟΣ ΕΑΝ ΜΗ ΣΚΑΝΔΑΛΙΣΘΗΙ ΕΝ ΕΜΟΙ
7,24,ΑΠΕΛΘΟΝΤΩΝ ΔΕ ΤΩΝ ΑΓΓΕΛΩΝ ΙΩΑΝΝΟΥ ΗΡΞΑΤΟ ΛΕΓΕΙΝ ΠΡΟΣ ΤΟΥΣ ΟΧΛΟΥΣ ΠΕΡΙ ΙΩΑΝΝΟΥ ΤΙ ΕΞΗΛΘΑΤΕ ΕΙΣ ΤΗΝ ΕΡΗΜΟΝ ΘΕΑΣΑΣΘΑΙ ΚΑΛΑΜΟΝ ΥΠΟ ΑΝΕΜΟΥ ΣΑΛΕΥΟΜΕΝΟΝ
7,25,ΑΛΛΑ ΤΙ ΕΞΗΛΘΑΤΕ ΙΔΕΙΝ ΑΝΘΡΩΠΟΝ ΕΝ ΜΑΛΑΚΟΙΣ ΙΜΑΤΙΟΙΣ ΗΜΦΙΕΣΜΕΝΟΝ ΙΔΟΥ ΟΙ ΕΝ ΙΜΑΤΙΣΜΩΙ ΕΝΔΟΞΩΙ ΚΑΙ ΤΡΥΦΗΙ ΥΠΑΡΧΟΝΤΕΣ ΕΝ ΤΟΙΣ ΒΑΣΙΛΕΙΟΙΣ ΕΙΣΙΝ
7,26,ΑΛΛΑ ΤΙ ΕΞΗΛΘΑΤΕ ΙΔΕΙΝ ΠΡΟΦΗΤΗΝ ΝΑΙ ΛΕΓΩ ΥΜΙΝ ΚΑΙ ΠΕΡΙΣΣΟΤΕΡΟΝ ΠΡΟΦΗΤΟΥ
7,27,ΟΥΤΟΣ ΕΣΤΙΝ ΠΕΡΙ ΟΥ ΓΕΓΡΑΠΤΑΙ ΙΔΟΥ ΑΠΟΣΤΕΛΛΩ ΤΟΝ ΑΓΓΕΛΟΝ ΜΟΥ ΠΡΟ ΠΡΟΣΩΠΟΥ ΣΟΥ ΟΣ ΚΑΤΑΣΚΕΥΑΣΕΙ ΤΗΝ ΟΔΟΝ ΣΟΥ ΕΜΠΡΟΣΘΕΝ ΣΟΥ
7,28,ΛΕΓΩ ΥΜΙΝ ΜΕΙΖΩΝ ΕΝ ΓΕΝΝΗΤΟΙΣ ΓΥΝΑΙΚΩΝ ΙΩΑΝΝΟΥ ΟΥΔΕΙΣ ΕΣΤΙΝ Ο ΔΕ ΜΙΚΡΟΤΕΡΟΣ ΕΝ ΤΗΙ ΒΑΣΙΛΕΙΑΙ ΤΟΥ ΘΕΟΥ ΜΕΙΖΩΝ ΑΥΤΟΥ ΕΣΤΙΝ
7,29,ΚΑΙ ΠΑΣ Ο ΛΑΟΣ ΑΚΟΥΣΑΣ ΚΑΙ ΟΙ ΤΕΛΩΝΑΙ ΕΔΙΚΑΙΩΣΑΝ ΤΟΝ ΘΕΟΝ ΒΑΠΤΙΣΘΕΝΤΕΣ ΤΟ ΒΑΠΤΙΣΜΑ ΙΩΑΝΝΟΥ
7,30,ΟΙ ΔΕ ΦΑΡΙΣΑΙΟΙ ΚΑΙ ΟΙ ΝΟΜΙΚΟΙ ΤΗΝ ΒΟΥΛΗΝ ΤΟΥ ΘΕΟΥ ΗΘΕΤΗΣΑΝ ΕΙΣ ΕΑΥΤΟΥΣ ΜΗ ΒΑΠΤΙΣΘΕΝΤΕΣ ΥΠΟ ΑΥΤΟΥ
7,31,ΤΙΝΙ ΟΥΝ ΟΜΟΙΩΣΩ ΤΟΥΣ ΑΝΘΡΩΠΟΥΣ ΤΗΣ ΓΕΝΕΑΣ ΤΑΥΤΗΣ ΚΑΙ ΤΙΝΙ ΕΙΣΙΝ ΟΜΟΙΟΙ
7,32,ΟΜΟΙΟΙ ΕΙΣΙΝ ΠΑΙΔΙΟΙΣ ΤΟΙΣ ΕΝ ΑΓΟΡΑΙ ΚΑΘΗΜΕΝΟΙΣ ΚΑΙ ΠΡΟΣΦΩΝΟΥΣΙΝ ΑΛΛΗΛΟΙΣ Α ΛΕΓΕΙ ΗΥΛΗΣΑΜΕΝ ΥΜΙΝ ΚΑΙ ΟΥΚ ΩΡΧΗΣΑΣΘΕ ΕΘΡΗΝΗΣΑΜΕΝ ΚΑΙ ΟΥΚ ΕΚΛΑΥΣΑΤΕ
7,33,ΕΛΗΛΥΘΕΝ ΓΑΡ ΙΩΑΝΝΗΣ Ο ΒΑΠΤΙΣΤΗΣ ΜΗ ΕΣΘΙΩΝ ΑΡΤΟΝ ΜΗΤΕ ΠΙΝΩΝ ΟΙΝΟΝ ΚΑΙ ΛΕΓΕΤΕ ΔΑΙΜΟΝΙΟΝ ΕΧΕΙ
7,34,ΕΛΗΛΥΘΕΝ Ο ΥΙΟΣ ΤΟΥ ΑΝΘΡΩΠΟΥ ΕΣΘΙΩΝ ΚΑΙ ΠΙΝΩΝ ΚΑΙ ΛΕΓΕΤΕ ΙΔΟΥ ΑΝΘΡΩΠΟΣ ΦΑΓΟΣ ΚΑΙ ΟΙΝΟΠΟΤΗΣ ΦΙΛΟΣ ΤΕΛΩΝΩΝ ΚΑΙ ΑΜΑΡΤΩΛΩΝ
7,35,ΚΑΙ ΕΔΙΚΑΙΩΘΗ Η ΣΟΦΙΑ ΑΠΟ ΠΑΝΤΩΝ ΤΩΝ ΤΕΚΝΩΝ ΑΥΤΗΣ
7,36,ΗΡΩΤΑ ΔΕ ΤΙΣ ΑΥΤΟΝ ΤΩΝ ΦΑΡΙΣΑΙΩΝ ΙΝΑ ΦΑΓΗΙ ΜΕΤΑ ΑΥΤΟΥ ΚΑΙ ΕΙΣΕΛΘΩΝ ΕΙΣ ΤΟΝ ΟΙΚΟΝ ΤΟΥ ΦΑΡΙΣΑΙΟΥ ΚΑΤΕΚΛΙΘΗ
7,37,ΚΑΙ ΙΔΟΥ ΓΥΝΗ ΗΤΙΣ ΗΝ ΕΝ ΤΗΙ ΠΟΛΕΙ ΑΜΑΡΤΩΛΟΣ ΚΑΙ ΕΠΙΓΝΟΥΣΑ ΟΤΙ ΚΑΤΑΚΕΙΤΑΙ ΕΝ ΤΗΙ ΟΙΚΙΑΙ ΤΟΥ ΦΑΡΙΣΑΙΟΥ ΚΟΜΙΣΑΣΑ ΑΛΑΒΑΣΤΡΟΝ ΜΥΡΟΥ
7,38,ΚΑΙ ΣΤΑΣΑ ΟΠΙΣΩ ΠΑΡΑ ΤΟΥΣ ΠΟΔΑΣ ΑΥΤΟΥ ΚΛΑΙΟΥΣΑ ΤΟΙΣ ΔΑΚΡΥΣΙΝ ΗΡΞΑΤΟ ΒΡΕΧΕΙΝ ΤΟΥΣ ΠΟΔΑΣ ΑΥΤΟΥ ΚΑΙ ΤΑΙΣ ΘΡΙΞΙΝ ΤΗΣ ΚΕΦΑΛΗΣ ΑΥΤΗΣ ΕΞΕΜΑΣΣΕΝ ΚΑΙ ΚΑΤΕΦΙΛΕΙ ΤΟΥΣ ΠΟΔΑΣ ΑΥΤΟΥ ΚΑΙ ΗΛΕΙΦΕΝ ΤΩΙ ΜΥΡΩΙ
7,39,ΙΔΩΝ ΔΕ Ο ΦΑΡΙΣΑΙΟΣ Ο ΚΑΛΕΣΑΣ ΑΥΤΟΝ ΕΙΠΕΝ ΕΝ ΕΑΥΤΩΙ ΛΕΓΩΝ ΟΥΤΟΣ ΕΙ ΗΝ ΠΡΟΦΗΤΗΣ ΕΓΙΝΩΣΚΕΝ ΑΝ ΤΙΣ ΚΑΙ ΠΟΤΑΠΗ Η ΓΥΝΗ ΗΤΙΣ ΑΠΤΕΤΑΙ ΑΥΤΟΥ ΟΤΙ ΑΜΑΡΤΩΛΟΣ ΕΣΤΙΝ
7,40,ΚΑΙ ΑΠΟΚΡΙΘΕΙΣ Ο ΙΗΣΟΥΣ ΕΙΠΕΝ ΠΡΟΣ ΑΥΤΟΝ ΣΙΜΩΝ ΕΧΩ ΣΟΙ ΤΙ ΕΙΠΕΙΝ Ο ΔΕ ΔΙΔΑΣΚΑΛΕ ΕΙΠΕ ΦΗΣΙΝ
7,41,ΔΥΟ ΧΡΕΟΦΙΛΕΤΑΙ ΗΣΑΝ ΔΑΝΙΣΤΗΙ ΤΙΝΙ Ο ΕΙΣ ΩΦΕΙΛΕΝ ΔΗΝΑΡΙΑ ΠΕΝΤΑΚΟΣΙΑ Ο ΔΕ ΕΤΕΡΟΣ ΠΕΝΤΗΚΟΝΤΑ
7,42,ΜΗ ΕΧΟΝΤΩΝ ΑΥΤΩΝ ΑΠΟΔΟΥΝΑΙ ΑΜΦΟΤΕΡΟΙΣ ΕΧΑΡΙΣΑΤΟ ΤΙΣ ΟΥΝ ΑΥΤΩΝ ΠΛΕΙΟΝ ΑΓΑΠΗΣΕΙ ΑΥΤΟΝ
7,43,ΑΠΟΚΡΙΘΕΙΣ ΣΙΜΩΝ ΕΙΠΕΝ ΥΠΟΛΑΜΒΑΝΩ ΟΤΙ ΩΙ ΤΟ ΠΛΕΙΟΝ ΕΧΑΡΙΣΑΤΟ Ο ΔΕ ΕΙΠΕΝ ΑΥΤΩΙ ΟΡΘΩΣ ΕΚΡΙΝΑΣ
7,44,ΚΑΙ ΣΤΡΑΦΕΙΣ ΠΡΟΣ ΤΗΝ ΓΥΝΑΙΚΑ ΤΩΙ ΣΙΜΩΝΙ ΕΦΗ ΒΛΕΠΕΙΣ ΤΑΥΤΗΝ ΤΗΝ ΓΥΝΑΙΚΑ ΕΙΣΗΛΘΟΝ ΣΟΥ ΕΙΣ ΤΗΝ ΟΙΚΙΑΝ ΥΔΩΡ ΜΟΙ ΕΠΙ ΠΟΔΑΣ ΟΥΚ ΕΔΩΚΑΣ ΑΥΤΗ ΔΕ ΤΟΙΣ ΔΑΚΡΥΣΙΝ ΕΒΡΕΞΕΝ ΜΟΥ ΤΟΥΣ ΠΟΔΑΣ ΚΑΙ ΤΑΙΣ ΘΡΙΞΙΝ ΑΥΤΗΣ ΕΞΕΜΑΞΕΝ
7,45,ΦΙΛΗΜΑ ΜΟΙ ΟΥΚ ΕΔΩΚΑΣ ΑΥΤΗ ΔΕ ΑΠΟ ΗΣ ΕΙΣΗΛΘΟΝ ΟΥ ΔΙΕΛΙΠΕΝ ΚΑΤΑΦΙΛΟΥΣΑ ΜΟΥ ΤΟΥΣ ΠΟΔΑΣ
7,46,ΕΛΑΙΩΙ ΤΗΝ ΚΕΦΑΛΗΝ ΜΟΥ ΟΥΚ ΗΛΕΙΨΑΣ ΑΥΤΗ ΔΕ ΜΥΡΩΙ ΗΛΕΙΨΕΝ ΤΟΥΣ ΠΟΔΑΣ ΜΟΥ
7,47,ΟΥ ΧΑΡΙΝ ΛΕΓΩ ΣΟΙ ΑΦΕΩΝΤΑΙ ΑΙ ΑΜΑΡΤΙΑΙ ΑΥΤΗΣ ΑΙ ΠΟΛΛΑΙ ΟΤΙ ΗΓΑΠΗΣΕΝ ΠΟΛΥ ΩΙ ΔΕ ΟΛΙΓΟΝ ΑΦΙΕΤΑΙ ΟΛΙΓΟΝ ΑΓΑΠΑΙ
7,48,ΕΙΠΕΝ ΔΕ ΑΥΤΗΙ ΑΦΕΩΝΤΑΙ ΣΟΥ ΑΙ ΑΜΑΡΤΙΑΙ
7,49,ΚΑΙ ΗΡΞΑΝΤΟ ΟΙ ΣΥΝΑΝΑΚΕΙΜΕΝΟΙ ΛΕΓΕΙΝ ΕΝ ΕΑΥΤΟΙΣ ΤΙΣ ΟΥΤΟΣ ΕΣΤΙΝ ΟΣ ΚΑΙ ΑΜΑΡΤΙΑΣ ΑΦΙΗΣΙΝ
7,50,ΕΙΠΕΝ ΔΕ ΠΡΟΣ ΤΗΝ ΓΥΝΑΙΚΑ Η ΠΙΣΤΙΣ ΣΟΥ ΣΕΣΩΚΕΝ ΣΕ ΠΟΡΕΥΟΥ ΕΙΣ ΕΙΡΗΝΗΝ
8,1,ΚΑΙ ΕΓΕΝΕΤΟ ΕΝ ΤΩΙ ΚΑΘΕΞΗΣ ΚΑΙ ΑΥΤΟΣ ΔΙΩΔΕΥΕΝ ΚΑΤΑ ΠΟΛΙΝ ΚΑΙ ΚΩΜΗΝ ΚΗΡΥΣΣΩΝ ΚΑΙ ΕΥΑΓΓΕΛΙΖΟΜΕΝΟΣ ΤΗΝ ΒΑΣΙΛΕΙΑΝ ΤΟΥ ΘΕΟΥ ΚΑΙ ΟΙ ΔΩΔΕΚΑ ΣΥΝ ΑΥΤΩΙ
8,2,ΚΑΙ ΓΥΝΑΙΚΕΣ ΤΙΝΕΣ ΑΙ ΗΣΑΝ ΤΕΘΕΡΑΠΕΥΜΕΝΑΙ ΑΠΟ ΠΝΕΥΜΑΤΩΝ ΠΟΝΗΡΩΝ ΚΑΙ ΑΣΘΕΝΕΙΩΝ ΜΑΡΙΑ Η ΚΑΛΟΥΜΕΝΗ ΜΑΓΔΑΛΗΝΗ ΑΠΟ ΗΣ ΔΑΙΜΟΝΙΑ ΕΠΤΑ ΕΞΕΛΗΛΥΘΕΙ
8,3,ΚΑΙ ΙΩΑΝΝΑ ΓΥΝΗ ΧΟΥΖΑ ΕΠΙΤΡΟΠΟΥ ΗΡΩΙΔΟΥ ΚΑΙ ΣΟΥΣΑΝΝΑ ΚΑΙ ΕΤΕΡΑΙ ΠΟΛΛΑΙ ΑΙΤΙΝΕΣ ΔΙΗΚΟΝΟΥΝ ΑΥΤΟΙΣ ΕΚ ΤΩΝ ΥΠΑΡΧΟΝΤΩΝ ΑΥΤΑΙΣ
8,4,ΣΥΝΙΟΝΤΟΣ ΔΕ ΟΧΛΟΥ ΠΟΛΛΟΥ ΚΑΙ ΤΩΝ ΚΑΤΑ ΠΟΛΙΝ ΕΠΙΠΟΡΕΥΟΜΕΝΩΝ ΠΡΟΣ ΑΥΤΟΝ ΕΙΠΕΝ ΔΙΑ ΠΑΡΑΒΟΛΗΣ
8,5,ΕΞΗΛΘΕΝ Ο ΣΠΕΙΡΩΝ ΤΟΥ ΣΠΕΙΡΑΙ ΤΟΝ ΣΠΟΡΟΝ ΑΥΤΟΥ ΚΑΙ ΕΝ ΤΩΙ ΣΠΕΙΡΕΙΝ ΑΥΤΟΝ Ο ΜΕΝ ΕΠΕΣΕΝ ΠΑΡΑ ΤΗΝ ΟΔΟΝ ΚΑΙ ΚΑΤΕΠΑΤΗΘΗ ΚΑΙ ΤΑ ΠΕΤΕΙΝΑ ΤΟΥ ΟΥΡΑΝΟΥ ΚΑΤΕΦΑΓΕΝ ΑΥΤΟ
8,6,ΚΑΙ ΕΤΕΡΟΝ ΚΑΤΕΠΕΣΕΝ ΕΠΙ ΤΗΝ ΠΕΤΡΑΝ ΚΑΙ ΦΥΕΝ ΕΞΗΡΑΝΘΗ ΔΙΑ ΤΟ ΜΗ ΕΧΕΙΝ ΙΚΜΑΔΑ
8,7,ΚΑΙ ΕΤΕΡΟΝ ΕΠΕΣΕΝ ΕΝ ΜΕΣΩΙ ΤΩΝ ΑΚΑΝΘΩΝ ΚΑΙ ΣΥΝΦΥΕΙΣΑΙ ΑΙ ΑΚΑΝΘΑΙ ΑΠΕΠΝΙΞΑΝ ΑΥΤΟ
8,8,ΚΑΙ ΕΤΕΡΟΝ ΕΠΕΣΕΝ ΕΙΣ ΤΗΝ ΓΗΝ ΤΗΝ ΑΓΑΘΗΝ ΚΑΙ ΦΥΕΝ ΕΠΟΙΗΣΕΝ ΚΑΡΠΟΝ ΕΚΑΤΟΝΤΑΠΛΑΣΙΟΝΑ ΤΑΥΤΑ ΛΕΓΩΝ ΕΦΩΝΕΙ Ο ΕΧΩΝ ΩΤΑ ΑΚΟΥΕΙΝ ΑΚΟΥΕΤΩ
8,9,ΕΠΗΡΩΤΩΝ ΔΕ ΑΥΤΟΝ ΟΙ ΜΑΘΗΤΑΙ ΑΥΤΟΥ ΤΙΣ ΑΥΤΗ ΕΙΗ Η ΠΑΡΑΒΟΛΗ
8,10,Ο ΔΕ ΕΙΠΕΝ ΥΜΙΝ ΔΕΔΟΤΑΙ ΓΝΩΝΑΙ ΤΑ ΜΥΣΤΗΡΙΑ ΤΗΣ ΒΑΣΙΛΕΙΑΣ ΤΟΥ ΘΕΟΥ ΤΟΙΣ ΔΕ ΛΟΙΠΟΙΣ ΕΝ ΠΑΡΑΒΟΛΑΙΣ ΙΝΑ ΒΛΕΠΟΝΤΕΣ ΜΗ ΒΛΕΠΩΣΙΝ ΚΑΙ ΑΚΟΥΟΝΤΕΣ ΜΗ ΣΥΝΙΩΣΙΝ
8,11,ΕΣΤΙΝ ΔΕ ΑΥΤΗ Η ΠΑΡΑΒΟΛΗ Ο ΣΠΟΡΟΣ ΕΣΤΙΝ Ο ΛΟΓΟΣ ΤΟΥ ΘΕΟΥ
8,12,ΟΙ ΔΕ ΠΑΡΑ ΤΗΝ ΟΔΟΝ ΕΙΣΙΝ ΟΙ ΑΚΟΥΣΑΝΤΕΣ ΕΙΤΑ ΕΡΧΕΤΑΙ Ο ΔΙΑΒΟΛΟΣ ΚΑΙ ΑΙΡΕΙ ΤΟΝ ΛΟΓΟΝ ΑΠΟ ΤΗΣ ΚΑΡΔΙΑΣ ΑΥΤΩΝ ΙΝΑ ΜΗ ΠΙΣΤΕΥΣΑΝΤΕΣ ΣΩΘΩΣΙΝ
8,13,ΟΙ ΔΕ ΕΠΙ ΤΗΣ ΠΕΤΡΑΣ ΟΙ ΟΤΑΝ ΑΚΟΥΣΩΣΙΝ ΜΕΤΑ ΧΑΡΑΣ ΔΕΧΟΝΤΑΙ ΤΟΝ ΛΟΓΟΝ ΚΑΙ ΟΥΤΟΙ ΡΙΖΑΝ ΟΥΚ ΕΧΟΥΣΙΝ ΟΙ ΠΡΟΣ ΚΑΙΡΟΝ ΠΙΣΤΕΥΟΥΣΙΝ ΚΑΙ ΕΝ ΚΑΙΡΩΙ ΠΕΙΡΑΣΜΟΥ ΑΦΙΣΤΑΝΤΑΙ
8,14,ΤΟ ΔΕ ΕΙΣ ΤΑΣ ΑΚΑΝΘΑΣ ΠΕΣΟΝ ΟΥΤΟΙ ΕΙΣΙΝ ΟΙ ΑΚΟΥΣΑΝΤΕΣ ΚΑΙ ΥΠΟ ΜΕΡΙΜΝΩΝ ΚΑΙ ΠΛΟΥΤΟΥ ΚΑΙ ΗΔΟΝΩΝ ΤΟΥ ΒΙΟΥ ΠΟΡΕΥΟΜΕΝΟΙ ΣΥΝΠΝΙΓΟΝΤΑΙ ΚΑΙ ΟΥ ΤΕΛΕΣΦΟΡΟΥΣΙΝ
8,15,ΤΟ ΔΕ ΕΝ ΤΗΙ ΚΑΛΗΙ ΓΗΙ ΟΥΤΟΙ ΕΙΣΙΝ ΟΙΤΙΝΕΣ ΕΝ ΚΑΡΔΙΑΙ ΚΑΛΗΙ ΚΑΙ ΑΓΑΘΗΙ ΑΚΟΥΣΑΝΤΕΣ ΤΟΝ ΛΟΓΟΝ ΚΑΤΕΧΟΥΣΙΝ ΚΑΙ ΚΑΡΠΟΦΟΡΟΥΣΙΝ ΕΝ ΥΠΟΜΟΝΗΙ
8,16,ΟΥΔΕΙΣ ΔΕ ΛΥΧΝΟΝ ΑΨΑΣ ΚΑΛΥΠΤΕΙ ΑΥΤΟΝ ΣΚΕΥΕΙ Η ΥΠΟΚΑΤΩ ΚΛΙΝΗΣ ΤΙΘΗΣΙΝ ΑΛΛΑ ΕΠΙ ΛΥΧΝΙΑΣ ΤΙΘΗΣΙΝ ΙΝΑ ΟΙ ΕΙΣΠΟΡΕΥΟΜΕΝΟΙ ΒΛΕΠΩΣΙΝ ΤΟ ΦΩΣ
8,17,ΟΥ ΓΑΡ ΕΣΤΙΝ ΚΡΥΠΤΟΝ Ο ΟΥ ΦΑΝΕΡΟΝ ΓΕΝΗΣΕΤΑΙ ΟΥΔΕ ΑΠΟΚΡΥΦΟΝ Ο ΟΥ ΜΗ ΓΝΩΣΘΗΙ ΚΑΙ ΕΙΣ ΦΑΝΕΡΟΝ ΕΛΘΗΙ
8,18,ΒΛΕΠΕΤΕ ΟΥΝ ΠΩΣ ΑΚΟΥΕΤΕ ΟΣ ΑΝ ΓΑΡ ΕΧΗΙ ΔΟΘΗΣΕΤΑΙ ΑΥΤΩΙ ΚΑΙ ΟΣ ΑΝ ΜΗ ΕΧΗΙ ΚΑΙ Ο ΔΟΚΕΙ ΕΧΕΙΝ ΑΡΘΗΣΕΤΑΙ ΑΠΟ ΑΥΤΟΥ
8,19,ΠΑΡΕΓΕΝΕΤΟ ΔΕ ΠΡΟΣ ΑΥΤΟΝ Η ΜΗΤΗΡ ΚΑΙ ΟΙ ΑΔΕΛΦΟΙ ΑΥΤΟΥ ΚΑΙ ΟΥΚ ΗΔΥΝΑΝΤΟ ΣΥΝΤΥΧΕΙΝ ΑΥΤΩΙ ΔΙΑ ΤΟΝ ΟΧΛΟΝ
8,20,ΑΠΗΓΓΕΛΗ ΔΕ ΑΥΤΩΙ Η ΜΗΤΗΡ ΣΟΥ ΚΑΙ ΟΙ ΑΔΕΛΦΟΙ ΣΟΥ ΕΣΤΗΚΑΣΙΝ ΕΞΩ ΙΔΕΙΝ ΘΕΛΟΝΤΕΣ ΣΕ
8,21,Ο ΔΕ ΑΠΟΚΡΙΘΕΙΣ ΕΙΠΕΝ ΠΡΟΣ ΑΥΤΟΥΣ ΜΗΤΗΡ ΜΟΥ ΚΑΙ ΑΔΕΛΦΟΙ ΜΟΥ ΟΥΤΟΙ ΕΙΣΙΝ ΟΙ ΤΟΝ ΛΟΓΟΝ ΤΟΥ ΘΕΟΥ ΑΚΟΥΟΝΤΕΣ ΚΑΙ ΠΟΙΟΥΝΤΕΣ
8,22,ΕΓΕΝΕΤΟ ΔΕ ΕΝ ΜΙΑΙ ΤΩΝ ΗΜΕΡΩΝ ΚΑΙ ΑΥΤΟΣ ΕΝΕΒΗ ΕΙΣ ΠΛΟΙΟΝ ΚΑΙ ΟΙ ΜΑΘΗΤΑΙ ΑΥΤΟΥ ΚΑΙ ΕΙΠΕΝ ΠΡΟΣ ΑΥΤΟΥΣ ΔΙΕΛΘΩΜΕΝ ΕΙΣ ΤΟ ΠΕΡΑΝ ΤΗΣ ΛΙΜΝΗΣ ΚΑΙ ΑΝΗΧΘΗΣΑΝ
8,23,ΠΛΕΟΝΤΩΝ ΔΕ ΑΥΤΩΝ ΑΦΥΠΝΩΣΕΝ ΚΑΙ ΚΑΤΕΒΗ ΛΑΙΛΑΨ ΑΝΕΜΟΥ ΕΙΣ ΤΗΝ ΛΙΜΝΗΝ ΚΑΙ ΣΥΝΕΠΛΗΡΟΥΝΤΟ ΚΑΙ ΕΚΙΝΔΥΝΕΥΟΝ
8,24,ΠΡΟΣΕΛΘΟΝΤΕΣ ΔΕ ΔΙΗΓΕΙΡΑΝ ΑΥΤΟΝ ΛΕΓΟΝΤΕΣ ΕΠΙΣΤΑΤΑ ΕΠΙΣΤΑΤΑ ΑΠΟΛΛΥΜΕΘΑ Ο ΔΕ ΔΙΕΓΕΡΘΕΙΣ ΕΠΕΤΙΜΗΣΕΝ ΤΩΙ ΑΝΕΜΩΙ ΚΑΙ ΤΩΙ ΚΛΥΔΩΝΙ ΤΟΥ ΥΔΑΤΟΣ ΚΑΙ ΕΠΑΥΣΑΝΤΟ ΚΑΙ ΕΓΕΝΕΤΟ ΓΑΛΗΝΗ
8,25,ΕΙΠΕΝ ΔΕ ΑΥΤΟΙΣ ΠΟΥ Η ΠΙΣΤΙΣ ΥΜΩΝ ΦΟΒΗΘΕΝΤΕΣ ΔΕ ΕΘΑΥΜΑΣΑΝ ΛΕΓΟΝΤΕΣ ΠΡΟΣ ΑΛΛΗΛΟΥΣ ΤΙΣ ΑΡΑ ΟΥΤΟΣ ΕΣΤΙΝ ΟΤΙ ΚΑΙ ΤΟΙΣ ΑΝΕΜΟΙΣ ΕΠΙΤΑΣΣΕΙ ΚΑΙ ΤΩΙ ΥΔΑΤΙ ΚΑΙ ΥΠΑΚΟΥΟΥΣΙΝ ΑΥΤΩΙ
8,26,ΚΑΙ ΚΑΤΕΠΛΕΥΣΑΝ ΕΙΣ ΤΗΝ ΧΩΡΑΝ ΤΩΝ ΓΕΡΑΣΗΝΩΝ ΗΤΙΣ ΕΣΤΙΝ ΑΝΤΙΠΕΡΑ ΤΗΣ ΓΑΛΙΛΑΙΑΣ
8,27,ΕΞΕΛΘΟΝΤΙ ΔΕ ΑΥΤΩΙ ΕΠΙ ΤΗΝ ΓΗΝ ΥΠΗΝΤΗΣΕΝ ΑΝΗΡ ΤΙΣ ΕΚ ΤΗΣ ΠΟΛΕΩΣ ΕΧΩΝ ΔΑΙΜΟΝΙΑ ΚΑΙ ΧΡΟΝΩΙ ΙΚΑΝΩΙ ΟΥΚ ΕΝΕΔΥΣΑΤΟ ΙΜΑΤΙΟΝ ΚΑΙ ΕΝ ΟΙΚΙΑΙ ΟΥΚ ΕΜΕΝΕΝ ΑΛΛΑ ΕΝ ΤΟΙΣ ΜΝΗΜΑΣΙΝ
8,28,ΙΔΩΝ ΔΕ ΤΟΝ ΙΗΣΟΥΝ ΑΝΑΚΡΑΞΑΣ ΠΡΟΣΕΠΕΣΕΝ ΑΥΤΩΙ ΚΑΙ ΦΩΝΗΙ ΜΕΓΑΛΗΙ ΕΙΠΕΝ ΤΙ ΕΜΟΙ ΚΑΙ ΣΟΙ ΙΗΣΟΥ ΥΙΕ ΤΟΥ ΘΕΟΥ ΤΟΥ ΥΨΙΣΤΟΥ ΔΕΟΜΑΙ ΣΟΥ ΜΗ ΜΕ ΒΑΣΑΝΙΣΗΙΣ
8,29,ΠΑΡΗΓΓΕΙΛΕΝ ΓΑΡ ΤΩΙ ΠΝΕΥΜΑΤΙ ΤΩΙ ΑΚΑΘΑΡΤΩΙ ΕΞΕΛΘΕΙΝ ΑΠΟ ΤΟΥ ΑΝΘΡΩΠΟΥ ΠΟΛΛΟΙΣ ΓΑΡ ΧΡΟΝΟΙΣ ΣΥΝΗΡΠΑΚΕΙ ΑΥΤΟΝ ΚΑΙ ΕΔΕΣΜΕΥΕΤΟ ΑΛΥΣΕΣΙΝ ΚΑΙ ΠΕΔΑΙΣ ΦΥΛΑΣΣΟΜΕΝΟΣ ΚΑΙ ΔΙΑΡΗΣΣΩΝ ΤΑ ΔΕΣΜΑ ΗΛΑΥΝΕΤΟ ΥΠΟ ΤΟΥ ΔΑΙΜΟΝΙΟΥ ΕΙΣ ΤΑΣ ΕΡΗΜΟΥΣ
8,30,ΕΠΗΡΩΤΗΣΕΝ ΔΕ ΑΥΤΟΝ Ο ΙΗΣΟΥΣ ΤΙ ΣΟΙ ΟΝΟΜΑ ΕΣΤΙΝ Ο ΔΕ ΕΙΠΕΝ ΛΕΓΕΩΝ ΟΤΙ ΕΙΣΗΛΘΕΝ ΔΑΙΜΟΝΙΑ ΠΟΛΛΑ ΕΙΣ ΑΥΤΟΝ
8,31,ΚΑΙ ΠΑΡΕΚΑΛΟΥΝ ΑΥΤΟΝ ΙΝΑ ΜΗ ΕΠΙΤΑΞΗΙ ΑΥΤΟΙΣ ΕΙΣ ΤΗΝ ΑΒΥΣΣΟΝ ΑΠΕΛΘΕΙΝ
8,32,ΗΝ ΔΕ ΕΚΕΙ ΑΓΕΛΗ ΧΟΙΡΩΝ ΙΚΑΝΩΝ ΒΟΣΚΟΜΕΝΗ ΕΝ ΤΩΙ ΟΡΕΙ ΚΑΙ ΠΑΡΕΚΑΛΕΣΑΝ ΑΥΤΟΝ ΙΝΑ ΕΠΙΤΡΕΨΗΙ ΑΥΤΟΙΣ ΕΙΣ ΕΚΕΙΝΟΥΣ ΕΙΣΕΛΘΕΙΝ ΚΑΙ ΕΠΕΤΡΕΨΕΝ ΑΥΤΟΙΣ
8,33,ΕΞΕΛΘΟΝΤΑ ΔΕ ΤΑ ΔΑΙΜΟΝΙΑ ΑΠΟ ΤΟΥ ΑΝΘΡΩΠΟΥ ΕΙΣΗΛΘΟΝ ΕΙΣ ΤΟΥΣ ΧΟΙΡΟΥΣ ΚΑΙ ΩΡΜΗΣΕΝ Η ΑΓΕΛΗ ΚΑΤΑ ΤΟΥ ΚΡΗΜΝΟΥ ΕΙΣ ΤΗΝ ΛΙΜΝΗΝ ΚΑΙ ΑΠΕΠΝΙΓΗ
8,34,ΙΔΟΝΤΕΣ ΔΕ ΟΙ ΒΟΣΚΟΝΤΕΣ ΤΟ ΓΕΓΟΝΟΣ ΕΦΥΓΟΝ ΚΑΙ ΑΠΗΓΓΕΙΛΑΝ ΕΙΣ ΤΗΝ ΠΟΛΙΝ ΚΑΙ ΕΙΣ ΤΟΥΣ ΑΓΡΟΥΣ
8,35,ΕΞΗΛΘΟΝ ΔΕ ΙΔΕΙΝ ΤΟ ΓΕΓΟΝΟΣ ΚΑΙ ΗΛΘΑΝ ΠΡΟΣ ΤΟΝ ΙΗΣΟΥΝ ΚΑΙ ΕΥΡΑΝ ΚΑΘΗΜΕΝΟΝ ΤΟΝ ΑΝΘΡΩΠΟΝ ΑΠΟ ΟΥ ΤΑ ΔΑΙΜΟΝΙΑ ΕΞΗΛΘΕΝ ΙΜΑΤΙΣΜΕΝΟΝ ΚΑΙ ΣΩΦΡΟΝΟΥΝΤΑ ΠΑΡΑ ΤΟΥΣ ΠΟΔΑΣ ΤΟΥ ΙΗΣΟΥ ΚΑΙ ΕΦΟΒΗΘΗΣΑΝ
8,36,ΑΠΗΓΓΕΙΛΑΝ ΔΕ ΑΥΤΟΙΣ ΟΙ ΙΔΟΝΤΕΣ ΠΩΣ ΕΣΩΘΗ Ο ΔΑΙΜΟΝΙΣΘΕΙΣ
8,37,ΚΑΙ ΗΡΩΤΗΣΕΝ ΑΥΤΟΝ ΑΠΑΝ ΤΟ ΠΛΗΘΟΣ ΤΗΣ ΠΕΡΙΧΩΡΟΥ ΤΩΝ ΓΕΡΑΣΗΝΩΝ ΑΠΕΛΘΕΙΝ ΑΠΟ ΑΥΤΩΝ ΟΤΙ ΦΟΒΩΙ ΜΕΓΑΛΩΙ ΣΥΝΕΙΧΟΝΤΟ ΑΥΤΟΣ ΔΕ ΕΜΒΑΣ ΕΙΣ ΠΛΟΙΟΝ ΥΠΕΣΤΡΕΨΕΝ
8,38,ΕΔΕΙΤΟ ΔΕ ΑΥΤΟΥ Ο ΑΝΗΡ ΑΠΟ ΟΥ ΕΞΕΛΗΛΥΘΕΙ ΤΑ ΔΑΙΜΟΝΙΑ ΕΙΝΑΙ ΣΥΝ ΑΥΤΩΙ ΑΠΕΛΥΣΕΝ ΔΕ ΑΥΤΟΝ ΛΕΓΩΝ
8,39,ΥΠΟΣΤΡΕΦΕ ΕΙΣ ΤΟΝ ΟΙΚΟΝ ΣΟΥ ΚΑΙ ΔΙΗΓΟΥ ΟΣΑ ΣΟΙ ΕΠΟΙΗΣΕΝ Ο ΘΕΟΣ ΚΑΙ ΑΠΗΛΘΕΝ ΚΑΤΑ ΟΛΗΝ ΤΗΝ ΠΟΛΙΝ ΚΗΡΥΣΣΩΝ ΟΣΑ ΕΠΟΙΗΣΕΝ ΑΥΤΩΙ Ο ΙΗΣΟΥΣ
8,40,ΕΝ ΔΕ ΤΩΙ ΥΠΟΣΤΡΕΦΕΙΝ ΤΟΝ ΙΗΣΟΥΝ ΑΠΕΔΕΞΑΤΟ ΑΥΤΟΝ Ο ΟΧΛΟΣ ΗΣΑΝ ΓΑΡ ΠΑΝΤΕΣ ΠΡΟΣΔΟΚΩΝΤΕΣ ΑΥΤΟΝ
8,41,ΚΑΙ ΙΔΟΥ ΗΛΘΕΝ ΑΝΗΡ ΩΙ ΟΝΟΜΑ ΙΑΕΙΡΟΣ ΚΑΙ ΟΥΤΟΣ ΑΡΧΩΝ ΤΗΣ ΣΥΝΑΓΩΓΗΣ ΥΠΗΡΧΕΝ ΚΑΙ ΠΕΣΩΝ ΠΑΡΑ ΤΟΥΣ ΠΟΔΑΣ ΙΗΣΟΥ ΠΑΡΕΚΑΛΕΙ ΑΥΤΟΝ ΕΙΣΕΛΘΕΙΝ ΕΙΣ ΤΟΝ ΟΙΚΟΝ ΑΥΤΟΥ
8,42,ΟΤΙ ΘΥΓΑΤΗΡ ΜΟΝΟΓΕΝΗΣ ΗΝ ΑΥΤΩΙ ΩΣ ΕΤΩΝ ΔΩΔΕΚΑ ΚΑΙ ΑΥΤΗ ΑΠΕΘΝΗΙΣΚΕΝ ΕΝ ΔΕ ΤΩΙ ΥΠΑΓΕΙΝ ΑΥΤΟΝ ΟΙ ΟΧΛΟΙ ΣΥΝΕΠΝΙΓΟΝ ΑΥΤΟΝ
8,43,ΚΑΙ ΓΥΝΗ ΟΥΣΑ ΕΝ ΡΥΣΕΙ ΑΙΜΑΤΟΣ ΑΠΟ ΕΤΩΝ ΔΩΔΕΚΑ ΗΤΙΣ ΙΑΤΡΟΙΣ ΠΡΟΣΑΝΑΛΩΣΑΣΑ ΟΛΟΝ ΤΟΝ ΒΙΟΝ ΟΥΚ ΙΣΧΥΣΕΝ ΑΠΟ ΟΥΔΕΝΟΣ ΘΕΡΑΠΕΥΘΗΝΑΙ
8,44,ΠΡΟΣΕΛΘΟΥΣΑ ΟΠΙΣΘΕΝ ΗΨΑΤΟ ΤΟΥ ΚΡΑΣΠΕΔΟΥ ΤΟΥ ΙΜΑΤΙΟΥ ΑΥΤΟΥ ΚΑΙ ΠΑΡΑΧΡΗΜΑ ΕΣΤΗ Η ΡΥΣΙΣ ΤΟΥ ΑΙΜΑΤΟΣ ΑΥΤΗΣ
