chapter,verse,text
11,11,ΤΙΝΑ ΔΕ ΕΞ ΥΜΩΝ ΤΟΝ ΠΑΤΕΡΑ ΑΙΤΗΣΕΙ Ο ΥΙΟΣ ΙΧΘΥΝ ΚΑΙ ΑΝΤΙ ΙΧΘΥΟΣ ΟΦΙΝ ΑΥΤΩΙ ΕΠΙΔΩΣΕΙ
11,12,Η ΚΑΙ ΑΙΤΗΣΕΙ ΩΙΟΝ ΕΠΙΔΩΣΕΙ ΑΥΤΩΙ ΣΚΟΡΠΙΟΝ
11,13,ΕΙ ΟΥΝ ΥΜΕΙΣ ΠΟΝΗΡΟΙ ΥΠΑΡΧΟΝΤΕΣ ΟΙΔΑΤΕ ΔΟΜΑΤΑ ΑΓΑΘΑ ΔΙΔΟΝΑΙ ΤΟΙΣ ΤΕΚΝΟΙΣ ΥΜΩΝ ΠΟΣΩΙ ΜΑΛΛΟΝ Ο ΠΑΤΗΡ Ο ΕΞ ΟΥΡΑΝΟΥ ΔΩΣΕΙ ΠΝΕΥΜΑ ΑΓΙΟΝ ΤΟΙΣ ΑΙΤΟΥΣΙΝ ΑΥΤΟΝ
11,14,ΚΑΙ ΗΝ ΕΚΒΑΛΛΩΝ ΔΑΙΜΟΝΙΟΝ ΚΩΦΟΝ ΕΓΕΝΕΤΟ ΔΕ ΤΟΥ ΔΑΙΜΟΝΙΟΥ ΕΞΕΛΘΟΝΤΟΣ ΕΛΑΛΗΣΕΝ Ο ΚΩΦΟΣ ΚΑΙ ΕΘΑΥΜΑΣΑΝ ΟΙ ΟΧΛΟΙ
11,15,ΤΙΝΕΣ ΔΕ ΕΞ ΑΥΤΩΝ ΕΙΠΟΝ ΕΝ ΒΕΕΛΖΕΒΟΥΛ ΤΩΙ ΑΡΧΟΝΤΙ ΤΩΝ ΔΑΙΜΟΝΙΩΝ ΕΚΒΑΛΛΕΙ ΤΑ ΔΑΙΜΟΝΙΑ
11,16,ΕΤΕΡΟΙ ΔΕ ΠΕΙΡΑΖΟΝΤΕΣ ΣΗΜΕΙΟΝ ΕΞ ΟΥΡΑΝΟΥ ΕΖΗΤΟΥΝ ΠΑΡΑ ΑΥΤΟΥ
11,17,ΑΥΤΟΣ ΔΕ ΕΙΔΩΣ ΑΥΤΩΝ ΤΑ ΔΙΑΝΟΗΜΑΤΑ ΕΙΠΕΝ ΑΥΤΟΙΣ ΠΑΣΑ ΒΑΣΙΛΕΙΑ ΕΠΙ ΕΑΥΤΗΝ ΔΙΑΜΕΡΙΣΘΕΙΣΑ ΕΡΗΜΟΥΤΑΙ ΚΑΙ ΟΙΚΟΣ ΕΠΙ ΟΙΚΟΝ ΠΙΠΤΕΙ
11,18,ΕΙ ΔΕ ΚΑΙ Ο ΣΑΤΑΝΑΣ ΕΠΙ ΕΑΥΤΟΝ ΔΙΕΜΕΡΙΣΘΗ ΠΩΣ ΣΤΑΘΗΣΕΤΑΙ Η ΒΑΣΙΛΕΙΑ ΑΥΤΟΥ ΟΤΙ ΛΕΓΕΤΕ ΕΝ ΒΕΕΛΖΕΒΟΥΛ ΕΚΒΑΛΛΕΙΝ ΜΕ ΤΑ ΔΑΙΜΟΝΙΑ
11,19,ΕΙ ΔΕ ΕΓΩ ΕΝ ΒΕΕΛΖΕΒΟΥΛ ΕΚΒΑΛΛΩ ΤΑ ΔΑΙΜΟΝΙΑ ΟΙ ΥΙΟΙ ΥΜΩΝ ΕΝ ΤΙΝΙ ΕΚΒΑΛΛΟΥΣΙΝ ΔΙΑ ΤΟΥΤΟ ΑΥΤΟΙ ΥΜΩΝ ΚΡΙΤΑΙ ΕΣΟΝΤΑΙ
11,20,ΕΙ ΔΕ ΕΝ ΔΑΚΤΥΛΩΙ ΘΕΟΥ ΕΓΩ ΕΚΒΑΛΛΩ ΤΑ ΔΑΙΜΟΝΙΑ ΑΡΑ ΕΦΘΑΣΕΝ ΕΠΙ ΥΜΑΣ Η ΒΑΣΙΛΕΙΑ ΤΟΥ ΘΕΟΥ
11,21,ΟΤΑΝ Ο ΙΣΧΥΡΟΣ ΚΑΘΩΠΛΙΣΜΕΝΟΣ ΦΥΛΑΣΣΗΙ ΤΗΝ ΕΑΥΤΟΥ ΑΥΛΗΝ ΕΝ ΕΙΡΗΝΗΙ ΕΣΤΙΝ ΤΑ ΥΠΑΡΧΟΝΤΑ ΑΥΤΟΥ
11,22,ΕΠΑΝ ΔΕ ΙΣΧΥΡΟΤΕΡΟΣ ΑΥΤΟΥ ΕΠΕΛΘΩΝ ΝΙΚΗΣΗΙ ΑΥΤΟΝ ΤΗΝ ΠΑΝΟΠΛΙΑΝ ΑΥΤΟΥ ΑΙΡΕΙ ΕΠΙ ΗΙ ΕΠΕΠΟΙΘΕΙ ΚΑΙ ΤΑ ΣΚΥΛΑ ΑΥΤΟΥ ΔΙΑΔΙΔΩΣΙΝ
11,23,Ο ΜΗ ΩΝ ΜΕΤΑ ΕΜΟΥ ΚΑΤΑ ΕΜΟΥ ΕΣΤΙΝ ΚΑΙ Ο ΜΗ ΣΥΝΑΓΩΝ ΜΕΤΑ ΕΜΟΥ ΣΚΟΡΠΙΖΕΙ
11,24,ΟΤΑΝ ΤΟ ΑΚΑΘΑΡΤΟΝ ΠΝΕΥΜΑ ΕΞΕΛΘΗΙ ΑΠΟ ΤΟΥ ΑΝΘΡΩΠΟΥ ΔΙΕΡΧΕΤΑΙ ΔΙΑ ΑΝΥΔΡΩΝ ΤΟΠΩΝ ΖΗΤΟΥΝ ΑΝΑΠΑΥΣΙΝ ΚΑΙ ΜΗ ΕΥΡΙΣΚΟΝ ΛΕΓΕΙ ΥΠΟΣΤΡΕΨΩ ΕΙΣ ΤΟΝ ΟΙΚΟΝ ΜΟΥ ΟΘΕΝ ΕΞΗΛΘΟΝ
11,25,ΚΑΙ ΕΛΘΟΝ ΕΥΡΙΣΚΕΙ ΣΕΣΑΡΩΜΕΝΟΝ ΚΑΙ ΚΕΚΟΣΜΗΜΕΝΟΝ
11,26,ΤΟΤΕ ΠΟΡΕΥΕΤΑΙ ΚΑΙ ΠΑΡΑΛΑΜΒΑΝΕΙ ΕΤΕΡΑ ΠΝΕΥΜΑΤΑ ΠΟΝΗΡΟΤΕΡΑ ΕΑΥΤΟΥ ΕΠΤΑ ΚΑΙ ΕΙΣΕΛΘΟΝΤΑ ΚΑΤΟΙΚΕΙ ΕΚΕΙ ΚΑΙ ΓΙΝΕΤΑΙ ΤΑ ΕΣΧΑΤΑ ΤΟΥ ΑΝΘΡΩΠΟΥ ΕΚΕΙΝΟΥ ΧΕΙΡΟΝΑ ΤΩΝ ΠΡΩΤΩΝ
11,27,ΕΓΕΝΕΤΟ ΔΕ ΕΝ ΤΩΙ ΛΕΓΕΙΝ ΑΥΤΟΝ ΤΑΥΤΑ ΕΠΑΡΑΣΑ ΤΙΣ ΦΩΝΗΝ ΓΥΝΗ ΕΚ ΤΟΥ ΟΧΛΟΥ ΕΙΠΕΝ ΑΥΤΩΙ ΜΑΚΑΡΙΑ Η ΚΟΙΛΙΑ Η ΒΑΣΤΑΣΑΣΑ ΣΕ ΚΑΙ ΜΑΣΤΟΙ ΟΥΣ ΕΘΗΛΑΣΑΣ
11,28,ΑΥΤΟΣ ΔΕ ΕΙΠΕΝ ΜΕΝΟΥΝ ΜΑΚΑΡΙΟΙ ΟΙ ΑΚΟΥΟΝΤΕΣ ΤΟΝ ΛΟΓΟΝ ΤΟΥ ΘΕΟΥ ΚΑΙ ΦΥΛΑΣΣΟΝΤΕΣ
11,29,ΤΩΝ ΔΕ ΟΧΛΩΝ ΕΠΑΘΡΟΙΖΟΜΕΝΩΝ ΗΡΞΑΤΟ ΛΕΓΕΙΝ Η ΓΕΝΕΑ ΑΥΤΗ ΓΕΝΕΑ ΠΟΝΗΡΑ ΕΣΤΙΝ ΣΗΜΕΙΟΝ ΖΗΤΕΙ ΚΑΙ ΣΗΜΕΙΟΝ ΟΥ ΔΟΘΗΣΕΤΑΙ ΑΥΤΗΙ ΕΙ ΜΗ ΤΟ ΣΗΜΕΙΟΝ ΙΩΝΑ
11,30,ΚΑΘΩΣ ΓΑΡ ΕΓΕΝΕΤΟ ΙΩΝΑΣ ΤΟΙΣ ΝΙΝΕΥΕΙΤΑΙΣ ΣΗΜΕΙΟΝ ΟΥΤΩΣ ΕΣΤΑΙ ΚΑΙ Ο ΥΙΟΣ ΤΟΥ ΑΝΘΡΩΠΟΥ ΤΗΙ ΓΕΝΕΑΙ ΤΑΥΤΗΙ
11,31,ΒΑΣΙΛΙΣΣΑ ΝΟΤΟΥ ΕΓΕΡΘΗΣΕΤΑΙ ΕΝ ΤΗΙ ΚΡΙΣΕΙ ΜΕΤΑ ΤΩΝ ΑΝΔΡΩΝ ΤΗΣ ΓΕΝΕΑΣ ΤΑΥΤΗΣ ΚΑΙ ΚΑΤΑΚΡΙΝΕΙ ΑΥΤΟΥΣ ΟΤΙ ΗΛΘΕΝ ΕΚ ΤΩΝ ΠΕΡΑΤΩΝ ΤΗΣ ΓΗΣ ΑΚΟΥΣΑΙ ΤΗΝ ΣΟΦΙΑΝ ΣΟΛΟΜΩΝΟΣ ΚΑΙ ΙΔΟΥ ΠΛΕΙΟΝ ΣΟΛΟΜΩΝΟΣ ΩΔΕ
11,32,ΑΝΔΡΕΣ ΝΙΝΕΥΕΙΤΑΙ ΑΝΑΣΤΗΣΟΝΤΑΙ ΕΝ ΤΗΙ ΚΡΙΣΕΙ ΜΕΤΑ ΤΗΣ ΓΕΝΕΑΣ ΤΑΥΤΗΣ ΚΑΙ ΚΑΤΑΚΡΙΝΟΥΣΙΝ ΑΥΤΗΝ ΟΤΙ ΜΕΤΕΝΟΗΣΑΝ ΕΙΣ ΤΟ ΚΗΡΥΓΜΑ ΙΩΝΑ ΚΑΙ ΙΔΟΥ ΠΛΕΙΟΝ ΙΩΝΑ ΩΔΕ
11,33,ΟΥΔΕΙΣ ΛΥΧΝΟΝ ΑΨΑΣ ΕΙΣ ΚΡΥΠΤΗΝ ΤΙΘΗΣΙΝ ΟΥΔΕ ΥΠΟ ΤΟΝ ΜΟΔΙΟΝ ΑΛΛΑ ΕΠΙ ΤΗΝ ΛΥΧΝΙΑΝ ΙΝΑ ΟΙ ΕΙΣΠΟΡΕΥΟΜΕΝΟΙ ΤΟ ΦΩΣ ΒΛΕΠΩΣΙΝ
11,34,Ο ΛΥΧΝΟΣ ΤΟΥ ΣΩΜΑΤΟΣ ΕΣΤΙΝ Ο ΟΦΘΑΛΜΟΣ ΣΟΥ ΟΤΑΝ Ο ΟΦΘΑΛΜΟΣ ΣΟΥ ΑΠΛΟΥΣ ΗΙ ΚΑΙ ΟΛΟΝ ΤΟ ΣΩΜΑ ΣΟΥ ΦΩΤΕΙΝΟΝ ΕΣΤΙΝ ΕΠΑΝ ΔΕ ΠΟΝΗΡΟΣ ΗΙ ΚΑΙ ΤΟ ΣΩΜΑ ΣΟΥ ΣΚΟΤΕΙΝΟΝ
11,35,ΣΚΟΠΕΙ ΟΥΝ ΜΗ ΤΟ ΦΩΣ ΤΟ ΕΝ ΣΟΙ ΣΚΟΤΟΣ ΕΣΤΙΝ
11,36,ΕΙ ΟΥΝ ΤΟ ΣΩΜΑ ΣΟΥ ΟΛΟΝ ΦΩΤΕΙΝΟΝ ΜΗ ΕΧΟΝ ΜΕΡΟΣ ΤΙ ΣΚΟΤΕΙΝΟΝ ΕΣΤΑΙ ΦΩΤΕΙΝΟΝ ΟΛΟΝ ΩΣ ΟΤΑΝ Ο ΛΥΧΝΟΣ ΤΗΙ ΑΣΤΡΑΠΗΙ ΦΩΤΙΖΗΙ ΣΕ
11,37,ΕΝ ΔΕ ΤΩΙ ΛΑΛΗΣΑΙ ΕΡΩΤΑΙ ΑΥΤΟΝ ΦΑΡΙΣΑΙΟΣ ΟΠΩΣ ΑΡΙΣΤΗΣΗΙ ΠΑΡΑ ΑΥΤΩΙ ΕΙΣΕΛΘΩΝ ΔΕ ΑΝΕΠΕΣΕΝ
11,38,Ο ΔΕ ΦΑΡΙΣΑΙΟΣ ΙΔΩΝ ΕΘΑΥΜΑΣΕΝ ΟΤΙ ΟΥ ΠΡΩΤΟΝ ΕΒΑΠΤΙΣΘΗ ΠΡΟ ΤΟΥ ΑΡΙΣΤΟΥ
11,39,ΕΙΠΕΝ ΔΕ Ο ΚΥΡΙΟΣ ΠΡΟΣ ΑΥΤΟΝ ΝΥΝ ΥΜΕΙΣ ΟΙ ΦΑΡΙΣΑΙΟΙ ΤΟ ΕΞΩΘΕΝ ΤΟΥ ΠΟΤΗΡΙΟΥ ΚΑΙ ΤΟΥ ΠΙΝΑΚΟΣ ΚΑΘΑΡΙΖΕΤΕ ΤΟ ΔΕ ΕΣΩΘΕΝ ΥΜΩΝ ΓΕΜΕΙ ΑΡΠΑΓΗΣ ΚΑΙ ΠΟΝΗΡΙΑΣ
11,40,ΑΦΡΟΝΕΣ ΟΥΧ Ο ΠΟΙΗΣΑΣ ΤΟ ΕΞΩΘΕΝ ΚΑΙ ΤΟ ΕΣΩΘΕΝ ΕΠΟΙΗΣΕΝ
11,41,ΠΛΗΝ ΤΑ ΕΝΟΝΤΑ ΔΟΤΕ ΕΛΕΗΜΟΣΥΝΗΝ ΚΑΙ ΙΔΟΥ ΠΑΝΤΑ ΚΑΘΑΡΑ ΥΜΙΝ ΕΣΤΙΝ
11,42,ΑΛΛΑ ΟΥΑΙ ΥΜΙΝ ΤΟΙΣ ΦΑΡΙΣΑΙΟΙΣ ΟΤΙ ΑΠΟΔΕΚΑΤΟΥΤΕ ΤΟ ΗΔΥΟΣΜΟΝ ΚΑΙ ΤΟ ΠΗΓΑΝΟΝ ΚΑΙ ΠΑΝ ΛΑΧΑΝΟΝ ΚΑΙ ΠΑΡΕΡΧΕΣΘΕ ΤΗΝ ΚΡΙΣΙΝ ΚΑΙ ΤΗΝ ΑΓΑΠΗΝ ΤΟΥ ΘΕΟΥ ΤΑΥΤΑ ΔΕ ΕΔΕΙ ΠΟΙΗΣΑΙ ΚΑΚΕΙΝΑ ΜΗ ΠΑΡΕΙΝΑΙ
11,43,ΟΥΑΙ ΥΜΙΝ ΤΟΙΣ ΦΑΡΙΣΑΙΟΙΣ ΟΤΙ ΑΓΑΠΑΤΕ ΤΗΝ ΠΡΩΤΟΚΑΘΕΔΡΙΑΝ ΕΝ ΤΑΙΣ ΣΥΝΑΓΩΓΑΙΣ ΚΑΙ ΤΟΥΣ ΑΣΠΑΣΜΟΥΣ ΕΝ ΤΑΙΣ ΑΓΟΡΑΙΣ
11,44,ΟΥΑΙ ΥΜΙΝ ΟΤΙ ΕΣΤΕ ΩΣ ΤΑ ΜΝΗΜΕΙΑ ΤΑ ΑΔΗΛΑ ΚΑΙ ΟΙ ΑΝΘΡΩΠΟΙ ΟΙ ΠΕΡΙΠΑΤΟΥΝΤΕΣ ΕΠΑΝΩ ΟΥΚ ΟΙΔΑΣΙΝ
11,45,ΑΠΟΚΡΙΘΕΙΣ ΔΕ ΤΙΣ ΤΩΝ ΝΟΜΙΚΩΝ ΛΕΓΕΙ ΑΥΤΩΙ ΔΙΔΑΣΚΑΛΕ ΤΑΥΤΑ ΛΕΓΩΝ ΚΑΙ ΗΜΑΣ ΥΒΡΙΖΕΙΣ
11,46,Ο ΔΕ ΕΙΠΕΝ ΚΑΙ ΥΜΙΝ ΤΟΙΣ ΝΟΜΙΚΟΙΣ ΟΥΑΙ ΟΤΙ ΦΟΡΤΙΖΕΤΕ ΤΟΥΣ ΑΝΘΡΩΠΟΥΣ ΦΟΡΤΙΑ ΔΥΣΒΑΣΤΑΚΤΑ ΚΑΙ ΑΥΤΟΙ ΕΝΙ ΤΩΝ ΔΑΚΤΥΛΩΝ ΥΜΩΝ ΟΥ ΠΡΟΣΨΑΥΕΤΕ ΤΟΙΣ ΦΟΡΤΙΟΙΣ
11,47,ΟΥΑΙ ΥΜΙΝ ΟΤΙ ΟΙΚΟΔΟΜΕΙΤΕ ΤΑ ΜΝΗΜΕΙΑ ΤΩΝ ΠΡΟΦΗΤΩΝ ΟΙ ΔΕ ΠΑΤΕΡΕΣ ΥΜΩΝ ΑΠΕΚΤΕΙΝΑΝ ΑΥΤΟΥΣ
11,48,ΑΡΑ ΜΑΡΤΥΡΕΙΤΕ ΚΑΙ ΣΥΝΕΥΔΟΚΕΙΤΕ ΤΟΙΣ ΕΡΓΟΙΣ ΤΩΝ ΠΑΤΕΡΩΝ ΥΜΩΝ ΟΤΙ ΑΥΤΟΙ ΜΕΝ ΑΠΕΚΤΕΙΝΑΝ ΑΥΤΟΥΣ ΥΜΕΙΣ ΔΕ ΟΙΚΟΔΟΜΕΙΤΕ
11,49,ΔΙΑ ΤΟΥΤΟ ΚΑΙ Η ΣΟΦΙΑ ΤΟΥ ΘΕΟΥ ΕΙΠΕΝ ΑΠΟΣΤΕΛΩ ΕΙΣ ΑΥΤΟΥΣ ΠΡΟΦΗΤΑΣ ΚΑΙ ΑΠΟΣΤΟΛΟΥΣ ΚΑΙ ΕΞ ΑΥΤΩΝ ΑΠΟΚΤΕΝΟΥΣΙΝ ΚΑΙ ΔΙΩΞΟΥΣΙΝ
11,50,ΙΝΑ ΕΚΖΗΤΗΘΗΙ ΤΟ ΑΙΜΑ ΠΑΝΤΩΝ ΤΩΝ ΠΡΟΦΗΤΩΝ ΤΟ ΕΚΧΥΝΝΟΜΕΝΟΝ ΑΠΟ ΚΑΤΑΒΟΛΗΣ ΚΟΣΜΟΥ ΑΠΟ ΤΗΣ ΓΕΝΕΑΣ ΤΑΥΤΗΣ
11,51,ΑΠΟ ΑΙΜΑΤΟΣ ΑΒΕΛ ΕΩΣ ΑΙΜΑΤΟΣ ΖΑΧΑΡΙΟΥ ΤΟΥ ΑΠΟΛΟΜΕΝΟΥ ΜΕΤΑΞΥ ΤΟΥ ΘΥΣΙΑΣΤΗΡΙΟΥ ΚΑΙ ΤΟΥ ΟΙΚΟΥ ΝΑΙ ΛΕΓΩ ΥΜΙΝ ΕΚΖΗΤΗΘΗΣΕΤΑΙ ΑΠΟ ΤΗΣ ΓΕΝΕΑΣ ΤΑΥΤΗΣ
11,52,ΟΥΑΙ ΥΜΙΝ ΤΟΙΣ ΝΟΜΙΚΟΙΣ ΟΤΙ ΗΡΑΤΕ ΤΗΝ ΚΛΕΙΔΑ ΤΗΣ ΓΝΩΣΕΩΣ ΑΥΤΟΙ ΟΥΚ ΕΙΣΗΛΘΑΤΕ ΚΑΙ ΤΟΥΣ ΕΙΣΕΡΧΟΜΕΝΟΥΣ ΕΚΩΛΥΣΑΤΕ
11,53,ΚΑΚΕΙΘΕΝ ΕΞΕΛΘΟΝΤΟΣ ΑΥΤΟΥ ΗΡΞΑΝΤΟ ΟΙ ΓΡΑΜΜΑΤΕΙΣ ΚΑΙ ΟΙ ΦΑΡΙΣΑΙΟΙ ΔΕΙΝΩΣ ΕΝΕΧΕΙΝ ΚΑΙ ΑΠΟΣΤΟΜΑΤΙΖΕΙΝ ΑΥΤΟΝ ΠΕΡΙ ΠΛΕΙΟΝΩΝ
11,54,ΕΝΕΔΡΕΥΟΝΤΕΣ ΑΥΤΟΝ ΘΗΡΕΥΣΑΙ ΤΙ ΕΚ ΤΟΥ ΣΤΟΜΑΤΟΣ ΑΥΤΟΥ
12,1,ΕΝ ΟΙΣ ΕΠΙΣΥΝΑΧΘΕΙΣΩΝ ΤΩΝ ΜΥΡΙΑΔΩΝ ΤΟΥ ΟΧΛΟΥ ΩΣΤΕ ΚΑΤΑΠΑΤΕΙΝ ΑΛΛΗΛΟΥΣ ΗΡΞΑΤΟ ΛΕΓΕΙΝ ΠΡΟΣ ΤΟΥΣ ΜΑΘΗΤΑΣ ΑΥΤΟΥ ΠΡΩΤΟΝ ΠΡΟΣΕΧΕΤΕ ΕΑΥΤΟΙΣ ΑΠΟ ΤΗΣ ΖΥΜΗΣ ΤΩΝ ΦΑΡΙΣΑΙΩΝ ΗΤΙΣ ΕΣΤΙΝ ΥΠΟΚΡΙΣΙΣ
12,2,ΟΥΔΕΝ ΔΕ ΣΥΝΚΕΚΑΛΥΜΜΕΝΟΝ ΕΣΤΙΝ Ο ΟΥΚ ΑΠΟΚΑΛΥΦΘΗΣΕΤΑΙ ΚΑΙ ΚΡΥΠΤΟΝ Ο ΟΥ ΓΝΩΣΘΗΣΕΤΑΙ
12,3,ΑΝΤΙ ΩΝ ΟΣΑ ΕΝ ΤΗΙ ΣΚΟΤΙΑΙ ΕΙΠΑΤΕ ΕΝ ΤΩΙ ΦΩΤΙ ΑΚΟΥΣΘΗΣΕΤΑΙ ΚΑΙ Ο ΠΡΟΣ ΤΟ ΟΥΣ ΕΛΑΛΗΣΑΤΕ ΕΝ ΤΟΙΣ ΤΑΜΕΙΟΙΣ ΚΗΡΥΧΘΗΣΕΤΑΙ ΕΠΙ ΤΩΝ ΔΩΜΑΤΩΝ
12,4,ΛΕΓΩ ΔΕ ΥΜΙΝ ΤΟΙΣ ΦΙΛΟΙΣ ΜΟΥ ΜΗ ΦΟΒΗΘΗΤΕ ΑΠΟ ΤΩΝ ΑΠΟΚΤΕΙΝΟΝΤΩΝ ΤΟ ΣΩΜΑ ΚΑΙ ΜΕΤΑ ΤΑΥΤΑ ΜΗ ΕΧΟΝΤΩΝ ΠΕΡΙΣΣΟΤΕΡΟΝ ΤΙ ΠΟΙΗΣΑΙ
12,5,ΥΠΟΔΕΙΞΩ ΔΕ ΥΜΙΝ ΤΙΝΑ ΦΟΒΗΘΗΤΕ ΦΟΒΗΘΗΤΕ ΤΟΝ ΜΕΤΑ ΤΟ ΑΠΟΚΤΕΙΝΑΙ ΕΧΟΝΤΑ ΕΞΟΥΣΙΑΝ ΕΜΒΑΛΕΙΝ ΕΙΣ ΤΗΝ ΓΕΕΝΝΑΝ ΝΑΙ ΛΕΓΩ ΥΜΙΝ ΤΟΥΤΟΝ ΦΟΒΗΘΗΤΕ
12,6,ΟΥΧΙ ΠΕΝΤΕ ΣΤΡΟΥΘΙΑ ΠΩΛΟΥΝΤΑΙ ΑΣΣΑΡΙΩΝ ΔΥΟ ΚΑΙ ΕΝ ΕΞ ΑΥΤΩΝ ΟΥΚ ΕΣΤΙΝ ΕΠΙΛΕΛΗΣΜΕΝΟΝ ΕΝΩΠΙΟΝ ΤΟΥ ΘΕΟΥ
12,7,ΑΛΛΑ ΚΑΙ ΑΙ ΤΡΙΧΕΣ ΤΗΣ ΚΕΦΑΛΗΣ ΥΜΩΝ ΠΑΣΑΙ ΗΡΙΘΜΗΝΤΑΙ ΜΗ ΦΟΒΕΙΣΘΕ ΠΟΛΛΩΝ ΣΤΡΟΥΘΙΩΝ ΔΙΑΦΕΡΕΤΕ
12,8,ΛΕΓΩ ΔΕ ΥΜΙΝ ΠΑΣ ΟΣ ΑΝ ΟΜΟΛΟΓΗΣΗΙ ΕΝ ΕΜΟΙ ΕΜΠΡΟΣΘΕΝ ΤΩΝ ΑΝΘΡΩΠΩΝ ΚΑΙ Ο ΥΙΟΣ ΤΟΥ ΑΝΘΡΩΠΟΥ ΟΜΟΛΟΓΗΣΕΙ ΕΝ ΑΥΤΩΙ ΕΜΠΡΟΣΘΕΝ ΤΩΝ ΑΓΓΕΛΩΝ ΤΟΥ ΘΕΟΥ
12,9,Ο ΔΕ ΑΡΝΗΣΑΜΕΝΟΣ ΜΕ ΕΝΩΠΙΟΝ ΤΩΝ ΑΝΘΡΩΠΩΝ ΑΠΑΡΝΗΘΗΣΕΤΑΙ ΕΝΩΠΙΟΝ ΤΩΝ ΑΓΓΕΛΩΝ ΤΟΥ ΘΕΟΥ
12,10,ΚΑΙ ΠΑΣ ΟΣ ΕΡΕΙ ΛΟΓΟΝ ΕΙΣ ΤΟΝ ΥΙΟΝ ΤΟΥ ΑΝΘΡΩΠΟΥ ΑΦΕΘΗΣΕΤΑΙ ΑΥΤΩΙ ΤΩΙ ΔΕ ΕΙΣ ΤΟ ΑΓΙΟΝ ΠΝΕΥΜΑ ΒΛΑΣΦΗΜΗΣΑΝΤΙ ΟΥΚ ΑΦΕΘΗΣΕΤΑΙ
12,11,ΟΤΑΝ ΔΕ ΕΙΣΦΕΡΩΣΙΝ ΥΜΑΣ ΕΠΙ ΤΑΣ ΣΥΝΑΓΩΓΑΣ ΚΑΙ ΤΑΣ ΑΡΧΑΣ ΚΑΙ ΤΑΣ ΕΞΟΥΣΙΑΣ ΜΗ ΜΕΡΙΜΝΗΣΗΤΕ ΠΩΣ Η ΤΙ ΑΠΟΛΟΓΗΣΗΣΘΕ Η ΤΙ ΕΙΠΗΤΕ
12,12,ΤΟ ΓΑΡ ΑΓΙΟΝ ΠΝΕΥΜΑ ΔΙΔΑΞΕΙ ΥΜΑΣ ΕΝ ΑΥΤΗΙ ΤΗΙ ΩΡΑΙ Α ΔΕΙ ΕΙΠΕΙΝ
12,13,ΕΙΠΕΝ ΔΕ ΤΙΣ ΕΚ ΤΟΥ ΟΧΛΟΥ ΑΥΤΩΙ ΔΙΔΑΣΚΑΛΕ ΕΙΠΕ ΤΩΙ ΑΔΕΛΦΩΙ ΜΟΥ ΜΕΡΙΣΑΣΘΑΙ ΜΕΤΑ ΕΜΟΥ ΤΗΝ ΚΛΗΡΟΝΟΜΙΑΝ
12,14,Ο ΔΕ ΕΙΠΕΝ ΑΥΤΩΙ ΑΝΘΡΩΠΕ ΤΙΣ ΜΕ ΚΑΤΕΣΤΗΣΕΝ ΚΡΙΤΗΝ Η ΜΕΡΙΣΤΗΝ ΕΠΙ ΥΜΑΣ
12,15,ΕΙΠΕΝ ΔΕ ΠΡΟΣ ΑΥΤΟΥΣ ΟΡΑΤΕ ΚΑΙ ΦΥΛΑΣΣΕΣΘΕ ΑΠΟ ΠΑΣΗΣ ΠΛΕΟΝΕΞΙΑΣ ΟΤΙ ΟΥΚ ΕΝ ΤΩΙ ΠΕΡΙΣΣΕΥΕΙΝ ΤΙΝΙ Η ΖΩΗ ΑΥΤΟΥ ΕΣΤΙΝ ΕΚ ΤΩΝ ΥΠΑΡΧΟΝΤΩΝ ΑΥΤΩΙ
12,16,ΕΙΠΕΝ ΔΕ ΠΑΡΑΒΟΛΗΝ ΠΡΟΣ ΑΥΤΟΥΣ ΛΕΓΩΝ ΑΝΘΡΩΠΟΥ ΤΙΝΟΣ ΠΛΟΥΣΙΟΥ ΕΥΦΟΡΗΣΕΝ Η ΧΩΡΑ
12,17,ΚΑΙ ΔΙΕΛΟΓΙΖΕΤΟ ΕΝ ΕΑΥΤΩΙ ΛΕΓΩΝ ΤΙ ΠΟΙΗΣΩ ΟΤΙ ΟΥΚ ΕΧΩ ΠΟΥ ΣΥΝΑΞΩ ΤΟΥΣ ΚΑΡΠΟΥΣ ΜΟΥ
12,18,ΚΑΙ ΕΙΠΕΝ ΤΟΥΤΟ ΠΟΙΗΣΩ ΚΑΘΕΛΩ ΜΟΥ ΤΑΣ ΑΠΟΘΗΚΑΣ ΚΑΙ ΜΕΙΖΟΝΑΣ ΟΙΚΟΔΟΜΗΣΩ ΚΑΙ ΣΥΝΑΞΩ ΕΚΕΙ ΠΑΝΤΑ ΤΟΝ ΣΙΤΟΝ ΚΑΙ ΤΑ ΑΓΑΘΑ ΜΟΥ
12,19,ΚΑΙ ΕΡΩ ΤΗΙ ΨΥΧΗΙ ΜΟΥ ΨΥΧΗ ΕΧΕΙΣ ΠΟΛΛΑ ΑΓΑΘΑ ΚΕΙΜΕΝΑ ΕΙΣ ΕΤΗ ΠΟΛΛΑ ΑΝΑΠΑΥΟΥ ΦΑΓΕ ΠΙΕ ΕΥΦΡΑΙΝΟΥ
12,20,ΕΙΠΕΝ ΔΕ ΑΥΤΩΙ Ο ΘΕΟΣ ΑΦΡΩΝ ΤΑΥΤΗΙ ΤΗΙ ΝΥΚΤΙ ΤΗΝ ΨΥΧΗΝ ΣΟΥ ΑΠΑΙΤΟΥΣΙΝ ΑΠΟ ΣΟΥ Α ΔΕ ΗΤΟΙΜΑΣΑΣ ΤΙΝΙ ΕΣΤΑΙ
12,21,ΟΥΤΩΣ Ο ΘΗΣΑΥΡΙΖΩΝ ΕΑΥΤΩΙ ΚΑΙ ΜΗ ΕΙΣ ΘΕΟΝ ΠΛΟΥΤΩΝ
12,22,ΕΙΠΕΝ ΔΕ ΠΡΟΣ ΤΟΥΣ ΜΑΘΗΤΑΣ ΑΥΤΟΥ ΔΙΑ ΤΟΥΤΟ ΛΕΓΩ ΥΜΙΝ ΜΗ ΜΕΡΙΜΝΑΤΕ ΤΗΙ ΨΥΧΗΙ ΤΙ ΦΑΓΗΤΕ ΜΗΔΕ ΤΩΙ ΣΩΜΑΤΙ ΤΙ ΕΝΔΥΣΗΣΘΕ
12,23,Η ΓΑΡ ΨΥΧΗ ΠΛΕΙΟΝ ΕΣΤΙΝ ΤΗΣ ΤΡΟΦΗΣ ΚΑΙ ΤΟ ΣΩΜΑ ΤΟΥ ΕΝΔΥΜΑΤΟΣ
12,24,ΚΑΤΑΝΟΗΣΑΤΕ ΤΟΥΣ ΚΟΡΑΚΑΣ ΟΤΙ ΟΥ ΣΠΕΙΡΟΥΣΙΝ ΟΥΔΕ ΘΕΡΙΖΟΥΣΙΝ ΟΙΣ ΟΥΚ ΕΣΤΙΝ ΤΑΜΕΙΟΝ ΟΥΔΕ ΑΠΟΘΗΚΗ ΚΑΙ Ο ΘΕΟΣ ΤΡΕΦΕΙ ΑΥΤΟΥΣ ΠΟΣΩΙ ΜΑΛΛΟΝ ΥΜΕΙΣ ΔΙΑΦΕΡΕΤΕ ΤΩΝ ΠΕΤΕΙΝΩΝ
12,25,ΤΙΣ ΔΕ ΕΞ ΥΜΩΝ ΜΕΡΙΜΝΩΝ ΔΥΝΑΤΑΙ ΕΠΙ ΤΗΝ ΗΛΙΚΙΑΝ ΑΥΤΟΥ ΠΡΟΣΘΕΙΝΑΙ ΠΗΧΥΝ
12,26,ΕΙ ΟΥΝ ΟΥΔΕ ΕΛΑΧΙΣΤΟΝ ΔΥΝΑΣΘΕ ΤΙ ΠΕΡΙ ΤΩΝ ΛΟΙΠΩΝ ΜΕΡΙΜΝΑΤΕ
12,27,ΚΑΤΑΝΟΗΣΑΤΕ ΤΑ ΚΡΙΝΑ ΠΩΣ ΑΥΞΑΝΕΙ ΟΥ ΚΟΠΙΑΙ ΟΥΔΕ ΝΗΘΕΙ ΛΕΓΩ ΔΕ ΥΜΙΝ ΟΥΔΕ ΣΟΛΟΜΩΝ ΕΝ ΠΑΣΗΙ ΤΗΙ ΔΟΞΗΙ ΑΥΤΟΥ ΠΕΡΙΕΒΑΛΕΤΟ ΩΣ ΕΝ ΤΟΥΤΩΝ
12,28,ΕΙ ΔΕ ΕΝ ΑΓΡΩΙ ΤΟΝ ΧΟΡΤΟΝ ΟΝΤΑ ΣΗΜΕΡΟΝ ΚΑΙ ΑΥΡΙΟΝ ΕΙΣ ΚΛΙΒΑΝΟΝ ΒΑΛΛΟΜΕΝΟΝ Ο ΘΕΟΣ ΟΥΤΩΣ ΑΜΦΙΕΖΕΙ ΠΟΣΩΙ ΜΑΛΛΟΝ ΥΜΑΣ ΟΛΙΓΟΠΙΣΤΟΙ
12,29,ΚΑΙ ΥΜΕΙΣ ΜΗ ΖΗΤΕΙΤΕ ΤΙ ΦΑΓΗΤΕ ΚΑΙ ΤΙ ΠΙΗΤΕ ΚΑΙ ΜΗ ΜΕΤΕΩΡΙΖΕΣΘΕ
12,30,ΤΑΥΤΑ ΓΑΡ ΠΑΝΤΑ ΤΑ ΕΘΝΗ ΤΟΥ ΚΟΣΜΟΥ ΕΠΙΖΗΤΟΥΣΙΝ ΥΜΩΝ ΔΕ Ο ΠΑΤΗΡ ΟΙΔΕΝ ΟΤΙ ΧΡΗΙΖΕΤΕ ΤΟΥΤΩΝ
12,31,ΠΛΗΝ ΖΗΤΕΙΤΕ ΤΗΝ ΒΑΣΙΛΕΙΑΝ ΑΥΤΟΥ ΚΑΙ ΤΑΥΤΑ ΠΡΟΣΤΕΘΗΣΕΤΑΙ ΥΜΙΝ
12,32,ΜΗ ΦΟΒΟΥ ΤΟ ΜΙΚΡΟΝ ΠΟΙΜΝΙΟΝ ΟΤΙ ΕΥΔΟΚΗΣΕΝ Ο ΠΑΤΗΡ ΥΜΩΝ ΔΟΥΝΑΙ ΥΜΙΝ ΤΗΝ ΒΑΣΙΛΕΙΑΝ
12,33,ΠΩΛΗΣΑΤΕ ΤΑ ΥΠΑΡΧΟΝΤΑ ΥΜΩΝ ΚΑΙ ΔΟΤΕ ΕΛΕΗΜΟΣΥΝΗΝ ΠΟΙΗΣΑΤΕ ΕΑΥΤΟΙΣ ΒΑΛΛΑΝΤΙΑ ΜΗ ΠΑΛΑΙΟΥΜΕΝΑ ΘΗΣΑΥΡΟΝ ΑΝΕΚΛΕΙΠΤΟΝ ΕΝ ΤΟΙΣ ΟΥΡΑΝΟΙΣ ΟΠΟΥ ΚΛΕΠΤΗΣ ΟΥΚ ΕΓΓΙΖΕΙ ΟΥΔΕ ΣΗΣ ΔΙΑΦΘΕΙΡΕΙ
12,34,ΟΠΟΥ ΓΑΡ ΕΣΤΙΝ Ο ΘΗΣΑΥΡΟΣ ΥΜΩΝ ΕΚΕΙ ΚΑΙ Η ΚΑΡΔΙΑ ΥΜΩΝ ΕΣΤΑΙ
12,35,ΕΣΤΩΣΑΝ ΥΜΩΝ ΑΙ ΟΣΦΥΕΣ ΠΕΡΙΕΖΩΣΜΕΝΑΙ ΚΑΙ ΟΙ ΛΥΧΝΟΙ ΚΑΙΟΜΕΝΟΙ
12,36,ΚΑΙ ΥΜΕΙΣ ΟΜΟΙΟΙ ΑΝΘΡΩΠΟΙΣ ΠΡΟΣΔΕΧΟΜΕΝΟΙΣ ΤΟΝ ΚΥΡΙΟΝ ΕΑΥΤΩΝ ΠΟΤΕ ΑΝΑΛΥΣΗΙ ΕΚ ΤΩΝ ΓΑΜΩΝ ΙΝΑ ΕΛΘΟΝΤΟΣ ΚΑΙ ΚΡΟΥΣΑΝΤΟΣ ΕΥΘΕΩΣ ΑΝΟΙΞΩΣΙΝ ΑΥΤΩΙ
12,37,ΜΑΚΑΡΙΟΙ ΟΙ ΔΟΥΛΟΙ ΕΚΕΙΝΟΙ ΟΥΣ ΕΛΘΩΝ Ο ΚΥΡΙΟΣ ΕΥΡΗΣΕΙ ΓΡΗΓΟΡΟΥΝΤΑΣ ΑΜΗΝ ΛΕΓΩ ΥΜΙΝ ΟΤΙ ΠΕΡΙΖΩΣΕΤΑΙ ΚΑΙ ΑΝΑΚΛΙΝΕΙ ΑΥΤΟΥΣ ΚΑΙ ΠΑΡΕΛΘΩΝ ΔΙΑΚΟΝΗΣΕΙ ΑΥΤΟΙΣ
12,38,ΚΑΝ ΕΝ ΤΗΙ ΔΕΥΤΕΡΑΙ ΚΑΝ ΕΝ ΤΗΙ ΤΡΙΤΗΙ ΦΥΛΑΚΗΙ ΕΛΘΗΙ ΚΑΙ ΕΥΡΗΙ ΟΥΤΩΣ ΜΑΚΑΡΙΟΙ ΕΙΣΙΝ ΕΚΕΙΝΟΙ
12,39,ΤΟΥΤΟ ΔΕ ΓΙΝΩΣΚΕΤΕ ΟΤΙ ΕΙ ΗΙΔΕΙ Ο ΟΙΚΟΔΕΣΠΟΤΗΣ ΠΟΙΑΙ ΩΡΑΙ Ο ΚΛΕΠΤΗΣ ΕΡΧΕΤΑΙ ΟΥΚ ΑΝ ΑΦΗΚΕΝ ΔΙΟΡΥΧΘΗΝΑΙ ΤΟΝ ΟΙΚΟΝ ΑΥΤΟΥ
12,40,ΚΑΙ ΥΜΕΙΣ ΓΙΝΕΣΘΕ ΕΤΟΙΜΟΙ ΟΤΙ ΗΙ ΩΡΑΙ ΟΥ ΔΟΚΕΙΤΕ Ο ΥΙΟΣ ΤΟΥ ΑΝΘΡΩΠΟΥ ΕΡΧΕΤΑΙ
12,41,ΕΙΠΕΝ ΔΕ Ο ΠΕΤΡΟΣ ΚΥΡΙΕ ΠΡΟΣ ΗΜΑΣ ΤΗΝ ΠΑΡΑΒΟΛΗΝ ΤΑΥΤΗΝ ΛΕΓΕΙΣ Η ΚΑΙ ΠΡΟΣ ΠΑΝΤΑΣ
12,42,ΚΑΙ ΕΙΠΕΝ Ο ΚΥΡΙΟΣ ΤΙΣ ΑΡΑ ΕΣΤΙΝ Ο ΠΙΣΤΟΣ ΟΙΚΟΝΟΜΟΣ Ο ΦΡΟΝΙΜΟΣ ΟΝ ΚΑΤΑΣΤΗΣΕΙ Ο ΚΥΡΙΟΣ ΕΠΙ ΤΗΣ ΘΕΡΑΠΕΙΑΣ ΑΥΤΟΥ ΤΟΥ ΔΙΔΟΝΑΙ ΕΝ ΚΑΙΡΩΙ ΤΟ ΣΙΤΟΜΕΤΡΙΟΝ
12,43,ΜΑΚΑΡΙΟΣ Ο ΔΟΥΛΟΣ ΕΚΕΙΝΟΣ ΟΝ ΕΛΘΩΝ Ο ΚΥΡΙΟΣ ΑΥΤΟΥ ΕΥΡΗΣΕΙ ΠΟΙΟΥΝΤΑ ΟΥΤΩΣ
12,44,ΑΛΗΘΩΣ ΛΕΓΩ ΥΜΙΝ ΟΤΙ ΕΠΙ ΠΑΣΙΝ ΤΟΙΣ ΥΠΑΡΧΟΥΣΙΝ ΑΥΤΟΥ ΚΑΤΑΣΤΗΣΕΙ ΑΥΤΟΝ
12,45,ΕΑΝ ΔΕ ΕΙΠΗΙ Ο ΔΟΥΛΟΣ ΕΚΕΙΝΟΣ ΕΝ ΤΗΙ ΚΑΡΔΙΑΙ ΑΥΤΟΥ ΧΡΟΝΙΖΕΙ Ο ΚΥΡΙΟΣ ΜΟΥ ΕΡΧΕΣΘΑΙ ΚΑΙ ΑΡΞΗΤΑΙ ΤΥΠΤΕΙΝ ΤΟΥΣ ΠΑΙΔΑΣ ΚΑΙ ΤΑΣ ΠΑΙΔΙΣΚΑΣ ΕΣΘΙΕΙΝ ΤΕ ΚΑΙ ΠΙΝΕΙΝ ΚΑΙ ΜΕΘΥΣΚΕΣΘΑΙ
12,46,ΗΞΕΙ Ο ΚΥΡΙΟΣ ΤΟΥ ΔΟΥΛΟΥ ΕΚΕΙΝΟΥ ΕΝ ΗΜΕΡΑΙ ΗΙ ΟΥ ΠΡΟΣΔΟΚΑΙ ΚΑΙ ΕΝ ΩΡΑΙ ΗΙ ΟΥ ΓΙΝΩΣΚΕΙ ΚΑΙ ΔΙΧΟΤΟΜΗΣΕΙ ΑΥΤΟΝ ΚΑΙ ΤΟ ΜΕΡΟΣ ΑΥΤΟΥ ΜΕΤΑ ΤΩΝ ΑΠΙΣΤΩΝ ΘΗΣΕΙ
12,47,ΕΚΕΙΝΟΣ ΔΕ Ο ΔΟΥΛΟΣ Ο ΓΝΟΥΣ ΤΟ ΘΕΛΗΜΑ ΤΟΥ ΚΥΡΙΟΥ ΑΥΤΟΥ ΚΑΙ ΜΗ ΕΤΟΙΜΑΣΑΣ Η ΠΟΙΗΣΑΣ ΠΡΟΣ ΤΟ ΘΕΛΗΜΑ ΑΥΤΟΥ ΔΑΡΗΣΕΤΑΙ ΠΟΛΛΑΣ
12,48,Ο ΔΕ ΜΗ ΓΝΟΥΣ ΠΟΙΗΣΑΣ ΔΕ ΑΞΙΑ ΠΛΗΓΩΝ ΔΑΡΗΣΕΤΑΙ ΟΛΙΓΑΣ ΠΑΝΤΙ ΔΕ ΩΙ ΕΔΟΘΗ ΠΟΛΥ ΠΟΛΥ ΖΗΤΗΘΗΣΕΤΑΙ ΠΑΡΑ ΑΥΤΟΥ ΚΑΙ ΩΙ ΠΑΡΕΘΕΝΤΟ ΠΟΛΥ ΠΕΡΙΣΣΟΤΕΡΟΝ ΑΙΤΗΣΟΥΣΙΝ ΑΥΤΟΝ
12,49,ΠΥΡ ΗΛΘΟΝ ΒΑΛΕΙΝ ΕΠΙ ΤΗΝ ΓΗΝ ΚΑΙ ΤΙ ΘΕΛΩ ΕΙ ΗΔΗ ΑΝΗΦΘΗ
12,50,ΒΑΠΤΙΣΜΑ ΔΕ ΕΧΩ ΒΑΠΤΙΣΘΗΝΑΙ ΚΑΙ ΠΩΣ ΣΥΝΕΧΟΜΑΙ ΕΩΣ ΟΤΟΥ ΤΕΛΕΣΘΗΙ
12,51,ΔΟΚΕΙΤΕ ΟΤΙ ΕΙΡΗΝΗΝ ΠΑΡΕΓΕΝΟΜΗΝ ΔΟΥΝΑΙ ΕΝ ΤΗΙ ΓΗΙ ΟΥΧΙ ΛΕΓΩ ΥΜΙΝ ΑΛΛΑ Η ΔΙΑΜΕΡΙΣΜΟΝ
12,52,ΕΣΟΝΤΑΙ ΓΑΡ ΑΠΟ ΤΟΥ ΝΥΝ ΠΕΝΤΕ ΕΝ ΕΝΙ ΟΙΚΩΙ ΔΙΑΜΕΜΕΡΙΣΜΕΝΟΙ ΤΡΕΙΣ ΕΠΙ ΔΥΣΙΝ ΚΑΙ ΔΥΟ ΕΠΙ ΤΡΙΣΙΝ
12,53,ΔΙΑΜΕΡΙΣΘΗΣΟΝΤΑΙ ΠΑΤΗΡ ΕΠΙ ΥΙΩΙ ΚΑΙ ΥΙΟΣ ΕΠΙ ΠΑΤΡΙ ΜΗΤΗΡ ΕΠΙ ΤΗΝ ΘΥΓΑΤΕΡΑ ΚΑΙ ΘΥΓΑΤΗΡ ΕΠΙ ΤΗΝ ΜΗΤΕΡΑ ΠΕΝΘΕΡΑ ΕΠΙ ΤΗΝ ΝΥΜΦΗΝ ΑΥΤΗΣ ΚΑΙ ΝΥΜΦΗ ΕΠΙ ΤΗΝ ΠΕΝΘΕΡΑΝ
12,54,ΕΛΕΓΕΝ ΔΕ ΚΑΙ ΤΟΙΣ ΟΧΛΟΙΣ ΟΤΑΝ ΙΔΗΤΕ ΝΕΦΕΛΗΝ ΑΝΑΤΕΛΛΟΥΣΑΝ ΕΠΙ ΔΥΣΜΩΝ ΕΥΘΕΩΣ ΛΕΓΕΤΕ ΟΤΙ ΟΜΒΡΟΣ ΕΡΧΕΤΑΙ ΚΑΙ ΓΙΝΕΤΑΙ ΟΥΤΩΣ
12,55,ΚΑΙ ΟΤΑΝ ΝΟΤΟΝ ΠΝΕΟΝΤΑ ΛΕΓΕΤΕ ΟΤΙ ΚΑΥΣΩΝ ΕΣΤΑΙ ΚΑΙ ΓΙΝΕΤΑΙ
12,56,ΥΠΟΚΡΙΤΑΙ ΤΟ ΠΡΟΣΩΠΟΝ ΤΟΥ ΟΥΡΑΝΟΥ ΚΑΙ ΤΗΣ ΓΗΣ ΟΙΔΑΤΕ ΔΟΚΙΜΑΖΕΙΝ ΤΟΝ ΚΑΙΡΟΝ ΔΕ ΤΟΥΤΟΝ ΠΩΣ ΟΥΚ ΟΙΔΑΤΕ ΔΟΚΙΜΑΖΕΙΝ
12,57,ΤΙ ΔΕ ΚΑΙ ΑΠΟ ΕΑΥΤΩΝ ΟΥ ΚΡΙΝΕΤΕ ΤΟ ΔΙΚΑΙΟΝ
12,58,ΩΣ ΓΑΡ ΥΠΑΓΕΙΣ ΜΕΤΑ ΤΟΥ ΑΝΤΙΔΙΚΟΥ ΣΟΥ ΕΠΙ ΑΡΧΟΝΤΑ ΕΝ ΤΗΙ ΟΔΩΙ ΔΟΣ ΕΡΓΑΣΙΑΝ ΑΠΗΛΛΑΧΘΑΙ ΑΠΟ ΑΥΤΟΥ ΜΗΠΟΤΕ ΚΑΤΑΣΥΡΗΙ ΣΕ ΠΡΟΣ ΤΟΝ ΚΡΙΤΗΝ ΚΑΙ Ο ΚΡΙΤΗΣ ΣΕ ΠΑΡΑΔΩΣΕΙ ΤΩΙ ΠΡΑΚΤΟΡΙ ΚΑΙ Ο ΠΡΑΚΤΩΡ ΣΕ ΒΑΛΕΙ ΕΙΣ ΦΥΛΑΚΗΝ
12,59,ΛΕΓΩ ΣΟΙ ΟΥ ΜΗ ΕΞΕΛΘΗΙΣ ΕΚΕΙΘΕΝ ΕΩΣ ΚΑΙ ΤΟ ΕΣΧΑΤΟΝ ΛΕΠΤΟΝ ΑΠΟΔΩΙΣ
13,1,ΠΑΡΗΣΑΝ ΔΕ ΤΙΝΕΣ ΕΝ ΑΥΤΩΙ ΤΩΙ ΚΑΙΡΩΙ ΑΠΑΓΓΕΛΛΟΝΤΕΣ ΑΥΤΩΙ ΠΕΡΙ ΤΩΝ ΓΑΛΙΛΑΙΩΝ ΩΝ ΤΟ ΑΙΜΑ ΠΕΙΛΑΤΟΣ ΕΜΙΞΕΝ ΜΕΤΑ ΤΩΝ ΘΥΣΙΩΝ ΑΥΤΩΝ
13,2,ΚΑΙ ΑΠΟΚΡΙΘΕΙΣ ΕΙΠΕΝ ΑΥΤΟΙΣ ΔΟΚΕΙΤΕ ΟΤΙ ΟΙ ΓΑΛΙΛΑΙΟΙ ΟΥΤΟΙ ΑΜΑΡΤΩΛΟΙ ΠΑΡΑ ΠΑΝΤΑΣ ΤΟΥΣ ΓΑΛΙΛΑΙΟΥΣ ΕΓΕΝΟΝΤΟ ΟΤΙ ΤΑΥΤΑ ΠΕΠΟΝΘΑΣΙΝ
13,3,ΟΥΧΙ ΛΕΓΩ ΥΜΙΝ ΑΛΛΑ ΕΑΝ ΜΗ ΜΕΤΑΝΟΗΤΕ ΠΑΝΤΕΣ ΟΜΟΙΩΣ ΑΠΟΛΕΙΣΘΕ
13,4,Η ΕΚΕΙΝΟΙ ΟΙ ΔΕΚΑΟΚΤΩ ΕΠΙ ΟΥΣ ΕΠΕΣΕΝ Ο ΠΥΡΓΟΣ ΕΝ ΤΩΙ ΣΙΛΩΑΜ ΚΑΙ ΑΠΕΚΤΕΙΝΕΝ ΑΥΤΟΥΣ ΔΟΚΕΙΤΕ ΟΤΙ ΑΥΤΟΙ ΟΦΕΙΛΕΤΑΙ ΕΓΕΝΟΝΤΟ ΠΑΡΑ ΠΑΝΤΑΣ ΤΟΥΣ ΑΝΘΡΩΠΟΥΣ ΤΟΥΣ ΚΑΤΟΙΚΟΥΝΤΑΣ ΙΕΡΟΥΣΑΛΗΜ
13,5,ΟΥΧΙ ΛΕΓΩ ΥΜΙΝ ΑΛΛΑ ΕΑΝ ΜΗ ΜΕΤΑΝΟΗΤΕ ΠΑΝΤΕΣ ΩΣΑΥΤΩΣ ΑΠΟΛΕΙΣΘΕ
13,6,ΕΛΕΓΕΝ ΔΕ ΤΑΥΤΗΝ ΤΗΝ ΠΑΡΑΒΟΛΗΝ ΣΥΚΗΝ ΕΙΧΕΝ ΤΙΣ ΠΕΦΥΤΕΥΜΕΝΗΝ ΕΝ ΤΩΙ ΑΜΠΕΛΩΝΙ ΑΥΤΟΥ ΚΑΙ ΗΛΘΕΝ ΖΗΤΩΝ ΚΑΡΠΟΝ ΕΝ ΑΥΤΗΙ ΚΑΙ ΟΥΧ ΕΥΡΕΝ
13,7,ΕΙΠΕΝ ΔΕ ΠΡΟΣ ΤΟΝ ΑΜΠΕΛΟΥΡΓΟΝ ΙΔΟΥ ΤΡΙΑ ΕΤΗ ΑΠΟ ΟΥ ΕΡΧΟΜΑΙ ΖΗΤΩΝ ΚΑΡΠΟΝ ΕΝ ΤΗΙ ΣΥΚΗΙ ΤΑΥΤΗΙ ΚΑΙ ΟΥΧ ΕΥΡΙΣΚΩ ΕΚΚΟΨΟΝ ΑΥΤΗΝ ΙΝΑ ΤΙ ΚΑΙ ΤΗΝ ΓΗΝ ΚΑΤΑΡΓΕΙ
13,8,Ο ΔΕ ΑΠΟΚΡΙΘΕΙΣ ΛΕΓΕΙ ΑΥΤΩΙ ΚΥΡΙΕ ΑΦΕΣ ΑΥΤΗΝ ΚΑΙ ΤΟΥΤΟ ΤΟ ΕΤΟΣ ΕΩΣ ΟΤΟΥ ΣΚΑΨΩ ΠΕΡΙ ΑΥΤΗΝ ΚΑΙ ΒΑΛΩ ΚΟΠΡΙΑ
13,9,ΚΑΝ ΜΕΝ ΠΟΙΗΣΗΙ ΚΑΡΠΟΝ ΕΙΣ ΤΟ ΜΕΛΛΟΝ ΕΙ ΔΕ ΜΗ ΓΕ ΕΚΚΟΨΕΙΣ ΑΥΤΗΝ
13,10,ΗΝ ΔΕ ΔΙΔΑΣΚΩΝ ΕΝ ΜΙΑΙ ΤΩΝ ΣΥΝΑΓΩΓΩΝ ΕΝ ΤΟΙΣ ΣΑΒΒΑΣΙΝ
13,11,ΚΑΙ ΙΔΟΥ ΓΥΝΗ ΠΝΕΥΜΑ ΕΧΟΥΣΑ ΑΣΘΕΝΕΙΑΣ ΕΤΗ ΔΕΚΑΟΚΤΩ ΚΑΙ ΗΝ ΣΥΝΚΥΠΤΟΥΣΑ ΚΑΙ ΜΗ ΔΥΝΑΜΕΝΗ ΑΝΑΚΥΨΑΙ ΕΙΣ ΤΟ ΠΑΝΤΕΛΕΣ
13,12,ΙΔΩΝ ΔΕ ΑΥΤΗΝ Ο ΙΗΣΟΥΣ ΠΡΟΣΕΦΩΝΗΣΕΝ ΚΑΙ ΕΙΠΕΝ ΑΥΤΗΙ ΓΥΝΑΙ ΑΠΟΛΕΛΥΣΑΙ ΤΗΣ ΑΣΘΕΝΕΙΑΣ ΣΟΥ
13,13,ΚΑΙ ΕΠΕΘΗΚΕΝ ΑΥΤΗΙ ΤΑΣ ΧΕΙΡΑΣ ΚΑΙ ΠΑΡΑΧΡΗΜΑ ΑΝΩΡΘΩΘΗ ΚΑΙ ΕΔΟΞΑΖΕΝ ΤΟΝ ΘΕΟΝ
13,14,ΑΠΟΚΡΙΘΕΙΣ ΔΕ Ο ΑΡΧΙΣΥΝΑΓΩΓΟΣ ΑΓΑΝΑΚΤΩΝ ΟΤΙ ΤΩΙ ΣΑΒΒΑΤΩΙ ΕΘΕΡΑΠΕΥΣΕΝ Ο ΙΗΣΟΥΣ ΕΛΕΓΕΝ ΤΩΙ ΟΧΛΩΙ ΟΤΙ ΕΞ ΗΜΕΡΑΙ ΕΙΣΙΝ ΕΝ ΑΙΣ ΔΕΙ ΕΡΓΑΖΕΣΘΑΙ ΕΝ ΑΥΤΑΙΣ ΟΥΝ ΕΡΧΟΜΕΝΟΙ ΘΕΡΑΠΕΥΕΣΘΕ ΚΑΙ ΜΗ ΤΗΙ ΗΜΕΡΑΙ ΤΟΥ ΣΑΒΒΑΤΟΥ
13,15,ΑΠΕΚΡΙΘΗ ΔΕ ΑΥΤΩΙ Ο ΚΥΡΙΟΣ ΚΑΙ ΕΙΠΕΝ ΥΠΟΚΡΙΤΑΙ ΕΚΑΣΤΟΣ ΥΜΩΝ ΤΩΙ ΣΑΒΒΑΤΩΙ ΟΥ ΛΥΕΙ ΤΟΝ ΒΟΥΝ ΑΥΤΟΥ Η ΤΟΝ ΟΝΟΝ ΑΠΟ ΤΗΣ ΦΑΤΝΗΣ ΚΑΙ ΑΠΑΓΑΓΩΝ ΠΟΤΙΖΕΙ
13,16,ΤΑΥΤΗΝ ΔΕ ΘΥΓΑΤΕΡΑ ΑΒΡΑΑΜ ΟΥΣΑΝ ΗΝ ΕΔΗΣΕΝ Ο ΣΑΤΑΝΑΣ ΙΔΟΥ ΔΕΚΑ ΚΑΙ ΟΚΤΩ ΕΤΗ ΟΥΚ ΕΔΕΙ ΛΥΘΗΝΑΙ ΑΠΟ ΤΟΥ ΔΕΣΜΟΥ ΤΟΥΤΟΥ ΤΗΙ ΗΜΕΡΑΙ ΤΟΥ ΣΑΒΒΑΤΟΥ
13,17,ΚΑΙ ΤΑΥΤΑ ΛΕΓΟΝΤΟΣ ΑΥΤΟΥ ΚΑΤΗΙΣΧΥΝΟΝΤΟ ΠΑΝΤΕΣ ΟΙ ΑΝΤΙΚΕΙΜΕΝΟΙ ΑΥΤΩΙ ΚΑΙ ΠΑΣ Ο ΟΧΛΟΣ ΕΧΑΙΡΕΝ ΕΠΙ ΠΑΣΙΝ ΤΟΙΣ ΕΝΔΟΞΟΙΣ ΤΟΙΣ ΓΙΝΟΜΕΝΟΙΣ ΥΠΟ ΑΥΤΟΥ
13,18,ΕΛΕΓΕΝ ΟΥΝ ΤΙΝΙ ΟΜΟΙΑ ΕΣΤΙΝ Η ΒΑΣΙΛΕΙΑ ΤΟΥ ΘΕΟΥ ΚΑΙ ΤΙΝΙ ΟΜΟΙΩΣΩ ΑΥΤΗΝ
13,19,ΟΜΟΙΑ ΕΣΤΙΝ ΚΟΚΚΩΙ ΣΙΝΑΠΕΩΣ ΟΝ ΛΑΒΩΝ ΑΝΘΡΩΠΟΣ ΕΒΑΛΕΝ ΕΙΣ ΚΗΠΟΝ ΕΑΥΤΟΥ ΚΑΙ ΗΥΞΗΣΕΝ ΚΑΙ ΕΓΕΝΕΤΟ ΕΙΣ ΔΕΝΔΡΟΝ ΚΑΙ ΤΑ ΠΕΤΕΙΝΑ ΤΟΥ ΟΥΡΑΝΟΥ ΚΑΤΕΣΚΗΝΩΣΕΝ ΕΝ ΤΟΙΣ ΚΛΑΔΟΙΣ ΑΥΤΟΥ
13,20,ΚΑΙ ΠΑΛΙΝ ΕΙΠΕΝ ΤΙΝΙ ΟΜΟΙΩΣΩ ΤΗΝ ΒΑΣΙΛΕΙΑΝ ΤΟΥ ΘΕΟΥ
13,21,ΟΜΟΙΑ ΕΣΤΙΝ ΖΥΜΗΙ ΗΝ ΛΑΒΟΥΣΑ ΓΥΝΗ ΕΝΕΚΡΥΨΕΝ ΕΙΣ ΑΛΕΥΡΟΥ ΣΑΤΑ ΤΡΙΑ ΕΩΣ ΟΥ ΕΖΥΜΩΘΗ ΟΛΟΝ
13,22,ΚΑΙ ΔΙΕΠΟΡΕΥΕΤΟ ΚΑΤΑ ΠΟΛΕΙΣ ΚΑΙ ΚΩΜΑΣ ΔΙΔΑΣΚΩΝ ΚΑΙ ΠΟΡΕΙΑΝ ΠΟΙΟΥΜΕΝΟΣ ΕΙΣ ΙΕΡΟΣΟΛΥΜΑ
13,23,ΕΙΠΕΝ ΔΕ ΤΙΣ ΑΥΤΩΙ ΚΥΡΙΕ ΕΙ ΟΛΙΓΟΙ ΟΙ ΣΩΙΖΟΜΕΝΟΙ Ο ΔΕ ΕΙΠΕΝ ΠΡΟΣ ΑΥΤΟΥΣ
13,24,ΑΓΩΝΙΖΕΣΘΕ ΕΙΣΕΛΘΕΙΝ ΔΙΑ ΤΗΣ ΣΤΕΝΗΣ ΘΥΡΑΣ ΟΤΙ ΠΟΛΛΟΙ ΛΕΓΩ ΥΜΙΝ ΖΗΤΗΣΟΥΣΙΝ ΕΙΣΕΛΘΕΙΝ ΚΑΙ ΟΥΚ ΙΣΧΥΣΟΥΣΙΝ
13,25,ΑΠΟ ΟΥ ΑΝ ΕΓΕΡΘΗΙ Ο ΟΙΚΟΔΕΣΠΟΤΗΣ ΚΑΙ ΑΠΟΚΛΕΙΣΗΙ ΤΗΝ ΘΥΡΑΝ ΚΑΙ ΑΡΞΗΣΘΕ ΕΞΩ ΕΣΤΑΝΑΙ ΚΑΙ ΚΡΟΥΕΙΝ ΤΗΝ ΘΥΡΑΝ ΛΕΓΟΝΤΕΣ ΚΥΡΙΕ ΑΝΟΙΞΟΝ ΗΜΙΝ ΚΑΙ ΑΠΟΚΡΙΘΕΙΣ ΕΡΕΙ ΥΜΙΝ ΟΥΚ ΟΙΔΑ ΥΜΑΣ ΠΟΘΕΝ ΕΣΤΕ
13,26,ΤΟΤΕ ΑΡΞΕΣΘΕ ΛΕΓΕΙΝ ΕΦΑΓΟΜΕΝ ΕΝΩΠΙΟΝ ΣΟΥ ΚΑΙ ΕΠΙΟΜΕΝ ΚΑΙ ΕΝ ΤΑΙΣ ΠΛΑΤΕΙΑΙΣ ΗΜΩΝ ΕΔΙΔΑΞΑΣ
