chapter,verse,text
1,1,ΕΠΕΙΔΗΠΕΡ ΠΟΛΛΟΙ ΕΠΕΧΕΙΡΗΣΑΝ ΑΝΑΤΑΞΑΣΘΑΙ ΔΙΗΓΗΣΙΝ ΠΕΡΙ ΤΩΝ ΠΕΠΛΗΡΟΦΟΡΗΜΕΝΩΝ ΕΝ ΗΜΙΝ ΠΡΑΓΜΑΤΩΝ
1,2,ΚΑΘΩΣ ΠΑΡΕΔΟΣΑΝ ΗΜΙΝ ΟΙ ΑΠΟ ΑΡΧΗΣ ΑΥΤΟΠΤΑΙ ΚΑΙ ΥΠΗΡΕΤΑΙ ΓΕΝΟΜΕΝΟΙ ΤΟΥ ΛΟΓΟΥ
1,3,ΕΔΟΞΕ ΚΑΜΟΙ ΠΑΡΗΚΟΛΟΥΘΗΚΟΤΙ ΑΝΩΘΕΝ ΠΑΣΙΝ ΑΚΡΙΒΩΣ ΚΑΘΕΞΗΣ ΣΟΙ ΓΡΑΨΑΙ ΚΡΑΤΙΣΤΕ ΘΕΟΦΙΛΕ
1,4,ΙΝΑ ΕΠΙΓΝΩΙΣ ΠΕΡΙ ΩΝ ΚΑΤΗΧΗΘΗΣ ΛΟΓΩΝ ΤΗΝ ΑΣΦΑΛΕΙΑΝ
1,5,ΕΓΕΝΕΤΟ ΕΝ ΤΑΙΣ ΗΜΕΡΑΙΣ ΗΡΩΙΔΟΥ ΒΑΣΙΛΕΩΣ ΤΗΣ ΙΟΥΔΑΙΑΣ ΙΕΡΕΥΣ ΤΙΣ ΟΝΟΜΑΤΙ ΖΑΧΑΡΙΑΣ ΕΞ ΕΦΗΜΕΡΙΑΣ ΑΒΙΑ ΚΑΙ ΓΥΝΗ ΑΥΤΩΙ ΕΚ ΤΩΝ ΘΥΓΑΤΕΡΩΝ ΑΑΡΩΝ ΚΑΙ ΤΟ ΟΝΟΜΑ ΑΥΤΗΣ ΕΛΕΙΣΑΒΕΤ
1,6,ΗΣΑΝ ΔΕ ΔΙΚΑΙΟΙ ΑΜΦΟΤΕΡΟΙ ΕΝΑΝΤΙΟΝ ΤΟΥ ΘΕΟΥ ΠΟΡΕΥΟΜΕΝΟΙ ΕΝ ΠΑΣΑΙΣ ΤΑΙΣ ΕΝΤΟΛΑΙΣ ΚΑΙ ΔΙΚΑΙΩΜΑΣΙΝ ΤΟΥ ΚΥΡΙΟΥ ΑΜΕΜΠΤΟΙ
1,7,ΚΑΙ ΟΥΚ ΗΝ ΑΥΤΟΙΣ ΤΕΚΝΟΝ ΚΑΘΟΤΙ ΗΝ Η ΕΛΕΙΣΑΒΕΤ ΣΤΕΙΡΑ ΚΑΙ ΑΜΦΟΤΕΡΟΙ ΠΡΟΒΕΒΗΚΟΤΕΣ ΕΝ ΤΑΙΣ ΗΜΕΡΑΙΣ ΑΥΤΩΝ ΗΣΑΝ
1,8,ΕΓΕΝΕΤΟ ΔΕ ΕΝ ΤΩΙ ΙΕΡΑΤΕΥΕΙΝ ΑΥΤΟΝ ΕΝ ΤΗΙ ΤΑΞΕΙ ΤΗΣ ΕΦΗΜΕΡΙΑΣ ΑΥΤΟΥ ΕΝΑΝΤΙ ΤΟΥ ΘΕΟΥ
1,9,ΚΑΤΑ ΤΟ ΕΘΟΣ ΤΗΣ ΙΕΡΑΤΕΙΑΣ ΕΛΑΧΕ ΤΟΥ ΘΥΜΙΑΣΑΙ ΕΙΣΕΛΘΩΝ ΕΙΣ ΤΟΝ ΝΑΟΝ ΤΟΥ ΚΥΡΙΟΥ
1,10,ΚΑΙ ΠΑΝ ΤΟ ΠΛΗΘΟΣ ΗΝ ΤΟΥ ΛΑΟΥ ΠΡΟΣΕΥΧΟΜΕΝΟΝ ΕΞΩ ΤΗΙ ΩΡΑΙ ΤΟΥ ΘΥΜΙΑΜΑΤΟΣ
1,11,ΩΦΘΗ ΔΕ ΑΥΤΩΙ ΑΓΓΕΛΟΣ ΚΥΡΙΟΥ ΕΣΤΩΣ ΕΚ ΔΕΞΙΩΝ ΤΟΥ ΘΥΣΙΑΣΤΗΡΙΟΥ ΤΟΥ ΘΥΜΙΑΜΑΤΟΣ
1,12,ΚΑΙ ΕΤΑΡΑΧΘΗ ΖΑΧΑΡΙΑΣ ΙΔΩΝ ΚΑΙ ΦΟΒΟΣ ΕΠΕΠΕΣΕΝ ΕΠΙ ΑΥΤΟΝ
1,13,ΕΙΠΕΝ ΔΕ ΠΡΟΣ ΑΥΤΟΝ Ο ΑΓΓΕΛΟΣ ΜΗ ΦΟΒΟΥ ΖΑΧΑΡΙΑ ΔΙΟΤΙ ΕΙΣΗΚΟΥΣΘΗ Η ΔΕΗΣΙΣ ΣΟΥ ΚΑΙ Η ΓΥΝΗ ΣΟΥ ΕΛΕΙΣΑΒΕΤ ΓΕΝΝΗΣΕΙ ΥΙΟΝ ΣΟΙ ΚΑΙ ΚΑΛΕΣΕΙΣ ΤΟ ΟΝΟΜΑ ΑΥΤΟΥ ΙΩΑΝΝΗΝ
1,14,ΚΑΙ ΕΣΤΑΙ ΧΑΡΑ ΣΟΙ ΚΑΙ ΑΓΑΛΛΙΑΣΙΣ ΚΑΙ ΠΟΛΛΟΙ ΕΠΙ ΤΗΙ ΓΕΝΕΣΕΙ ΑΥΤΟΥ ΧΑΡΗΣΟΝΤΑΙ
1,15,ΕΣΤΑΙ ΓΑΡ ΜΕΓΑΣ ΕΝΩΠΙΟΝ ΤΟΥ ΚΥΡΙΟΥ ΚΑΙ ΟΙΝΟΝ ΚΑΙ ΣΙΚΕΡΑ ΟΥ ΜΗ ΠΙΗΙ ΚΑΙ ΠΝΕΥΜΑΤΟΣ ΑΓΙΟΥ ΠΛΗΣΘΗΣΕΤΑΙ ΕΤΙ ΕΚ ΚΟΙΛΙΑΣ ΜΗΤΡΟΣ ΑΥΤΟΥ
1,16,ΚΑΙ ΠΟΛΛΟΥΣ ΤΩΝ ΥΙΩΝ ΙΣΡΑΗΛ ΕΠΙΣΤΡΕΨΕΙ ΕΠΙ ΚΥΡΙΟΝ ΤΟΝ ΘΕΟΝ ΑΥΤΩΝ
1,17,ΚΑΙ ΑΥΤΟΣ ΠΡΟΕΛΕΥΣΕΤΑΙ ΕΝΩΠΙΟΝ ΑΥΤΟΥ ΕΝ ΠΝΕΥΜΑΤΙ ΚΑΙ ΔΥΝΑΜΕΙ ΗΛΕΙΑ ΕΠΙΣΤΡΕΨΑΙ ΚΑΡΔΙΑΣ ΠΑΤΕΡΩΝ ΕΠΙ ΤΕΚΝΑ ΚΑΙ ΑΠΕΙΘΕΙΣ ΕΝ ΦΡΟΝΗΣΕΙ ΔΙΚΑΙΩΝ ΕΤΟΙΜΑΣΑΙ ΚΥΡΙΩΙ ΛΑΟΝ ΚΑΤΕΣΚΕΥΑΣΜΕΝΟΝ
1,18,ΚΑΙ ΕΙΠΕΝ ΖΑΧΑΡΙΑΣ ΠΡΟΣ ΤΟΝ ΑΓΓΕΛΟΝ ΚΑΤΑ ΤΙ ΓΝΩΣΟΜΑΙ ΤΟΥΤΟ ΕΓΩ ΓΑΡ ΕΙΜΙ ΠΡΕΣΒΥΤΗΣ ΚΑΙ Η ΓΥΝΗ ΜΟΥ ΠΡΟΒΕΒΗΚΥΙΑ ΕΝ ΤΑΙΣ ΗΜΕΡΑΙΣ ΑΥΤΗΣ
1,19,ΚΑΙ ΑΠΟΚΡΙΘΕΙΣ Ο ΑΓΓΕΛΟΣ ΕΙΠΕΝ ΑΥΤΩΙ ΕΓΩ ΕΙΜΙ ΓΑΒΡΙΗΛ Ο ΠΑΡΕΣΤΗΚΩΣ ΕΝΩΠΙΟΝ ΤΟΥ ΘΕΟΥ ΚΑΙ ΑΠΕΣΤΑΛΗΝ ΛΑΛΗΣΑΙ ΠΡΟΣ ΣΕ ΚΑΙ ΕΥΑΓΓΕΛΙΣΑΣΘΑΙ ΣΟΙ ΤΑΥΤΑ
1,20,ΚΑΙ ΙΔΟΥ ΕΣΗΙ ΣΙΩΠΩΝ ΚΑΙ ΜΗ ΔΥΝΑΜΕΝΟΣ ΛΑΛΗΣΑΙ ΑΧΡΙ ΗΣ ΗΜΕΡΑΣ ΓΕΝΗΤΑΙ ΤΑΥΤΑ ΑΝΤΙ ΩΝ ΟΥΚ ΕΠΙΣΤΕΥΣΑΣ ΤΟΙΣ ΛΟΓΟΙΣ ΜΟΥ ΟΙΤΙΝΕΣ ΠΛΗΡΩΘΗΣΟΝΤΑΙ ΕΙΣ ΤΟΝ ΚΑΙΡΟΝ ΑΥΤΩΝ
1,21,ΚΑΙ ΗΝ Ο ΛΑΟΣ ΠΡΟΣΔΟΚΩΝ ΤΟΝ ΖΑΧΑΡΙΑΝ ΚΑΙ ΕΘΑΥΜΑΖΟΝ ΕΝ ΤΩΙ ΧΡΟΝΙΖΕΙΝ ΑΥΤΟΝ ΕΝ ΤΩΙ ΝΑΩΙ
1,22,ΕΞΕΛΘΩΝ ΔΕ ΟΥΚ ΕΔΥΝΑΤΟ ΛΑΛΗΣΑΙ ΑΥΤΟΙΣ ΚΑΙ ΕΠΕΓΝΩΣΑΝ ΟΤΙ ΟΠΤΑΣΙΑΝ ΕΩΡΑΚΕΝ ΕΝ ΤΩΙ ΝΑΩΙ ΚΑΙ ΑΥΤΟΣ ΗΝ ΔΙΑΝΕΥΩΝ ΑΥΤΟΙΣ ΚΑΙ ΔΙΕΜΕΝΕΝ ΚΩΦΟΣ
1,23,ΚΑΙ ΕΓΕΝΕΤΟ ΩΣ ΕΠΛΗΣΘΗΣΑΝ ΑΙ ΗΜΕΡΑΙ ΤΗΣ ΛΕΙΤΟΥΡΓΙΑΣ ΑΥΤΟΥ ΑΠΗΛΘΕΝ ΕΙΣ ΤΟΝ ΟΙΚΟΝ ΑΥΤΟΥ
1,24,ΜΕΤΑ ΔΕ ΤΑΥΤΑΣ ΤΑΣ ΗΜΕΡΑΣ ΣΥΝΕΛΑΒΕΝ ΕΛΕΙΣΑΒΕΤ Η ΓΥΝΗ ΑΥΤΟΥ ΚΑΙ ΠΕΡΙΕΚΡΥΒΕΝ ΕΑΥΤΗΝ ΜΗΝΑΣ ΠΕΝΤΕ ΛΕΓΟΥΣΑ
1,25,ΟΤΙ ΟΥΤΩΣ ΜΟΙ ΠΕΠΟΙΗΚΕΝ ΚΥΡΙΟΣ ΕΝ ΗΜΕΡΑΙΣ ΑΙΣ ΕΠΕΙΔΕΝ ΑΦΕΛΕΙΝ ΟΝΕΙΔΟΣ ΜΟΥ ΕΝ ΑΝΘΡΩΠΟΙΣ
1,26,ΕΝ ΔΕ ΤΩΙ ΜΗΝΙ ΤΩΙ ΕΚΤΩΙ ΑΠΕΣΤΑΛΗ Ο ΑΓΓΕΛΟΣ ΓΑΒΡΙΗΛ ΑΠΟ ΤΟΥ ΘΕΟΥ ΕΙΣ ΠΟΛΙΝ ΤΗΣ ΓΑΛΙΛΑΙΑΣ ΗΙ ΟΝΟΜΑ ΝΑΖΑΡΕΤ
1,27,ΠΡΟΣ ΠΑΡΘΕΝΟΝ ΕΜΝΗΣΤΕΥΜΕΝΗΝ ΑΝΔΡΙ ΩΙ ΟΝΟΜΑ ΙΩΣΗΦ ΕΞ ΟΙΚΟΥ ΔΑΥΕΙΔ ΚΑΙ ΤΟ ΟΝΟΜΑ ΤΗΣ ΠΑΡΘΕΝΟΥ ΜΑΡΙΑΜ
1,28,ΚΑΙ ΕΙΣΕΛΘΩΝ ΠΡΟΣ ΑΥΤΗΝ Ο ΑΓΓΕΛΟΣ ΕΙΠΕΝ ΧΑΙΡΕ ΚΕΧΑΡΙΤΩΜΕΝΗ Ο ΚΥΡΙΟΣ ΜΕΤΑ ΣΟΥ
1,29,Η ΔΕ ΕΠΙ ΤΩΙ ΛΟΓΩΙ ΔΙΕΤΑΡΑΧΘΗ ΚΑΙ ΔΙΕΛΟΓΙΖΕΤΟ ΠΟΤΑΠΟΣ ΕΙΗ Ο ΑΣΠΑΣΜΟΣ ΟΥΤΟΣ
1,30,ΚΑΙ ΕΙΠΕΝ Ο ΑΓΓΕΛΟΣ ΑΥΤΗΙ ΜΗ ΦΟΒΟΥ ΜΑΡΙΑΜ ΕΥΡΕΣ ΓΑΡ ΧΑΡΙΝ ΠΑΡΑ ΤΩΙ ΘΕΩΙ
1,31,ΚΑΙ ΙΔΟΥ ΣΥΝΛΗΜΨΗΙ ΕΝ ΓΑΣΤΡΙ ΚΑΙ ΤΕΞΗΙ ΥΙΟΝ ΚΑΙ ΚΑΛΕΣΕΙΣ ΤΟ ΟΝΟΜΑ ΑΥΤΟΥ ΙΗΣΟΥΝ
1,32,ΟΥΤΟΣ ΕΣΤΑΙ ΜΕΓΑΣ ΚΑΙ ΥΙΟΣ ΥΨΙΣΤΟΥ ΚΛΗΘΗΣΕΤΑΙ ΚΑΙ ΔΩΣΕΙ ΑΥΤΩΙ ΚΥΡΙΟΣ Ο ΘΕΟΣ ΤΟΝ ΘΡΟΝΟΝ ΔΑΥΕΙΔ ΤΟΥ ΠΑΤΡΟΣ ΑΥΤΟΥ
1,33,ΚΑΙ ΒΑΣΙΛΕΥΣΕΙ ΕΠΙ ΤΟΝ ΟΙΚΟΝ ΙΑΚΩΒ ΕΙΣ ΤΟΥΣ ΑΙΩΝΑΣ ΚΑΙ ΤΗΣ ΒΑΣΙΛΕΙΑΣ ΑΥΤΟΥ ΟΥΚ ΕΣΤΑΙ ΤΕΛΟΣ
1,34,ΕΙΠΕΝ ΔΕ ΜΑΡΙΑΜ ΠΡΟΣ ΤΟΝ ΑΓΓΕΛΟΝ ΠΩΣ ΕΣΤΑΙ ΤΟΥΤΟ ΕΠΕΙ ΑΝΔΡΑ ΟΥ ΓΙΝΩΣΚΩ
1,35,ΚΑΙ ΑΠΟΚΡΙΘΕΙΣ Ο ΑΓΓΕΛΟΣ ΕΙΠΕΝ ΑΥΤΗΙ ΠΝΕΥΜΑ ΑΓΙΟΝ ΕΠΕΛΕΥΣΕΤΑΙ ΕΠΙ ΣΕ ΚΑΙ ΔΥΝΑΜΙΣ ΥΨΙΣΤΟΥ ΕΠΙΣΚΙΑΣΕΙ ΣΟΙ ΔΙΟ ΚΑΙ ΤΟ ΓΕΝΝΩΜΕΝΟΝ ΑΓΙΟΝ ΚΛΗΘΗΣΕΤΑΙ ΥΙΟΣ ΘΕΟΥ
1,36,ΚΑΙ ΙΔΟΥ ΕΛΕΙΣΑΒΕΤ Η ΣΥΓΓΕΝΙΣ ΣΟΥ ΚΑΙ ΑΥΤΗ ΣΥΝΕΙΛΗΦΕΝ ΥΙΟΝ ΕΝ ΓΗΡΕΙ ΑΥΤΗΣ ΚΑΙ ΟΥΤΟΣ ΜΗΝ ΕΚΤΟΣ ΕΣΤΙΝ ΑΥΤΗΙ ΤΗΙ ΚΑΛΟΥΜΕΝΗΙ ΣΤΕΙΡΑΙ
1,37,ΟΤΙ ΟΥΚ ΑΔΥΝΑΤΗΣΕΙ ΠΑΡΑ ΤΟΥ ΘΕΟΥ ΠΑΝ ΡΗΜΑ
1,38,ΕΙΠΕΝ ΔΕ ΜΑΡΙΑΜ ΙΔΟΥ Η ΔΟΥΛΗ ΚΥΡΙΟΥ ΓΕΝΟΙΤΟ ΜΟΙ ΚΑΤΑ ΤΟ ΡΗΜΑ ΣΟΥ ΚΑΙ ΑΠΗΛΘΕΝ ΑΠΟ ΑΥΤΗΣ Ο ΑΓΓΕΛΟΣ
1,39,ΑΝΑΣΤΑΣΑ ΔΕ ΜΑΡΙΑΜ ΕΝ ΤΑΙΣ ΗΜΕΡΑΙΣ ΤΑΥΤΑΙΣ ΕΠΟΡΕΥΘΗ ΕΙΣ ΤΗΝ ΟΡΙΝΗΝ ΜΕΤΑ ΣΠΟΥΔΗΣ ΕΙΣ ΠΟΛΙΝ ΙΟΥΔΑ
1,40,ΚΑΙ ΕΙΣΗΛΘΕΝ ΕΙΣ ΤΟΝ ΟΙΚΟΝ ΖΑΧΑΡΙΟΥ ΚΑΙ ΗΣΠΑΣΑΤΟ ΤΗΝ ΕΛΕΙΣΑΒΕΤ
1,41,ΚΑΙ ΕΓΕΝΕΤΟ ΩΣ ΗΚΟΥΣΕΝ ΤΟΝ ΑΣΠΑΣΜΟΝ ΤΗΣ ΜΑΡΙΑΣ Η ΕΛΕΙΣΑΒΕΤ ΕΣΚΙΡΤΗΣΕΝ ΤΟ ΒΡΕΦΟΣ ΕΝ ΤΗΙ ΚΟΙΛΙΑΙ ΑΥΤΗΣ ΚΑΙ ΕΠΛΗΣΘΗ ΠΝΕΥΜΑΤΟΣ ΑΓΙΟΥ Η ΕΛΕΙΣΑΒΕΤ
1,42,ΚΑΙ ΑΝΕΦΩΝΗΣΕΝ ΦΩΝΗΙ ΜΕΓΑΛΗΙ ΚΑΙ ΕΙΠΕΝ ΕΥΛΟΓΗΜΕΝΗ ΣΥ ΕΝ ΓΥΝΑΙΞΙΝ ΚΑΙ ΕΥΛΟΓΗΜΕΝΟΣ Ο ΚΑΡΠΟΣ ΤΗΣ ΚΟΙΛΙΑΣ ΣΟΥ
1,43,ΚΑΙ ΠΟΘΕΝ ΜΟΙ ΤΟΥΤΟ ΙΝΑ ΕΛΘΗΙ Η ΜΗΤΗΡ ΤΟΥ ΚΥΡΙΟΥ ΜΟΥ ΠΡΟΣ ΕΜΕ
1,44,ΙΔΟΥ ΓΑΡ ΩΣ ΕΓΕΝΕΤΟ Η ΦΩΝΗ ΤΟΥ ΑΣΠΑΣΜΟΥ ΣΟΥ ΕΙΣ ΤΑ ΩΤΑ ΜΟΥ ΕΣΚΙΡΤΗΣΕΝ ΕΝ ΑΓΑΛΛΙΑΣΕΙ ΤΟ ΒΡΕΦΟΣ ΕΝ ΤΗΙ ΚΟΙΛΙΑΙ ΜΟΥ
1,45,ΚΑΙ ΜΑΚΑΡΙΑ Η ΠΙΣΤΕΥΣΑΣΑ ΟΤΙ ΕΣΤΑΙ ΤΕΛΕΙΩΣΙΣ ΤΟΙΣ ΛΕΛΑΛΗΜΕΝΟΙΣ ΑΥΤΗΙ ΠΑΡΑ ΚΥΡΙΟΥ
1,46,ΚΑΙ ΕΙΠΕΝ ΜΑΡΙΑΜ ΜΕΓΑΛΥΝΕΙ Η ΨΥΧΗ ΜΟΥ ΤΟΝ ΚΥΡΙΟΝ
1,47,ΚΑΙ ΗΓΑΛΛΙΑΣΕΝ ΤΟ ΠΝΕΥΜΑ ΜΟΥ ΕΠΙ ΤΩΙ ΘΕΩΙ ΤΩΙ ΣΩΤΗΡΙ ΜΟΥ
1,48,ΟΤΙ ΕΠΕΒΛΕΨΕΝ ΕΠΙ ΤΗΝ ΤΑΠΕΙΝΩΣΙΝ ΤΗΣ ΔΟΥΛΗΣ ΑΥΤΟΥ ΙΔΟΥ ΓΑΡ ΑΠΟ ΤΟΥ ΝΥΝ ΜΑΚΑΡΙΟΥΣΙΝ ΜΕ ΠΑΣΑΙ ΑΙ ΓΕΝΕΑΙ
1,49,ΟΤΙ ΕΠΟΙΗΣΕΝ ΜΟΙ ΜΕΓΑΛΑ Ο ΔΥΝΑΤΟΣ ΚΑΙ ΑΓΙΟΝ ΤΟ ΟΝΟΜΑ ΑΥΤΟΥ
1,50,ΚΑΙ ΤΟ ΕΛΕΟΣ ΑΥΤΟΥ ΕΙΣ ΓΕΝΕΑΣ ΚΑΙ ΓΕΝΕΑΣ ΤΟΙΣ ΦΟΒΟΥΜΕΝΟΙΣ ΑΥΤΟΝ
1,51,ΕΠΟΙΗΣΕΝ ΚΡΑΤΟΣ ΕΝ ΒΡΑΧΙΟΝΙ ΑΥΤΟΥ ΔΙΕΣΚΟΡΠΙΣΕΝ ΥΠΕΡΗΦΑΝΟΥΣ ΔΙΑΝΟΙΑΙ ΚΑΡΔΙΑΣ ΑΥΤΩΝ
1,52,ΚΑΘΕΙΛΕΝ ΔΥΝΑΣΤΑΣ ΑΠΟ ΘΡΟΝΩΝ ΚΑΙ ΥΨΩΣΕΝ ΤΑΠΕΙΝΟΥΣ
1,53,ΠΕΙΝΩΝΤΑΣ ΕΝΕΠΛΗΣΕΝ ΑΓΑΘΩΝ ΚΑΙ ΠΛΟΥΤΟΥΝΤΑΣ ΕΞΑΠΕΣΤΕΙΛΕΝ ΚΕΝΟΥΣ
1,54,ΑΝΤΕΛΑΒΕΤΟ ΙΣΡΑΗΛ ΠΑΙΔΟΣ ΑΥΤΟΥ ΜΝΗΣΘΗΝΑΙ ΕΛΕΟΥΣ
1,55,ΚΑΘΩΣ ΕΛΑΛΗΣΕΝ ΠΡΟΣ ΤΟΥΣ ΠΑΤΕΡΑΣ ΗΜΩΝ ΤΩΙ ΑΒΡΑΑΜ ΚΑΙ ΤΩΙ ΣΠΕΡΜΑΤΙ ΑΥΤΟΥ ΕΙΣ ΤΟΝ ΑΙΩΝΑ
1,56,ΕΜΕΙΝΕΝ ΔΕ ΜΑΡΙΑΜ ΣΥΝ ΑΥΤΗΙ ΩΣ ΜΗΝΑΣ ΤΡΕΙΣ ΚΑΙ ΥΠΕΣΤΡΕΨΕΝ ΕΙΣ ΤΟΝ ΟΙΚΟΝ ΑΥΤΗΣ
1,57,ΤΗΙ ΔΕ ΕΛΕΙΣΑΒΕΤ ΕΠΛΗΣΘΗ Ο ΧΡΟΝΟΣ ΤΟΥ ΤΕΚΕΙΝ ΑΥΤΗΝ ΚΑΙ ΕΓΕΝΝΗΣΕΝ ΥΙΟΝ
1,58,ΚΑΙ ΗΚΟΥΣΑΝ ΟΙ ΠΕΡΙΟΙΚΟΙ ΚΑΙ ΟΙ ΣΥΓΓΕΝΕΙΣ ΑΥΤΗΣ ΟΤΙ ΕΜΕΓΑΛΥΝΕΝ ΚΥΡΙΟΣ ΤΟ ΕΛΕΟΣ ΑΥΤΟΥ ΜΕΤΑ ΑΥΤΗΣ ΚΑΙ ΣΥΝΕΧΑΙΡΟΝ ΑΥΤΗΙ
1,59,ΚΑΙ ΕΓΕΝΕΤΟ ΕΝ ΤΗΙ ΗΜΕΡΑΙ ΤΗΙ ΟΓΔΟΗΙ ΗΛΘΟΝ ΠΕΡΙΤΕΜΕΙΝ ΤΟ ΠΑΙΔΙΟΝ ΚΑΙ ΕΚΑΛΟΥΝ ΑΥΤΟ ΕΠΙ ΤΩΙ ΟΝΟΜΑΤΙ ΤΟΥ ΠΑΤΡΟΣ ΑΥΤΟΥ ΖΑΧΑΡΙΑΝ
1,60,ΚΑΙ ΑΠΟΚΡΙΘΕΙΣΑ Η ΜΗΤΗΡ ΑΥΤΟΥ ΕΙΠΕΝ ΟΥΧΙ ΑΛΛΑ ΚΛΗΘΗΣΕΤΑΙ ΙΩΑΝΝΗΣ
1,61,ΚΑΙ ΕΙΠΑΝ ΠΡΟΣ ΑΥΤΗΝ ΟΤΙ ΟΥΔΕΙΣ ΕΣΤΙΝ ΕΚ ΤΗΣ ΣΥΓΓΕΝΕΙΑΣ ΣΟΥ ΟΣ ΚΑΛΕΙΤΑΙ ΤΩΙ ΟΝΟΜΑΤΙ ΤΟΥΤΩΙ
1,62,ΕΝΕΝΕΥΟΝ ΔΕ ΤΩΙ ΠΑΤΡΙ ΑΥΤΟΥ ΤΟ ΤΙ ΑΝ ΘΕΛΟΙ ΚΑΛΕΙΣΘΑΙ ΑΥΤΟ
1,63,ΚΑΙ ΑΙΤΗΣΑΣ ΠΙΝΑΚΙΔΙΟΝ ΕΓΡΑΨΕΝ ΛΕΓΩΝ ΙΩΑΝΝΗΣ ΕΣΤΙΝ ΟΝΟΜΑ ΑΥΤΟΥ ΚΑΙ ΕΘΑΥΜΑΣΑΝ ΠΑΝΤΕΣ
1,64,ΑΝΕΩΙΧΘΗ ΔΕ ΤΟ ΣΤΟΜΑ ΑΥΤΟΥ ΠΑΡΑΧΡΗΜΑ ΚΑΙ Η ΓΛΩΣΣΑ ΑΥΤΟΥ ΚΑΙ ΕΛΑΛΕΙ ΕΥΛΟΓΩΝ ΤΟΝ ΘΕΟΝ
1,65,ΚΑΙ ΕΓΕΝΕΤΟ ΕΠΙ ΠΑΝΤΑΣ ΦΟΒΟΣ ΤΟΥΣ ΠΕΡΙΟΙΚΟΥΝΤΑΣ ΑΥΤΟΥΣ ΚΑΙ ΕΝ ΟΛΗΙ ΤΗΙ ΟΡΕΙΝΗΙ ΤΗΣ ΙΟΥΔΑΙΑΣ ΔΙΕΛΑΛΕΙΤΟ ΠΑΝΤΑ ΤΑ ΡΗΜΑΤΑ ΤΑΥΤΑ
1,66,ΚΑΙ ΕΘΕΝΤΟ ΠΑΝΤΕΣ ΟΙ ΑΚΟΥΣΑΝΤΕΣ ΕΝ ΤΗΙ ΚΑΡΔΙΑΙ ΑΥΤΩΝ ΛΕΓΟΝΤΕΣ ΤΙ ΑΡΑ ΤΟ ΠΑΙΔΙΟΝ ΤΟΥΤΟ ΕΣΤΑΙ ΚΑΙ ΓΑΡ ΧΕΙΡ ΚΥΡΙΟΥ ΗΝ ΜΕΤΑ ΑΥΤΟΥ
1,67,ΚΑΙ ΖΑΧΑΡΙΑΣ Ο ΠΑΤΗΡ ΑΥΤΟΥ ΕΠΛΗΣΘΗ ΠΝΕΥΜΑΤΟΣ ΑΓΙΟΥ ΚΑΙ ΕΠΡΟΦΗΤΕΥΣΕΝ ΛΕΓΩΝ
1,68,ΕΥΛΟΓΗΤΟΣ ΚΥΡΙΟΣ Ο ΘΕΟΣ ΤΟΥ ΙΣΡΑΗΛ ΟΤΙ ΕΠΕΣΚΕΨΑΤΟ ΚΑΙ ΕΠΟΙΗΣΕΝ ΛΥΤΡΩΣΙΝ ΤΩΙ ΛΑΩΙ ΑΥΤΟΥ
1,69,ΚΑΙ ΗΓΕΙΡΕΝ ΚΕΡΑΣ ΣΩΤΗΡΙΑΣ ΗΜΙΝ ΕΝ ΟΙΚΩΙ ΔΑΥΕΙΔ ΠΑΙΔΟΣ ΑΥΤΟΥ
1,70,ΚΑΘΩΣ ΕΛΑΛΗΣΕΝ ΔΙΑ ΣΤΟΜΑΤΟΣ ΤΩΝ ΑΓΙΩΝ ΑΠΟ ΑΙΩΝΟΣ ΠΡΟΦΗΤΩΝ ΑΥΤΟΥ
1,71,ΣΩΤΗΡΙΑΝ ΕΞ ΕΧΘΡΩΝ ΗΜΩΝ ΚΑΙ ΕΚ ΧΕΙΡΟΣ ΠΑΝΤΩΝ ΤΩΝ ΜΙΣΟΥΝΤΩΝ ΗΜΑΣ
1,72,ΠΟΙΗΣΑΙ ΕΛΕΟΣ ΜΕΤΑ ΤΩΝ ΠΑΤΕΡΩΝ ΗΜΩΝ ΚΑΙ ΜΝΗΣΘΗΝΑΙ ΔΙΑΘΗΚΗΣ ΑΓΙΑΣ ΑΥΤΟΥ
1,73,ΟΡΚΟΝ ΟΝ ΩΜΟΣΕΝ ΠΡΟΣ ΑΒΡΑΑΜ ΤΟΝ ΠΑΤΕΡΑ ΗΜΩΝ ΤΟΥ ΔΟΥΝΑΙ ΗΜΙΝ
1,74,ΑΦΟΒΩΣ ΕΚ ΧΕΙΡΟΣ ΕΧΘΡΩΝ ΡΥΣΘΕΝΤΑΣ ΛΑΤΡΕΥΕΙΝ ΑΥΤΩΙ
1,75,ΕΝ ΟΣΙΟΤΗΤΙ ΚΑΙ ΔΙΚΑΙΟΣΥΝΗΙ ΕΝΩΠΙΟΝ ΑΥΤΟΥ ΠΑΣΑΙΣ ΤΑΙΣ ΗΜΕΡΑΙΣ ΗΜΩΝ
1,76,ΚΑΙ ΣΥ ΔΕ ΠΑΙΔΙΟΝ ΠΡΟΦΗΤΗΣ ΥΨΙΣΤΟΥ ΚΛΗΘΗΣΗΙ ΠΡΟΠΟΡΕΥΣΗΙ ΓΑΡ ΕΝΩΠΙΟΝ ΚΥΡΙΟΥ ΕΤΟΙΜΑΣΑΙ ΟΔΟΥΣ ΑΥΤΟΥ
1,77,ΤΟΥ ΔΟΥΝΑΙ ΓΝΩΣΙΝ ΣΩΤΗΡΙΑΣ ΤΩΙ ΛΑΩΙ ΑΥΤΟΥ ΕΝ ΑΦΕΣΕΙ ΑΜΑΡΤΙΩΝ ΑΥΤΩΝ
1,78,ΔΙΑ ΣΠΛΑΓΧΝΑ ΕΛΕΟΥΣ ΘΕΟΥ ΗΜΩΝ ΕΝ ΟΙΣ ΕΠΙΣΚΕΨΕΤΑΙ ΗΜΑΣ ΑΝΑΤΟΛΗ ΕΞ ΥΨΟΥΣ
1,79,ΕΠΙΦΑΝΑΙ ΤΟΙΣ ΕΝ ΣΚΟΤΕΙ ΚΑΙ ΣΚΙΑΙ ΘΑΝΑΤΟΥ ΚΑΘΗΜΕΝΟΙΣ ΤΟΥ ΚΑΤΕΥΘΥΝΑΙ ΤΟΥΣ ΠΟΔΑΣ ΗΜΩΝ ΕΙΣ ΟΔΟΝ ΕΙΡΗΝΗΣ
1,80,ΤΟ ΔΕ ΠΑΙΔΙΟΝ ΗΥΞΑΝΕ ΚΑΙ ΕΚΡΑΤΑΙΟΥΤΟ ΠΝΕΥΜΑΤΙ ΚΑΙ ΗΝ ΕΝ ΤΑΙΣ ΕΡΗΜΟΙΣ ΕΩΣ ΗΜΕΡΑΣ ΑΝΑΔΕΙΞΕΩΣ ΑΥΤΟΥ ΠΡΟΣ ΤΟΝ ΙΣΡΑΗΛ
2,1,ΕΓΕΝΕΤΟ ΔΕ ΕΝ ΤΑΙΣ ΗΜΕΡΑΙΣ ΕΚΕΙΝΑΙΣ ΕΞΗΛΘΕΝ ΔΟΓΜΑ ΠΑΡΑ ΚΑΙΣΑΡΟΣ ΑΥΓΟΥΣΤΟΥ ΑΠΟΓΡΑΦΕΣΘΑΙ ΠΑΣΑΝ ΤΗΝ ΟΙΚΟΥΜΕΝΗΝ
2,2,ΑΥΤΗ ΑΠΟΓΡΑΦΗ ΠΡΩΤΗ ΕΓΕΝΕΤΟ ΗΓΕΜΟΝΕΥΟΝΤΟΣ ΤΗΣ ΣΥΡΙΑΣ ΚΥΡΗΝΙΟΥ
2,3,ΚΑΙ ΕΠΟΡΕΥΟΝΤΟ ΠΑΝΤΕΣ ΑΠΟΓΡΑΦΕΣΘΑΙ ΕΚΑΣΤΟΣ ΕΙΣ ΤΗΝ ΕΑΥΤΟΥ ΠΟΛΙΝ
2,4,ΑΝΕΒΗ ΔΕ ΚΑΙ ΙΩΣΗΦ ΑΠΟ ΤΗΣ ΓΑΛΙΛΑΙΑΣ ΕΚ ΠΟΛΕΩΣ ΝΑΖΑΡΕΘ ΕΙΣ ΤΗΝ ΙΟΥΔΑΙΑΝ ΕΙΣ ΠΟΛΙΝ ΔΑΥΕΙΔ ΗΤΙΣ ΚΑΛΕΙΤΑΙ ΒΗΘΛΕΕΜ ΔΙΑ ΤΟ ΕΙΝΑΙ ΑΥΤΟΝ ΕΞ ΟΙΚΟΥ ΚΑΙ ΠΑΤΡΙΑΣ ΔΑΥΕΙΔ
2,5,ΑΠΟΓΡΑΨΑΣΘΑΙ ΣΥΝ ΜΑΡΙΑΜ ΤΗΙ ΕΜΝΗΣΤΕΥΜΕΝΗΙ ΑΥΤΩΙ ΟΥΣΗΙ ΕΝΚΥΩΙ
2,6,ΕΓΕΝΕΤΟ ΔΕ ΕΝ ΤΩΙ ΕΙΝΑΙ ΑΥΤΟΥΣ ΕΚΕΙ ΕΠΛΗΣΘΗΣΑΝ ΑΙ ΗΜΕΡΑΙ ΤΟΥ ΤΕΚΕΙΝ ΑΥΤΗΝ
2,7,ΚΑΙ ΕΤΕΚΕΝ ΤΟΝ ΥΙΟΝ ΑΥΤΗΣ ΤΟΝ ΠΡΩΤΟΤΟΚΟΝ ΚΑΙ ΕΣΠΑΡΓΑΝΩΣΕΝ ΑΥΤΟΝ ΚΑΙ ΑΝΕΚΛΙΝΕΝ ΑΥΤΟΝ ΕΝ ΦΑΤΝΗΙ ΔΙΟΤΙ ΟΥΚ ΗΝ ΑΥΤΟΙΣ ΤΟΠΟΣ ΕΝ ΤΩΙ ΚΑΤΑΛΥΜΑΤΙ
2,8,ΚΑΙ ΠΟΙΜΕΝΕΣ ΗΣΑΝ ΕΝ ΤΗΙ ΧΩΡΑΙ ΤΗΙ ΑΥΤΗΙ ΑΓΡΑΥΛΟΥΝΤΕΣ ΚΑΙ ΦΥΛΑΣΣΟΝΤΕΣ ΦΥΛΑΚΑΣ ΤΗΣ ΝΥΚΤΟΣ ΕΠΙ ΤΗΝ ΠΟΙΜΝΗΝ ΑΥΤΩΝ
2,9,ΚΑΙ ΑΓΓΕΛΟΣ ΚΥΡΙΟΥ ΕΠΕΣΤΗ ΑΥΤΟΙΣ ΚΑΙ ΔΟΞΑ ΚΥΡΙΟΥ ΠΕΡΙΕΛΑΜΨΕΝ ΑΥΤΟΥΣ ΚΑΙ ΕΦΟΒΗΘΗΣΑΝ ΦΟΒΟΝ ΜΕΓΑΝ
2,10,ΚΑΙ ΕΙΠΕΝ ΑΥΤΟΙΣ Ο ΑΓΓΕΛΟΣ ΜΗ ΦΟΒΕΙΣΘΕ ΙΔΟΥ ΓΑΡ ΕΥΑΓΓΕΛΙΖΟΜΑΙ ΥΜΙΝ ΧΑΡΑΝ ΜΕΓΑΛΗΝ ΗΤΙΣ ΕΣΤΑΙ ΠΑΝΤΙ ΤΩΙ ΛΑΩΙ
2,11,ΟΤΙ ΕΤΕΧΘΗ ΥΜΙΝ ΣΗΜΕΡΟΝ ΣΩΤΗΡ ΟΣ ΕΣΤΙΝ ΧΡΙΣΤΟΣ ΚΥΡΙΟΣ ΕΝ ΠΟΛΕΙ ΔΑΥΕΙΔ
2,12,ΚΑΙ ΤΟΥΤΟ ΥΜΙΝ ΤΟ ΣΗΜΕΙΟΝ ΕΥΡΗΣΕΤΕ ΒΡΕΦΟΣ ΕΣΠΑΡΓΑΝΩΜΕΝΟΝ ΚΑΙ ΚΕΙΜΕΝΟΝ ΕΝ ΦΑΤΝΗΙ
2,13,ΚΑΙ ΕΞΑΙΦΝΗΣ ΕΓΕΝΕΤΟ ΣΥΝ ΤΩΙ ΑΓΓΕΛΩΙ ΠΛΗΘΟΣ ΣΤΡΑΤΙΑΣ ΟΥΡΑΝΙΟΥ ΑΙΝΟΥΝΤΩΝ ΤΟΝ ΘΕΟΝ ΚΑΙ ΛΕΓΟΝΤΩΝ
2,14,ΔΟΞΑ ΕΝ ΥΨΙΣΤΟΙΣ ΘΕΩΙ ΚΑΙ ΕΠΙ ΓΗΣ ΕΙΡΗΝΗ ΕΝ ΑΝΘΡΩΠΟΙΣ ΕΥΔΟΚΙΑΣ
2,15,ΚΑΙ ΕΓΕΝΕΤΟ ΩΣ ΑΠΗΛΘΟΝ ΑΠΟ ΑΥΤΩΝ ΕΙΣ ΤΟΝ ΟΥΡΑΝΟΝ ΟΙ ΑΓΓΕΛΟΙ ΟΙ ΠΟΙΜΕΝΕΣ ΕΛΑΛΟΥΝ ΠΡΟΣ ΑΛΛΗΛΟΥΣ ΔΙΕΛΘΩΜΕΝ ΔΗ ΕΩΣ ΒΗΘΛΕΕΜ ΚΑΙ ΙΔΩΜΕΝ ΤΟ ΡΗΜΑ ΤΟΥΤΟ ΤΟ ΓΕΓΟΝΟΣ Ο Ο ΚΥΡΙΟΣ ΕΓΝΩΡΙΣΕΝ ΗΜΙΝ
2,16,ΚΑΙ ΗΛΘΟΝ ΣΠΕΥΣΑΝΤΕΣ ΚΑΙ ΑΝΕΥΡΟΝ ΤΗΝ ΤΕ ΜΑΡΙΑΜ ΚΑΙ ΤΟΝ ΙΩΣΗΦ ΚΑΙ ΤΟ ΒΡΕΦΟΣ ΚΕΙΜΕΝΟΝ ΕΝ ΤΗΙ ΦΑΤΝΗΙ
2,17,ΙΔΟΝΤΕΣ ΔΕ ΕΓΝΩΡΙΣΑΝ ΠΕΡΙ ΤΟΥ ΡΗΜΑΤΟΣ ΤΟΥ ΛΑΛΗΘΕΝΤΟΣ ΑΥΤΟΙΣ ΠΕΡΙ ΤΟΥ ΠΑΙΔΙΟΥ ΤΟΥΤΟΥ
2,18,ΚΑΙ ΠΑΝΤΕΣ ΟΙ ΑΚΟΥΣΑΝΤΕΣ ΕΘΑΥΜΑΣΑΝ ΠΕΡΙ ΤΩΝ ΛΑΛΗΘΕΝΤΩΝ ΥΠΟ ΤΩΝ ΠΟΙΜΕΝΩΝ ΠΡΟΣ ΑΥΤΟΥΣ
2,19,Η ΔΕ ΜΑΡΙΑ ΠΑΝΤΑ ΣΥΝΕΤΗΡΕΙ ΤΑ ΡΗΜΑΤΑ ΤΑΥΤΑ ΣΥΜΒΑΛΛΟΥΣΑ ΕΝ ΤΗΙ ΚΑΡΔΙΑΙ ΑΥΤΗΣ
2,20,ΚΑΙ ΥΠΕΣΤΡΕΨΑΝ ΟΙ ΠΟΙΜΕΝΕΣ ΔΟΞΑΖΟΝΤΕΣ ΚΑΙ ΑΙΝΟΥΝΤΕΣ ΤΟΝ ΘΕΟΝ ΕΠΙ ΠΑΣΙΝ ΟΙΣ ΗΚΟΥΣΑΝ ΚΑΙ ΕΙΔΟΝ ΚΑΘΩΣ ΕΛΑΛΗΘΗ ΠΡΟΣ ΑΥΤΟΥΣ
2,21,ΚΑΙ ΟΤΕ ΕΠΛΗΣΘΗΣΑΝ ΗΜΕΡΑΙ ΟΚΤΩ ΤΟΥ ΠΕΡΙΤΕΜΕΙΝ ΑΥΤΟΝ ΚΑΙ ΕΚΛΗΘΗ ΤΟ ΟΝΟΜΑ ΑΥΤΟΥ ΙΗΣΟΥΣ ΤΟ ΚΛΗΘΕΝ ΥΠΟ ΤΟΥ ΑΓΓΕΛΟΥ ΠΡΟ ΤΟΥ ΣΥΝΛΗΜΦΘΗΝΑΙ ΑΥΤΟΝ ΕΝ ΤΗΙ ΚΟΙΛΙΑΙ
2,22,ΚΑΙ ΟΤΕ ΕΠΛΗΣΘΗΣΑΝ ΑΙ ΗΜΕΡΑΙ ΤΟΥ ΚΑΘΑΡΙΣΜΟΥ ΑΥΤΩΝ ΚΑΤΑ ΤΟΝ ΝΟΜΟΝ ΜΩΥΣΕΩΣ ΑΝΗΓΑΓΟΝ ΑΥΤΟΝ ΕΙΣ ΙΕΡΟΣΟΛΥΜΑ ΠΑΡΑΣΤΗΣΑΙ ΤΩΙ ΚΥΡΙΩΙ
2,23,ΚΑΘΩΣ ΓΕΓΡΑΠΤΑΙ ΕΝ ΝΟΜΩΙ ΚΥΡΙΟΥ ΟΤΙ ΠΑΝ ΑΡΣΕΝ ΔΙΑΝΟΙΓΟΝ ΜΗΤΡΑΝ ΑΓΙΟΝ ΤΩΙ ΚΥΡΙΩΙ ΚΛΗΘΗΣΕΤΑΙ
2,24,ΚΑΙ ΤΟΥ ΔΟΥΝΑΙ ΘΥΣΙΑΝ ΚΑΤΑ ΤΟ ΕΙΡΗΜΕΝΟΝ ΕΝ ΤΩΙ ΝΟΜΩΙ ΚΥΡΙΟΥ ΖΕΥΓΟΣ ΤΡΥΓΟΝΩΝ Η ΔΥΟ ΝΟΣΣΟΥΣ ΠΕΡΙΣΤΕΡΩΝ
2,25,ΚΑΙ ΙΔΟΥ ΑΝΘΡΩΠΟΣ ΗΝ ΕΝ ΙΕΡΟΥΣΑΛΗΜ ΩΙ ΟΝΟΜΑ ΣΥΜΕΩΝ ΚΑΙ Ο ΑΝΘΡΩΠΟΣ ΟΥΤΟΣ ΔΙΚΑΙΟΣ ΚΑΙ ΕΥΛΑΒΗΣ ΠΡΟΣΔΕΧΟΜΕΝΟΣ ΠΑΡΑΚΛΗΣΙΝ ΤΟΥ ΙΣΡΑΗΛ ΚΑΙ ΠΝΕΥΜΑ ΗΝ ΑΓΙΟΝ ΕΠΙ ΑΥΤΟΝ
2,26,ΚΑΙ ΗΝ ΑΥΤΩΙ ΚΕΧΡΗΜΑΤΙΣΜΕΝΟΝ ΥΠΟ ΤΟΥ ΠΝΕΥΜΑΤΟΣ ΤΟΥ ΑΓΙΟΥ ΜΗ ΙΔΕΙΝ ΘΑΝΑΤΟΝ ΠΡΙΝ ΑΝ ΙΔΗΙ ΤΟΝ ΧΡΙΣΤΟΝ ΚΥΡΙΟΥ
2,27,ΚΑΙ ΗΛΘΕΝ ΕΝ ΤΩΙ ΠΝΕΥΜΑΤΙ ΕΙΣ ΤΟ ΙΕΡΟΝ ΚΑΙ ΕΝ ΤΩΙ ΕΙΣΑΓΑΓΕΙΝ ΤΟΥΣ ΓΟΝΕΙΣ ΤΟ ΠΑΙΔΙΟΝ ΙΗΣΟΥΝ ΤΟΥ ΠΟΙΗΣΑΙ ΑΥΤΟΥΣ ΚΑΤΑ ΤΟ ΕΙΘΙΣΜΕΝΟΝ ΤΟΥ ΝΟΜΟΥ ΠΕΡΙ ΑΥΤΟΥ
2,28,ΚΑΙ ΑΥΤΟΣ ΕΔΕΞΑΤΟ ΑΥΤΟ ΕΙΣ ΤΑΣ ΑΓΚΑΛΑΣ ΚΑΙ ΕΥΛΟΓΗΣΕΝ ΤΟΝ ΘΕΟΝ ΚΑΙ ΕΙΠΕΝ
2,29,ΝΥΝ ΑΠΟΛΥΕΙΣ ΤΟΝ ΔΟΥΛΟΝ ΣΟΥ ΔΕΣΠΟΤΑ ΚΑΤΑ ΤΟ ΡΗΜΑ ΣΟΥ ΕΝ ΕΙΡΗΝΗΙ
2,30,ΟΤΙ ΕΙΔΟΝ ΟΙ ΟΦΘΑΛΜΟΙ ΜΟΥ ΤΟ ΣΩΤΗΡΙΟΝ ΣΟΥ
2,31,Ο ΗΤΟΙΜΑΣΑΣ ΚΑΤΑ ΠΡΟΣΩΠΟΝ ΠΑΝΤΩΝ ΤΩΝ ΛΑΩΝ
2,32,ΦΩΣ ΕΙΣ ΑΠΟΚΑΛΥΨΙΝ ΕΘΝΩΝ ΚΑΙ ΔΟΞΑΝ ΛΑΟΥ ΣΟΥ ΙΣΡΑΗΛ
2,33,ΚΑΙ ΗΝ Ο ΠΑΤΗΡ ΑΥΤΟΥ ΚΑΙ Η ΜΗΤΗΡ ΘΑΥΜΑΖΟΝΤΕΣ ΕΠΙ ΤΟΙΣ ΛΑΛΟΥΜΕΝΟΙΣ ΠΕΡΙ ΑΥΤΟΥ
2,34,ΚΑΙ ΕΥΛΟΓΗΣΕΝ ΑΥΤΟΥΣ ΣΥΜΕΩΝ ΚΑΙ ΕΙΠΕΝ ΠΡΟΣ ΜΑΡΙΑΜ ΤΗΝ ΜΗΤΕΡΑ ΑΥΤΟΥ ΙΔΟΥ ΟΥΤΟΣ ΚΕΙΤΑΙ ΕΙΣ ΠΤΩΣΙΝ ΚΑΙ ΑΝΑΣΤΑΣΙΝ ΠΟΛΛΩΝ ΕΝ ΤΩΙ ΙΣΡΑΗΛ ΚΑΙ ΕΙΣ ΣΗΜΕΙΟΝ ΑΝΤΙΛΕΓΟΜΕΝΟΝ
2,35,ΚΑΙ ΣΟΥ ΔΕ ΑΥΤΗΣ ΤΗΝ ΨΥΧΗΝ ΔΙΕΛΕΥΣΕΤΑΙ ΡΟΜΦΑΙΑ ΟΠΩΣ ΑΝ ΑΠΟΚΑΛΥΦΘΩΣΙΝ ΕΚ ΠΟΛΛΩΝ ΚΑΡΔΙΩΝ ΔΙΑΛΟΓΙΣΜΟΙ
2,36,ΚΑΙ ΗΝ ΑΝΝΑ ΠΡΟΦΗΤΙΣ ΘΥΓΑΤΗΡ ΦΑΝΟΥΗΛ ΕΚ ΦΥΛΗΣ ΑΣΗΡ ΑΥΤΗ ΠΡΟΒΕΒΗΚΥΙΑ ΕΝ ΗΜΕΡΑΙΣ ΠΟΛΛΑΙΣ ΖΗΣΑΣΑ ΜΕΤΑ ΑΝΔΡΟΣ ΕΤΗ ΕΠΤΑ ΑΠΟ ΤΗΣ ΠΑΡΘΕΝΙΑΣ ΑΥΤΗΣ
2,37,ΚΑΙ ΑΥΤΗ ΧΗΡΑ ΕΩΣ ΕΤΩΝ ΟΓΔΟΗΚΟΝΤΑ ΤΕΣΣΑΡΩΝ Η ΟΥΚ ΑΦΙΣΤΑΤΟ ΤΟΥ ΙΕΡΟΥ ΝΗΣΤΕΙΑΙΣ ΚΑΙ ΔΕΗΣΕΣΙΝ ΛΑΤΡΕΥΟΥΣΑ ΝΥΚΤΑ ΚΑΙ ΗΜΕΡΑΝ
2,38,ΚΑΙ ΑΥΤΗΙ ΤΗΙ ΩΡΑΙ ΕΠΙΣΤΑΣΑ ΑΝΘΩΜΟΛΟΓΕΙΤΟ ΤΩΙ ΘΕΩΙ ΚΑΙ ΕΛΑΛΕΙ ΠΕΡΙ ΑΥΤΟΥ ΠΑΣΙΝ ΤΟΙΣ ΠΡΟΣΔΕΧΟΜΕΝΟΙΣ ΛΥΤΡΩΣΙΝ ΙΕΡΟΥΣΑΛΗΜ
2,39,ΚΑΙ ΩΣ ΕΤΕΛΕΣΑΝ ΠΑΝΤΑ ΤΑ ΚΑΤΑ ΤΟΝ ΝΟΜΟΝ ΚΥΡΙΟΥ ΕΠΕΣΤΡΕΨΑΝ ΕΙΣ ΤΗΝ ΓΑΛΙΛΑΙΑΝ ΕΙΣ ΠΟΛΙΝ ΕΑΥΤΩΝ ΝΑΖΑΡΕΤ
2,40,ΤΟ ΔΕ ΠΑΙΔΙΟΝ ΗΥΞΑΝΕΝ ΚΑΙ ΕΚΡΑΤΑΙΟΥΤΟ ΠΛΗΡΟΥΜΕΝΟΝ ΣΟΦΙΑΙ ΚΑΙ ΧΑΡΙΣ ΘΕΟΥ ΗΝ ΕΠΙ ΑΥΤΟ
2,41,ΚΑΙ ΕΠΟΡΕΥΟΝΤΟ ΟΙ ΓΟΝΕΙΣ ΑΥΤΟΥ ΚΑΤΑ ΕΤΟΣ ΕΙΣ ΙΕΡΟΥΣΑΛΗΜ ΤΗΙ ΕΟΡΤΗΙ ΤΟΥ ΠΑΣΧΑ
2,42,ΚΑΙ ΟΤΕ ΕΓΕΝΕΤΟ ΕΤΩΝ ΔΩΔΕΚΑ ΑΝΑΒΑΙΝΟΝΤΩΝ ΑΥΤΩΝ ΚΑΤΑ ΤΟ ΕΘΟΣ ΤΗΣ ΕΟΡΤΗΣ
2,43,ΚΑΙ ΤΕΛΕΙΩΣΑΝΤΩΝ ΤΑΣ ΗΜΕΡΑΣ ΕΝ ΤΩΙ ΥΠΟΣΤΡΕΦΕΙΝ ΑΥΤΟΥΣ ΥΠΕΜΕΙΝΕΝ ΙΗΣΟΥΣ Ο ΠΑΙΣ ΕΝ ΙΕΡΟΥΣΑΛΗΜ ΚΑΙ ΟΥΚ ΕΓΝΩΣΑΝ ΟΙ ΓΟΝΕΙΣ ΑΥΤΟΥ
2,44,ΝΟΜΙΣΑΝΤΕΣ ΔΕ ΑΥΤΟΝ ΕΙΝΑΙ ΕΝ ΤΗΙ ΣΥΝΟΔΙΑΙ ΗΛΘΟΝ ΗΜΕΡΑΣ ΟΔΟΝ ΚΑΙ ΑΝΕΖΗΤΟΥΝ ΑΥΤΟΝ ΕΝ ΤΟΙΣ ΣΥΓΓΕΝΕΥΣΙΝ ΚΑΙ ΤΟΙΣ ΓΝΩΣΤΟΙΣ
2,45,ΚΑΙ ΜΗ ΕΥΡΟΝΤΕΣ ΥΠΕΣΤΡΕΨΑΝ ΕΙΣ ΙΕΡΟΥΣΑΛΗΜ ΑΝΑΖΗΤΟΥΝΤΕΣ ΑΥΤΟΝ
2,46,ΚΑΙ ΕΓΕΝΕΤΟ ΜΕΤΑ ΗΜΕΡΑΣ ΤΡΕΙΣ ΕΥΡΟΝ ΑΥΤΟΝ ΕΝ ΤΩΙ ΙΕΡΩΙ ΚΑΘΕΖΟΜΕΝΟΝ ΕΝ ΜΕΣΩΙ ΤΩΝ ΔΙΔΑΣΚΑΛΩΝ ΚΑΙ ΑΚΟΥΟΝΤΑ ΑΥΤΩΝ ΚΑΙ ΕΠΕΡΩΤΩΝΤΑ ΑΥΤΟΥΣ
2,47,ΕΞΙΣΤΑΝΤΟ ΔΕ ΠΑΝΤΕΣ ΟΙ ΑΚΟΥΟΝΤΕΣ ΑΥΤΟΥ ΕΠΙ ΤΗΙ ΣΥΝΕΣΕΙ ΚΑΙ ΤΑΙΣ ΑΠΟΚΡΙΣΕΣΙΝ ΑΥΤΟΥ
2,48,ΚΑΙ ΙΔΟΝΤΕΣ ΑΥΤΟΝ ΕΞΕΠΛΑΓΗΣΑΝ ΚΑΙ ΕΙΠΕΝ ΠΡΟΣ ΑΥΤΟΝ Η ΜΗΤΗΡ ΑΥΤΟΥ ΤΕΚΝΟΝ ΤΙ ΕΠΟΙΗΣΑΣ ΗΜΙΝ ΟΥΤΩΣ ΙΔΟΥ Ο ΠΑΤΗΡ ΣΟΥ ΚΑΓΩ ΟΔΥΝΩΜΕΝΟΙ ΖΗΤΟΥΜΕΝ ΣΕ
2,49,ΚΑΙ ΕΙΠΕΝ ΠΡΟΣ ΑΥΤΟΥΣ ΤΙ ΟΤΙ ΕΖΗΤΕΙΤΕ ΜΕ ΟΥΚ ΗΙΔΕΙΤΕ ΟΤΙ ΕΝ ΤΟΙΣ ΤΟΥ ΠΑΤΡΟΣ ΜΟΥ ΔΕΙ ΕΙΝΑΙ ΜΕ
2,50,ΚΑΙ ΑΥΤΟΙ ΟΥ ΣΥΝΗΚΑΝ ΤΟ ΡΗΜΑ Ο ΕΛΑΛΗΣΕΝ ΑΥΤΟΙΣ
2,51,ΚΑΙ ΚΑΤΕΒΗ ΜΕΤΑ ΑΥΤΩΝ ΚΑΙ ΗΛΘΕΝ ΕΙΣ ΝΑΖΑΡΕΤ ΚΑΙ ΗΝ ΥΠΟΤΑΣΣΟΜΕΝΟΣ ΑΥΤΟΙΣ ΚΑΙ Η ΜΗΤΗΡ ΑΥΤΟΥ ΔΙΕΤΗΡΕΙ ΠΑΝΤΑ ΤΑ ΡΗΜΑΤΑ ΕΝ ΤΗΙ ΚΑΡΔΙΑΙ ΑΥΤΗΣ
2,52,ΚΑΙ ΙΗΣΟΥΣ ΠΡΟΕΚΟΠΤΕΝ ΤΗΙ ΣΟΦΙΑΙ ΚΑΙ ΗΛΙΚΙΑΙ ΚΑΙ ΧΑΡΙΤΙ ΠΑΡΑ ΘΕΩΙ ΚΑΙ ΑΝΘΡΩΠΟΙΣ
3,1,ΕΝ ΕΤΕΙ ΔΕ ΠΕΝΤΕΚΑΙΔΕΚΑΤΩΙ ΤΗΣ ΗΓΕΜΟΝΙΑΣ ΤΙΒΕΡΙΟΥ ΚΑΙΣΑΡΟΣ ΗΓΕΜΟΝΕΥΟΝΤΟΣ ΠΟΝΤΙΟΥ ΠΕΙΛΑΤΟΥ ΤΗΣ ΙΟΥΔΑΙΑΣ ΚΑΙ ΤΕΤΡΑΡΧΟΥΝΤΟΣ ΤΗΣ ΓΑΛΙΛΑΙΑΣ ΗΡΩΙΔΟΥ ΦΙΛΙΠΠΟΥ ΔΕ ΤΟΥ ΑΔΕΛΦΟΥ ΑΥΤΟΥ ΤΕΤΡΑΡΧΟΥΝΤΟΣ ΤΗΣ ΙΤΟΥΡΑΙΑΣ ΚΑΙ ΤΡΑΧΩΝΙΤΙΔΟΣ ΧΩΡΑΣ ΚΑΙ ΛΥΣΑΝΙΟΥ ΤΗΣ ΑΒΕΙΛΗΝΗΣ ΤΕΤΡΑΡΧΟΥΝΤΟΣ
3,2,ΕΠΙ ΑΡΧΙΕΡΕΩΣ ΑΝΝΑ ΚΑΙ ΚΑΙΑΦΑ ΕΓΕΝΕΤΟ ΡΗΜΑ ΘΕΟΥ ΕΠΙ ΙΩΑΝΝΗΝ ΤΟΝ ΖΑΧΑΡΙΟΥ ΥΙΟΝ ΕΝ ΤΗΙ ΕΡΗΜΩΙ
3,3,ΚΑΙ ΗΛΘΕΝ ΕΙΣ ΠΑΣΑΝ ΠΕΡΙΧΩΡΟΝ ΤΟΥ ΙΟΡΔΑΝΟΥ ΚΗΡΥΣΣΩΝ ΒΑΠΤΙΣΜΑ ΜΕΤΑΝΟΙΑΣ ΕΙΣ ΑΦΕΣΙΝ ΑΜΑΡΤΙΩΝ
3,4,ΩΣ ΓΕΓΡΑΠΤΑΙ ΕΝ ΒΙΒΛΩΙ ΛΟΓΩΝ ΗΣΑΙΟΥ ΤΟΥ ΠΡΟΦΗΤΟΥ ΦΩΝΗ ΒΟΩΝΤΟΣ ΕΝ ΤΗΙ ΕΡΗΜΩΙ ΕΤΟΙΜΑΣΑΤΕ ΤΗΝ ΟΔΟΝ ΚΥΡΙΟΥ ΕΥΘΕΙΑΣ ΠΟΙΕΙΤΕ ΤΑΣ ΤΡΙΒΟΥΣ ΑΥΤΟΥ
3,5,ΠΑΣΑ ΦΑΡΑΓΞ ΠΛΗΡΩΘΗΣΕΤΑΙ ΚΑΙ ΠΑΝ ΟΡΟΣ ΚΑΙ ΒΟΥΝΟΣ ΤΑΠΕΙΝΩΘΗΣΕΤΑΙ ΚΑΙ ΕΣΤΑΙ ΤΑ ΣΚΟΛΙΑ ΕΙΣ ΕΥΘΕΙΑΝ ΚΑΙ ΑΙ ΤΡΑΧΕΙΑΙ ΕΙΣ ΟΔΟΥΣ ΛΕΙΑΣ
3,6,ΚΑΙ ΟΨΕΤΑΙ ΠΑΣΑ ΣΑΡΞ ΤΟ ΣΩΤΗΡΙΟΝ ΤΟΥ ΘΕΟΥ
3,7,ΕΛΕΓΕΝ ΟΥΝ ΤΟΙΣ ΕΚΠΟΡΕΥΟΜΕΝΟΙΣ ΟΧΛΟΙΣ ΒΑΠΤΙΣΘΗΝΑΙ ΥΠΟ ΑΥΤΟΥ ΓΕΝΝΗΜΑΤΑ ΕΧΙΔΝΩΝ ΤΙΣ ΥΠΕΔΕΙΞΕΝ ΥΜΙΝ ΦΥΓΕΙΝ ΑΠΟ ΤΗΣ ΜΕΛΛΟΥΣΗΣ ΟΡΓΗΣ
3,8,ΠΟΙΗΣΑΤΕ ΟΥΝ ΚΑΡΠΟΥΣ ΑΞΙΟΥΣ ΤΗΣ ΜΕΤΑΝΟΙΑΣ ΚΑΙ ΜΗ ΑΡΞΗΣΘΕ ΛΕΓΕΙΝ ΕΝ ΕΑΥΤΟΙΣ ΠΑΤΕΡΑ ΕΧΟΜΕΝ ΤΟΝ ΑΒΡΑΑΜ ΛΕΓΩ ΓΑΡ ΥΜΙΝ ΟΤΙ ΔΥΝΑΤΑΙ Ο ΘΕΟΣ ΕΚ ΤΩΝ ΛΙΘΩΝ ΤΟΥΤΩΝ ΕΓΕΙΡΑΙ ΤΕΚΝΑ ΤΩΙ ΑΒΡΑΑΜ
3,9,ΗΔΗ ΔΕ ΚΑΙ Η ΑΞΙΝΗ ΠΡΟΣ ΤΗΝ ΡΙΖΑΝ ΤΩΝ ΔΕΝΔΡΩΝ ΚΕΙΤΑΙ ΠΑΝ ΟΥΝ ΔΕΝΔΡΟΝ ΜΗ ΠΟΙΟΥΝ ΚΑΡΠΟΝ ΚΑΛΟΝ ΕΚΚΟΠΤΕΤΑΙ ΚΑΙ ΕΙΣ ΠΥΡ ΒΑΛΛΕΤΑΙ
3,10,ΚΑΙ ΕΠΗΡΩΤΩΝ ΑΥΤΟΝ ΟΙ ΟΧΛΟΙ ΛΕΓΟΝΤΕΣ ΤΙ ΟΥΝ ΠΟΙΗΣΩΜΕΝ
3,11,ΑΠΟΚΡΙΘΕΙΣ ΔΕ ΕΛΕΓΕΝ ΑΥΤΟΙΣ Ο ΕΧΩΝ ΔΥΟ ΧΙΤΩΝΑΣ ΜΕΤΑΔΟΤΩ ΤΩΙ ΜΗ ΕΧΟΝΤΙ ΚΑΙ Ο ΕΧΩΝ ΒΡΩΜΑΤΑ ΟΜΟΙΩΣ ΠΟΙΕΙΤΩ
3,12,ΗΛΘΟΝ ΔΕ ΚΑΙ ΤΕΛΩΝΑΙ ΒΑΠΤΙΣΘΗΝΑΙ ΚΑΙ ΕΙΠΟΝ ΠΡΟΣ ΑΥΤΟΝ ΔΙΔΑΣΚΑΛΕ ΤΙ ΠΟΙΗΣΩΜΕΝ
