chapter,verse,text
17,22,ΕΙΠΕΝ ΔΕ ΠΡΟΣ ΤΟΥΣ ΜΑΘΗΤΑΣ ΕΛΕΥΣΟΝΤΑΙ ΗΜΕΡΑΙ ΟΤΕ ΕΠΙΘΥΜΗΣΕΤΕ ΜΙΑΝ ΤΩΝ ΗΜΕΡΩΝ ΤΟΥ ΥΙΟΥ ΤΟΥ ΑΝΘΡΩΠΟΥ ΙΔΕΙΝ ΚΑΙ ΟΥΚ ΟΨΕΣΘΕ
17,23,ΚΑΙ ΕΡΟΥΣΙΝ ΥΜΙΝ ΙΔΟΥ ΕΚΕΙ Η ΙΔΟΥ ΩΔΕ ΜΗ ΑΠΕΛΘΗΤΕ ΜΗΔΕ ΔΙΩΞΗΤΕ
17,24,ΩΣΠΕΡ ΓΑΡ Η ΑΣΤΡΑΠΗ ΑΣΤΡΑΠΤΟΥΣΑ ΕΚ ΤΗΣ ΥΠΟ ΤΟΝ ΟΥΡΑΝΟΝ ΕΙΣ ΤΗΝ ΥΠΟ ΟΥΡΑΝΟΝ ΛΑΜΠΕΙ ΟΥΤΩΣ ΕΣΤΑΙ Ο ΥΙΟΣ ΤΟΥ ΑΝΘΡΩΠΟΥ
17,25,ΠΡΩΤΟΝ ΔΕ ΔΕΙ ΑΥΤΟΝ ΠΟΛΛΑ ΠΑΘΕΙΝ ΚΑΙ ΑΠΟΔΟΚΙΜΑΣΘΗΝΑΙ ΑΠΟ ΤΗΣ ΓΕΝΕΑΣ ΤΑΥΤΗΣ
17,26,ΚΑΙ ΚΑΘΩΣ ΕΓΕΝΕΤΟ ΕΝ ΤΑΙΣ ΗΜΕΡΑΙΣ ΝΩΕ ΟΥΤΩΣ ΕΣΤΑΙ ΚΑΙ ΕΝ ΤΑΙΣ ΗΜΕΡΑΙΣ ΤΟΥ ΥΙΟΥ ΤΟΥ ΑΝΘΡΩΠΟΥ
17,27,ΗΣΘΙΟΝ ΕΠΙΝΟΝ ΕΓΑΜΟΥΝ ΕΓΑΜΙΖΟΝΤΟ ΑΧΡΙ ΗΣ ΗΜΕΡΑΣ ΕΙΣΗΛΘΕΝ ΝΩΕ ΕΙΣ ΤΗΝ ΚΙΒΩΤΟΝ ΚΑΙ ΗΛΘΕΝ Ο ΚΑΤΑΚΛΥΣΜΟΣ ΚΑΙ ΑΠΩΛΕΣΕΝ ΠΑΝΤΑΣ
17,28,ΟΜΟΙΩΣ ΚΑΘΩΣ ΕΓΕΝΕΤΟ ΕΝ ΤΑΙΣ ΗΜΕΡΑΙΣ ΛΩΤ ΗΣΘΙΟΝ ΕΠΙΝΟΝ ΗΓΟΡΑΖΟΝ ΕΠΩΛΟΥΝ ΕΦΥΤΕΥΟΝ ΩΙΚΟΔΟΜΟΥΝ
17,29,ΗΙ ΔΕ ΗΜΕΡΑΙ ΕΞΗΛΘΕΝ ΛΩΤ ΑΠΟ ΣΟΔΟΜΩΝ ΕΒΡΕΞΕΝ ΠΥΡ ΚΑΙ ΘΕΙΟΝ ΑΠΟ ΟΥΡΑΝΟΥ ΚΑΙ ΑΠΩΛΕΣΕΝ ΠΑΝΤΑΣ
17,30,ΚΑΤΑ ΤΑΥΤΑ ΕΣΤΑΙ ΗΙ ΗΜΕΡΑΙ Ο ΥΙΟΣ ΤΟΥ ΑΝΘΡΩΠΟΥ ΑΠΟΚΑΛΥΠΤΕΤΑΙ
17,31,ΕΝ ΕΚΕΙΝΗΙ ΤΗΙ ΗΜΕΡΑΙ ΟΣ ΕΣΤΑΙ ΕΠΙ ΤΟΥ ΔΩΜΑΤΟΣ ΚΑΙ ΤΑ ΣΚΕΥΗ ΑΥΤΟΥ ΕΝ ΤΗΙ ΟΙΚΙΑΙ ΜΗ ΚΑΤΑΒΑΤΩ ΑΡΑΙ ΑΥΤΑ ΚΑΙ Ο ΕΝ ΑΓΡΩΙ ΟΜΟΙΩΣ ΜΗ ΕΠΙΣΤΡΕΨΑΤΩ ΕΙΣ ΤΑ ΟΠΙΣΩ
17,32,ΜΝΗΜΟΝΕΥΕΤΕ ΤΗΣ ΓΥΝΑΙΚΟΣ ΛΩΤ
17,33,ΟΣ ΕΑΝ ΖΗΤΗΣΗΙ ΤΗΝ ΨΥΧΗΝ ΑΥΤΟΥ ΠΕΡΙΠΟΙΗΣΑΣΘΑΙ ΑΠΟΛΕΣΕΙ ΑΥΤΗΝ ΟΣ ΔΕ ΑΝ ΑΠΟΛΕΣΕΙ ΖΩΙΟΓΟΝΗΣΕΙ ΑΥΤΗΝ
17,34,ΛΕΓΩ ΥΜΙΝ ΤΑΥΤΗΙ ΤΗΙ ΝΥΚΤΙ ΕΣΟΝΤΑΙ ΔΥΟ ΕΠΙ ΚΛΙΝΗΣ ΜΙΑΣ Ο ΕΙΣ ΠΑΡΑΛΗΜΦΘΗΣΕΤΑΙ ΚΑΙ Ο ΕΤΕΡΟΣ ΑΦΕΘΗΣΕΤΑΙ
17,35,ΕΣΟΝΤΑΙ ΔΥΟ ΑΛΗΘΟΥΣΑΙ ΕΠΙ ΤΟ ΑΥΤΟ Η ΜΙΑ ΠΑΡΑΛΗΜΦΘΗΣΕΤΑΙ Η ΔΕ ΕΤΕΡΑ ΑΦΕΘΗΣΕΤΑΙ
17,37,ΚΑΙ ΑΠΟΚΡΙΘΕΝΤΕΣ ΛΕΓΟΥΣΙΝ ΑΥΤΩΙ ΠΟΥ ΚΥΡΙΕ Ο ΔΕ ΕΙΠΕΝ ΑΥΤΟΙΣ ΟΠΟΥ ΤΟ ΣΩΜΑ ΕΚΕΙ ΚΑΙ ΟΙ ΑΕΤΟΙ ΕΠΙΣΥΝΑΧΘΗΣΟΝΤΑΙ
18,1,ΕΛΕΓΕΝ ΔΕ ΠΑΡΑΒΟΛΗΝ ΑΥΤΟΙΣ ΠΡΟΣ ΤΟ ΔΕΙΝ ΠΑΝΤΟΤΕ ΠΡΟΣΕΥΧΕΣΘΑΙ ΑΥΤΟΥΣ ΚΑΙ ΜΗ ΕΝΚΑΚΕΙΝ
18,2,ΛΕΓΩΝ ΚΡΙΤΗΣ ΤΙΣ ΗΝ ΕΝ ΤΙΝΙ ΠΟΛΕΙ ΤΟΝ ΘΕΟΝ ΜΗ ΦΟΒΟΥΜΕΝΟΣ ΚΑΙ ΑΝΘΡΩΠΟΝ ΜΗ ΕΝΤΡΕΠΟΜΕΝΟΣ
18,3,ΧΗΡΑ ΔΕ ΗΝ ΕΝ ΤΗΙ ΠΟΛΕΙ ΕΚΕΙΝΗΙ ΚΑΙ ΗΡΧΕΤΟ ΠΡΟΣ ΑΥΤΟΝ ΛΕΓΟΥΣΑ ΕΚΔΙΚΗΣΟΝ ΜΕ ΑΠΟ ΤΟΥ ΑΝΤΙΔΙΚΟΥ ΜΟΥ
18,4,ΚΑΙ ΟΥΚ ΗΘΕΛΕΝ ΕΠΙ ΧΡΟΝΟΝ ΜΕΤΑ ΤΑΥΤΑ ΔΕ ΕΙΠΕΝ ΕΝ ΕΑΥΤΩΙ ΕΙ ΚΑΙ ΤΟΝ ΘΕΟΝ ΟΥ ΦΟΒΟΥΜΑΙ ΟΥΔΕ ΑΝΘΡΩΠΟΝ ΕΝΤΡΕΠΟΜΑΙ
18,5,ΔΙΑ ΓΕ ΤΟ ΠΑΡΕΧΕΙΝ ΜΟΙ ΚΟΠΟΝ ΤΗΝ ΧΗΡΑΝ ΤΑΥΤΗΝ ΕΚΔΙΚΗΣΩ ΑΥΤΗΝ ΙΝΑ ΜΗ ΕΙΣ ΤΕΛΟΣ ΕΡΧΟΜΕΝΗ ΥΠΩΠΙΑΖΗΙ ΜΕ
18,6,ΕΙΠΕΝ ΔΕ Ο ΚΥΡΙΟΣ ΑΚΟΥΣΑΤΕ ΤΙ Ο ΚΡΙΤΗΣ ΤΗΣ ΑΔΙΚΙΑΣ ΛΕΓΕΙ
18,7,Ο ΔΕ ΘΕΟΣ ΟΥ ΜΗ ΠΟΙΗΣΗΙ ΤΗΝ ΕΚΔΙΚΗΣΙΝ ΤΩΝ ΕΚΛΕΚΤΩΝ ΑΥΤΟΥ ΤΩΝ ΒΟΩΝΤΩΝ ΑΥΤΩΙ ΗΜΕΡΑΣ ΚΑΙ ΝΥΚΤΟΣ ΚΑΙ ΜΑΚΡΟΘΥΜΕΙ ΕΠΙ ΑΥΤΟΙΣ
18,8,ΛΕΓΩ ΥΜΙΝ ΟΤΙ ΠΟΙΗΣΕΙ ΤΗΝ ΕΚΔΙΚΗΣΙΝ ΑΥΤΩΝ ΕΝ ΤΑΧΕΙ ΠΛΗΝ Ο ΥΙΟΣ ΤΟΥ ΑΝΘΡΩΠΟΥ ΕΛΘΩΝ ΑΡΑ ΕΥΡΗΣΕΙ ΤΗΝ ΠΙΣΤΙΝ ΕΠΙ ΤΗΣ ΓΗΣ
18,9,ΕΙΠΕΝ ΔΕ ΚΑΙ ΠΡΟΣ ΤΙΝΑΣ ΤΟΥΣ ΠΕΠΟΙΘΟΤΑΣ ΕΠΙ ΕΑΥΤΟΙΣ ΟΤΙ ΕΙΣΙΝ ΔΙΚΑΙΟΙ ΚΑΙ ΕΞΟΥΘΕΝΟΥΝΤΑΣ ΤΟΥΣ ΛΟΙΠΟΥΣ ΤΗΝ ΠΑΡΑΒΟΛΗΝ ΤΑΥΤΗΝ
18,10,ΑΝΘΡΩΠΟΙ ΔΥΟ ΑΝΕΒΗΣΑΝ ΕΙΣ ΤΟ ΙΕΡΟΝ ΠΡΟΣΕΥΞΑΣΘΑΙ Ο ΕΙΣ ΦΑΡΙΣΑΙΟΣ ΚΑΙ Ο ΕΤΕΡΟΣ ΤΕΛΩΝΗΣ
18,11,Ο ΦΑΡΙΣΑΙΟΣ ΣΤΑΘΕΙΣ ΤΑΥΤΑ ΠΡΟΣ ΕΑΥΤΟΝ ΠΡΟΣΗΥΧΕΤΟ Ο ΘΕΟΣ ΕΥΧΑΡΙΣΤΩ ΣΟΙ ΟΤΙ ΟΥΚ ΕΙΜΙ ΩΣΠΕΡ ΟΙ ΛΟΙΠΟΙ ΤΩΝ ΑΝΘΡΩΠΩΝ ΑΡΠΑΓΕΣ ΑΔΙΚΟΙ ΜΟΙΧΟΙ Η ΚΑΙ ΩΣ ΟΥΤΟΣ Ο ΤΕΛΩΝΗΣ
18,12,ΝΗΣΤΕΥΩ ΔΙΣ ΤΟΥ ΣΑΒΒΑΤΟΥ ΑΠΟΔΕΚΑΤΕΥΩ ΠΑΝΤΑ ΟΣΑ ΚΤΩΜΑΙ
18,13,Ο ΔΕ ΤΕΛΩΝΗΣ ΜΑΚΡΟΘΕΝ ΕΣΤΩΣ ΟΥΚ ΗΘΕΛΕΝ ΟΥΔΕ ΤΟΥΣ ΟΦΘΑΛΜΟΥΣ ΕΠΑΡΑΙ ΕΙΣ ΤΟΝ ΟΥΡΑΝΟΝ ΑΛΛΑ ΕΤΥΠΤΕ ΤΟ ΣΤΗΘΟΣ ΑΥΤΟΥ ΛΕΓΩΝ Ο ΘΕΟΣ ΙΛΑΣΘΗΤΙ ΜΟΙ ΤΩΙ ΑΜΑΡΤΩΛΩΙ
18,14,ΛΕΓΩ ΥΜΙΝ ΚΑΤΕΒΗ ΟΥΤΟΣ ΔΕΔΙΚΑΙΩΜΕΝΟΣ ΕΙΣ ΤΟΝ ΟΙΚΟΝ ΑΥΤΟΥ ΠΑΡΑ ΕΚΕΙΝΟΝ ΟΤΙ ΠΑΣ Ο ΥΨΩΝ ΕΑΥΤΟΝ ΤΑΠΕΙΝΩΘΗΣΕΤΑΙ Ο ΔΕ ΤΑΠΕΙΝΩΝ ΕΑΥΤΟΝ ΥΨΩΘΗΣΕΤΑΙ
18,15,ΠΡΟΣΕΦΕΡΟΝ ΔΕ ΑΥΤΩΙ ΚΑΙ ΤΑ ΒΡΕΦΗ ΙΝΑ ΑΥΤΩΝ ΑΠΤΗΤΑΙ ΙΔΟΝΤΕΣ ΔΕ ΟΙ ΜΑΘΗΤΑΙ ΕΠΕΤΙΜΩΝ ΑΥΤΟΙΣ
18,16,Ο ΔΕ ΙΗΣΟΥΣ ΠΡΟΣΕΚΑΛΕΣΑΤΟ ΑΥΤΑ ΛΕΓΩΝ ΑΦΕΤΕ ΤΑ ΠΑΙΔΙΑ ΕΡΧΕΣΘΑΙ ΠΡΟΣ ΜΕ ΚΑΙ ΜΗ ΚΩΛΥΕΤΕ ΑΥΤΑ ΤΩΝ ΓΑΡ ΤΟΙΟΥΤΩΝ ΕΣΤΙΝ Η ΒΑΣΙΛΕΙΑ ΤΟΥ ΘΕΟΥ
18,17,ΑΜΗΝ ΛΕΓΩ ΥΜΙΝ ΟΣ ΑΝ ΜΗ ΔΕΞΗΤΑΙ ΤΗΝ ΒΑΣΙΛΕΙΑΝ ΤΟΥ ΘΕΟΥ ΩΣ ΠΑΙΔΙΟΝ ΟΥ ΜΗ ΕΙΣΕΛΘΗΙ ΕΙΣ ΑΥΤΗΝ
18,18,ΚΑΙ ΕΠΗΡΩΤΗΣΕΝ ΤΙΣ ΑΥΤΟΝ ΑΡΧΩΝ ΛΕΓΩΝ ΔΙΔΑΣΚΑΛΕ ΑΓΑΘΕ ΤΙ ΠΟΙΗΣΑΣ ΖΩΗΝ ΑΙΩΝΙΟΝ ΚΛΗΡΟΝΟΜΗΣΩ
18,19,ΕΙΠΕΝ ΔΕ ΑΥΤΩΙ Ο ΙΗΣΟΥΣ ΤΙ ΜΕ ΛΕΓΕΙΣ ΑΓΑΘΟΝ ΟΥΔΕΙΣ ΑΓΑΘΟΣ ΕΙ ΜΗ ΕΙΣ Ο ΘΕΟΣ
18,20,ΤΑΣ ΕΝΤΟΛΑΣ ΟΙΔΑΣ ΜΗ ΜΟΙΧΕΥΣΗΙΣ ΜΗ ΦΟΝΕΥΣΗΙΣ ΜΗ ΚΛΕΨΗΙΣ ΜΗ ΨΕΥΔΟΜΑΡΤΥΡΗΣΗΙΣ ΤΙΜΑ ΤΟΝ ΠΑΤΕΡΑ ΣΟΥ ΚΑΙ ΤΗΝ ΜΗΤΕΡΑ
18,21,Ο ΔΕ ΕΙΠΕΝ ΤΑΥΤΑ ΠΑΝΤΑ ΕΦΥΛΑΞΑ ΕΚ ΝΕΟΤΗΤΟΣ ΜΟΥ
18,22,ΑΚΟΥΣΑΣ ΔΕ Ο ΙΗΣΟΥΣ ΕΙΠΕΝ ΑΥΤΩΙ ΕΤΙ ΕΝ ΣΟΙ ΛΕΙΠΕΙ ΠΑΝΤΑ ΟΣΑ ΕΧΕΙΣ ΠΩΛΗΣΟΝ ΚΑΙ ΔΙΑΔΟΣ ΠΤΩΧΟΙΣ ΚΑΙ ΕΞΕΙΣ ΘΗΣΑΥΡΟΝ ΕΝ ΟΥΡΑΝΟΙΣ ΚΑΙ ΔΕΥΡΟ ΑΚΟΛΟΥΘΕΙ ΜΟΙ
18,23,Ο ΔΕ ΑΚΟΥΣΑΣ ΤΑΥΤΑ ΠΕΡΙΛΥΠΟΣ ΕΓΕΝΗΘΗ ΗΝ ΓΑΡ ΠΛΟΥΣΙΟΣ ΣΦΟΔΡΑ
18,24,ΙΔΩΝ ΔΕ ΑΥΤΟΝ Ο ΙΗΣΟΥΣ ΕΙΠΕΝ ΠΩΣ ΔΥΣΚΟΛΩΣ ΟΙ ΤΑ ΧΡΗΜΑΤΑ ΕΧΟΝΤΕΣ ΕΙΣ ΤΗΝ ΒΑΣΙΛΕΙΑΝ ΤΟΥ ΘΕΟΥ ΕΙΣΠΟΡΕΥΟΝΤΑΙ
18,25,ΕΥΚΟΠΩΤΕΡΟΝ ΓΑΡ ΕΣΤΙΝ ΚΑΜΗΛΟΝ ΔΙΑ ΤΡΗΜΑΤΟΣ ΒΕΛΟΝΗΣ ΕΙΣΕΛΘΕΙΝ Η ΠΛΟΥΣΙΟΝ ΕΙΣ ΤΗΝ ΒΑΣΙΛΕΙΑΝ ΤΟΥ ΘΕΟΥ ΕΙΣΕΛΘΕΙΝ
18,26,ΕΙΠΟΝ ΔΕ ΟΙ ΑΚΟΥΣΑΝΤΕΣ ΚΑΙ ΤΙΣ ΔΥΝΑΤΑΙ ΣΩΘΗΝΑΙ
18,27,Ο ΔΕ ΕΙΠΕΝ ΤΑ ΑΔΥΝΑΤΑ ΠΑΡΑ ΑΝΘΡΩΠΟΙΣ ΔΥΝΑΤΑ ΠΑΡΑ ΤΩΙ ΘΕΩΙ ΕΣΤΙΝ
18,28,ΕΙΠΕΝ ΔΕ Ο ΠΕΤΡΟΣ ΙΔΟΥ ΗΜΕΙΣ ΑΦΗΚΑΜΕΝ ΠΑΝΤΑ ΚΑΙ ΗΚΟΛΟΥΘΗΣΑΜΕΝ ΣΟΙ
18,29,Ο ΔΕ ΕΙΠΕΝ ΑΥΤΟΙΣ ΑΜΗΝ ΛΕΓΩ ΥΜΙΝ ΟΤΙ ΟΥΔΕΙΣ ΕΣΤΙΝ ΟΣ ΑΦΗΚΕΝ ΟΙΚΙΑΝ Η ΓΥΝΑΙΚΑ Η ΑΔΕΛΦΟΥΣ Η ΓΟΝΕΙΣ Η ΤΕΚΝΑ ΕΙΝΕΚΕΝ ΤΗΣ ΒΑΣΙΛΕΙΑΣ ΤΟΥ ΘΕΟΥ
18,30,ΟΣ ΟΥΧΙ ΜΗ ΑΠΟΛΑΒΗΙ ΠΟΛΛΑΠΛΑΣΙΟΝΑ ΕΝ ΤΩΙ ΚΑΙΡΩΙ ΤΟΥΤΩΙ ΚΑΙ ΕΝ ΤΩΙ ΑΙΩΝΙ ΤΩΙ ΕΡΧΟΜΕΝΩΙ ΖΩΗΝ ΑΙΩΝΙΟΝ
18,31,ΠΑΡΑΛΑΒΩΝ ΔΕ ΤΟΥΣ ΔΩΔΕΚΑ ΕΙΠΕΝ ΠΡΟΣ ΑΥΤΟΥΣ ΙΔΟΥ ΑΝΑΒΑΙΝΟΜΕΝ ΕΙΣ ΙΕΡΟΥΣΑΛΗΜ ΚΑΙ ΤΕΛΕΣΘΗΣΕΤΑΙ ΠΑΝΤΑ ΤΑ ΓΕΓΡΑΜΜΕΝΑ ΔΙΑ ΤΩΝ ΠΡΟΦΗΤΩΝ ΤΩΙ ΥΙΩΙ ΤΟΥ ΑΝΘΡΩΠΟΥ
18,32,ΠΑΡΑΔΟΘΗΣΕΤΑΙ ΓΑΡ ΤΟΙΣ ΕΘΝΕΣΙΝ ΚΑΙ ΕΜΠΑΙΧΘΗΣΕΤΑΙ ΚΑΙ ΥΒΡΙΣΘΗΣΕΤΑΙ ΚΑΙ ΕΜΠΤΥΣΘΗΣΕΤΑΙ
18,33,ΚΑΙ ΜΑΣΤΙΓΩΣΑΝΤΕΣ ΑΠΟΚΤΕΝΟΥΣΙΝ ΑΥΤΟΝ ΚΑΙ ΤΗΙ ΗΜΕΡΑΙ ΤΗΙ ΤΡΙΤΗΙ ΑΝΑΣΤΗΣΕΤΑΙ
18,34,ΚΑΙ ΑΥΤΟΙ ΟΥΔΕΝ ΤΟΥΤΩΝ ΣΥΝΗΚΑΝ ΚΑΙ ΗΝ ΤΟ ΡΗΜΑ ΤΟΥΤΟ ΚΕΚΡΥΜΜΕΝΟΝ ΑΠΟ ΑΥΤΩΝ ΚΑΙ ΟΥΚ ΕΓΙΝΩΣΚΟΝ ΤΑ ΛΕΓΟΜΕΝΑ
18,35,ΕΓΕΝΕΤΟ ΔΕ ΕΝ ΤΩΙ ΕΓΓΙΖΕΙΝ ΑΥΤΟΝ ΕΙΣ ΙΕΡΕΙΧΩ ΤΥΦΛΟΣ ΤΙΣ ΕΚΑΘΗΤΟ ΠΑΡΑ ΤΗΝ ΟΔΟΝ ΕΠΑΙΤΩΝ
18,36,ΑΚΟΥΣΑΣ ΔΕ ΟΧΛΟΥ ΔΙΑΠΟΡΕΥΟΜΕΝΟΥ ΕΠΥΝΘΑΝΕΤΟ ΤΙ ΕΙΗ ΤΟΥΤΟ
18,37,ΑΠΗΓΓΕΙΛΑΝ ΔΕ ΑΥΤΩΙ ΟΤΙ ΙΗΣΟΥΣ Ο ΝΑΖΩΡΑΙΟΣ ΠΑΡΕΡΧΕΤΑΙ
18,38,ΚΑΙ ΕΒΟΗΣΕΝ ΛΕΓΩΝ ΙΗΣΟΥ ΥΙΕ ΔΑΥΕΙΔ ΕΛΕΗΣΟΝ ΜΕ
18,39,ΚΑΙ ΟΙ ΠΡΟΑΓΟΝΤΕΣ ΕΠΕΤΙΜΩΝ ΑΥΤΩΙ ΙΝΑ ΣΙΓΗΣΗΙ ΑΥΤΟΣ ΔΕ ΠΟΛΛΩΙ ΜΑΛΛΟΝ ΕΚΡΑΖΕΝ ΥΙΕ ΔΑΥΕΙΔ ΕΛΕΗΣΟΝ ΜΕ
18,40,ΣΤΑΘΕΙΣ ΔΕ Ο ΙΗΣΟΥΣ ΕΚΕΛΕΥΣΕΝ ΑΥΤΟΝ ΑΧΘΗΝΑΙ ΠΡΟΣ ΑΥΤΟΝ ΕΓΓΙΣΑΝΤΟΣ ΔΕ ΑΥΤΟΥ ΕΠΗΡΩΤΗΣΕΝ ΑΥΤΟΝ
18,41,ΤΙ ΣΟΙ ΘΕΛΕΙΣ ΠΟΙΗΣΩ Ο ΔΕ ΕΙΠΕΝ ΚΥΡΙΕ ΙΝΑ ΑΝΑΒΛΕΨΩ
18,42,ΚΑΙ Ο ΙΗΣΟΥΣ ΕΙΠΕΝ ΑΥΤΩΙ ΑΝΑΒΛΕΨΟΝ Η ΠΙΣΤΙΣ ΣΟΥ ΣΕΣΩΚΕΝ ΣΕ
18,43,ΚΑΙ ΠΑΡΑΧΡΗΜΑ ΑΝΕΒΛΕΨΕΝ ΚΑΙ ΗΚΟΛΟΥΘΕΙ ΑΥΤΩΙ ΔΟΞΑΖΩΝ ΤΟΝ ΘΕΟΝ ΚΑΙ ΠΑΣ Ο ΛΑΟΣ ΙΔΩΝ ΕΔΩΚΕΝ ΑΙΝΟΝ ΤΩΙ ΘΕΩΙ
19,1,ΚΑΙ ΕΙΣΕΛΘΩΝ ΔΙΗΡΧΕΤΟ ΤΗΝ ΙΕΡΕΙΧΩ
19,2,ΚΑΙ ΙΔΟΥ ΑΝΗΡ ΟΝΟΜΑΤΙ ΚΑΛΟΥΜΕΝΟΣ ΖΑΚΧΑΙΟΣ ΚΑΙ ΑΥΤΟΣ ΗΝ ΑΡΧΙΤΕΛΩΝΗΣ ΚΑΙ ΑΥΤΟΣ ΠΛΟΥΣΙΟΣ
19,3,ΚΑΙ ΕΖΗΤΕΙ ΙΔΕΙΝ ΤΟΝ ΙΗΣΟΥΝ ΤΙΣ ΕΣΤΙΝ ΚΑΙ ΟΥΚ ΗΔΥΝΑΤΟ ΑΠΟ ΤΟΥ ΟΧΛΟΥ ΟΤΙ ΤΗΙ ΗΛΙΚΙΑΙ ΜΙΚΡΟΣ ΗΝ
19,4,ΚΑΙ ΠΡΟΔΡΑΜΩΝ ΕΙΣ ΤΟ ΕΜΠΡΟΣΘΕΝ ΑΝΕΒΗ ΕΠΙ ΣΥΚΟΜΟΡΕΑΝ ΙΝΑ ΙΔΗΙ ΑΥΤΟΝ ΟΤΙ ΕΚΕΙΝΗΣ ΗΜΕΛΛΕΝ ΔΙΕΡΧΕΣΘΑΙ
19,5,ΚΑΙ ΩΣ ΗΛΘΕΝ ΕΠΙ ΤΟΝ ΤΟΠΟΝ ΑΝΑΒΛΕΨΑΣ Ο ΙΗΣΟΥΣ ΕΙΠΕΝ ΠΡΟΣ ΑΥΤΟΝ ΖΑΚΧΑΙΕ ΣΠΕΥΣΑΣ ΚΑΤΑΒΗΘΙ ΣΗΜΕΡΟΝ ΓΑΡ ΕΝ ΤΩΙ ΟΙΚΩΙ ΣΟΥ ΔΕΙ ΜΕ ΜΕΙΝΑΙ
19,6,ΚΑΙ ΣΠΕΥΣΑΣ ΚΑΤΕΒΗ ΚΑΙ ΥΠΕΔΕΞΑΤΟ ΑΥΤΟΝ ΧΑΙΡΩΝ
19,7,ΚΑΙ ΙΔΟΝΤΕΣ ΠΑΝΤΕΣ ΔΙΕΓΟΓΓΥΖΟΝ ΛΕΓΟΝΤΕΣ ΟΤΙ ΠΑΡΑ ΑΜΑΡΤΩΛΩΙ ΑΝΔΡΙ ΕΙΣΗΛΘΕΝ ΚΑΤΑΛΥΣΑΙ
19,8,ΣΤΑΘΕΙΣ ΔΕ ΖΑΚΧΑΙΟΣ ΕΙΠΕΝ ΠΡΟΣ ΤΟΝ ΚΥΡΙΟΝ ΙΔΟΥ ΤΑ ΗΜΙΣΙΑ ΜΟΥ ΤΩΝ ΥΠΑΡΧΟΝΤΩΝ ΚΥΡΙΕ ΤΟΙΣ ΠΤΩΧΟΙΣ ΔΙΔΩΜΙ ΚΑΙ ΕΙ ΤΙΝΟΣ ΤΙ ΕΣΥΚΟΦΑΝΤΗΣΑ ΑΠΟΔΙΔΩΜΙ ΤΕΤΡΑΠΛΟΥΝ
19,9,ΕΙΠΕΝ ΔΕ ΠΡΟΣ ΑΥΤΟΝ Ο ΙΗΣΟΥΣ ΟΤΙ ΣΗΜΕΡΟΝ ΣΩΤΗΡΙΑ ΤΩΙ ΟΙΚΩΙ ΤΟΥΤΩΙ ΕΓΕΝΕΤΟ ΚΑΘΟΤΙ ΚΑΙ ΑΥΤΟΣ ΥΙΟΣ ΑΒΡΑΑΜ ΕΣΤΙΝ
19,10,ΗΛΘΕΝ ΓΑΡ Ο ΥΙΟΣ ΤΟΥ ΑΝΘΡΩΠΟΥ ΖΗΤΗΣΑΙ ΚΑΙ ΣΩΣΑΙ ΤΟ ΑΠΟΛΩΛΟΣ
19,11,ΑΚΟΥΟΝΤΩΝ ΔΕ ΑΥΤΩΝ ΤΑΥΤΑ ΠΡΟΣΘΕΙΣ ΕΙΠΕΝ ΠΑΡΑΒΟΛΗΝ ΔΙΑ ΤΟ ΕΓΓΥΣ ΕΙΝΑΙ ΙΕΡΟΥΣΑΛΗΜ ΑΥΤΟΝ ΚΑΙ ΔΟΚΕΙΝ ΑΥΤΟΥΣ ΟΤΙ ΠΑΡΑΧΡΗΜΑ ΜΕΛΛΕΙ Η ΒΑΣΙΛΕΙΑ ΤΟΥ ΘΕΟΥ ΑΝΑΦΑΙΝΕΣΘΑΙ
19,12,ΕΙΠΕΝ ΟΥΝ ΑΝΘΡΩΠΟΣ ΤΙΣ ΕΥΓΕΝΗΣ ΕΠΟΡΕΥΘΗ ΕΙΣ ΧΩΡΑΝ ΜΑΚΡΑΝ ΛΑΒΕΙΝ ΕΑΥΤΩΙ ΒΑΣΙΛΕΙΑΝ ΚΑΙ ΥΠΟΣΤΡΕΨΑΙ
19,13,ΚΑΛΕΣΑΣ ΔΕ ΔΕΚΑ ΔΟΥΛΟΥΣ ΕΑΥΤΟΥ ΕΔΩΚΕΝ ΑΥΤΟΙΣ ΔΕΚΑ ΜΝΑΣ ΚΑΙ ΕΙΠΕΝ ΠΡΟΣ ΑΥΤΟΥΣ ΠΡΑΓΜΑΤΕΥΣΑΣΘΑΙ ΕΝ ΩΙ ΕΡΧΟΜΑΙ
19,14,ΟΙ ΔΕ ΠΟΛΙΤΑΙ ΑΥΤΟΥ ΕΜΙΣΟΥΝ ΑΥΤΟΝ ΚΑΙ ΑΠΕΣΤΕΙΛΑΝ ΠΡΕΣΒΕΙΑΝ ΟΠΙΣΩ ΑΥΤΟΥ ΛΕΓΟΝΤΕΣ ΟΥ ΘΕΛΟΜΕΝ ΤΟΥΤΟΝ ΒΑΣΙΛΕΥΣΑΙ ΕΠΙ ΗΜΑΣ
19,15,ΚΑΙ ΕΓΕΝΕΤΟ ΕΝ ΤΩΙ ΕΠΑΝΕΛΘΕΙΝ ΑΥΤΟΝ ΛΑΒΟΝΤΑ ΤΗΝ ΒΑΣΙΛΕΙΑΝ ΚΑΙ ΕΙΠΕΝ ΦΩΝΗΘΗΝΑΙ ΑΥΤΩΙ ΤΟΥΣ ΔΟΥΛΟΥΣ ΤΟΥΤΟΥΣ ΟΙΣ ΔΕΔΩΚΕΙ ΤΟ ΑΡΓΥΡΙΟΝ ΙΝΑ ΓΝΟΙ ΤΙ ΔΙΕΠΡΑΓΜΑΤΕΥΣΑΝΤΟ
19,16,ΠΑΡΕΓΕΝΕΤΟ ΔΕ Ο ΠΡΩΤΟΣ ΛΕΓΩΝ ΚΥΡΙΕ Η ΜΝΑ ΣΟΥ ΔΕΚΑ ΠΡΟΣΗΡΓΑΣΑΤΟ ΜΝΑΣ
19,17,ΚΑΙ ΕΙΠΕΝ ΑΥΤΩΙ ΕΥ ΑΓΑΘΕ ΔΟΥΛΕ ΟΤΙ ΕΝ ΕΛΑΧΙΣΤΩΙ ΠΙΣΤΟΣ ΕΓΕΝΟΥ ΙΣΘΙ ΕΞΟΥΣΙΑΝ ΕΧΩΝ ΕΠΑΝΩ ΔΕΚΑ ΠΟΛΕΩΝ
19,18,ΚΑΙ ΗΛΘΕΝ Ο ΔΕΥΤΕΡΟΣ ΛΕΓΩΝ Η ΜΝΑ ΣΟΥ ΚΥΡΙΕ ΕΠΟΙΗΣΕΝ ΠΕΝΤΕ ΜΝΑΣ
19,19,ΕΙΠΕΝ ΔΕ ΚΑΙ ΤΟΥΤΩΙ ΚΑΙ ΣΥ ΕΠΑΝΩ ΓΙΝΟΥ ΠΕΝΤΕ ΠΟΛΕΩΝ
19,20,ΚΑΙ Ο ΕΤΕΡΟΣ ΗΛΘΕΝ ΛΕΓΩΝ ΚΥΡΙΕ ΙΔΟΥ Η ΜΝΑ ΣΟΥ ΗΝ ΕΙΧΟΝ ΑΠΟΚΕΙΜΕΝΗΝ ΕΝ ΣΟΥΔΑΡΙΩΙ
19,21,ΕΦΟΒΟΥΜΗΝ ΓΑΡ ΣΕ ΟΤΙ ΑΝΘΡΩΠΟΣ ΑΥΣΤΗΡΟΣ ΕΙ ΑΙΡΕΙΣ Ο ΟΥΚ ΕΘΗΚΑΣ ΚΑΙ ΘΕΡΙΖΕΙΣ Ο ΟΥΚ ΕΣΠΕΙΡΑΣ
19,22,ΛΕΓΕΙ ΑΥΤΩΙ ΕΚ ΤΟΥ ΣΤΟΜΑΤΟΣ ΣΟΥ ΚΡΙΝΩ ΣΕ ΠΟΝΗΡΕ ΔΟΥΛΕ ΗΙΔΕΙΣ ΟΤΙ ΕΓΩ ΑΝΘΡΩΠΟΣ ΑΥΣΤΗΡΟΣ ΕΙΜΙ ΑΙΡΩΝ Ο ΟΥΚ ΕΘΗΚΑ ΚΑΙ ΘΕΡΙΖΩΝ Ο ΟΥΚ ΕΣΠΕΙΡΑ
19,23,ΚΑΙ ΔΙΑ ΤΙ ΟΥΚ ΕΔΩΚΑΣ ΜΟΥ ΤΟ ΑΡΓΥΡΙΟΝ ΕΠΙ ΤΡΑΠΕΖΑΝ ΚΑΓΩ ΕΛΘΩΝ ΣΥΝ ΤΟΚΩΙ ΑΝ ΑΥΤΟ ΕΠΡΑΞΑ
19,24,ΚΑΙ ΤΟΙΣ ΠΑΡΕΣΤΩΣΙΝ ΕΙΠΕΝ ΑΡΑΤΕ ΑΠΟ ΑΥΤΟΥ ΤΗΝ ΜΝΑΝ ΚΑΙ ΔΟΤΕ ΤΩΙ ΤΑΣ ΔΕΚΑ ΜΝΑΣ ΕΧΟΝΤΙ
19,25,ΚΑΙ ΕΙΠΑΝ ΑΥΤΩΙ ΚΥΡΙΕ ΕΧΕΙ ΔΕΚΑ ΜΝΑΣ
19,26,ΛΕΓΩ ΥΜΙΝ ΟΤΙ ΠΑΝΤΙ ΤΩΙ ΕΧΟΝΤΙ ΔΟΘΗΣΕΤΑΙ ΑΠΟ ΔΕ ΤΟΥ ΜΗ ΕΧΟΝΤΟΣ ΚΑΙ Ο ΕΧΕΙ ΑΡΘΗΣΕΤΑΙ
19,27,ΠΛΗΝ ΤΟΥΣ ΕΧΘΡΟΥΣ ΜΟΥ ΤΟΥΤΟΥΣ ΤΟΥΣ ΜΗ ΘΕΛΗΣΑΝΤΑΣ ΜΕ ΒΑΣΙΛΕΥΣΑΙ ΕΠΙ ΑΥΤΟΥΣ ΑΓΑΓΕΤΕ ΩΔΕ ΚΑΙ ΚΑΤΑΣΦΑΞΑΤΕ ΑΥΤΟΥΣ ΕΜΠΡΟΣΘΕΝ ΜΟΥ
19,28,ΚΑΙ ΕΙΠΩΝ ΤΑΥΤΑ ΕΠΟΡΕΥΕΤΟ ΕΜΠΡΟΣΘΕΝ ΑΝΑΒΑΙΝΩΝ ΕΙΣ ΙΕΡΟΣΟΛΥΜΑ
19,29,ΚΑΙ ΕΓΕΝΕΤΟ ΩΣ ΗΓΓΙΣΕΝ ΕΙΣ ΒΗΘΦΑΓΗ ΚΑΙ ΒΗΘΑΝΙΑΝ ΠΡΟΣ ΤΟ ΟΡΟΣ ΤΟ ΚΑΛΟΥΜΕΝΟΝ ΕΛΑΙΩΝ ΑΠΕΣΤΕΙΛΕΝ ΔΥΟ ΤΩΝ ΜΑΘΗΤΩΝ
19,30,ΛΕΓΩΝ ΥΠΑΓΕΤΕ ΕΙΣ ΤΗΝ ΚΑΤΕΝΑΝΤΙ ΚΩΜΗΝ ΕΝ ΗΙ ΕΙΣΠΟΡΕΥΟΜΕΝΟΙ ΕΥΡΗΣΕΤΕ ΠΩΛΟΝ ΔΕΔΕΜΕΝΟΝ ΕΠΙ ΟΝ ΟΥΔΕΙΣ ΠΩΠΟΤΕ ΑΝΘΡΩΠΩΝ ΕΚΑΘΙΣΕΝ ΛΥΣΑΝΤΕΣ ΑΥΤΟΝ ΑΓΑΓΕΤΕ
19,31,ΚΑΙ ΕΑΝ ΤΙΣ ΥΜΑΣ ΕΡΩΤΑΙ ΔΙΑ ΤΙ ΛΥΕΤΕ ΟΥΤΩΣ ΕΡΕΙΤΕ ΟΤΙ Ο ΚΥΡΙΟΣ ΑΥΤΟΥ ΧΡΕΙΑΝ ΕΧΕΙ
19,32,ΑΠΕΛΘΟΝΤΕΣ ΔΕ ΟΙ ΑΠΕΣΤΑΛΜΕΝΟΙ ΕΥΡΟΝ ΚΑΘΩΣ ΕΙΠΕΝ ΑΥΤΟΙΣ
19,33,ΛΥΟΝΤΩΝ ΔΕ ΑΥΤΩΝ ΤΟΝ ΠΩΛΟΝ ΕΙΠΑΝ ΟΙ ΚΥΡΙΟΙ ΑΥΤΟΥ ΠΡΟΣ ΑΥΤΟΥΣ ΤΙ ΛΥΕΤΕ ΤΟΝ ΠΩΛΟΝ
19,34,ΟΙ ΔΕ ΕΙΠΑΝ ΟΤΙ Ο ΚΥΡΙΟΣ ΑΥΤΟΥ ΧΡΕΙΑΝ ΕΧΕΙ
19,35,ΚΑΙ ΗΓΑΓΟΝ ΑΥΤΟΝ ΠΡΟΣ ΤΟΝ ΙΗΣΟΥΝ ΚΑΙ ΕΠΙΡΙΨΑΝΤΕΣ ΑΥΤΩΝ ΤΑ ΙΜΑΤΙΑ ΕΠΙ ΤΟΝ ΠΩΛΟΝ ΕΠΕΒΙΒΑΣΑΝ ΤΟΝ ΙΗΣΟΥΝ
19,36,ΠΟΡΕΥΟΜΕΝΟΥ ΔΕ ΑΥΤΟΥ ΥΠΕΣΤΡΩΝΝΥΟΝ ΤΑ ΙΜΑΤΙΑ ΕΑΥΤΩΝ ΕΝ ΤΗΙ ΟΔΩΙ
19,37,ΕΓΓΙΖΟΝΤΟΣ ΔΕ ΑΥΤΟΥ ΗΔΗ ΠΡΟΣ ΤΗΙ ΚΑΤΑΒΑΣΕΙ ΤΟΥ ΟΡΟΥΣ ΤΩΝ ΕΛΑΙΩΝ ΗΡΞΑΝΤΟ ΑΠΑΝ ΤΟ ΠΛΗΘΟΣ ΤΩΝ ΜΑΘΗΤΩΝ ΧΑΙΡΟΝΤΕΣ ΑΙΝΕΙΝ ΤΟΝ ΘΕΟΝ ΦΩΝΗΙ ΜΕΓΑΛΗΙ ΠΕΡΙ ΠΑΣΩΝ ΩΝ ΕΙΔΟΝ ΔΥΝΑΜΕΩΝ
19,38,ΛΕΓΟΝΤΕΣ ΕΥΛΟΓΗΜΕΝΟΣ Ο ΕΡΧΟΜΕΝΟΣ ΒΑΣΙΛΕΥΣ ΕΝ ΟΝΟΜΑΤΙ ΚΥΡΙΟΥ ΕΝ ΟΥΡΑΝΩΙ ΕΙΡΗΝΗ ΚΑΙ ΔΟΞΑ ΕΝ ΥΨΙΣΤΟΙΣ
19,39,ΚΑΙ ΤΙΝΕΣ ΤΩΝ ΦΑΡΙΣΑΙΩΝ ΑΠΟ ΤΟΥ ΟΧΛΟΥ ΕΙΠΑΝ ΠΡΟΣ ΑΥΤΟΝ ΔΙΔΑΣΚΑΛΕ ΕΠΙΤΙΜΗΣΟΝ ΤΟΙΣ ΜΑΘΗΤΑΙΣ ΣΟΥ
19,40,ΚΑΙ ΑΠΟΚΡΙΘΕΙΣ ΕΙΠΕΝ ΛΕΓΩ ΥΜΙΝ ΟΤΙ ΕΑΝ ΟΥΤΟΙ ΣΙΩΠΗΣΟΥΣΙΝ ΟΙ ΛΙΘΟΙ ΚΡΑΞΟΥΣΙΝ
19,41,ΚΑΙ ΩΣ ΗΓΓΙΣΕΝ ΙΔΩΝ ΤΗΝ ΠΟΛΙΝ ΕΚΛΑΥΣΕΝ ΕΠΙ ΑΥΤΗΝ
19,42,ΛΕΓΩΝ ΟΤΙ ΕΙ ΕΓΝΩΣ ΕΝ ΤΗΙ ΗΜΕΡΑΙ ΤΑΥΤΗΙ ΚΑΙ ΣΥ ΤΑ ΠΡΟΣ ΕΙΡΗΝΗΝ ΝΥΝ ΔΕ ΕΚΡΥΒΗ ΑΠΟ ΟΦΘΑΛΜΩΝ ΣΟΥ
19,43,ΟΤΙ ΗΞΟΥΣΙΝ ΗΜΕΡΑΙ ΕΠΙ ΣΕ ΚΑΙ ΠΕΡΙΒΑΛΟΥΣΙΝ ΟΙ ΕΧΘΡΟΙ ΣΟΥ ΧΑΡΑΚΑ ΣΟΙ ΚΑΙ ΠΕΡΙΚΥΚΛΩΣΟΥΣΙΝ ΣΕ ΚΑΙ ΣΥΝΕΞΟΥΣΙΝ ΣΕ ΠΑΝΤΟΘΕΝ
19,44,ΚΑΙ ΕΔΑΦΙΟΥΣΙΝ ΣΕ ΚΑΙ ΤΑ ΤΕΚΝΑ ΣΟΥ ΕΝ ΣΟΙ ΚΑΙ ΟΥΚ ΑΦΗΣΟΥΣΙΝ ΛΙΘΟΝ ΕΠΙ ΛΙΘΟΝ ΕΝ ΣΟΙ ΑΝΤΙ ΩΝ ΟΥΚ ΕΓΝΩΣ ΤΟΝ ΚΑΙΡΟΝ ΤΗΣ ΕΠΙΣΚΟΠΗΣ ΣΟΥ
19,45,ΚΑΙ ΕΙΣΕΛΘΩΝ ΕΙΣ ΤΟ ΙΕΡΟΝ ΗΡΞΑΤΟ ΕΚΒΑΛΛΕΙΝ ΤΟΥΣ ΠΩΛΟΥΝΤΑΣ
19,46,ΛΕΓΩΝ ΑΥΤΟΙΣ ΓΕΓΡΑΠΤΑΙ Ο ΟΙΚΟΣ ΜΟΥ ΟΙΚΟΣ ΠΡΟΣΕΥΧΗΣ ΥΜΕΙΣ ΔΕ ΑΥΤΟΝ ΕΠΟΙΗΣΑΤΕ ΣΠΗΛΑΙΟΝ ΛΗΙΣΤΩΝ
19,47,ΚΑΙ ΗΝ ΔΙΔΑΣΚΩΝ ΤΟ ΚΑΤΑ ΗΜΕΡΑΝ ΕΝ ΤΩΙ ΙΕΡΩΙ ΟΙ ΔΕ ΑΡΧΙΕΡΕΙΣ ΚΑΙ ΟΙ ΓΡΑΜΜΑΤΕΙΣ ΕΖΗΤΟΥΝ ΑΥΤΟΝ ΑΠΟΛΕΣΑΙ ΚΑΙ ΟΙ ΠΡΩΤΟΙ ΤΟΥ ΛΑΟΥ
19,48,ΚΑΙ ΟΥΧ ΕΥΡΙΣΚΟΝ ΤΟ ΤΙ ΠΟΙΗΣΩΣΙΝ Ο ΛΑΟΣ ΓΑΡ ΑΠΑΣ ΕΞΕΚΡΕΜΕΤΟ ΑΥΤΟΥ ΑΚΟΥΩΝ
20,1,ΚΑΙ ΕΓΕΝΕΤΟ ΕΝ ΜΙΑΙ ΤΩΝ ΗΜΕΡΩΝ ΔΙΔΑΣΚΟΝΤΟΣ ΑΥΤΟΥ ΤΟΝ ΛΑΟΝ ΕΝ ΤΩΙ ΙΕΡΩΙ ΚΑΙ ΕΥΑΓΓΕΛΙΖΟΜΕΝΟΥ ΕΠΕΣΤΗΣΑΝ ΟΙ ΑΡΧΙΕΡΕΙΣ ΚΑΙ ΟΙ ΓΡΑΜΜΑΤΕΙΣ ΣΥΝ ΤΟΙΣ ΠΡΕΣΒΥΤΕΡΟΙΣ
20,2,ΚΑΙ ΕΙΠΑΝ ΛΕΓΟΝΤΕΣ ΠΡΟΣ ΑΥΤΟΝ ΕΙΠΟΝ ΗΜΙΝ ΕΝ ΠΟΙΑΙ ΕΞΟΥΣΙΑΙ ΤΑΥΤΑ ΠΟΙΕΙΣ Η ΤΙΣ ΕΣΤΙΝ Ο ΔΟΥΣ ΣΟΙ ΤΗΝ ΕΞΟΥΣΙΑΝ ΤΑΥΤΗΝ
20,3,ΑΠΟΚΡΙΘΕΙΣ ΔΕ ΕΙΠΕΝ ΠΡΟΣ ΑΥΤΟΥΣ ΕΡΩΤΗΣΩ ΥΜΑΣ ΚΑΓΩ ΛΟΓΟΝ ΚΑΙ ΕΙΠΑΤΕ ΜΟΙ
20,4,ΤΟ ΒΑΠΤΙΣΜΑ ΙΩΑΝΝΟΥ ΕΞ ΟΥΡΑΝΟΥ ΗΝ Η ΕΞ ΑΝΘΡΩΠΩΝ
20,5,ΟΙ ΔΕ ΣΥΝΕΛΟΓΙΣΑΝΤΟ ΠΡΟΣ ΕΑΥΤΟΥΣ ΛΕΓΟΝΤΕΣ ΟΤΙ ΕΑΝ ΕΙΠΩΜΕΝ ΕΞ ΟΥΡΑΝΟΥ ΕΡΕΙ ΔΙΑ ΤΙ ΟΥΚ ΕΠΙΣΤΕΥΣΑΤΕ ΑΥΤΩΙ
20,6,ΕΑΝ ΔΕ ΕΙΠΩΜΕΝ ΕΞ ΑΝΘΡΩΠΩΝ Ο ΛΑΟΣ ΑΠΑΣ ΚΑΤΑΛΙΘΑΣΕΙ ΗΜΑΣ ΠΕΠΕΙΣΜΕΝΟΣ ΓΑΡ ΕΣΤΙΝ ΙΩΑΝΝΗΝ ΠΡΟΦΗΤΗΝ ΕΙΝΑΙ
20,7,ΚΑΙ ΑΠΕΚΡΙΘΗΣΑΝ ΜΗ ΕΙΔΕΝΑΙ ΠΟΘΕΝ
20,8,ΚΑΙ Ο ΙΗΣΟΥΣ ΕΙΠΕΝ ΑΥΤΟΙΣ ΟΥΔΕ ΕΓΩ ΛΕΓΩ ΥΜΙΝ ΕΝ ΠΟΙΑΙ ΕΞΟΥΣΙΑΙ ΤΑΥΤΑ ΠΟΙΩ
20,9,ΗΡΞΑΤΟ ΔΕ ΠΡΟΣ ΤΟΝ ΛΑΟΝ ΛΕΓΕΙΝ ΤΗΝ ΠΑΡΑΒΟΛΗΝ ΤΑΥΤΗΝ ΑΝΘΡΩΠΟΣ ΕΦΥΤΕΥΣΕΝ ΑΜΠΕΛΩΝΑ ΚΑΙ ΕΞΕΔΕΤΟ ΑΥΤΟΝ ΓΕΩΡΓΟΙΣ ΚΑΙ ΑΠΕΔΗΜΗΣΕΝ ΧΡΟΝΟΥΣ ΙΚΑΝΟΥΣ
20,10,ΚΑΙ ΚΑΙΡΩΙ ΑΠΕΣΤΕΙΛΕΝ ΠΡΟΣ ΤΟΥΣ ΓΕΩΡΓΟΥΣ ΔΟΥΛΟΝ ΙΝΑ ΑΠΟ ΤΟΥ ΚΑΡΠΟΥ ΤΟΥ ΑΜΠΕΛΩΝΟΣ ΔΩΣΟΥΣΙΝ ΑΥΤΩΙ ΟΙ ΔΕ ΓΕΩΡΓΟΙ ΕΞΑΠΕΣΤΕΙΛΑΝ ΑΥΤΟΝ ΔΕΙΡΑΝΤΕΣ ΚΕΝΟΝ
20,11,ΚΑΙ ΠΡΟΣΕΘΕΤΟ ΕΤΕΡΟΝ ΠΕΜΨΑΙ ΔΟΥΛΟΝ ΟΙ ΔΕ ΚΑΚΕΙΝΟΝ ΔΕΙΡΑΝΤΕΣ ΚΑΙ ΑΤΙΜΑΣΑΝΤΕΣ ΕΞΑΠΕΣΤΕΙΛΑΝ ΚΕΝΟΝ
20,12,ΚΑΙ ΠΡΟΣΕΘΕΤΟ ΤΡΙΤΟΝ ΠΕΜΨΑΙ ΟΙ ΔΕ ΚΑΙ ΤΟΥΤΟΝ ΤΡΑΥΜΑΤΙΣΑΝΤΕΣ ΕΞΕΒΑΛΟΝ
20,13,ΕΙΠΕΝ ΔΕ Ο ΚΥΡΙΟΣ ΤΟΥ ΑΜΠΕΛΩΝΟΣ ΤΙ ΠΟΙΗΣΩ ΠΕΜΨΩ ΤΟΝ ΥΙΟΝ ΜΟΥ ΤΟΝ ΑΓΑΠΗΤΟΝ ΙΣΩΣ ΤΟΥΤΟΝ ΕΝΤΡΑΠΗΣΟΝΤΑΙ
20,14,ΙΔΟΝΤΕΣ ΔΕ ΑΥΤΟΝ ΟΙ ΓΕΩΡΓΟΙ ΔΙΕΛΟΓΙΖΟΝΤΟ ΠΡΟΣ ΑΛΛΗΛΟΥΣ ΛΕΓΟΝΤΕΣ ΟΥΤΟΣ ΕΣΤΙΝ Ο ΚΛΗΡΟΝΟΜΟΣ ΑΠΟΚΤΕΙΝΩΜΕΝ ΑΥΤΟΝ ΙΝΑ ΗΜΩΝ ΓΕΝΗΤΑΙ Η ΚΛΗΡΟΝΟΜΙΑ
20,15,ΚΑΙ ΕΚΒΑΛΟΝΤΕΣ ΑΥΤΟΝ ΕΞΩ ΤΟΥ ΑΜΠΕΛΩΝΟΣ ΑΠΕΚΤΕΙΝΑΝ ΤΙ ΟΥΝ ΠΟΙΗΣΕΙ ΑΥΤΟΙΣ Ο ΚΥΡΙΟΣ ΤΟΥ ΑΜΠΕΛΩΝΟΣ
20,16,ΕΛΕΥΣΕΤΑΙ ΚΑΙ ΑΠΟΛΕΣΕΙ ΤΟΥΣ ΓΕΩΡΓΟΥΣ ΤΟΥΤΟΥΣ ΚΑΙ ΔΩΣΕΙ ΤΟΝ ΑΜΠΕΛΩΝΑ ΑΛΛΟΙΣ ΑΚΟΥΣΑΝΤΕΣ ΔΕ ΕΙΠΑΝ ΜΗ ΓΕΝΟΙΤΟ
20,17,Ο ΔΕ ΕΜΒΛΕΨΑΣ ΑΥΤΟΙΣ ΕΙΠΕΝ ΤΙ ΟΥΝ ΕΣΤΙΝ ΤΟ ΓΕΓΡΑΜΜΕΝΟΝ ΤΟΥΤΟ ΛΙΘΟΝ ΟΝ ΑΠΕΔΟΚΙΜΑΣΑΝ ΟΙ ΟΙΚΟΔΟΜΟΥΝΤΕΣ ΟΥΤΟΣ ΕΓΕΝΗΘΗ ΕΙΣ ΚΕΦΑΛΗΝ ΓΩΝΙΑΣ
20,18,ΠΑΣ Ο ΠΕΣΩΝ ΕΠΙ ΕΚΕΙΝΟΝ ΤΟΝ ΛΙΘΟΝ ΣΥΝΘΛΑΣΘΗΣΕΤΑΙ ΕΠΙ ΟΝ ΔΕ ΑΝ ΠΕΣΗΙ ΛΙΚΜΗΣΕΙ ΑΥΤΟΝ
20,19,ΚΑΙ ΕΖΗΤΗΣΑΝ ΟΙ ΓΡΑΜΜΑΤΕΙΣ ΚΑΙ ΟΙ ΑΡΧΙΕΡΕΙΣ ΕΠΙΒΑΛΕΙΝ ΕΠΙ ΑΥΤΟΝ ΤΑΣ ΧΕΙΡΑΣ ΕΝ ΑΥΤΗΙ ΤΗΙ ΩΡΑΙ ΚΑΙ ΕΦΟΒΗΘΗΣΑΝ ΤΟΝ ΛΑΟΝ ΕΓΝΩΣΑΝ ΓΑΡ ΟΤΙ ΠΡΟΣ ΑΥΤΟΥΣ ΕΙΠΕΝ ΤΗΝ ΠΑΡΑΒΟΛΗΝ ΤΑΥΤΗΝ
20,20,ΚΑΙ ΠΑΡΑΤΗΡΗΣΑΝΤΕΣ ΑΠΕΣΤΕΙΛΑΝ ΕΝΚΑΘΕΤΟΥΣ ΥΠΟΚΡΙΝΟΜΕΝΟΥΣ ΕΑΥΤΟΥΣ ΔΙΚΑΙΟΥΣ ΕΙΝΑΙ ΙΝΑ ΕΠΙΛΑΒΩΝΤΑΙ ΑΥΤΟΥ ΛΟΓΟΥ ΩΣΤΕ ΠΑΡΑΔΟΥΝΑΙ ΑΥΤΟΝ ΤΗΙ ΑΡΧΗΙ ΚΑΙ ΤΗΙ ΕΞΟΥΣΙΑΙ ΤΟΥ ΗΓΕΜΟΝΟΣ
20,21,ΚΑΙ ΕΠΗΡΩΤΗΣΑΝ ΑΥΤΟΝ ΛΕΓΟΝΤΕΣ ΔΙΔΑΣΚΑΛΕ ΟΙΔΑΜΕΝ ΟΤΙ ΟΡΘΩΣ ΛΕΓΕΙΣ ΚΑΙ ΔΙΔΑΣΚΕΙΣ ΚΑΙ ΟΥ ΛΑΜΒΑΝΕΙΣ ΠΡΟΣΩΠΟΝ ΑΛΛΑ ΕΠΙ ΑΛΗΘΕΙΑΣ ΤΗΝ ΟΔΟΝ ΤΟΥ ΘΕΟΥ ΔΙΔΑΣΚΕΙΣ
20,22,ΕΞΕΣΤΙΝ ΗΜΑΣ ΚΑΙΣΑΡΙ ΦΟΡΟΝ ΔΟΥΝΑΙ Η ΟΥ
20,23,ΚΑΤΑΝΟΗΣΑΣ ΔΕ ΑΥΤΩΝ ΤΗΝ ΠΑΝΟΥΡΓΙΑΝ ΕΙΠΕΝ ΠΡΟΣ ΑΥΤΟΥΣ
20,24,ΔΕΙΞΑΤΕ ΜΟΙ ΔΗΝΑΡΙΟΝ ΤΙΝΟΣ ΕΧΕΙ ΕΙΚΟΝΑ ΚΑΙ ΕΠΙΓΡΑΦΗΝ ΟΙ ΔΕ ΕΙΠΑΝ ΚΑΙΣΑΡΟΣ
20,25,Ο ΔΕ ΕΙΠΕΝ ΠΡΟΣ ΑΥΤΟΥΣ ΤΟΙΝΥΝ ΑΠΟΔΟΤΕ ΤΑ ΚΑΙΣΑΡΟΣ ΚΑΙΣΑΡΙ ΚΑΙ ΤΑ ΤΟΥ ΘΕΟΥ ΤΩΙ ΘΕΩΙ
20,26,ΚΑΙ ΟΥΚ ΙΣΧΥΣΑΝ ΕΠΙΛΑΒΕΣΘΑΙ ΤΟΥ ΡΗΜΑΤΟΣ ΕΝΑΝΤΙΟΝ ΤΟΥ ΛΑΟΥ ΚΑΙ ΘΑΥΜΑΣΑΝΤΕΣ ΕΠΙ ΤΗΙ ΑΠΟΚΡΙΣΕΙ ΑΥΤΟΥ ΕΣΙΓΗΣΑΝ
20,27,ΠΡΟΣΕΛΘΟΝΤΕΣ ΔΕ ΤΙΝΕΣ ΤΩΝ ΣΑΔΔΟΥΚΑΙΩΝ ΟΙ ΛΕΓΟΝΤΕΣ ΑΝΑΣΤΑΣΙΝ ΜΗ ΕΙΝΑΙ ΕΠΗΡΩΤΗΣΑΝ ΑΥΤΟΝ
20,28,ΛΕΓΟΝΤΕΣ ΔΙΔΑΣΚΑΛΕ ΜΩΥΣΗΣ ΕΓΡΑΨΕΝ ΗΜΙΝ ΕΑΝ ΤΙΝΟΣ ΑΔΕΛΦΟΣ ΑΠΟΘΑΝΗΙ ΕΧΩΝ ΓΥΝΑΙΚΑ ΚΑΙ ΟΥΤΟΣ ΑΤΕΚΝΟΣ ΗΙ ΙΝΑ ΛΑΒΗΙ Ο ΑΔΕΛΦΟΣ ΑΥΤΟΥ ΤΗΝ ΓΥΝΑΙΚΑ ΚΑΙ ΕΞΑΝΑΣΤΗΣΗΙ ΣΠΕΡΜΑ ΤΩΙ ΑΔΕΛΦΩΙ ΑΥΤΟΥ
20,29,ΕΠΤΑ ΟΥΝ ΑΔΕΛΦΟΙ ΗΣΑΝ ΚΑΙ Ο ΠΡΩΤΟΣ ΛΑΒΩΝ ΓΥΝΑΙΚΑ ΑΠΕΘΑΝΕΝ ΑΤΕΚΝΟΣ
20,30,ΚΑΙ Ο ΔΕΥΤΕΡΟΣ
20,31,ΚΑΙ Ο ΤΡΙΤΟΣ ΕΛΑΒΕΝ ΑΥΤΗΝ ΩΣΑΥΤΩΣ ΔΕ ΚΑΙ ΟΙ ΕΠΤΑ ΟΥ ΚΑΤΕΛΙΠΟΝ ΤΕΚΝΑ ΚΑΙ ΑΠΕΘΑΝΟΝ
20,32,ΥΣΤΕΡΟΝ ΚΑΙ Η ΓΥΝΗ ΑΠΕΘΑΝΕΝ
20,33,ΕΝ ΤΗΙ ΟΥΝ ΑΝΑΣΤΑΣΕΙ ΤΙΝΟΣ ΑΥΤΩΝ ΓΙΝΕΤΑΙ ΓΥΝΗ ΟΙ ΓΑΡ ΕΠΤΑ ΕΣΧΟΝ ΑΥΤΗΝ ΓΥΝΑΙΚΑ
20,34,ΚΑΙ ΕΙΠΕΝ ΑΥΤΟΙΣ Ο ΙΗΣΟΥΣ ΟΙ ΥΙΟΙ ΤΟΥ ΑΙΩΝΟΣ ΤΟΥΤΟΥ ΓΑΜΟΥΣΙΝ ΚΑΙ ΓΑΜΙΣΚΟΝΤΑΙ
20,35,ΟΙ ΔΕ ΚΑΤΑΞΙΩΘΕΝΤΕΣ ΤΟΥ ΑΙΩΝΟΣ ΕΚΕΙΝΟΥ ΤΥΧΕΙΝ ΚΑΙ ΤΗΣ ΑΝΑΣΤΑΣΕΩΣ ΤΗΣ ΕΚ ΝΕΚΡΩΝ ΟΥΤΕ ΓΑΜΟΥΣΙΝ ΟΥΤΕ ΓΑΜΙΖΟΝΤΑΙ
20,36,ΟΥΔΕ ΓΑΡ ΑΠΟΘΑΝΕΙΝ ΕΤΙ ΔΥΝΑΝΤΑΙ ΙΣΑΓΓΕΛΟΙ ΓΑΡ ΕΙΣΙΝ ΚΑΙ ΥΙΟΙ ΕΙΣΙΝ ΘΕΟΥ ΤΗΣ ΑΝΑΣΤΑΣΕΩΣ ΥΙΟΙ ΟΝΤΕΣ
20,37,ΟΤΙ ΔΕ ΕΓΕΙΡΟΝΤΑΙ ΟΙ ΝΕΚΡΟΙ ΚΑΙ ΜΩΥΣΗΣ ΕΜΗΝΥΣΕΝ ΕΠΙ ΤΗΣ ΒΑΤΟΥ ΩΣ ΛΕΓΕΙ ΚΥΡΙΟΝ ΤΟΝ ΘΕΟΝ ΑΒΡΑΑΜ ΚΑΙ ΘΕΟΝ ΙΣΑΑΚ ΚΑΙ ΘΕΟΝ ΙΑΚΩΒ
20,38,ΘΕΟΣ ΔΕ ΟΥΚ ΕΣΤΙΝ ΝΕΚΡΩΝ ΑΛΛΑ ΖΩΝΤΩΝ ΠΑΝΤΕΣ ΓΑΡ ΑΥΤΩΙ ΖΩΣΙΝ
20,39,ΑΠΟΚΡΙΘΕΝΤΕΣ ΔΕ ΤΙΝΕΣ ΤΩΝ ΓΡΑΜΜΑΤΕΩΝ ΕΙΠΑΝ ΔΙΔΑΣΚΑΛΕ ΚΑΛΩΣ ΕΙΠΑΣ
20,40,ΟΥΚΕΤΙ ΓΑΡ ΕΤΟΛΜΩΝ ΕΠΕΡΩΤΑΝ ΑΥΤΟΝ ΟΥΔΕΝ
20,41,ΕΙΠΕΝ ΔΕ ΠΡΟΣ ΑΥΤΟΥΣ ΠΩΣ ΛΕΓΟΥΣΙΝ ΤΟΝ ΧΡΙΣΤΟΝ ΕΙΝΑΙ ΔΑΥΕΙΔ ΥΙΟΝ
