chapter,verse,text
12,24,ΤΑ ΔΕ ΕΥΣΧΗΜΟΝΑ ΗΜΩΝ ΟΥ ΧΡΕΙΑΝ ΕΧΕΙ ΑΛΛΑ Ο ΘΕΟΣ ΣΥΝΕΚΕΡΑΣΕΝ ΤΟ ΣΩΜΑ ΤΩΙ ΥΣΤΕΡΟΥΜΕΝΩΙ ΠΕΡΙΣΣΟΤΕΡΑΝ ΔΟΥΣ ΤΙΜΗΝ
12,25,ΙΝΑ ΜΗ ΗΙ ΣΧΙΣΜΑ ΕΝ ΤΩΙ ΣΩΜΑΤΙ ΑΛΛΑ ΤΟ ΑΥΤΟ ΥΠΕΡ ΑΛΛΗΛΩΝ ΜΕΡΙΜΝΩΣΙ ΤΑ ΜΕΛΗ
12,26,ΚΑΙ ΕΙΤΕ ΠΑΣΧΕΙ ΕΝ ΜΕΛΟΣ ΣΥΝΠΑΣΧΕΙ ΠΑΝΤΑ ΤΑ ΜΕΛΗ ΕΙΤΕ ΔΟΞΑΖΕΤΑΙ ΜΕΛΟΣ ΣΥΝΧΑΙΡΕΙ ΠΑΝΤΑ ΤΑ ΜΕΛΗ
12,27,ΥΜΕΙΣ ΔΕ ΕΣΤΕ ΣΩΜΑ ΧΡΙΣΤΟΥ ΚΑΙ ΜΕΛΗ ΕΚ ΜΕΡΟΥΣ
12,28,ΚΑΙ ΟΥΣ ΜΕΝ ΕΘΕΤΟ Ο ΘΕΟΣ ΕΝ ΤΗΙ ΕΚΚΛΗΣΙΑΙ ΠΡΩΤΟΝ ΑΠΟΣΤΟΛΟΥΣ ΔΕΥΤΕΡΟΝ ΠΡΟΦΗΤΑΣ ΤΡΙΤΟΝ ΔΙΔΑΣΚΑΛΟΥΣ ΕΠΕΙΤΑ ΔΥΝΑΜΕΙΣ ΕΠΕΙΤΑ ΧΑΡΙΣΜΑΤΑ ΙΑΜΑΤΩΝ ΑΝΤΙΛΗΜΨΕΙΣ ΚΥΒΕΡΝΗΣΕΙΣ ΓΕΝΗ ΓΛΩΣΣΩΝ
12,29,ΜΗ ΠΑΝΤΕΣ ΑΠΟΣΤΟΛΟΙ ΜΗ ΠΑΝΤΕΣ ΠΡΟΦΗΤΑΙ ΜΗ ΠΑΝΤΕΣ ΔΙΔΑΣΚΑΛΟΙ ΜΗ ΠΑΝΤΕΣ ΔΥΝΑΜΕΙΣ
12,30,ΜΗ ΠΑΝΤΕΣ ΧΑΡΙΣΜΑΤΑ ΕΧΟΥΣΙΝ ΙΑΜΑΤΩΝ ΜΗ ΠΑΝΤΕΣ ΓΛΩΣΣΑΙΣ ΛΑΛΟΥΣΙΝ ΜΗ ΠΑΝΤΕΣ ΔΙΕΡΜΗΝΕΥΟΥΣΙΝ
12,31,ΖΗΛΟΥΤΕ ΔΕ ΤΑ ΧΑΡΙΣΜΑΤΑ ΤΑ ΜΕΙΖΟΝΑ ΚΑΙ ΕΤΙ ΚΑΤΑ ΥΠΕΡΒΟΛΗΝ ΟΔΟΝ ΥΜΙΝ ΔΕΙΚΝΥΜΙ
13,1,ΕΑΝ ΤΑΙΣ ΓΛΩΣΣΑΙΣ ΤΩΝ ΑΝΘΡΩΠΩΝ ΛΑΛΩ ΚΑΙ ΤΩΝ ΑΓΓΕΛΩΝ ΑΓΑΠΗΝ ΔΕ ΜΗ ΕΧΩ ΓΕΓΟΝΑ ΧΑΛΚΟΣ ΗΧΩΝ Η ΚΥΜΒΑΛΟΝ ΑΛΑΛΑΖΟΝ
13,2,ΚΑΙ ΕΑΝ ΕΧΩ ΠΡΟΦΗΤΕΙΑΝ ΚΑΙ ΕΙΔΩ ΤΑ ΜΥΣΤΗΡΙΑ ΠΑΝΤΑ ΚΑΙ ΠΑΣΑΝ ΤΗΝ ΓΝΩΣΙΝ ΚΑΙ ΕΑΝ ΕΧΩ ΠΑΣΑΝ ΤΗΝ ΠΙΣΤΙΝ ΩΣΤΕ ΟΡΗ ΜΕΘΙΣΤΑΝΑΙ ΑΓΑΠΗΝ ΔΕ ΜΗ ΕΧΩ ΟΥΘΕΝ ΕΙΜΙ
13,3,ΚΑΝ ΨΩΜΙΣΩ ΠΑΝΤΑ ΤΑ ΥΠΑΡΧΟΝΤΑ ΜΟΥ ΚΑΙ ΕΑΝ ΠΑΡΑΔΩ ΤΟ ΣΩΜΑ ΜΟΥ ΙΝΑ ΚΑΥΧΗΣΩΜΑΙ ΑΓΑΠΗΝ ΔΕ ΜΗ ΕΧΩ ΟΥΔΕΝ ΩΦΕΛΟΥΜΑΙ
13,4,Η ΑΓΑΠΗ ΜΑΚΡΟΘΥΜΕΙ ΧΡΗΣΤΕΥΕΤΑΙ Η ΑΓΑΠΗ ΟΥ ΖΗΛΟΙ Η ΑΓΑΠΗ ΟΥ ΠΕΡΠΕΡΕΥΕΤΑΙ ΟΥ ΦΥΣΙΟΥΤΑΙ
13,5,ΟΥΚ ΑΣΧΗΜΟΝΕΙ ΟΥ ΖΗΤΕΙ ΤΑ ΕΑΥΤΗΣ ΟΥ ΠΑΡΟΞΥΝΕΤΑΙ ΟΥ ΛΟΓΙΖΕΤΑΙ ΤΟ ΚΑΚΟΝ
13,6,ΟΥ ΧΑΙΡΕΙ ΕΠΙ ΤΗΙ ΑΔΙΚΙΑΙ ΣΥΝΧΑΙΡΕΙ ΔΕ ΤΗΙ ΑΛΗΘΕΙΑΙ
13,7,ΠΑΝΤΑ ΣΤΕΓΕΙ ΠΑΝΤΑ ΠΙΣΤΕΥΕΙ ΠΑΝΤΑ ΕΛΠΙΖΕΙ ΠΑΝΤΑ ΥΠΟΜΕΝΕΙ
13,8,Η ΑΓΑΠΗ ΟΥΔΕΠΟΤΕ ΠΙΠΤΕΙ ΕΙΤΕ ΔΕ ΠΡΟΦΗΤΕΙΑΙ ΚΑΤΑΡΓΗΘΗΣΟΝΤΑΙ ΕΙΤΕ ΓΛΩΣΣΑΙ ΠΑΥΣΟΝΤΑΙ ΕΙΤΕ ΓΝΩΣΙΣ ΚΑΤΑΡΓΗΘΗΣΕΤΑΙ
13,9,ΕΚ ΜΕΡΟΥΣ ΓΑΡ ΓΙΝΩΣΚΟΜΕΝ ΚΑΙ ΕΚ ΜΕΡΟΥΣ ΠΡΟΦΗΤΕΥΟΜΕΝ
13,10,ΟΤΑΝ ΔΕ ΕΛΘΗΙ ΤΟ ΤΕΛΕΙΟΝ ΤΟ ΕΚ ΜΕΡΟΥΣ ΚΑΤΑΡΓΗΘΗΣΕΤΑΙ
13,11,ΟΤΕ ΗΜΗΝ ΝΗΠΙΟΣ ΕΛΑΛΟΥΝ ΩΣ ΝΗΠΙΟΣ ΕΦΡΟΝΟΥΝ ΩΣ ΝΗΠΙΟΣ ΕΛΟΓΙΖΟΜΗΝ ΩΣ ΝΗΠΙΟΣ ΟΤΕ ΓΕΓΟΝΑ ΑΝΗΡ ΚΑΤΗΡΓΗΚΑ ΤΑ ΤΟΥ ΝΗΠΙΟΥ
13,12,ΒΛΕΠΟΜΕΝ ΓΑΡ ΑΡΤΙ ΔΙΑ ΕΣΟΠΤΡΟΥ ΕΝ ΑΙΝΙΓΜΑΤΙ ΤΟΤΕ ΔΕ ΠΡΟΣΩΠΟΝ ΠΡΟΣ ΠΡΟΣΩΠΟΝ ΑΡΤΙ ΓΙΝΩΣΚΩ ΕΚ ΜΕΡΟΥΣ ΤΟΤΕ ΔΕ ΕΠΙΓΝΩΣΟΜΑΙ ΚΑΘΩΣ ΚΑΙ ΕΠΕΓΝΩΣΘΗΝ
13,13,ΝΥΝΙ ΔΕ ΜΕΝΕΙ ΠΙΣΤΙΣ ΕΛΠΙΣ ΑΓΑΠΗ ΤΑ ΤΡΙΑ ΤΑΥΤΑ ΜΕΙΖΩΝ ΔΕ ΤΟΥΤΩΝ Η ΑΓΑΠΗ
14,1,ΔΙΩΚΕΤΕ ΤΗΝ ΑΓΑΠΗΝ ΖΗΛΟΥΤΕ ΔΕ ΤΑ ΠΝΕΥΜΑΤΙΚΑ ΜΑΛΛΟΝ ΔΕ ΙΝΑ ΠΡΟΦΗΤΕΥΗΤΕ
14,2,Ο ΓΑΡ ΛΑΛΩΝ ΓΛΩΣΣΗΙ ΟΥΚ ΑΝΘΡΩΠΟΙΣ ΛΑΛΕΙ ΑΛΛΑ ΘΕΩΙ ΟΥΔΕΙΣ ΓΑΡ ΑΚΟΥΕΙ ΠΝΕΥΜΑΤΙ ΔΕ ΛΑΛΕΙ ΜΥΣΤΗΡΙΑ
14,3,Ο ΔΕ ΠΡΟΦΗΤΕΥΩΝ ΑΝΘΡΩΠΟΙΣ ΛΑΛΕΙ ΟΙΚΟΔΟΜΗΝ ΚΑΙ ΠΑΡΑΚΛΗΣΙΝ ΚΑΙ ΠΑΡΑΜΥΘΙΑΝ
14,4,Ο ΛΑΛΩΝ ΓΛΩΣΣΗΙ ΕΑΥΤΟΝ ΟΙΚΟΔΟΜΕΙ Ο ΔΕ ΠΡΟΦΗΤΕΥΩΝ ΕΚΚΛΗΣΙΑΝ ΟΙΚΟΔΟΜΕΙ
14,5,ΘΕΛΩ ΔΕ ΠΑΝΤΑΣ ΥΜΑΣ ΛΑΛΕΙΝ ΓΛΩΣΣΑΙΣ ΜΑΛΛΟΝ ΔΕ ΙΝΑ ΠΡΟΦΗΤΕΥΗΤΕ ΜΕΙΖΩΝ ΔΕ Ο ΠΡΟΦΗΤΕΥΩΝ Η Ο ΛΑΛΩΝ ΓΛΩΣΣΑΙΣ ΕΚΤΟΣ ΕΙ ΜΗ ΔΙΕΡΜΗΝΕΥΗΙ ΙΝΑ Η ΕΚΚΛΗΣΙΑ ΟΙΚΟΔΟΜΗΝ ΛΑΒΗΙ
14,6,ΝΥΝ ΔΕ ΑΔΕΛΦΟΙ ΕΑΝ ΕΛΘΩ ΠΡΟΣ ΥΜΑΣ ΓΛΩΣΣΑΙΣ ΛΑΛΩΝ ΤΙ ΥΜΑΣ ΩΦΕΛΗΣΩ ΕΑΝ ΜΗ ΥΜΙΝ ΛΑΛΗΣΩ Η ΕΝ ΑΠΟΚΑΛΥΨΕΙ Η ΕΝ ΓΝΩΣΕΙ Η ΕΝ ΠΡΟΦΗΤΕΙΑΙ Η ΔΙΔΑΧΗΙ
14,7,ΟΜΩΣ ΤΑ ΑΨΥΧΑ ΦΩΝΗΝ ΔΙΔΟΝΤΑ ΕΙΤΕ ΑΥΛΟΣ ΕΙΤΕ ΚΙΘΑΡΑ ΕΑΝ ΔΙΑΣΤΟΛΗΝ ΤΟΙΣ ΦΘΟΓΓΟΙΣ ΜΗ ΔΩΙ ΠΩΣ ΓΝΩΣΘΗΣΕΤΑΙ ΤΟ ΑΥΛΟΥΜΕΝΟΝ Η ΤΟ ΚΙΘΑΡΙΖΟΜΕΝΟΝ
14,8,ΚΑΙ ΓΑΡ ΕΑΝ ΑΔΗΛΟΝ ΣΑΛΠΙΓΞ ΦΩΝΗΝ ΔΩΙ ΤΙΣ ΠΑΡΑΣΚΕΥΑΣΕΤΑΙ ΕΙΣ ΠΟΛΕΜΟΝ
14,9,ΟΥΤΩΣ ΚΑΙ ΥΜΕΙΣ ΔΙΑ ΤΗΣ ΓΛΩΣΣΗΣ ΕΑΝ ΜΗ ΕΥΣΗΜΟΝ ΛΟΓΟΝ ΔΩΤΕ ΠΩΣ ΓΝΩΣΘΗΣΕΤΑΙ ΤΟ ΛΑΛΟΥΜΕΝΟΝ ΕΣΕΣΘΕ ΓΑΡ ΕΙΣ ΑΕΡΑ ΛΑΛΟΥΝΤΕΣ
14,10,ΤΟΣΑΥΤΑ ΕΙ ΤΥΧΟΙ ΓΕΝΗ ΦΩΝΩΝ ΕΙΣΙΝ ΕΝ ΚΟΣΜΩΙ ΚΑΙ ΟΥΔΕΝ ΑΦΩΝΟΝ
14,11,ΕΑΝ ΟΥΝ ΜΗ ΕΙΔΩ ΤΗΝ ΔΥΝΑΜΙΝ ΤΗΣ ΦΩΝΗΣ ΕΣΟΜΑΙ ΤΩΙ ΛΑΛΟΥΝΤΙ ΒΑΡΒΑΡΟΣ ΚΑΙ Ο ΛΑΛΩΝ ΕΝ ΕΜΟΙ ΒΑΡΒΑΡΟΣ
14,12,ΟΥΤΩΣ ΚΑΙ ΥΜΕΙΣ ΕΠΕΙ ΖΗΛΩΤΑΙ ΕΣΤΕ ΠΝΕΥΜΑΤΩΝ ΠΡΟΣ ΤΗΝ ΟΙΚΟΔΟΜΗΝ ΤΗΣ ΕΚΚΛΗΣΙΑΣ ΖΗΤΕΙΤΕ ΙΝΑ ΠΕΡΙΣΣΕΥΗΤΕ
14,13,ΔΙΟ Ο ΛΑΛΩΝ ΓΛΩΣΣΗΙ ΠΡΟΣΕΥΧΕΣΘΩ ΙΝΑ ΔΙΕΡΜΗΝΕΥΗΙ
14,14,ΕΑΝ ΠΡΟΣΕΥΧΩΜΑΙ ΓΛΩΣΣΗΙ ΤΟ ΠΝΕΥΜΑ ΜΟΥ ΠΡΟΣΕΥΧΕΤΑΙ Ο ΔΕ ΝΟΥΣ ΜΟΥ ΑΚΑΡΠΟΣ ΕΣΤΙΝ
14,15,ΤΙ ΟΥΝ ΕΣΤΙΝ ΠΡΟΣΕΥΞΟΜΑΙ ΤΩΙ ΠΝΕΥΜΑΤΙ ΠΡΟΣΕΥΞΟΜΑΙ ΔΕ ΚΑΙ ΤΩΙ ΝΟΙ ΨΑΛΩ ΤΩΙ ΠΝΕΥΜΑΤΙ ΨΑΛΩ ΔΕ ΚΑΙ ΤΩΙ ΝΟΙ
14,16,ΕΠΕΙ ΕΑΝ ΕΥΛΟΓΗΙΣ ΠΝΕΥΜΑΤΙ Ο ΑΝΑΠΛΗΡΩΝ ΤΟΝ ΤΟΠΟΝ ΤΟΥ ΙΔΙΩΤΟΥ ΠΩΣ ΕΡΕΙ ΤΟ ΑΜΗΝ ΕΠΙ ΤΗΙ ΣΗΙ ΕΥΧΑΡΙΣΤΙΑΙ ΕΠΕΙΔΗ ΤΙ ΛΕΓΕΙΣ ΟΥΚ ΟΙΔΕΝ
14,17,ΣΥ ΜΕΝ ΓΑΡ ΚΑΛΩΣ ΕΥΧΑΡΙΣΤΕΙΣ ΑΛΛΑ Ο ΕΤΕΡΟΣ ΟΥΚ ΟΙΚΟΔΟΜΕΙΤΑΙ
14,18,ΕΥΧΑΡΙΣΤΩ ΤΩΙ ΘΕΩΙ ΠΑΝΤΩΝ ΥΜΩΝ ΜΑΛΛΟΝ ΓΛΩΣΣΑΙΣ ΛΑΛΩ
14,19,ΑΛΛΑ ΕΝ ΕΚΚΛΗΣΙΑΙ ΘΕΛΩ ΠΕΝΤΕ ΛΟΓΟΥΣ ΤΩΙ ΝΟΙ ΜΟΥ ΛΑΛΗΣΑΙ ΙΝΑ ΚΑΙ ΑΛΛΟΥΣ ΚΑΤΗΧΗΣΩ Η ΜΥΡΙΟΥΣ ΛΟΓΟΥΣ ΕΝ ΓΛΩΣΣΗΙ
14,20,ΑΔΕΛΦΟΙ ΜΗ ΠΑΙΔΙΑ ΓΙΝΕΣΘΕ ΤΑΙΣ ΦΡΕΣΙΝ ΑΛΛΑ ΤΗΙ ΚΑΚΙΑΙ ΝΗΠΙΑΖΕΤΕ ΤΑΙΣ ΔΕ ΦΡΕΣΙΝ ΤΕΛΕΙΟΙ ΓΙΝΕΣΘΕ
14,21,ΕΝ ΤΩΙ ΝΟΜΩΙ ΓΕΓΡΑΠΤΑΙ ΟΤΙ ΕΝ ΕΤΕΡΟΓΛΩΣΣΟΙΣ ΚΑΙ ΕΝ ΧΕΙΛΕΣΙΝ ΕΤΕΡΩΝ ΛΑΛΗΣΩ ΤΩΙ ΛΑΩΙ ΤΟΥΤΩΙ ΚΑΙ ΟΥΔΕ ΟΥΤΩΣ ΕΙΣΑΚΟΥΣΟΝΤΑΙ ΜΟΥ ΛΕΓΕΙ ΚΥΡΙΟΣ
14,22,ΩΣΤΕ ΑΙ ΓΛΩΣΣΑΙ ΕΙΣ ΣΗΜΕΙΟΝ ΕΙΣΙΝ ΟΥ ΤΟΙΣ ΠΙΣΤΕΥΟΥΣΙΝ ΑΛΛΑ ΤΟΙΣ ΑΠΙΣΤΟΙΣ Η ΔΕ ΠΡΟΦΗΤΕΙΑ ΟΥ ΤΟΙΣ ΑΠΙΣΤΟΙΣ ΑΛΛΑ ΤΟΙΣ ΠΙΣΤΕΥΟΥΣΙΝ
14,23,ΕΑΝ ΟΥΝ ΣΥΝΕΛΘΗΙ Η ΕΚΚΛΗΣΙΑ ΟΛΗ ΕΠΙ ΤΟ ΑΥΤΟ ΚΑΙ ΠΑΝΤΕΣ ΛΑΛΩΣΙΝ ΓΛΩΣΣΑΙΣ ΕΙΣΕΛΘΩΣΙΝ ΔΕ ΙΔΙΩΤΑΙ Η ΑΠΙΣΤΟΙ ΟΥΚ ΕΡΟΥΣΙΝ ΟΤΙ ΜΑΙΝΕΣΘΕ
14,24,ΕΑΝ ΔΕ ΠΑΝΤΕΣ ΠΡΟΦΗΤΕΥΩΣΙΝ ΕΙΣΕΛΘΗΙ ΔΕ ΤΙΣ ΑΠΙΣΤΟΣ Η ΙΔΙΩΤΗΣ ΕΛΕΓΧΕΤΑΙ ΥΠΟ ΠΑΝΤΩΝ ΑΝΑΚΡΙΝΕΤΑΙ ΥΠΟ ΠΑΝΤΩΝ
14,25,ΤΑ ΚΡΥΠΤΑ ΤΗΣ ΚΑΡΔΙΑΣ ΑΥΤΟΥ ΦΑΝΕΡΑ ΓΙΝΕΤΑΙ ΚΑΙ ΟΥΤΩΣ ΠΕΣΩΝ ΕΠΙ ΠΡΟΣΩΠΟΝ ΠΡΟΣΚΥΝΗΣΕΙ ΤΩΙ ΘΕΩΙ ΑΠΑΓΓΕΛΛΩΝ ΟΤΙ ΟΝΤΩΣ Ο ΘΕΟΣ ΕΝ ΥΜΙΝ ΕΣΤΙΝ
14,26,ΤΙ ΟΥΝ ΕΣΤΙΝ ΑΔΕΛΦΟΙ ΟΤΑΝ ΣΥΝΕΡΧΗΣΘΕ ΕΚΑΣΤΟΣ ΨΑΛΜΟΝ ΕΧΕΙ ΔΙΔΑΧΗΝ ΕΧΕΙ ΑΠΟΚΑΛΥΨΙΝ ΕΧΕΙ ΓΛΩΣΣΑΝ ΕΧΕΙ ΕΡΜΗΝΙΑΝ ΕΧΕΙ ΠΑΝΤΑ ΠΡΟΣ ΟΙΚΟΔΟΜΗΝ ΓΙΝΕΣΘΩ
14,27,ΕΙΤΕ ΓΛΩΣΣΗΙ ΤΙΣ ΛΑΛΕΙ ΚΑΤΑ ΔΥΟ Η ΤΟ ΠΛΕΙΣΤΟΝ ΤΡΕΙΣ ΚΑΙ ΑΝΑ ΜΕΡΟΣ ΚΑΙ ΕΙΣ ΔΙΕΡΜΗΝΕΥΕΤΩ
14,28,ΕΑΝ ΔΕ ΜΗ ΗΙ ΔΙΕΡΜΗΝΕΥΤΗΣ ΣΙΓΑΤΩ ΕΝ ΕΚΚΛΗΣΙΑΙ ΕΑΥΤΩΙ ΔΕ ΛΑΛΕΙΤΩ ΚΑΙ ΤΩΙ ΘΕΩΙ
14,29,ΠΡΟΦΗΤΑΙ ΔΕ ΔΥΟ Η ΤΡΕΙΣ ΛΑΛΕΙΤΩΣΑΝ ΚΑΙ ΟΙ ΑΛΛΟΙ ΔΙΑΚΡΙΝΕΤΩΣΑΝ
14,30,ΕΑΝ ΔΕ ΑΛΛΩΙ ΑΠΟΚΑΛΥΦΘΗΙ ΚΑΘΗΜΕΝΩΙ Ο ΠΡΩΤΟΣ ΣΙΓΑΤΩ
14,31,ΔΥΝΑΣΘΕ ΓΑΡ ΚΑΤΑ ΕΝΑ ΠΑΝΤΕΣ ΠΡΟΦΗΤΕΥΕΙΝ ΙΝΑ ΠΑΝΤΕΣ ΜΑΝΘΑΝΩΣΙΝ ΚΑΙ ΠΑΝΤΕΣ ΠΑΡΑΚΑΛΩΝΤΑΙ
14,32,ΚΑΙ ΠΝΕΥΜΑΤΑ ΠΡΟΦΗΤΩΝ ΠΡΟΦΗΤΑΙΣ ΥΠΟΤΑΣΣΕΤΑΙ
14,33,ΟΥ ΓΑΡ ΕΣΤΙΝ ΑΚΑΤΑΣΤΑΣΙΑΣ Ο ΘΕΟΣ ΑΛΛΑ ΕΙΡΗΝΗΣ ΩΣ ΕΝ ΠΑΣΑΙΣ ΤΑΙΣ ΕΚΚΛΗΣΙΑΙΣ ΤΩΝ ΑΓΙΩΝ
14,34,ΑΙ ΓΥΝΑΙΚΕΣ ΕΝ ΤΑΙΣ ΕΚΚΛΗΣΙΑΙΣ ΣΙΓΑΤΩΣΑΝ ΟΥ ΓΑΡ ΕΠΙΤΡΕΠΕΤΑΙ ΑΥΤΑΙΣ ΛΑΛΕΙΝ ΑΛΛΑ ΥΠΟΤΑΣΣΕΣΘΩΣΑΝ ΚΑΘΩΣ ΚΑΙ Ο ΝΟΜΟΣ ΛΕΓΕΙ
14,35,ΕΙ ΔΕ ΤΙ ΜΑΘΕΙΝ ΘΕΛΟΥΣΙΝ ΕΝ ΟΙΚΩΙ ΤΟΥΣ ΙΔΙΟΥΣ ΑΝΔΡΑΣ ΕΠΕΡΩΤΑΤΩΣΑΝ ΑΙΣΧΡΟΝ ΓΑΡ ΕΣΤΙΝ ΓΥΝΑΙΚΙ ΛΑΛΕΙΝ ΕΝ ΕΚΚΛΗΣΙΑΙ
14,36,Η ΑΠΟ ΥΜΩΝ Ο ΛΟΓΟΣ ΤΟΥ ΘΕΟΥ ΕΞΗΛΘΕΝ Η ΕΙΣ ΥΜΑΣ ΜΟΝΟΥΣ ΚΑΤΗΝΤΗΣΕΝ
14,37,ΕΙ ΤΙΣ ΔΟΚΕΙ ΠΡΟΦΗΤΗΣ ΕΙΝΑΙ Η ΠΝΕΥΜΑΤΙΚΟΣ ΕΠΙΓΙΝΩΣΚΕΤΩ Α ΓΡΑΦΩ ΥΜΙΝ ΟΤΙ ΚΥΡΙΟΥ ΕΣΤΙΝ ΕΝΤΟΛΗ
14,38,ΕΙ ΔΕ ΤΙΣ ΑΓΝΟΕΙ ΑΓΝΟΕΙΤΩ
14,39,ΩΣΤΕ ΑΔΕΛΦΟΙ ΖΗΛΟΥΤΕ ΤΟ ΠΡΟΦΗΤΕΥΕΙΝ ΚΑΙ ΤΟ ΛΑΛΕΙΝ ΜΗ ΚΩΛΥΕΤΕ ΓΛΩΣΣΑΙΣ
14,40,ΠΑΝΤΑ ΔΕ ΕΥΣΧΗΜΟΝΩΣ ΚΑΙ ΚΑΤΑ ΤΑΞΙΝ ΓΙΝΕΣΘΩ
15,1,ΓΝΩΡΙΖΩ ΔΕ ΥΜΙΝ ΑΔΕΛΦΟΙ ΤΟ ΕΥΑΓΓΕΛΙΟΝ Ο ΕΥΗΓΓΕΛΙΣΑΜΗΝ ΥΜΙΝ Ο ΚΑΙ ΠΑΡΕΛΑΒΕΤΕ ΕΝ ΩΙ ΚΑΙ ΕΣΤΗΚΑΤΕ
15,2,ΔΙΑ ΟΥ ΚΑΙ ΣΩΙΖΕΣΘΕ ΤΙΝΙ ΛΟΓΩΙ ΕΥΗΓΓΕΛΙΣΑΜΗΝ ΥΜΙΝ ΕΙ ΚΑΤΕΧΕΤΕ ΕΚΤΟΣ ΕΙ ΜΗ ΕΙΚΗΙ ΕΠΙΣΤΕΥΣΑΤΕ
15,3,ΠΑΡΕΔΩΚΑ ΓΑΡ ΥΜΙΝ ΕΝ ΠΡΩΤΟΙΣ Ο ΚΑΙ ΠΑΡΕΛΑΒΟΝ ΟΤΙ ΧΡΙΣΤΟΣ ΑΠΕΘΑΝΕΝ ΥΠΕΡ ΤΩΝ ΑΜΑΡΤΙΩΝ ΗΜΩΝ ΚΑΤΑ ΤΑΣ ΓΡΑΦΑΣ
15,4,ΚΑΙ ΟΤΙ ΕΤΑΦΗ ΚΑΙ ΟΤΙ ΕΓΗΓΕΡΤΑΙ ΤΗΙ ΗΜΕΡΑΙ ΤΗΙ ΤΡΙΤΗΙ ΚΑΤΑ ΤΑΣ ΓΡΑΦΑΣ
15,5,ΚΑΙ ΟΤΙ ΩΦΘΗ ΚΗΦΑΙ ΕΙΤΑ ΤΟΙΣ ΔΩΔΕΚΑ
15,6,ΕΠΕΙΤΑ ΩΦΘΗ ΕΠΑΝΩ ΠΕΝΤΑΚΟΣΙΟΙΣ ΑΔΕΛΦΟΙΣ ΕΦΑΠΑΞ ΕΞ ΩΝ ΟΙ ΠΛΕΙΟΝΕΣ ΜΕΝΟΥΣΙΝ ΕΩΣ ΑΡΤΙ ΤΙΝΕΣ ΔΕ ΕΚΟΙΜΗΘΗΣΑΝ
15,7,ΕΠΕΙΤΑ ΩΦΘΗ ΙΑΚΩΒΩΙ ΕΙΤΑ ΤΟΙΣ ΑΠΟΣΤΟΛΟΙΣ ΠΑΣΙΝ
15,8,ΕΣΧΑΤΟΝ ΔΕ ΠΑΝΤΩΝ ΩΣΠΕΡΕΙ ΤΩΙ ΕΚΤΡΩΜΑΤΙ ΩΦΘΗ ΚΑΜΟΙ
15,9,ΕΓΩ ΓΑΡ ΕΙΜΙ Ο ΕΛΑΧΙΣΤΟΣ ΤΩΝ ΑΠΟΣΤΟΛΩΝ ΟΣ ΟΥΚ ΕΙΜΙ ΙΚΑΝΟΣ ΚΑΛΕΙΣΘΑΙ ΑΠΟΣΤΟΛΟΣ ΔΙΟΤΙ ΕΔΙΩΞΑ ΤΗΝ ΕΚΚΛΗΣΙΑΝ ΤΟΥ ΘΕΟΥ
15,10,ΧΑΡΙΤΙ ΔΕ ΘΕΟΥ ΕΙΜΙ Ο ΕΙΜΙ ΚΑΙ Η ΧΑΡΙΣ ΑΥΤΟΥ Η ΕΙΣ ΕΜΕ ΟΥ ΚΕΝΗ ΕΓΕΝΗΘΗ ΑΛΛΑ ΠΕΡΙΣΣΟΤΕΡΟΝ ΑΥΤΩΝ ΠΑΝΤΩΝ ΕΚΟΠΙΑΣΑ ΟΥΚ ΕΓΩ ΔΕ ΑΛΛΑ Η ΧΑΡΙΣ ΤΟΥ ΘΕΟΥ ΣΥΝ ΕΜΟΙ
15,11,ΕΙΤΕ ΟΥΝ ΕΓΩ ΕΙΤΕ ΕΚΕΙΝΟΙ ΟΥΤΩΣ ΚΗΡΥΣΣΟΜΕΝ ΚΑΙ ΟΥΤΩΣ ΕΠΙΣΤΕΥΣΑΤΕ
15,12,ΕΙ ΔΕ ΧΡΙΣΤΟΣ ΚΗΡΥΣΣΕΤΑΙ ΟΤΙ ΕΚ ΝΕΚΡΩΝ ΕΓΗΓΕΡΤΑΙ ΠΩΣ ΛΕΓΟΥΣΙΝ ΕΝ ΥΜΙΝ ΤΙΝΕΣ ΟΤΙ ΑΝΑΣΤΑΣΙΣ ΝΕΚΡΩΝ ΟΥΚ ΕΣΤΙΝ
15,13,ΕΙ ΔΕ ΑΝΑΣΤΑΣΙΣ ΝΕΚΡΩΝ ΟΥΚ ΕΣΤΙΝ ΟΥΔΕ ΧΡΙΣΤΟΣ ΕΓΗΓΕΡΤΑΙ
15,14,ΕΙ ΔΕ ΧΡΙΣΤΟΣ ΟΥΚ ΕΓΗΓΕΡΤΑΙ ΚΕΝΟΝ ΑΡΑ ΤΟ ΚΗΡΥΓΜΑ ΗΜΩΝ ΚΕΝΗ ΚΑΙ Η ΠΙΣΤΙΣ ΥΜΩΝ
15,15,ΕΥΡΙΣΚΟΜΕΘΑ ΔΕ ΚΑΙ ΨΕΥΔΟΜΑΡΤΥΡΕΣ ΤΟΥ ΘΕΟΥ ΟΤΙ ΕΜΑΡΤΥΡΗΣΑΜΕΝ ΚΑΤΑ ΤΟΥ ΘΕΟΥ ΟΤΙ ΗΓΕΙΡΕΝ ΤΟΝ ΧΡΙΣΤΟΝ ΟΝ ΟΥΚ ΗΓΕΙΡΕΝ ΕΙΠΕΡ ΑΡΑ ΝΕΚΡΟΙ ΟΥΚ ΕΓΕΙΡΟΝΤΑΙ
15,16,ΕΙ ΓΑΡ ΝΕΚΡΟΙ ΟΥΚ ΕΓΕΙΡΟΝΤΑΙ ΟΥΔΕ ΧΡΙΣΤΟΣ ΕΓΗΓΕΡΤΑΙ
15,17,ΕΙ ΔΕ ΧΡΙΣΤΟΣ ΟΥΚ ΕΓΗΓΕΡΤΑΙ ΜΑΤΑΙΑ Η ΠΙΣΤΙΣ ΥΜΩΝ ΕΤΙ ΕΣΤΕ ΕΝ ΤΑΙΣ ΑΜΑΡΤΙΑΙΣ ΥΜΩΝ
15,18,ΑΡΑ ΚΑΙ ΟΙ ΚΟΙΜΗΘΕΝΤΕΣ ΕΝ ΧΡΙΣΤΩΙ ΑΠΩΛΟΝΤΟ
15,19,ΕΙ ΕΝ ΤΗΙ ΖΩΗΙ ΤΑΥΤΗΙ ΕΝ ΧΡΙΣΤΩΙ ΗΛΠΙΚΟΤΕΣ ΕΣΜΕΝ ΜΟΝΟΝ ΕΛΕΕΙΝΟΤΕΡΟΙ ΠΑΝΤΩΝ ΑΝΘΡΩΠΩΝ ΕΣΜΕΝ
15,20,ΝΥΝΙ ΔΕ ΧΡΙΣΤΟΣ ΕΓΗΓΕΡΤΑΙ ΕΚ ΝΕΚΡΩΝ ΑΠΑΡΧΗ ΤΩΝ ΚΕΚΟΙΜΗΜΕΝΩΝ
15,21,ΕΠΕΙΔΗ ΓΑΡ ΔΙΑ ΑΝΘΡΩΠΟΥ ΘΑΝΑΤΟΣ ΚΑΙ ΔΙΑ ΑΝΘΡΩΠΟΥ ΑΝΑΣΤΑΣΙΣ ΝΕΚΡΩΝ
15,22,ΩΣΠΕΡ ΓΑΡ ΕΝ ΤΩΙ ΑΔΑΜ ΠΑΝΤΕΣ ΑΠΟΘΝΗΙΣΚΟΥΣΙΝ ΟΥΤΩΣ ΚΑΙ ΕΝ ΤΩΙ ΧΡΙΣΤΩΙ ΠΑΝΤΕΣ ΖΩΙΟΠΟΙΗΘΗΣΟΝΤΑΙ
15,23,ΕΚΑΣΤΟΣ ΔΕ ΕΝ ΤΩΙ ΙΔΙΩΙ ΤΑΓΜΑΤΙ ΑΠΑΡΧΗ ΧΡΙΣΤΟΣ ΕΠΕΙΤΑ ΟΙ ΤΟΥ ΧΡΙΣΤΟΥ ΕΝ ΤΗΙ ΠΑΡΟΥΣΙΑΙ ΑΥΤΟΥ
15,24,ΕΙΤΑ ΤΟ ΤΕΛΟΣ ΟΤΑΝ ΠΑΡΑΔΙΔΩΙ ΤΗΝ ΒΑΣΙΛΕΙΑΝ ΤΩΙ ΘΕΩΙ ΚΑΙ ΠΑΤΡΙ ΟΤΑΝ ΚΑΤΑΡΓΗΣΗΙ ΠΑΣΑΝ ΑΡΧΗΝ ΚΑΙ ΠΑΣΑΝ ΕΞΟΥΣΙΑΝ ΚΑΙ ΔΥΝΑΜΙΝ
15,25,ΔΕΙ ΓΑΡ ΑΥΤΟΝ ΒΑΣΙΛΕΥΕΙΝ ΑΧΡΙ ΟΥ ΘΗΙ ΠΑΝΤΑΣ ΤΟΥΣ ΕΧΘΡΟΥΣ ΥΠΟ ΤΟΥΣ ΠΟΔΑΣ ΑΥΤΟΥ
15,26,ΕΣΧΑΤΟΣ ΕΧΘΡΟΣ ΚΑΤΑΡΓΕΙΤΑΙ Ο ΘΑΝΑΤΟΣ
15,27,ΠΑΝΤΑ ΓΑΡ ΥΠΕΤΑΞΕΝ ΥΠΟ ΤΟΥΣ ΠΟΔΑΣ ΑΥΤΟΥ ΟΤΑΝ ΔΕ ΕΙΠΗΙ ΟΤΙ ΠΑΝΤΑ ΥΠΟΤΕΤΑΚΤΑΙ ΔΗΛΟΝ ΟΤΙ ΕΚΤΟΣ ΤΟΥ ΥΠΟΤΑΞΑΝΤΟΣ ΑΥΤΩΙ ΤΑ ΠΑΝΤΑ
15,28,ΟΤΑΝ ΔΕ ΥΠΟΤΑΓΗΙ ΑΥΤΩΙ ΤΑ ΠΑΝΤΑ ΤΟΤΕ ΚΑΙ ΑΥΤΟΣ Ο ΥΙΟΣ ΥΠΟΤΑΓΗΣΕΤΑΙ ΤΩΙ ΥΠΟΤΑΞΑΝΤΙ ΑΥΤΩΙ ΤΑ ΠΑΝΤΑ ΙΝΑ ΗΙ Ο ΘΕΟΣ ΠΑΝΤΑ ΕΝ ΠΑΣΙΝ
15,29,ΕΠΕΙ ΤΙ ΠΟΙΗΣΟΥΣΙΝ ΟΙ ΒΑΠΤΙΖΟΜΕΝΟΙ ΥΠΕΡ ΤΩΝ ΝΕΚΡΩΝ ΕΙ ΟΛΩΣ ΝΕΚΡΟΙ ΟΥΚ ΕΓΕΙΡΟΝΤΑΙ ΤΙ ΚΑΙ ΒΑΠΤΙΖΟΝΤΑΙ ΥΠΕΡ ΑΥΤΩΝ
15,30,ΤΙ ΚΑΙ ΗΜΕΙΣ ΚΙΝΔΥΝΕΥΟΜΕΝ ΠΑΣΑΝ ΩΡΑΝ
15,31,ΚΑΤΑ ΗΜΕΡΑΝ ΑΠΟΘΝΗΙΣΚΩ ΝΗ ΤΗΝ ΥΜΕΤΕΡΑΝ ΚΑΥΧΗΣΙΝ ΑΔΕΛΦΟΙ ΗΝ ΕΧΩ ΕΝ ΧΡΙΣΤΩΙ ΙΗΣΟΥ ΤΩΙ ΚΥΡΙΩΙ ΗΜΩΝ
15,32,ΕΙ ΚΑΤΑ ΑΝΘΡΩΠΟΝ ΕΘΗΡΙΟΜΑΧΗΣΑ ΕΝ ΕΦΕΣΩΙ ΤΙ ΜΟΙ ΤΟ ΟΦΕΛΟΣ ΕΙ ΝΕΚΡΟΙ ΟΥΚ ΕΓΕΙΡΟΝΤΑΙ ΦΑΓΩΜΕΝ ΚΑΙ ΠΙΩΜΕΝ ΑΥΡΙΟΝ ΓΑΡ ΑΠΟΘΝΗΙΣΚΟΜΕΝ
15,33,ΜΗ ΠΛΑΝΑΣΘΕ ΦΘΕΙΡΟΥΣΙΝ ΗΘΗ ΧΡΗΣΤΑ ΟΜΙΛΙΑΙ ΚΑΚΑΙ
15,34,ΕΚΝΗΨΑΤΕ ΔΙΚΑΙΩΣ ΚΑΙ ΜΗ ΑΜΑΡΤΑΝΕΤΕ ΑΓΝΩΣΙΑΝ ΓΑΡ ΘΕΟΥ ΤΙΝΕΣ ΕΧΟΥΣΙΝ ΠΡΟΣ ΕΝΤΡΟΠΗΝ ΥΜΙΝ ΛΑΛΩ
15,35,ΑΛΛΑ ΕΡΕΙ ΤΙΣ ΠΩΣ ΕΓΕΙΡΟΝΤΑΙ ΟΙ ΝΕΚΡΟΙ ΠΟΙΩΙ ΔΕ ΣΩΜΑΤΙ ΕΡΧΟΝΤΑΙ
15,36,ΑΦΡΩΝ ΣΥ Ο ΣΠΕΙΡΕΙΣ ΟΥ ΖΩΙΟΠΟΙΕΙΤΑΙ ΕΑΝ ΜΗ ΑΠΟΘΑΝΗΙ
15,37,ΚΑΙ Ο ΣΠΕΙΡΕΙΣ ΟΥ ΤΟ ΣΩΜΑ ΤΟ ΓΕΝΗΣΟΜΕΝΟΝ ΣΠΕΙΡΕΙΣ ΑΛΛΑ ΓΥΜΝΟΝ ΚΟΚΚΟΝ ΕΙ ΤΥΧΟΙ ΣΙΤΟΥ Η ΤΙΝΟΣ ΤΩΝ ΛΟΙΠΩΝ
15,38,Ο ΔΕ ΘΕΟΣ ΔΙΔΩΣΙΝ ΑΥΤΩΙ ΣΩΜΑ ΚΑΘΩΣ ΗΘΕΛΗΣΕΝ ΚΑΙ ΕΚΑΣΤΩΙ ΤΩΝ ΣΠΕΡΜΑΤΩΝ ΙΔΙΟΝ ΣΩΜΑ
15,39,ΟΥ ΠΑΣΑ ΣΑΡΞ Η ΑΥΤΗ ΣΑΡΞ ΑΛΛΑ ΑΛΛΗ ΜΕΝ ΑΝΘΡΩΠΩΝ ΑΛΛΗ ΔΕ ΣΑΡΞ ΚΤΗΝΩΝ ΑΛΛΗ ΔΕ ΣΑΡΞ ΠΤΗΝΩΝ ΑΛΛΗ ΔΕ ΙΧΘΥΩΝ
15,40,ΚΑΙ ΣΩΜΑΤΑ ΕΠΟΥΡΑΝΙΑ ΚΑΙ ΣΩΜΑΤΑ ΕΠΙΓΕΙΑ ΑΛΛΑ ΕΤΕΡΑ ΜΕΝ Η ΤΩΝ ΕΠΟΥΡΑΝΙΩΝ ΔΟΞΑ ΕΤΕΡΑ ΔΕ Η ΤΩΝ ΕΠΙΓΕΙΩΝ
15,41,ΑΛΛΗ ΔΟΞΑ ΗΛΙΟΥ ΚΑΙ ΑΛΛΗ ΔΟΞΑ ΣΕΛΗΝΗΣ ΚΑΙ ΑΛΛΗ ΔΟΞΑ ΑΣΤΕΡΩΝ ΑΣΤΗΡ ΓΑΡ ΑΣΤΕΡΟΣ ΔΙΑΦΕΡΕΙ ΕΝ ΔΟΞΗΙ
15,42,ΟΥΤΩΣ ΚΑΙ Η ΑΝΑΣΤΑΣΙΣ ΤΩΝ ΝΕΚΡΩΝ ΣΠΕΙΡΕΤΑΙ ΕΝ ΦΘΟΡΑΙ ΕΓΕΙΡΕΤΑΙ ΕΝ ΑΦΘΑΡΣΙΑΙ
15,43,ΣΠΕΙΡΕΤΑΙ ΕΝ ΑΤΙΜΙΑΙ ΕΓΕΙΡΕΤΑΙ ΕΝ ΔΟΞΗΙ ΣΠΕΙΡΕΤΑΙ ΕΝ ΑΣΘΕΝΕΙΑΙ ΕΓΕΙΡΕΤΑΙ ΕΝ ΔΥΝΑΜΕΙ
15,44,ΣΠΕΙΡΕΤΑΙ ΣΩΜΑ ΨΥΧΙΚΟΝ ΕΓΕΙΡΕΤΑΙ ΣΩΜΑ ΠΝΕΥΜΑΤΙΚΟΝ ΕΙ ΕΣΤΙΝ ΣΩΜΑ ΨΥΧΙΚΟΝ ΕΣΤΙΝ ΚΑΙ ΠΝΕΥΜΑΤΙΚΟΝ
15,45,ΟΥΤΩΣ ΚΑΙ ΓΕΓΡΑΠΤΑΙ ΕΓΕΝΕΤΟ Ο ΠΡΩΤΟΣ ΑΝΘΡΩΠΟΣ ΑΔΑΜ ΕΙΣ ΨΥΧΗΝ ΖΩΣΑΝ Ο ΕΣΧΑΤΟΣ ΑΔΑΜ ΕΙΣ ΠΝΕΥΜΑ ΖΩΙΟΠΟΙΟΥΝ
15,46,ΑΛΛΑ ΟΥ ΠΡΩΤΟΝ ΤΟ ΠΝΕΥΜΑΤΙΚΟΝ ΑΛΛΑ ΤΟ ΨΥΧΙΚΟΝ ΕΠΕΙΤΑ ΤΟ ΠΝΕΥΜΑΤΙΚΟΝ
15,47,Ο ΠΡΩΤΟΣ ΑΝΘΡΩΠΟΣ ΕΚ ΓΗΣ ΧΟΙΚΟΣ Ο ΔΕΥΤΕΡΟΣ ΑΝΘΡΩΠΟΣ ΕΞ ΟΥΡΑΝΟΥ
15,48,ΟΙΟΣ Ο ΧΟΙΚΟΣ ΤΟΙΟΥΤΟΙ ΚΑΙ ΟΙ ΧΟΙΚΟΙ ΚΑΙ ΟΙΟΣ Ο ΕΠΟΥΡΑΝΙΟΣ ΤΟΙΟΥΤΟΙ ΚΑΙ ΟΙ ΕΠΟΥΡΑΝΙΟΙ
15,49,ΚΑΙ ΚΑΘΩΣ ΕΦΟΡΕΣΑΜΕΝ ΤΗΝ ΕΙΚΟΝΑ ΤΟΥ ΧΟΙΚΟΥ ΦΟΡΕΣΩΜΕΝ ΚΑΙ ΤΗΝ ΕΙΚΟΝΑ ΤΟΥ ΕΠΟΥΡΑΝΙΟΥ
15,50,ΤΟΥΤΟ ΔΕ ΦΗΜΙ ΑΔΕΛΦΟΙ ΟΤΙ ΣΑΡΞ ΚΑΙ ΑΙΜΑ ΒΑΣΙΛΕΙΑΝ ΘΕΟΥ ΚΛΗΡΟΝΟΜΗΣΑΙ ΟΥ ΔΥΝΑΤΑΙ ΟΥΔΕ Η ΦΘΟΡΑ ΤΗΝ ΑΦΘΑΡΣΙΑΝ ΚΛΗΡΟΝΟΜΕΙ
15,51,ΙΔΟΥ ΜΥΣΤΗΡΙΟΝ ΥΜΙΝ ΛΕΓΩ ΠΑΝΤΕΣ ΟΥ ΚΟΙΜΗΘΗΣΟΜΕΘΑ ΠΑΝΤΕΣ ΔΕ ΑΛΛΑΓΗΣΟΜΕΘΑ
15,52,ΕΝ ΑΤΟΜΩΙ ΕΝ ΡΙΠΗΙ ΟΦΘΑΛΜΟΥ ΕΝ ΤΗΙ ΕΣΧΑΤΗΙ ΣΑΛΠΙΓΓΙ ΣΑΛΠΙΣΕΙ ΓΑΡ ΚΑΙ ΟΙ ΝΕΚΡΟΙ ΕΓΕΡΘΗΣΟΝΤΑΙ ΑΦΘΑΡΤΟΙ ΚΑΙ ΗΜΕΙΣ ΑΛΛΑΓΗΣΟΜΕΘΑ
15,53,ΔΕΙ ΓΑΡ ΤΟ ΦΘΑΡΤΟΝ ΤΟΥΤΟ ΕΝΔΥΣΑΣΘΑΙ ΑΦΘΑΡΣΙΑΝ ΚΑΙ ΤΟ ΘΝΗΤΟΝ ΤΟΥΤΟ ΕΝΔΥΣΑΣΘΑΙ ΑΘΑΝΑΣΙΑΝ
15,54,ΟΤΑΝ ΔΕ ΤΟ ΦΘΑΡΤΟΝ ΤΟΥΤΟ ΕΝΔΥΣΗΤΑΙ ΑΦΘΑΡΣΙΑΝ ΚΑΙ ΤΟ ΘΝΗΤΟΝ ΤΟΥΤΟ ΕΝΔΥΣΗΤΑΙ ΑΘΑΝΑΣΙΑΝ ΤΟΤΕ ΓΕΝΗΣΕΤΑΙ Ο ΛΟΓΟΣ Ο ΓΕΓΡΑΜΜΕΝΟΣ ΚΑΤΕΠΟΘΗ Ο ΘΑΝΑΤΟΣ ΕΙΣ ΝΙΚΟΣ
15,55,ΠΟΥ ΣΟΥ ΘΑΝΑΤΕ ΤΟ ΝΙΚΟΣ ΠΟΥ ΣΟΥ ΘΑΝΑΤΕ ΤΟ ΚΕΝΤΡΟΝ
15,56,ΤΟ ΔΕ ΚΕΝΤΡΟΝ ΤΟΥ ΘΑΝΑΤΟΥ Η ΑΜΑΡΤΙΑ Η ΔΕ ΔΥΝΑΜΙΣ ΤΗΣ ΑΜΑΡΤΙΑΣ Ο ΝΟΜΟΣ
15,57,ΤΩΙ ΔΕ ΘΕΩΙ ΧΑΡΙΣ ΤΩΙ ΔΙΔΟΝΤΙ ΗΜΙΝ ΤΟ ΝΙΚΟΣ ΔΙΑ ΤΟΥ ΚΥΡΙΟΥ ΗΜΩΝ ΙΗΣΟΥ ΧΡΙΣΤΟΥ
15,58,ΩΣΤΕ ΑΔΕΛΦΟΙ ΜΟΥ ΑΓΑΠΗΤΟΙ ΕΔΡΑΙΟΙ ΓΙΝΕΣΘΕ ΑΜΕΤΑΚΙΝΗΤΟΙ ΠΕΡΙΣΣΕΥΟΝΤΕΣ ΕΝ ΤΩΙ ΕΡΓΩΙ ΤΟΥ ΚΥΡΙΟΥ ΠΑΝΤΟΤΕ ΕΙΔΟΤΕΣ ΟΤΙ Ο ΚΟΠΟΣ ΥΜΩΝ ΟΥΚ ΕΣΤΙΝ ΚΕΝΟΣ ΕΝ ΚΥΡΙΩΙ
16,1,ΠΕΡΙ ΔΕ ΤΗΣ ΛΟΓΕΙΑΣ ΤΗΣ ΕΙΣ ΤΟΥΣ ΑΓΙΟΥΣ ΩΣΠΕΡ ΔΙΕΤΑΞΑ ΤΑΙΣ ΕΚΚΛΗΣΙΑΙΣ ΤΗΣ ΓΑΛΑΤΙΑΣ ΟΥΤΩΣ ΚΑΙ ΥΜΕΙΣ ΠΟΙΗΣΑΤΕ
16,2,ΚΑΤΑ ΜΙΑΝ ΣΑΒΒΑΤΟΥ ΕΚΑΣΤΟΣ ΥΜΩΝ ΠΑΡΑ ΕΑΥΤΩΙ ΤΙΘΕΤΩ ΘΗΣΑΥΡΙΖΩΝ Ο ΤΙ ΕΑΝ ΕΥΟΔΩΤΑΙ ΙΝΑ ΜΗ ΟΤΑΝ ΕΛΘΩ ΤΟΤΕ ΛΟΓΕΙΑΙ ΓΙΝΩΝΤΑΙ
16,3,ΟΤΑΝ ΔΕ ΠΑΡΑΓΕΝΩΜΑΙ ΟΥΣ ΕΑΝ ΔΟΚΙΜΑΣΗΤΕ ΔΙΑ ΕΠΙΣΤΟΛΩΝ ΤΟΥΤΟΥΣ ΠΕΜΨΩ ΑΠΕΝΕΓΚΕΙΝ ΤΗΝ ΧΑΡΙΝ ΥΜΩΝ ΕΙΣ ΙΕΡΟΥΣΑΛΗΜ
16,4,ΕΑΝ ΔΕ ΑΞΙΟΝ ΗΙ ΤΟΥ ΚΑΜΕ ΠΟΡΕΥΕΣΘΑΙ ΣΥΝ ΕΜΟΙ ΠΟΡΕΥΣΟΝΤΑΙ
16,5,ΕΛΕΥΣΟΜΑΙ ΔΕ ΠΡΟΣ ΥΜΑΣ ΟΤΑΝ ΜΑΚΕΔΟΝΙΑΝ ΔΙΕΛΘΩ ΜΑΚΕΔΟΝΙΑΝ ΓΑΡ ΔΙΕΡΧΟΜΑΙ
16,6,ΠΡΟΣ ΥΜΑΣ ΔΕ ΤΥΧΟΝ ΠΑΡΑΜΕΝΩ Η ΚΑΙ ΠΑΡΑΧΕΙΜΑΣΩ ΙΝΑ ΥΜΕΙΣ ΜΕ ΠΡΟΠΕΜΨΗΤΕ ΟΥ ΕΑΝ ΠΟΡΕΥΩΜΑΙ
16,7,ΟΥ ΘΕΛΩ ΓΑΡ ΥΜΑΣ ΑΡΤΙ ΕΝ ΠΑΡΟΔΩΙ ΙΔΕΙΝ ΕΛΠΙΖΩ ΓΑΡ ΧΡΟΝΟΝ ΤΙΝΑ ΕΠΙΜΕΙΝΑΙ ΠΡΟΣ ΥΜΑΣ ΕΑΝ Ο ΚΥΡΙΟΣ ΕΠΙΤΡΕΨΗΙ
16,8,ΕΠΙΜΕΝΩ ΔΕ ΕΝ ΕΦΕΣΩΙ ΕΩΣ ΤΗΣ ΠΕΝΤΗΚΟΣΤΗΣ
16,9,ΘΥΡΑ ΓΑΡ ΜΟΙ ΑΝΕΩΙΓΕΝ ΜΕΓΑΛΗ ΚΑΙ ΕΝΕΡΓΗΣ ΚΑΙ ΑΝΤΙΚΕΙΜΕΝΟΙ ΠΟΛΛΟΙ
16,10,ΕΑΝ ΔΕ ΕΛΘΗΙ ΤΙΜΟΘΕΟΣ ΒΛΕΠΕΤΕ ΙΝΑ ΑΦΟΒΩΣ ΓΕΝΗΤΑΙ ΠΡΟΣ ΥΜΑΣ ΤΟ ΓΑΡ ΕΡΓΟΝ ΚΥΡΙΟΥ ΕΡΓΑΖΕΤΑΙ ΩΣ ΕΓΩ
16,11,ΜΗ ΤΙΣ ΟΥΝ ΑΥΤΟΝ ΕΞΟΥΘΕΝΗΣΗΙ ΠΡΟΠΕΜΨΑΤΕ ΔΕ ΑΥΤΟΝ ΕΝ ΕΙΡΗΝΗΙ ΙΝΑ ΕΛΘΗΙ ΠΡΟΣ ΜΕ ΕΚΔΕΧΟΜΑΙ ΓΑΡ ΑΥΤΟΝ ΜΕΤΑ ΤΩΝ ΑΔΕΛΦΩΝ
16,12,ΠΕΡΙ ΔΕ ΑΠΟΛΛΩ ΤΟΥ ΑΔΕΛΦΟΥ ΠΟΛΛΑ ΠΑΡΕΚΑΛΕΣΑ ΑΥΤΟΝ ΙΝΑ ΕΛΘΗΙ ΠΡΟΣ ΥΜΑΣ ΜΕΤΑ ΤΩΝ ΑΔΕΛΦΩΝ ΚΑΙ ΠΑΝΤΩΣ ΟΥΚ ΗΝ ΘΕΛΗΜΑ ΙΝΑ ΝΥΝ ΕΛΘΗΙ ΕΛΕΥΣΕΤΑΙ ΔΕ ΟΤΑΝ ΕΥΚΑΙΡΗΣΗΙ
16,13,ΓΡΗΓΟΡΕΙΤΕ ΣΤΗΚΕΤΕ ΕΝ ΤΗΙ ΠΙΣΤΕΙ ΑΝΔΡΙΖΕΣΘΕ ΚΡΑΤΑΙΟΥΣΘΕ
16,14,ΠΑΝΤΑ ΥΜΩΝ ΕΝ ΑΓΑΠΗΙ ΓΙΝΕΣΘΩ
16,15,ΠΑΡΑΚΑΛΩ ΔΕ ΥΜΑΣ ΑΔΕΛΦΟΙ ΟΙΔΑΤΕ ΤΗΝ ΟΙΚΙΑΝ ΣΤΕΦΑΝΑ ΟΤΙ ΕΣΤΙΝ ΑΠΑΡΧΗ ΤΗΣ ΑΧΑΙΑΣ ΚΑΙ ΕΙΣ ΔΙΑΚΟΝΙΑΝ ΤΟΙΣ ΑΓΙΟΙΣ ΕΤΑΞΑΝ ΕΑΥΤΟΥΣ
16,16,ΙΝΑ ΚΑΙ ΥΜΕΙΣ ΥΠΟΤΑΣΣΗΣΘΕ ΤΟΙΣ ΤΟΙΟΥΤΟΙΣ ΚΑΙ ΠΑΝΤΙ ΤΩΙ ΣΥΝΕΡΓΟΥΝΤΙ ΚΑΙ ΚΟΠΙΩΝΤΙ
16,17,ΧΑΙΡΩ ΔΕ ΕΠΙ ΤΗΙ ΠΑΡΟΥΣΙΑΙ ΣΤΕΦΑΝΑ ΚΑΙ ΦΟΡΤΟΥΝΑΤΟΥ ΚΑΙ ΑΧΑΙΚΟΥ ΟΤΙ ΤΟ ΥΜΩΝ ΥΣΤΕΡΗΜΑ ΟΥΤΟΙ ΑΝΕΠΛΗΡΩΣΑΝ
16,18,ΑΝΕΠΑΥΣΑΝ ΓΑΡ ΤΟ ΕΜΟΝ ΠΝΕΥΜΑ ΚΑΙ ΤΟ ΥΜΩΝ ΕΠΙΓΙΝΩΣΚΕΤΕ ΟΥΝ ΤΟΥΣ ΤΟΙΟΥΤΟΥΣ
16,19,ΑΣΠΑΖΟΝΤΑΙ ΥΜΑΣ ΑΙ ΕΚΚΛΗΣΙΑΙ ΤΗΣ ΑΣΙΑΣ ΑΣΠΑΖΕΤΑΙ ΥΜΑΣ ΕΝ ΚΥΡΙΩΙ ΠΟΛΛΑ ΑΚΥΛΑΣ ΚΑΙ ΠΡΙΣΚΑ ΣΥΝ ΤΗΙ ΚΑΤΑ ΟΙΚΟΝ ΑΥΤΩΝ ΕΚΚΛΗΣΙΑΙ
16,20,ΑΣΠΑΖΟΝΤΑΙ ΥΜΑΣ ΟΙ ΑΔΕΛΦΟΙ ΠΑΝΤΕΣ ΑΣΠΑΣΑΣΘΕ ΑΛΛΗΛΟΥΣ ΕΝ ΦΙΛΗΜΑΤΙ ΑΓΙΩΙ
16,21,Ο ΑΣΠΑΣΜΟΣ ΤΗΙ ΕΜΗΙ ΧΕΙΡΙ ΠΑΥΛΟΥ
16,22,ΕΙ ΤΙΣ ΟΥ ΦΙΛΕΙ ΤΟΝ ΚΥΡΙΟΝ ΗΤΩ ΑΝΑΘΕΜΑ ΜΑΡΑΝΑ ΘΑ
16,23,Η ΧΑΡΙΣ ΤΟΥ ΚΥΡΙΟΥ ΙΗΣΟΥ ΜΕΤΑ ΥΜΩΝ
16,24,Η ΑΓΑΠΗ ΜΟΥ ΜΕΤΑ ΠΑΝΤΩΝ ΥΜΩΝ ΕΝ ΧΡΙΣΤΩΙ ΙΗΣΟΥ ΑΜΗΝ
