chapter,verse,text
1,1,ΠΑΥΛΟΣ ΚΛΗΤΟΣ ΑΠΟΣΤΟΛΟΣ ΧΡΙΣΤΟΥ ΙΗΣΟΥ ΔΙΑ ΘΕΛΗΜΑΤΟΣ ΘΕΟΥ ΚΑΙ ΣΩΣΘΕΝΗΣ Ο ΑΔΕΛΦΟΣ
1,2,ΤΗΙ ΕΚΚΛΗΣΙΑΙ ΤΟΥ ΘΕΟΥ ΗΓΙΑΣΜΕΝΟΙΣ ΕΝ ΧΡΙΣΤΩΙ ΙΗΣΟΥ ΤΗΙ ΟΥΣΗΙ ΕΝ ΚΟΡΙΝΘΩΙ ΚΛΗΤΟΙΣ ΑΓΙΟΙΣ ΣΥΝ ΠΑΣΙΝ ΤΟΙΣ ΕΠΙΚΑΛΟΥΜΕΝΟΙΣ ΤΟ ΟΝΟΜΑ ΤΟΥ ΚΥΡΙΟΥ ΗΜΩΝ ΙΗΣΟΥ ΧΡΙΣΤΟΥ ΕΝ ΠΑΝΤΙ ΤΟΠΩΙ ΑΥΤΩΝ ΚΑΙ ΗΜΩΝ
1,3,ΧΑΡΙΣ ΥΜΙΝ ΚΑΙ ΕΙΡΗΝΗ ΑΠΟ ΘΕΟΥ ΠΑΤΡΟΣ ΗΜΩΝ ΚΑΙ ΚΥΡΙΟΥ ΙΗΣΟΥ ΧΡΙΣΤΟΥ
1,4,ΕΥΧΑΡΙΣΤΩ ΤΩΙ ΘΕΩΙ ΜΟΥ ΠΑΝΤΟΤΕ ΠΕΡΙ ΥΜΩΝ ΕΠΙ ΤΗΙ ΧΑΡΙΤΙ ΤΟΥ ΘΕΟΥ ΤΗΙ ΔΟΘΕΙΣΗΙ ΥΜΙΝ ΕΝ ΧΡΙΣΤΩΙ ΙΗΣΟΥ
1,5,ΟΤΙ ΕΝ ΠΑΝΤΙ ΕΠΛΟΥΤΙΣΘΗΤΕ ΕΝ ΑΥΤΩΙ ΕΝ ΠΑΝΤΙ ΛΟΓΩΙ ΚΑΙ ΠΑΣΗΙ ΓΝΩΣΕΙ
1,6,ΚΑΘΩΣ ΤΟ ΜΑΡΤΥΡΙΟΝ ΤΟΥ ΧΡΙΣΤΟΥ ΕΒΕΒΑΙΩΘΗ ΕΝ ΥΜΙΝ
1,7,ΩΣΤΕ ΥΜΑΣ ΜΗ ΥΣΤΕΡΕΙΣΘΑΙ ΕΝ ΜΗΔΕΝΙ ΧΑΡΙΣΜΑΤΙ ΑΠΕΚΔΕΧΟΜΕΝΟΥΣ ΤΗΝ ΑΠΟΚΑΛΥΨΙΝ ΤΟΥ ΚΥΡΙΟΥ ΗΜΩΝ ΙΗΣΟΥ ΧΡΙΣΤΟΥ
1,8,ΟΣ ΚΑΙ ΒΕΒΑΙΩΣΕΙ ΥΜΑΣ ΕΩΣ ΤΕΛΟΥΣ ΑΝΕΓΚΛΗΤΟΥΣ ΕΝ ΤΗΙ ΗΜΕΡΑΙ ΤΟΥ ΚΥΡΙΟΥ ΗΜΩΝ ΙΗΣΟΥ ΧΡΙΣΤΟΥ
1,9,ΠΙΣΤΟΣ Ο ΘΕΟΣ ΔΙΑ ΟΥ ΕΚΛΗΘΗΤΕ ΕΙΣ ΚΟΙΝΩΝΙΑΝ ΤΟΥ ΥΙΟΥ ΑΥΤΟΥ ΙΗΣΟΥ ΧΡΙΣΤΟΥ ΤΟΥ ΚΥΡΙΟΥ ΗΜΩΝ
1,10,ΠΑΡΑΚΑΛΩ ΔΕ ΥΜΑΣ ΑΔΕΛΦΟΙ ΔΙΑ ΤΟΥ ΟΝΟΜΑΤΟΣ ΤΟΥ ΚΥΡΙΟΥ ΗΜΩΝ ΙΗΣΟΥ ΧΡΙΣΤΟΥ ΙΝΑ ΤΟ ΑΥΤΟ ΛΕΓΗΤΕ ΠΑΝΤΕΣ ΚΑΙ ΜΗ ΗΙ ΕΝ ΥΜΙΝ ΣΧΙΣΜΑΤΑ ΗΤΕ ΔΕ ΚΑΤΗΡΤΙΣΜΕΝΟΙ ΕΝ ΤΩΙ ΑΥΤΩΙ ΝΟΙ ΚΑΙ ΕΝ ΤΗΙ ΑΥΤΗΙ ΓΝΩΜΗΙ
1,11,ΕΔΗΛΩΘΗ ΓΑΡ ΜΟΙ ΠΕΡΙ ΥΜΩΝ ΑΔΕΛΦΟΙ ΜΟΥ ΥΠΟ ΤΩΝ ΧΛΟΗΣ ΟΤΙ ΕΡΙΔΕΣ ΕΝ ΥΜΙΝ ΕΙΣΙΝ
1,12,ΛΕΓΩ ΔΕ ΤΟΥΤΟ ΟΤΙ ΕΚΑΣΤΟΣ ΥΜΩΝ ΛΕΓΕΙ ΕΓΩ ΜΕΝ ΕΙΜΙ ΠΑΥΛΟΥ ΕΓΩ ΔΕ ΑΠΟΛΛΩ ΕΓΩ ΔΕ ΚΗΦΑ ΕΓΩ ΔΕ ΧΡΙΣΤΟΥ
1,13,ΜΕΜΕΡΙΣΤΑΙ Ο ΧΡΙΣΤΟΣ ΜΗ ΠΑΥΛΟΣ ΕΣΤΑΥΡΩΘΗ ΥΠΕΡ ΥΜΩΝ Η ΕΙΣ ΤΟ ΟΝΟΜΑ ΠΑΥΛΟΥ ΕΒΑΠΤΙΣΘΗΤΕ
1,14,ΕΥΧΑΡΙΣΤΩ ΟΤΙ ΟΥΔΕΝΑ ΥΜΩΝ ΕΒΑΠΤΙΣΑ ΕΙ ΜΗ ΚΡΙΣΠΟΝ ΚΑΙ ΓΑΙΟΝ
1,15,ΙΝΑ ΜΗ ΤΙΣ ΕΙΠΗΙ ΟΤΙ ΕΙΣ ΤΟ ΕΜΟΝ ΟΝΟΜΑ ΕΒΑΠΤΙΣΘΗΤΕ
1,16,ΕΒΑΠΤΙΣΑ ΔΕ ΚΑΙ ΤΟΝ ΣΤΕΦΑΝΑ ΟΙΚΟΝ ΛΟΙΠΟΝ ΟΥΚ ΟΙΔΑ ΕΙ ΤΙΝΑ ΑΛΛΟΝ ΕΒΑΠΤΙΣΑ
1,17,ΟΥ ΓΑΡ ΑΠΕΣΤΕΙΛΕΝ ΜΕ ΧΡΙΣΤΟΣ ΒΑΠΤΙΖΕΙΝ ΑΛΛΑ ΕΥΑΓΓΕΛΙΖΕΣΘΑΙ ΟΥΚ ΕΝ ΣΟΦΙΑΙ ΛΟΓΟΥ ΙΝΑ ΜΗ ΚΕΝΩΘΗΙ Ο ΣΤΑΥΡΟΣ ΤΟΥ ΧΡΙΣΤΟΥ
1,18,Ο ΛΟΓΟΣ ΓΑΡ Ο ΤΟΥ ΣΤΑΥΡΟΥ ΤΟΙΣ ΜΕΝ ΑΠΟΛΛΥΜΕΝΟΙΣ ΜΩΡΙΑ ΕΣΤΙΝ ΤΟΙΣ ΔΕ ΣΩΙΖΟΜΕΝΟΙΣ ΗΜΙΝ ΔΥΝΑΜΙΣ ΘΕΟΥ ΕΣΤΙΝ
1,19,ΓΕΓΡΑΠΤΑΙ ΓΑΡ ΑΠΟΛΩ ΤΗΝ ΣΟΦΙΑΝ ΤΩΝ ΣΟΦΩΝ ΚΑΙ ΤΗΝ ΣΥΝΕΣΙΝ ΤΩΝ ΣΥΝΕΤΩΝ ΑΘΕΤΗΣΩ
1,20,ΠΟΥ ΣΟΦΟΣ ΠΟΥ ΓΡΑΜΜΑΤΕΥΣ ΠΟΥ ΣΥΝΖΗΤΗΤΗΣ ΤΟΥ ΑΙΩΝΟΣ ΤΟΥΤΟΥ ΟΥΧΙ ΕΜΩΡΑΝΕΝ Ο ΘΕΟΣ ΤΗΝ ΣΟΦΙΑΝ ΤΟΥ ΚΟΣΜΟΥ
1,21,ΕΠΕΙΔΗ ΓΑΡ ΕΝ ΤΗΙ ΣΟΦΙΑΙ ΤΟΥ ΘΕΟΥ ΟΥΚ ΕΓΝΩ Ο ΚΟΣΜΟΣ ΔΙΑ ΤΗΣ ΣΟΦΙΑΣ ΤΟΝ ΘΕΟΝ ΕΥΔΟΚΗΣΕΝ Ο ΘΕΟΣ ΔΙΑ ΤΗΣ ΜΩΡΙΑΣ ΤΟΥ ΚΗΡΥΓΜΑΤΟΣ ΣΩΣΑΙ ΤΟΥΣ ΠΙΣΤΕΥΟΝΤΑΣ
1,22,ΕΠΕΙΔΗ ΚΑΙ ΙΟΥΔΑΙΟΙ ΣΗΜΕΙΑ ΑΙΤΟΥΣΙΝ ΚΑΙ ΕΛΛΗΝΕΣ ΣΟΦΙΑΝ ΖΗΤΟΥΣΙΝ
1,23,ΗΜΕΙΣ ΔΕ ΚΗΡΥΣΣΟΜΕΝ ΧΡΙΣΤΟΝ ΕΣΤΑΥΡΩΜΕΝΟΝ ΙΟΥΔΑΙΟΙΣ ΜΕΝ ΣΚΑΝΔΑΛΟΝ ΕΘΝΕΣΙΝ ΔΕ ΜΩΡΙΑΝ
1,24,ΑΥΤΟΙΣ ΔΕ ΤΟΙΣ ΚΛΗΤΟΙΣ ΙΟΥΔΑΙΟΙΣ ΤΕ ΚΑΙ ΕΛΛΗΣΙΝ ΧΡΙΣΤΟΝ ΘΕΟΥ ΔΥΝΑΜΙΝ ΚΑΙ ΘΕΟΥ ΣΟΦΙΑΝ
1,25,ΟΤΙ ΤΟ ΜΩΡΟΝ ΤΟΥ ΘΕΟΥ ΣΟΦΩΤΕΡΟΝ ΤΩΝ ΑΝΘΡΩΠΩΝ ΕΣΤΙΝ ΚΑΙ ΤΟ ΑΣΘΕΝΕΣ ΤΟΥ ΘΕΟΥ ΙΣΧΥΡΟΤΕΡΟΝ ΤΩΝ ΑΝΘΡΩΠΩΝ
1,26,ΒΛΕΠΕΤΕ ΓΑΡ ΤΗΝ ΚΛΗΣΙΝ ΥΜΩΝ ΑΔΕΛΦΟΙ ΟΤΙ ΟΥ ΠΟΛΛΟΙ ΣΟΦΟΙ ΚΑΤΑ ΣΑΡΚΑ ΟΥ ΠΟΛΛΟΙ ΔΥΝΑΤΟΙ ΟΥ ΠΟΛΛΟΙ ΕΥΓΕΝΕΙΣ
1,27,ΑΛΛΑ ΤΑ ΜΩΡΑ ΤΟΥ ΚΟΣΜΟΥ ΕΞΕΛΕΞΑΤΟ Ο ΘΕΟΣ ΙΝΑ ΚΑΤΑΙΣΧΥΝΗΙ ΤΟΥΣ ΣΟΦΟΥΣ ΚΑΙ ΤΑ ΑΣΘΕΝΗ ΤΟΥ ΚΟΣΜΟΥ ΕΞΕΛΕΞΑΤΟ Ο ΘΕΟΣ ΙΝΑ ΚΑΤΑΙΣΧΥΝΗΙ ΤΑ ΙΣΧΥΡΑ
1,28,ΚΑΙ ΤΑ ΑΓΕΝΗ ΤΟΥ ΚΟΣΜΟΥ ΚΑΙ ΤΑ ΕΞΟΥΘΕΝΗΜΕΝΑ ΕΞΕΛΕΞΑΤΟ Ο ΘΕΟΣ ΤΑ ΜΗ ΟΝΤΑ ΙΝΑ ΤΑ ΟΝΤΑ ΚΑΤΑΡΓΗΣΗΙ
1,29,ΟΠΩΣ ΜΗ ΚΑΥΧΗΣΗΤΑΙ ΠΑΣΑ ΣΑΡΞ ΕΝΩΠΙΟΝ ΤΟΥ ΘΕΟΥ
1,30,ΕΞ ΑΥΤΟΥ ΔΕ ΥΜΕΙΣ ΕΣΤΕ ΕΝ ΧΡΙΣΤΩΙ ΙΗΣΟΥ ΟΣ ΕΓΕΝΗΘΗ ΣΟΦΙΑ ΗΜΙΝ ΑΠΟ ΘΕΟΥ ΔΙΚΑΙΟΣΥΝΗ ΤΕ ΚΑΙ ΑΓΙΑΣΜΟΣ ΚΑΙ ΑΠΟΛΥΤΡΩΣΙΣ
1,31,ΙΝΑ ΚΑΘΩΣ ΓΕΓΡΑΠΤΑΙ Ο ΚΑΥΧΩΜΕΝΟΣ ΕΝ ΚΥΡΙΩΙ ΚΑΥΧΑΣΘΩ
2,1,ΚΑΓΩ ΕΛΘΩΝ ΠΡΟΣ ΥΜΑΣ ΑΔΕΛΦΟΙ ΗΛΘΟΝ ΟΥ ΚΑΤΑ ΥΠΕΡΟΧΗΝ ΛΟΓΟΥ Η ΣΟΦΙΑΣ ΚΑΤΑΓΓΕΛΛΩΝ ΥΜΙΝ ΤΟ ΜΥΣΤΗΡΙΟΝ ΤΟΥ ΘΕΟΥ
2,2,ΟΥ ΓΑΡ ΕΚΡΙΝΑ ΤΙ ΕΙΔΕΝΑΙ ΕΝ ΥΜΙΝ ΕΙ ΜΗ ΙΗΣΟΥΝ ΧΡΙΣΤΟΝ ΚΑΙ ΤΟΥΤΟΝ ΕΣΤΑΥΡΩΜΕΝΟΝ
2,3,ΚΑΓΩ ΕΝ ΑΣΘΕΝΕΙΑΙ ΚΑΙ ΕΝ ΦΟΒΩΙ ΚΑΙ ΕΝ ΤΡΟΜΩΙ ΠΟΛΛΩΙ ΕΓΕΝΟΜΗΝ ΠΡΟΣ ΥΜΑΣ
2,4,ΚΑΙ Ο ΛΟΓΟΣ ΜΟΥ ΚΑΙ ΤΟ ΚΗΡΥΓΜΑ ΜΟΥ ΟΥΚ ΕΝ ΠΕΙΘΟΙΣ ΣΟΦΙΑΣ ΛΟΓΟΙΣ ΑΛΛΑ ΕΝ ΑΠΟΔΕΙΞΕΙ ΠΝΕΥΜΑΤΟΣ ΚΑΙ ΔΥΝΑΜΕΩΣ
2,5,ΙΝΑ Η ΠΙΣΤΙΣ ΥΜΩΝ ΜΗ ΗΙ ΕΝ ΣΟΦΙΑΙ ΑΝΘΡΩΠΩΝ ΑΛΛΑ ΕΝ ΔΥΝΑΜΕΙ ΘΕΟΥ
2,6,ΣΟΦΙΑΝ ΔΕ ΛΑΛΟΥΜΕΝ ΕΝ ΤΟΙΣ ΤΕΛΕΙΟΙΣ ΣΟΦΙΑΝ ΔΕ ΟΥ ΤΟΥ ΑΙΩΝΟΣ ΤΟΥΤΟΥ ΟΥΔΕ ΤΩΝ ΑΡΧΟΝΤΩΝ ΤΟΥ ΑΙΩΝΟΣ ΤΟΥΤΟΥ ΤΩΝ ΚΑΤΑΡΓΟΥΜΕΝΩΝ
2,7,ΑΛΛΑ ΛΑΛΟΥΜΕΝ ΘΕΟΥ ΣΟΦΙΑΝ ΕΝ ΜΥΣΤΗΡΙΩΙ ΤΗΝ ΑΠΟΚΕΚΡΥΜΜΕΝΗΝ ΗΝ ΠΡΟΩΡΙΣΕΝ Ο ΘΕΟΣ ΠΡΟ ΤΩΝ ΑΙΩΝΩΝ ΕΙΣ ΔΟΞΑΝ ΗΜΩΝ
2,8,ΗΝ ΟΥΔΕΙΣ ΤΩΝ ΑΡΧΟΝΤΩΝ ΤΟΥ ΑΙΩΝΟΣ ΤΟΥΤΟΥ ΕΓΝΩΚΕΝ ΕΙ ΓΑΡ ΕΓΝΩΣΑΝ ΟΥΚ ΑΝ ΤΟΝ ΚΥΡΙΟΝ ΤΗΣ ΔΟΞΗΣ ΕΣΤΑΥΡΩΣΑΝ
2,9,ΑΛΛΑ ΚΑΘΩΣ ΓΕΓΡΑΠΤΑΙ Α ΟΦΘΑΛΜΟΣ ΟΥΚ ΕΙΔΕΝ ΚΑΙ ΟΥΣ ΟΥΚ ΗΚΟΥΣΕΝ ΚΑΙ ΕΠΙ ΚΑΡΔΙΑΝ ΑΝΘΡΩΠΟΥ ΟΥΚ ΑΝΕΒΗ Α ΗΤΟΙΜΑΣΕΝ Ο ΘΕΟΣ ΤΟΙΣ ΑΓΑΠΩΣΙΝ ΑΥΤΟΝ
2,10,ΗΜΙΝ ΓΑΡ ΑΠΕΚΑΛΥΨΕΝ Ο ΘΕΟΣ ΔΙΑ ΤΟΥ ΠΝΕΥΜΑΤΟΣ ΤΟ ΓΑΡ ΠΝΕΥΜΑ ΠΑΝΤΑ ΕΡΑΥΝΑΙ ΚΑΙ ΤΑ ΒΑΘΗ ΤΟΥ ΘΕΟΥ
2,11,ΤΙΣ ΓΑΡ ΟΙΔΕΝ ΑΝΘΡΩΠΩΝ ΤΑ ΤΟΥ ΑΝΘΡΩΠΟΥ ΕΙ ΜΗ ΤΟ ΠΝΕΥΜΑ ΤΟΥ ΑΝΘΡΩΠΟΥ ΤΟ ΕΝ ΑΥΤΩΙ ΟΥΤΩΣ ΚΑΙ ΤΑ ΤΟΥ ΘΕΟΥ ΟΥΔΕΙΣ ΕΓΝΩΚΕΝ ΕΙ ΜΗ ΤΟ ΠΝΕΥΜΑ ΤΟΥ ΘΕΟΥ
2,12,ΗΜΕΙΣ ΔΕ ΟΥ ΤΟ ΠΝΕΥΜΑ ΤΟΥ ΚΟΣΜΟΥ ΕΛΑΒΟΜΕΝ ΑΛΛΑ ΤΟ ΠΝΕΥΜΑ ΤΟ ΕΚ ΤΟΥ ΘΕΟΥ ΙΝΑ ΕΙΔΩΜΕΝ ΤΑ ΥΠΟ ΤΟΥ ΘΕΟΥ ΧΑΡΙΣΘΕΝΤΑ ΗΜΙΝ
2,13,Α ΚΑΙ ΛΑΛΟΥΜΕΝ ΟΥΚ ΕΝ ΔΙΔΑΚΤΟΙΣ ΑΝΘΡΩΠΙΝΗΣ ΣΟΦΙΑΣ ΛΟΓΟΙΣ ΑΛΛΑ ΕΝ ΔΙΔΑΚΤΟΙΣ ΠΝΕΥΜΑΤΟΣ ΠΝΕΥΜΑΤΙΚΟΙΣ ΠΝΕΥΜΑΤΙΚΑ ΣΥΝΚΡΙΝΟΝΤΕΣ
2,14,ΨΥΧΙΚΟΣ ΔΕ ΑΝΘΡΩΠΟΣ ΟΥ ΔΕΧΕΤΑΙ ΤΑ ΤΟΥ ΠΝΕΥΜΑΤΟΣ ΤΟΥ ΘΕΟΥ ΜΩΡΙΑ ΓΑΡ ΑΥΤΩΙ ΕΣΤΙΝ ΚΑΙ ΟΥ ΔΥΝΑΤΑΙ ΓΝΩΝΑΙ ΟΤΙ ΠΝΕΥΜΑΤΙΚΩΣ ΑΝΑΚΡΙΝΕΤΑΙ
2,15,Ο ΔΕ ΠΝΕΥΜΑΤΙΚΟΣ ΑΝΑΚΡΙΝΕΙ ΤΑ ΠΑΝΤΑ ΑΥΤΟΣ ΔΕ ΥΠΟ ΟΥΔΕΝΟΣ ΑΝΑΚΡΙΝΕΤΑΙ
2,16,ΤΙΣ ΓΑΡ ΕΓΝΩ ΝΟΥΝ ΚΥΡΙΟΥ ΟΣ ΣΥΜΒΙΒΑΣΕΙ ΑΥΤΟΝ ΗΜΕΙΣ ΔΕ ΝΟΥΝ ΧΡΙΣΤΟΥ ΕΧΟΜΕΝ
3,1,ΚΑΓΩ ΑΔΕΛΦΟΙ ΟΥΚ ΗΔΥΝΗΘΗΝ ΛΑΛΗΣΑΙ ΥΜΙΝ ΩΣ ΠΝΕΥΜΑΤΙΚΟΙΣ ΑΛΛΑ ΩΣ ΣΑΡΚΙΝΟΙΣ ΩΣ ΝΗΠΙΟΙΣ ΕΝ ΧΡΙΣΤΩΙ
3,2,ΓΑΛΑ ΥΜΑΣ ΕΠΟΤΙΣΑ ΟΥ ΒΡΩΜΑ ΟΥΠΩ ΓΑΡ ΕΔΥΝΑΣΘΕ ΑΛΛΑ ΟΥΔΕ ΝΥΝ ΔΥΝΑΣΘΕ
3,3,ΕΤΙ ΓΑΡ ΣΑΡΚΙΚΟΙ ΕΣΤΕ ΟΠΟΥ ΓΑΡ ΕΝ ΥΜΙΝ ΖΗΛΟΣ ΚΑΙ ΕΡΙΣ ΟΥΧΙ ΣΑΡΚΙΚΟΙ ΕΣΤΕ ΚΑΙ ΚΑΤΑ ΑΝΘΡΩΠΟΝ ΠΕΡΙΠΑΤΕΙΤΕ
3,4,ΟΤΑΝ ΓΑΡ ΛΕΓΗΙ ΤΙΣ ΕΓΩ ΜΕΝ ΕΙΜΙ ΠΑΥΛΟΥ ΕΤΕΡΟΣ ΔΕ ΕΓΩ ΑΠΟΛΛΩ ΟΥΚ ΑΝΘΡΩΠΟΙ ΕΣΤΕ
3,5,ΤΙ ΟΥΝ ΕΣΤΙΝ ΑΠΟΛΛΩΣ ΤΙ ΔΕ ΕΣΤΙΝ ΠΑΥΛΟΣ ΔΙΑΚΟΝΟΙ ΔΙΑ ΩΝ ΕΠΙΣΤΕΥΣΑΤΕ ΚΑΙ ΕΚΑΣΤΩΙ ΩΣ Ο ΚΥΡΙΟΣ ΕΔΩΚΕΝ
3,6,ΕΓΩ ΕΦΥΤΕΥΣΑ ΑΠΟΛΛΩΣ ΕΠΟΤΙΣΕΝ ΑΛΛΑ Ο ΘΕΟΣ ΗΥΞΑΝΕΝ
3,7,ΩΣΤΕ ΟΥΤΕ Ο ΦΥΤΕΥΩΝ ΕΣΤΙΝ ΤΙ ΟΥΤΕ Ο ΠΟΤΙΖΩΝ ΑΛΛΑ Ο ΑΥΞΑΝΩΝ ΘΕΟΣ
3,8,Ο ΦΥΤΕΥΩΝ ΔΕ ΚΑΙ Ο ΠΟΤΙΖΩΝ ΕΝ ΕΙΣΙΝ ΕΚΑΣΤΟΣ ΔΕ ΤΟΝ ΙΔΙΟΝ ΜΙΣΘΟΝ ΛΗΜΨΕΤΑΙ ΚΑΤΑ ΤΟΝ ΙΔΙΟΝ ΚΟΠΟΝ
3,9,ΘΕΟΥ ΓΑΡ ΕΣΜΕΝ ΣΥΝΕΡΓΟΙ ΘΕΟΥ ΓΕΩΡΓΙΟΝ ΘΕΟΥ ΟΙΚΟΔΟΜΗ ΕΣΤΕ
3,10,ΚΑΤΑ ΤΗΝ ΧΑΡΙΝ ΤΟΥ ΘΕΟΥ ΤΗΝ ΔΟΘΕΙΣΑΝ ΜΟΙ ΩΣ ΣΟΦΟΣ ΑΡΧΙΤΕΚΤΩΝ ΘΕΜΕΛΙΟΝ ΕΘΗΚΑ ΑΛΛΟΣ ΔΕ ΕΠΟΙΚΟΔΟΜΕΙ ΕΚΑΣΤΟΣ ΔΕ ΒΛΕΠΕΤΩ ΠΩΣ ΕΠΟΙΚΟΔΟΜΕΙ
3,11,ΘΕΜΕΛΙΟΝ ΓΑΡ ΑΛΛΟΝ ΟΥΔΕΙΣ ΔΥΝΑΤΑΙ ΘΕΙΝΑΙ ΠΑΡΑ ΤΟΝ ΚΕΙΜΕΝΟΝ ΟΣ ΕΣΤΙΝ ΙΗΣΟΥΣ ΧΡΙΣΤΟΣ
3,12,ΕΙ ΔΕ ΤΙΣ ΕΠΟΙΚΟΔΟΜΕΙ ΕΠΙ ΤΟΝ ΘΕΜΕΛΙΟΝ ΧΡΥΣΟΝ ΑΡΓΥΡΟΝ ΛΙΘΟΥΣ ΤΙΜΙΟΥΣ ΞΥΛΑ ΧΟΡΤΟΝ ΚΑΛΑΜΗΝ
3,13,ΕΚΑΣΤΟΥ ΤΟ ΕΡΓΟΝ ΦΑΝΕΡΟΝ ΓΕΝΗΣΕΤΑΙ Η ΓΑΡ ΗΜΕΡΑ ΔΗΛΩΣΕΙ ΟΤΙ ΕΝ ΠΥΡΙ ΑΠΟΚΑΛΥΠΤΕΤΑΙ ΚΑΙ ΕΚΑΣΤΟΥ ΤΟ ΕΡΓΟΝ ΟΠΟΙΟΝ ΕΣΤΙΝ ΤΟ ΠΥΡ ΑΥΤΟ ΔΟΚΙΜΑΣΕΙ
3,14,ΕΙ ΤΙΝΟΣ ΤΟ ΕΡΓΟΝ ΜΕΝΕΙ Ο ΕΠΟΙΚΟΔΟΜΗΣΕΝ ΜΙΣΘΟΝ ΛΗΜΨΕΤΑΙ
3,15,ΕΙ ΤΙΝΟΣ ΤΟ ΕΡΓΟΝ ΚΑΤΑΚΑΗΣΕΤΑΙ ΖΗΜΙΩΘΗΣΕΤΑΙ ΑΥΤΟΣ ΔΕ ΣΩΘΗΣΕΤΑΙ ΟΥΤΩΣ ΔΕ ΩΣ ΔΙΑ ΠΥΡΟΣ
3,16,ΟΥΚ ΟΙΔΑΤΕ ΟΤΙ ΝΑΟΣ ΘΕΟΥ ΕΣΤΕ ΚΑΙ ΤΟ ΠΝΕΥΜΑ ΤΟΥ ΘΕΟΥ ΟΙΚΕΙ ΕΝ ΥΜΙΝ
3,17,ΕΙ ΤΙΣ ΤΟΝ ΝΑΟΝ ΤΟΥ ΘΕΟΥ ΦΘΕΙΡΕΙ ΦΘΕΡΕΙ ΤΟΥΤΟΝ Ο ΘΕΟΣ Ο ΓΑΡ ΝΑΟΣ ΤΟΥ ΘΕΟΥ ΑΓΙΟΣ ΕΣΤΙΝ ΟΙΤΙΝΕΣ ΕΣΤΕ ΥΜΕΙΣ
3,18,ΜΗΔΕΙΣ ΕΑΥΤΟΝ ΕΞΑΠΑΤΑΤΩ ΕΙ ΤΙΣ ΔΟΚΕΙ ΣΟΦΟΣ ΕΙΝΑΙ ΕΝ ΥΜΙΝ ΕΝ ΤΩΙ ΑΙΩΝΙ ΤΟΥΤΩΙ ΜΩΡΟΣ ΓΕΝΕΣΘΩ ΙΝΑ ΓΕΝΗΤΑΙ ΣΟΦΟΣ
3,19,Η ΓΑΡ ΣΟΦΙΑ ΤΟΥ ΚΟΣΜΟΥ ΤΟΥΤΟΥ ΜΩΡΙΑ ΠΑΡΑ ΤΩΙ ΘΕΩΙ ΕΣΤΙΝ ΓΕΓΡΑΠΤΑΙ ΓΑΡ Ο ΔΡΑΣΣΟΜΕΝΟΣ ΤΟΥΣ ΣΟΦΟΥΣ ΕΝ ΤΗΙ ΠΑΝΟΥΡΓΙΑΙ ΑΥΤΩΝ
3,20,ΚΑΙ ΠΑΛΙΝ ΚΥΡΙΟΣ ΓΙΝΩΣΚΕΙ ΤΟΥΣ ΔΙΑΛΟΓΙΣΜΟΥΣ ΤΩΝ ΣΟΦΩΝ ΟΤΙ ΕΙΣΙΝ ΜΑΤΑΙΟΙ
3,21,ΩΣΤΕ ΜΗΔΕΙΣ ΚΑΥΧΑΣΘΩ ΕΝ ΑΝΘΡΩΠΟΙΣ ΠΑΝΤΑ ΓΑΡ ΥΜΩΝ ΕΣΤΙΝ
3,22,ΕΙΤΕ ΠΑΥΛΟΣ ΕΙΤΕ ΑΠΟΛΛΩΣ ΕΙΤΕ ΚΗΦΑΣ ΕΙΤΕ ΚΟΣΜΟΣ ΕΙΤΕ ΖΩΗ ΕΙΤΕ ΘΑΝΑΤΟΣ ΕΙΤΕ ΕΝΕΣΤΩΤΑ ΕΙΤΕ ΜΕΛΛΟΝΤΑ ΠΑΝΤΑ ΥΜΩΝ
3,23,ΥΜΕΙΣ ΔΕ ΧΡΙΣΤΟΥ ΧΡΙΣΤΟΣ ΔΕ ΘΕΟΥ
4,1,ΟΥΤΩΣ ΗΜΑΣ ΛΟΓΙΖΕΣΘΩ ΑΝΘΡΩΠΟΣ ΩΣ ΥΠΗΡΕΤΑΣ ΧΡΙΣΤΟΥ ΚΑΙ ΟΙΚΟΝΟΜΟΥΣ ΜΥΣΤΗΡΙΩΝ ΘΕΟΥ
4,2,ΩΔΕ ΛΟΙΠΟΝ ΖΗΤΕΙΤΑΙ ΕΝ ΤΟΙΣ ΟΙΚΟΝΟΜΟΙΣ ΙΝΑ ΠΙΣΤΟΣ ΤΙΣ ΕΥΡΕΘΗΙ
4,3,ΕΜΟΙ ΔΕ ΕΙΣ ΕΛΑΧΙΣΤΟΝ ΕΣΤΙΝ ΙΝΑ ΥΠΟ ΥΜΩΝ ΑΝΑΚΡΙΘΩ Η ΥΠΟ ΑΝΘΡΩΠΙΝΗΣ ΗΜΕΡΑΣ ΑΛΛΑ ΟΥΔΕ ΕΜΑΥΤΟΝ ΑΝΑΚΡΙΝΩ
4,4,ΟΥΔΕΝ ΓΑΡ ΕΜΑΥΤΩΙ ΣΥΝΟΙΔΑ ΑΛΛΑ ΟΥΚ ΕΝ ΤΟΥΤΩΙ ΔΕΔΙΚΑΙΩΜΑΙ Ο ΔΕ ΑΝΑΚΡΙΝΩΝ ΜΕ ΚΥΡΙΟΣ ΕΣΤΙΝ
4,5,ΩΣΤΕ ΜΗ ΠΡΟ ΚΑΙΡΟΥ ΤΙ ΚΡΙΝΕΤΕ ΕΩΣ ΑΝ ΕΛΘΗΙ Ο ΚΥΡΙΟΣ ΟΣ ΚΑΙ ΦΩΤΙΣΕΙ ΤΑ ΚΡΥΠΤΑ ΤΟΥ ΣΚΟΤΟΥΣ ΚΑΙ ΦΑΝΕΡΩΣΕΙ ΤΑΣ ΒΟΥΛΑΣ ΤΩΝ ΚΑΡΔΙΩΝ ΚΑΙ ΤΟΤΕ Ο ΕΠΑΙΝΟΣ ΓΕΝΗΣΕΤΑΙ ΕΚΑΣΤΩΙ ΑΠΟ ΤΟΥ ΘΕΟΥ
4,6,ΤΑΥΤΑ ΔΕ ΑΔΕΛΦΟΙ ΜΕΤΕΣΧΗΜΑΤΙΣΑ ΕΙΣ ΕΜΑΥΤΟΝ ΚΑΙ ΑΠΟΛΛΩΝ ΔΙΑ ΥΜΑΣ ΙΝΑ ΕΝ ΗΜΙΝ ΜΑΘΗΤΕ ΤΟ ΜΗ ΥΠΕΡ Α ΓΕΓΡΑΠΤΑΙ ΙΝΑ ΜΗ ΕΙΣ ΥΠΕΡ ΤΟΥ ΕΝΟΣ ΦΥΣΙΟΥΣΘΕ ΚΑΤΑ ΤΟΥ ΕΤΕΡΟΥ
4,7,ΤΙΣ ΓΑΡ ΣΕ ΔΙΑΚΡΙΝΕΙ ΤΙ ΔΕ ΕΧΕΙΣ Ο ΟΥΚ ΕΛΑΒΕΣ ΕΙ ΔΕ ΚΑΙ ΕΛΑΒΕΣ ΤΙ ΚΑΥΧΑΣΑΙ ΩΣ ΜΗ ΛΑΒΩΝ
4,8,ΗΔΗ ΚΕΚΟΡΕΣΜΕΝΟΙ ΕΣΤΕ ΗΔΗ ΕΠΛΟΥΤΗΣΑΤΕ ΧΩΡΙΣ ΗΜΩΝ ΕΒΑΣΙΛΕΥΣΑΤΕ ΚΑΙ ΟΦΕΛΟΝ ΓΕ ΕΒΑΣΙΛΕΥΣΑΤΕ ΙΝΑ ΚΑΙ ΗΜΕΙΣ ΥΜΙΝ ΣΥΝΒΑΣΙΛΕΥΣΩΜΕΝ
4,9,ΔΟΚΩ ΓΑΡ Ο ΘΕΟΣ ΗΜΑΣ ΤΟΥΣ ΑΠΟΣΤΟΛΟΥΣ ΕΣΧΑΤΟΥΣ ΑΠΕΔΕΙΞΕΝ ΩΣ ΕΠΙΘΑΝΑΤΙΟΥΣ ΟΤΙ ΘΕΑΤΡΟΝ ΕΓΕΝΗΘΗΜΕΝ ΤΩΙ ΚΟΣΜΩΙ ΚΑΙ ΑΓΓΕΛΟΙΣ ΚΑΙ ΑΝΘΡΩΠΟΙΣ
4,10,ΗΜΕΙΣ ΜΩΡΟΙ ΔΙΑ ΧΡΙΣΤΟΝ ΥΜΕΙΣ ΔΕ ΦΡΟΝΙΜΟΙ ΕΝ ΧΡΙΣΤΩΙ ΗΜΕΙΣ ΑΣΘΕΝΕΙΣ ΥΜΕΙΣ ΔΕ ΙΣΧΥΡΟΙ ΥΜΕΙΣ ΕΝΔΟΞΟΙ ΗΜΕΙΣ ΔΕ ΑΤΙΜΟΙ
4,11,ΑΧΡΙ ΤΗΣ ΑΡΤΙ ΩΡΑΣ ΚΑΙ ΠΕΙΝΩΜΕΝ ΚΑΙ ΔΙΨΩΜΕΝ ΚΑΙ ΓΥΜΝΙΤΕΥΟΜΕΝ ΚΑΙ ΚΟΛΑΦΙΖΟΜΕΘΑ ΚΑΙ ΑΣΤΑΤΟΥΜΕΝ
4,12,ΚΑΙ ΚΟΠΙΩΜΕΝ ΕΡΓΑΖΟΜΕΝΟΙ ΤΑΙΣ ΙΔΙΑΙΣ ΧΕΡΣΙΝ ΛΟΙΔΟΡΟΥΜΕΝΟΙ ΕΥΛΟΓΟΥΜΕΝ ΔΙΩΚΟΜΕΝΟΙ ΑΝΕΧΟΜΕΘΑ
4,13,ΔΥΣΦΗΜΟΥΜΕΝΟΙ ΠΑΡΑΚΑΛΟΥΜΕΝ ΩΣ ΠΕΡΙΚΑΘΑΡΜΑΤΑ ΤΟΥ ΚΟΣΜΟΥ ΕΓΕΝΗΘΗΜΕΝ ΠΑΝΤΩΝ ΠΕΡΙΨΗΜΑ ΕΩΣ ΑΡΤΙ
4,14,ΟΥΚ ΕΝΤΡΕΠΩΝ ΥΜΑΣ ΓΡΑΦΩ ΤΑΥΤΑ ΑΛΛΑ ΩΣ ΤΕΚΝΑ ΜΟΥ ΑΓΑΠΗΤΑ ΝΟΥΘΕΤΩ
4,15,ΕΑΝ ΓΑΡ ΜΥΡΙΟΥΣ ΠΑΙΔΑΓΩΓΟΥΣ ΕΧΗΤΕ ΕΝ ΧΡΙΣΤΩΙ ΑΛΛΑ ΟΥ ΠΟΛΛΟΥΣ ΠΑΤΕΡΑΣ ΕΝ ΓΑΡ ΧΡΙΣΤΩΙ ΙΗΣΟΥ ΔΙΑ ΤΟΥ ΕΥΑΓΓΕΛΙΟΥ ΕΓΩ ΥΜΑΣ ΕΓΕΝΝΗΣΑ
4,16,ΠΑΡΑΚΑΛΩ ΟΥΝ ΥΜΑΣ ΜΙΜΗΤΑΙ ΜΟΥ ΓΙΝΕΣΘΕ
4,17,ΔΙΑ ΤΟΥΤΟ ΕΠΕΜΨΑ ΥΜΙΝ ΤΙΜΟΘΕΟΝ ΟΣ ΕΣΤΙΝ ΜΟΥ ΤΕΚΝΟΝ ΑΓΑΠΗΤΟΝ ΚΑΙ ΠΙΣΤΟΝ ΕΝ ΚΥΡΙΩΙ ΟΣ ΥΜΑΣ ΑΝΑΜΝΗΣΕΙ ΤΑΣ ΟΔΟΥΣ ΜΟΥ ΤΑΣ ΕΝ ΧΡΙΣΤΩΙ ΙΗΣΟΥ ΚΑΘΩΣ ΠΑΝΤΑΧΟΥ ΕΝ ΠΑΣΗΙ ΕΚΚΛΗΣΙΑΙ ΔΙΔΑΣΚΩ
4,18,ΩΣ ΜΗ ΕΡΧΟΜΕΝΟΥ ΔΕ ΜΟΥ ΠΡΟΣ ΥΜΑΣ ΕΦΥΣΙΩΘΗΣΑΝ ΤΙΝΕΣ
4,19,ΕΛΕΥΣΟΜΑΙ ΔΕ ΤΑΧΕΩΣ ΠΡΟΣ ΥΜΑΣ ΕΑΝ Ο ΚΥΡΙΟΣ ΘΕΛΗΣΗΙ ΚΑΙ ΓΝΩΣΟΜΑΙ ΟΥ ΤΟΝ ΛΟΓΟΝ ΤΩΝ ΠΕΦΥΣΙΩΜΕΝΩΝ ΑΛΛΑ ΤΗΝ ΔΥΝΑΜΙΝ
4,20,ΟΥ ΓΑΡ ΕΝ ΛΟΓΩΙ Η ΒΑΣΙΛΕΙΑ ΤΟΥ ΘΕΟΥ ΑΛΛΑ ΕΝ ΔΥΝΑΜΕΙ
4,21,ΤΙ ΘΕΛΕΤΕ ΕΝ ΡΑΒΔΩΙ ΕΛΘΩ ΠΡΟΣ ΥΜΑΣ Η ΕΝ ΑΓΑΠΗΙ ΠΝΕΥΜΑΤΙ ΤΕ ΠΡΑΥΤΗΤΟΣ
5,1,ΟΛΩΣ ΑΚΟΥΕΤΑΙ ΕΝ ΥΜΙΝ ΠΟΡΝΕΙΑ ΚΑΙ ΤΟΙΑΥΤΗ ΠΟΡΝΕΙΑ ΗΤΙΣ ΟΥΔΕ ΕΝ ΤΟΙΣ ΕΘΝΕΣΙΝ ΩΣΤΕ ΓΥΝΑΙΚΑ ΤΙΝΑ ΤΟΥ ΠΑΤΡΟΣ ΕΧΕΙΝ
5,2,ΚΑΙ ΥΜΕΙΣ ΠΕΦΥΣΙΩΜΕΝΟΙ ΕΣΤΕ ΚΑΙ ΟΥΧΙ ΜΑΛΛΟΝ ΕΠΕΝΘΗΣΑΤΕ ΙΝΑ ΑΡΘΗΙ ΕΚ ΜΕΣΟΥ ΥΜΩΝ Ο ΤΟ ΕΡΓΟΝ ΤΟΥΤΟ ΠΟΙΗΣΑΣ
5,3,ΕΓΩ ΜΕΝ ΓΑΡ ΑΠΩΝ ΤΩΙ ΣΩΜΑΤΙ ΠΑΡΩΝ ΔΕ ΤΩΙ ΠΝΕΥΜΑΤΙ ΗΔΗ ΚΕΚΡΙΚΑ ΩΣ ΠΑΡΩΝ ΤΟΝ ΟΥΤΩΣ ΤΟΥΤΟ ΚΑΤΕΡΓΑΣΑΜΕΝΟΝ
5,4,ΕΝ ΤΩΙ ΟΝΟΜΑΤΙ ΤΟΥ ΚΥΡΙΟΥ ΗΜΩΝ ΙΗΣΟΥ ΧΡΙΣΤΟΥ ΣΥΝΑΧΘΕΝΤΩΝ ΥΜΩΝ ΚΑΙ ΤΟΥ ΕΜΟΥ ΠΝΕΥΜΑΤΟΣ ΣΥΝ ΤΗΙ ΔΥΝΑΜΕΙ ΤΟΥ ΚΥΡΙΟΥ ΗΜΩΝ ΙΗΣΟΥ
5,5,ΠΑΡΑΔΟΥΝΑΙ ΤΟΝ ΤΟΙΟΥΤΟΝ ΤΩΙ ΣΑΤΑΝΑΙ ΕΙΣ ΟΛΕΘΡΟΝ ΤΗΣ ΣΑΡΚΟΣ ΙΝΑ ΤΟ ΠΝΕΥΜΑ ΣΩΘΗΙ ΕΝ ΤΗΙ ΗΜΕΡΑΙ ΤΟΥ ΚΥΡΙΟΥ
5,6,ΟΥ ΚΑΛΟΝ ΤΟ ΚΑΥΧΗΜΑ ΥΜΩΝ ΟΥΚ ΟΙΔΑΤΕ ΟΤΙ ΜΙΚΡΑ ΖΥΜΗ ΟΛΟΝ ΤΟ ΦΥΡΑΜΑ ΖΥΜΟΙ
5,7,ΕΚΚΑΘΑΡΑΤΕ ΤΗΝ ΠΑΛΑΙΑΝ ΖΥΜΗΝ ΙΝΑ ΗΤΕ ΝΕΟΝ ΦΥΡΑΜΑ ΚΑΘΩΣ ΕΣΤΕ ΑΖΥΜΟΙ ΚΑΙ ΓΑΡ ΤΟ ΠΑΣΧΑ ΗΜΩΝ ΕΤΥΘΗ ΧΡΙΣΤΟΣ
5,8,ΩΣΤΕ ΕΟΡΤΑΖΩΜΕΝ ΜΗ ΕΝ ΖΥΜΗΙ ΠΑΛΑΙΑΙ ΜΗΔΕ ΕΝ ΖΥΜΗΙ ΚΑΚΙΑΣ ΚΑΙ ΠΟΝΗΡΙΑΣ ΑΛΛΑ ΕΝ ΑΖΥΜΟΙΣ ΕΙΛΙΚΡΙΝΕΙΑΣ ΚΑΙ ΑΛΗΘΕΙΑΣ
5,9,ΕΓΡΑΨΑ ΥΜΙΝ ΕΝ ΤΗΙ ΕΠΙΣΤΟΛΗΙ ΜΗ ΣΥΝΑΝΑΜΙΓΝΥΣΘΑΙ ΠΟΡΝΟΙΣ
5,10,ΟΥ ΠΑΝΤΩΣ ΤΟΙΣ ΠΟΡΝΟΙΣ ΤΟΥ ΚΟΣΜΟΥ ΤΟΥΤΟΥ Η ΤΟΙΣ ΠΛΕΟΝΕΚΤΑΙΣ ΚΑΙ ΑΡΠΑΞΙΝ Η ΕΙΔΩΛΟΛΑΤΡΑΙΣ ΕΠΕΙ ΩΦΕΙΛΕΤΕ ΑΡΑ ΕΚ ΤΟΥ ΚΟΣΜΟΥ ΕΞΕΛΘΕΙΝ
5,11,ΝΥΝ ΔΕ ΕΓΡΑΨΑ ΥΜΙΝ ΜΗ ΣΥΝΑΝΑΜΙΓΝΥΣΘΑΙ ΕΑΝ ΤΙΣ ΑΔΕΛΦΟΣ ΟΝΟΜΑΖΟΜΕΝΟΣ ΗΙ ΠΟΡΝΟΣ Η ΠΛΕΟΝΕΚΤΗΣ Η ΕΙΔΩΛΟΛΑΤΡΗΣ Η ΛΟΙΔΟΡΟΣ Η ΜΕΘΥΣΟΣ Η ΑΡΠΑΞ ΤΩΙ ΤΟΙΟΥΤΩΙ ΜΗΔΕ ΣΥΝΕΣΘΙΕΙΝ
5,12,ΤΙ ΓΑΡ ΜΟΙ ΤΟΥΣ ΕΞΩ ΚΡΙΝΕΙΝ ΟΥΧΙ ΤΟΥΣ ΕΣΩ ΥΜΕΙΣ ΚΡΙΝΕΤΕ
5,13,ΤΟΥΣ ΔΕ ΕΞΩ Ο ΘΕΟΣ ΚΡΙΝΕΙ ΕΞΑΡΑΤΕ ΤΟΝ ΠΟΝΗΡΟΝ ΕΞ ΥΜΩΝ ΑΥΤΩΝ
6,1,ΤΟΛΜΑΙ ΤΙΣ ΥΜΩΝ ΠΡΑΓΜΑ ΕΧΩΝ ΠΡΟΣ ΤΟΝ ΕΤΕΡΟΝ ΚΡΙΝΕΣΘΑΙ ΕΠΙ ΤΩΝ ΑΔΙΚΩΝ ΚΑΙ ΟΥΧΙ ΕΠΙ ΤΩΝ ΑΓΙΩΝ
6,2,Η ΟΥΚ ΟΙΔΑΤΕ ΟΤΙ ΟΙ ΑΓΙΟΙ ΤΟΝ ΚΟΣΜΟΝ ΚΡΙΝΟΥΣΙΝ ΚΑΙ ΕΙ ΕΝ ΥΜΙΝ ΚΡΙΝΕΤΑΙ Ο ΚΟΣΜΟΣ ΑΝΑΞΙΟΙ ΕΣΤΕ ΚΡΙΤΗΡΙΩΝ ΕΛΑΧΙΣΤΩΝ
6,3,ΟΥΚ ΟΙΔΑΤΕ ΟΤΙ ΑΓΓΕΛΟΥΣ ΚΡΙΝΟΥΜΕΝ ΜΗΤΙ ΓΕ ΒΙΩΤΙΚΑ
6,4,ΒΙΩΤΙΚΑ ΜΕΝ ΟΥΝ ΚΡΙΤΗΡΙΑ ΕΑΝ ΕΧΗΤΕ ΤΟΥΣ ΕΞΟΥΘΕΝΗΜΕΝΟΥΣ ΕΝ ΤΗΙ ΕΚΚΛΗΣΙΑΙ ΤΟΥΤΟΥΣ ΚΑΘΙΖΕΤΕ
6,5,ΠΡΟΣ ΕΝΤΡΟΠΗΝ ΥΜΙΝ ΛΕΓΩ ΟΥΤΩΣ ΟΥΚ ΕΝΙ ΕΝ ΥΜΙΝ ΟΥΔΕΙΣ ΣΟΦΟΣ ΟΣ ΔΥΝΗΣΕΤΑΙ ΔΙΑΚΡΙΝΑΙ ΑΝΑ ΜΕΣΟΝ ΤΟΥ ΑΔΕΛΦΟΥ ΑΥΤΟΥ
6,6,ΑΛΛΑ ΑΔΕΛΦΟΣ ΜΕΤΑ ΑΔΕΛΦΟΥ ΚΡΙΝΕΤΑΙ ΚΑΙ ΤΟΥΤΟ ΕΠΙ ΑΠΙΣΤΩΝ
6,7,ΗΔΗ ΜΕΝ ΟΥΝ ΟΛΩΣ ΗΤΤΗΜΑ ΥΜΙΝ ΕΣΤΙΝ ΟΤΙ ΚΡΙΜΑΤΑ ΕΧΕΤΕ ΜΕΤΑ ΕΑΥΤΩΝ ΔΙΑ ΤΙ ΟΥΧΙ ΜΑΛΛΟΝ ΑΔΙΚΕΙΣΘΕ ΔΙΑ ΤΙ ΟΥΧΙ ΜΑΛΛΟΝ ΑΠΟΣΤΕΡΕΙΣΘΕ
6,8,ΑΛΛΑ ΥΜΕΙΣ ΑΔΙΚΕΙΤΕ ΚΑΙ ΑΠΟΣΤΕΡΕΙΤΕ ΚΑΙ ΤΟΥΤΟ ΑΔΕΛΦΟΥΣ
6,9,Η ΟΥΚ ΟΙΔΑΤΕ ΟΤΙ ΑΔΙΚΟΙ ΘΕΟΥ ΒΑΣΙΛΕΙΑΝ ΟΥ ΚΛΗΡΟΝΟΜΗΣΟΥΣΙΝ ΜΗ ΠΛΑΝΑΣΘΕ ΟΥΤΕ ΠΟΡΝΟΙ ΟΥΤΕ ΕΙΔΩΛΟΛΑΤΡΑΙ ΟΥΤΕ ΜΟΙΧΟΙ ΟΥΤΕ ΜΑΛΑΚΟΙ ΟΥΤΕ ΑΡΣΕΝΟΚΟΙΤΑΙ
6,10,ΟΥΤΕ ΚΛΕΠΤΑΙ ΟΥΤΕ ΠΛΕΟΝΕΚΤΑΙ ΟΥ ΜΕΘΥΣΟΙ ΟΥ ΛΟΙΔΟΡΟΙ ΟΥΧ ΑΡΠΑΓΕΣ ΒΑΣΙΛΕΙΑΝ ΘΕΟΥ ΚΛΗΡΟΝΟΜΗΣΟΥΣΙΝ
6,11,ΚΑΙ ΤΑΥΤΑ ΤΙΝΕΣ ΗΤΕ ΑΛΛΑ ΑΠΕΛΟΥΣΑΣΘΕ ΑΛΛΑ ΗΓΙΑΣΘΗΤΕ ΑΛΛΑ ΕΔΙΚΑΙΩΘΗΤΕ ΕΝ ΤΩΙ ΟΝΟΜΑΤΙ ΤΟΥ ΚΥΡΙΟΥ ΙΗΣΟΥ ΧΡΙΣΤΟΥ ΚΑΙ ΕΝ ΤΩΙ ΠΝΕΥΜΑΤΙ ΤΟΥ ΘΕΟΥ ΗΜΩΝ
6,12,ΠΑΝΤΑ ΜΟΙ ΕΞΕΣΤΙΝ ΑΛΛΑ ΟΥ ΠΑΝΤΑ ΣΥΜΦΕΡΕΙ ΠΑΝΤΑ ΜΟΙ ΕΞΕΣΤΙΝ ΑΛΛΑ ΟΥΚ ΕΓΩ ΕΞΟΥΣΙΑΣΘΗΣΟΜΑΙ ΥΠΟ ΤΙΝΟΣ
6,13,ΤΑ ΒΡΩΜΑΤΑ ΤΗΙ ΚΟΙΛΙΑΙ ΚΑΙ Η ΚΟΙΛΙΑ ΤΟΙΣ ΒΡΩΜΑΣΙΝ Ο ΔΕ ΘΕΟΣ ΚΑΙ ΤΑΥΤΗΝ ΚΑΙ ΤΑΥΤΑ ΚΑΤΑΡΓΗΣΕΙ ΤΟ ΔΕ ΣΩΜΑ ΟΥ ΤΗΙ ΠΟΡΝΕΙΑΙ ΑΛΛΑ ΤΩΙ ΚΥΡΙΩΙ ΚΑΙ Ο ΚΥΡΙΟΣ ΤΩΙ ΣΩΜΑΤΙ
6,14,Ο ΔΕ ΘΕΟΣ ΚΑΙ ΤΟΝ ΚΥΡΙΟΝ ΗΓΕΙΡΕΝ ΚΑΙ ΗΜΑΣ ΕΞΕΓΕΡΕΙ ΔΙΑ ΤΗΣ ΔΥΝΑΜΕΩΣ ΑΥΤΟΥ
6,15,ΟΥΚ ΟΙΔΑΤΕ ΟΤΙ ΤΑ ΣΩΜΑΤΑ ΥΜΩΝ ΜΕΛΗ ΧΡΙΣΤΟΥ ΕΣΤΙΝ ΑΡΑΣ ΟΥΝ ΤΑ ΜΕΛΗ ΤΟΥ ΧΡΙΣΤΟΥ ΠΟΙΗΣΩ ΠΟΡΝΗΣ ΜΕΛΗ ΜΗ ΓΕΝΟΙΤΟ
6,16,Η ΟΥΚ ΟΙΔΑΤΕ ΟΤΙ Ο ΚΟΛΛΩΜΕΝΟΣ ΤΗΙ ΠΟΡΝΗΙ ΕΝ ΣΩΜΑ ΕΣΤΙΝ ΕΣΟΝΤΑΙ ΓΑΡ ΦΗΣΙΝ ΟΙ ΔΥΟ ΕΙΣ ΣΑΡΚΑ ΜΙΑΝ
6,17,Ο ΔΕ ΚΟΛΛΩΜΕΝΟΣ ΤΩΙ ΚΥΡΙΩΙ ΕΝ ΠΝΕΥΜΑ ΕΣΤΙΝ
6,18,ΦΕΥΓΕΤΕ ΤΗΝ ΠΟΡΝΕΙΑΝ ΠΑΝ ΑΜΑΡΤΗΜΑ Ο ΕΑΝ ΠΟΙΗΣΗΙ ΑΝΘΡΩΠΟΣ ΕΚΤΟΣ ΤΟΥ ΣΩΜΑΤΟΣ ΕΣΤΙΝ Ο ΔΕ ΠΟΡΝΕΥΩΝ ΕΙΣ ΤΟ ΙΔΙΟΝ ΣΩΜΑ ΑΜΑΡΤΑΝΕΙ
6,19,Η ΟΥΚ ΟΙΔΑΤΕ ΟΤΙ ΤΟ ΣΩΜΑ ΥΜΩΝ ΝΑΟΣ ΤΟΥ ΕΝ ΥΜΙΝ ΑΓΙΟΥ ΠΝΕΥΜΑΤΟΣ ΕΣΤΙΝ ΟΥ ΕΧΕΤΕ ΑΠΟ ΘΕΟΥ ΚΑΙ ΟΥΚ ΕΣΤΕ ΕΑΥΤΩΝ
6,20,ΗΓΟΡΑΣΘΗΤΕ ΓΑΡ ΤΙΜΗΣ ΔΟΞΑΣΑΤΕ ΔΗ ΤΟΝ ΘΕΟΝ ΕΝ ΤΩΙ ΣΩΜΑΤΙ ΥΜΩΝ
7,1,ΠΕΡΙ ΔΕ ΩΝ ΕΓΡΑΨΑΤΕ ΚΑΛΟΝ ΑΝΘΡΩΠΩΙ ΓΥΝΑΙΚΟΣ ΜΗ ΑΠΤΕΣΘΑΙ
7,2,ΔΙΑ ΔΕ ΤΑΣ ΠΟΡΝΕΙΑΣ ΕΚΑΣΤΟΣ ΤΗΝ ΕΑΥΤΟΥ ΓΥΝΑΙΚΑ ΕΧΕΤΩ ΚΑΙ ΕΚΑΣΤΗ ΤΟΝ ΙΔΙΟΝ ΑΝΔΡΑ ΕΧΕΤΩ
7,3,ΤΗΙ ΓΥΝΑΙΚΙ Ο ΑΝΗΡ ΤΗΝ ΟΦΕΙΛΗΝ ΑΠΟΔΙΔΟΤΩ ΟΜΟΙΩΣ ΔΕ ΚΑΙ Η ΓΥΝΗ ΤΩΙ ΑΝΔΡΙ
7,4,Η ΓΥΝΗ ΤΟΥ ΙΔΙΟΥ ΣΩΜΑΤΟΣ ΟΥΚ ΕΞΟΥΣΙΑΖΕΙ ΑΛΛΑ Ο ΑΝΗΡ ΟΜΟΙΩΣ ΔΕ ΚΑΙ Ο ΑΝΗΡ ΤΟΥ ΙΔΙΟΥ ΣΩΜΑΤΟΣ ΟΥΚ ΕΞΟΥΣΙΑΖΕΙ ΑΛΛΑ Η ΓΥΝΗ
7,5,ΜΗ ΑΠΟΣΤΕΡΕΙΤΕ ΑΛΛΗΛΟΥΣ ΕΙ ΜΗΤΙ ΑΝ ΕΚ ΣΥΜΦΩΝΟΥ ΠΡΟΣ ΚΑΙΡΟΝ ΙΝΑ ΣΧΟΛΑΣΗΤΕ ΤΗΙ ΠΡΟΣΕΥΧΗΙ ΚΑΙ ΠΑΛΙΝ ΕΠΙ ΤΟ ΑΥΤΟ ΗΤΕ ΙΝΑ ΜΗ ΠΕΙΡΑΖΗΙ ΥΜΑΣ Ο ΣΑΤΑΝΑΣ ΔΙΑ ΤΗΝ ΑΚΡΑΣΙΑΝ ΥΜΩΝ
7,6,ΤΟΥΤΟ ΔΕ ΛΕΓΩ ΚΑΤΑ ΣΥΝΓΝΩΜΗΝ ΟΥ ΚΑΤΑ ΕΠΙΤΑΓΗΝ
7,7,ΘΕΛΩ ΔΕ ΠΑΝΤΑΣ ΑΝΘΡΩΠΟΥΣ ΕΙΝΑΙ ΩΣ ΚΑΙ ΕΜΑΥΤΟΝ ΑΛΛΑ ΕΚΑΣΤΟΣ ΙΔΙΟΝ ΕΧΕΙ ΧΑΡΙΣΜΑ ΕΚ ΘΕΟΥ Ο ΜΕΝ ΟΥΤΩΣ Ο ΔΕ ΟΥΤΩΣ
7,8,ΛΕΓΩ ΔΕ ΤΟΙΣ ΑΓΑΜΟΙΣ ΚΑΙ ΤΑΙΣ ΧΗΡΑΙΣ ΚΑΛΟΝ ΑΥΤΟΙΣ ΕΑΝ ΜΕΙΝΩΣΙΝ ΩΣ ΚΑΓΩ
7,9,ΕΙ ΔΕ ΟΥΚ ΕΝΚΡΑΤΕΥΟΝΤΑΙ ΓΑΜΗΣΑΤΩΣΑΝ ΚΡΕΙΤΤΟΝ ΓΑΡ ΕΣΤΙΝ ΓΑΜΗΣΑΙ Η ΠΥΡΟΥΣΘΑΙ
7,10,ΤΟΙΣ ΔΕ ΓΕΓΑΜΗΚΟΣΙΝ ΠΑΡΑΓΓΕΛΛΩ ΟΥΚ ΕΓΩ ΑΛΛΑ Ο ΚΥΡΙΟΣ ΓΥΝΑΙΚΑ ΑΠΟ ΑΝΔΡΟΣ ΜΗ ΧΩΡΙΣΘΗΝΑΙ
7,11,ΕΑΝ ΔΕ ΚΑΙ ΧΩΡΙΣΘΗΙ ΜΕΝΕΤΩ ΑΓΑΜΟΣ Η ΤΩΙ ΑΝΔΡΙ ΚΑΤΑΛΛΑΓΗΤΩ ΚΑΙ ΑΝΔΡΑ ΓΥΝΑΙΚΑ ΜΗ ΑΦΙΕΝΑΙ
7,12,ΤΟΙΣ ΔΕ ΛΟΙΠΟΙΣ ΛΕΓΩ ΕΓΩ ΟΥΧ Ο ΚΥΡΙΟΣ ΕΙ ΤΙΣ ΑΔΕΛΦΟΣ ΓΥΝΑΙΚΑ ΕΧΕΙ ΑΠΙΣΤΟΝ ΚΑΙ ΑΥΤΗ ΣΥΝΕΥΔΟΚΕΙ ΟΙΚΕΙΝ ΜΕΤΑ ΑΥΤΟΥ ΜΗ ΑΦΙΕΤΩ ΑΥΤΗΝ
7,13,ΚΑΙ ΓΥΝΗ ΕΙ ΤΙΣ ΕΧΕΙ ΑΝΔΡΑ ΑΠΙΣΤΟΝ ΚΑΙ ΟΥΤΟΣ ΣΥΝΕΥΔΟΚΕΙ ΟΙΚΕΙΝ ΜΕΤΑ ΑΥΤΗΣ ΜΗ ΑΦΙΕΤΩ ΤΟΝ ΑΝΔΡΑ
7,14,ΗΓΙΑΣΤΑΙ ΓΑΡ Ο ΑΝΗΡ Ο ΑΠΙΣΤΟΣ ΕΝ ΤΗΙ ΓΥΝΑΙΚΙ ΚΑΙ ΗΓΙΑΣΤΑΙ Η ΓΥΝΗ Η ΑΠΙΣΤΟΣ ΕΝ ΤΩΙ ΑΔΕΛΦΩΙ ΕΠΕΙ ΑΡΑ ΤΑ ΤΕΚΝΑ ΥΜΩΝ ΑΚΑΘΑΡΤΑ ΕΣΤΙΝ ΝΥΝ ΔΕ ΑΓΙΑ ΕΣΤΙΝ
7,15,ΕΙ ΔΕ Ο ΑΠΙΣΤΟΣ ΧΩΡΙΖΕΤΑΙ ΧΩΡΙΖΕΣΘΩ ΟΥ ΔΕΔΟΥΛΩΤΑΙ Ο ΑΔΕΛΦΟΣ Η Η ΑΔΕΛΦΗ ΕΝ ΤΟΙΣ ΤΟΙΟΥΤΟΙΣ ΕΝ ΔΕ ΕΙΡΗΝΗΙ ΚΕΚΛΗΚΕΝ ΗΜΑΣ Ο ΘΕΟΣ
7,16,ΤΙ ΓΑΡ ΟΙΔΑΣ ΓΥΝΑΙ ΕΙ ΤΟΝ ΑΝΔΡΑ ΣΩΣΕΙΣ Η ΤΙ ΟΙΔΑΣ ΑΝΕΡ ΕΙ ΤΗΝ ΓΥΝΑΙΚΑ ΣΩΣΕΙΣ
7,17,ΕΙ ΜΗ ΕΚΑΣΤΩΙ ΩΣ ΕΜΕΡΙΣΕΝ Ο ΚΥΡΙΟΣ ΕΚΑΣΤΟΝ ΩΣ ΚΕΚΛΗΚΕΝ Ο ΘΕΟΣ ΟΥΤΩΣ ΠΕΡΙΠΑΤΕΙΤΩ ΚΑΙ ΟΥΤΩΣ ΕΝ ΤΑΙΣ ΕΚΚΛΗΣΙΑΙΣ ΠΑΣΑΙΣ ΔΙΑΤΑΣΣΟΜΑΙ
7,18,ΠΕΡΙΤΕΤΜΗΜΕΝΟΣ ΤΙΣ ΕΚΛΗΘΗ ΜΗ ΕΠΙΣΠΑΣΘΩ ΕΝ ΑΚΡΟΒΥΣΤΙΑΙ ΚΕΚΛΗΤΑΙ ΤΙΣ ΜΗ ΠΕΡΙΤΕΜΝΕΣΘΩ
7,19,Η ΠΕΡΙΤΟΜΗ ΟΥΔΕΝ ΕΣΤΙΝ ΚΑΙ Η ΑΚΡΟΒΥΣΤΙΑ ΟΥΔΕΝ ΕΣΤΙΝ ΑΛΛΑ ΤΗΡΗΣΙΣ ΕΝΤΟΛΩΝ ΘΕΟΥ
7,20,ΕΚΑΣΤΟΣ ΕΝ ΤΗΙ ΚΛΗΣΕΙ ΗΙ ΕΚΛΗΘΗ ΕΝ ΤΑΥΤΗΙ ΜΕΝΕΤΩ
7,21,ΔΟΥΛΟΣ ΕΚΛΗΘΗΣ ΜΗ ΣΟΙ ΜΕΛΕΤΩ ΑΛΛΑ ΕΙ ΚΑΙ ΔΥΝΑΣΑΙ ΕΛΕΥΘΕΡΟΣ ΓΕΝΕΣΘΑΙ ΜΑΛΛΟΝ ΧΡΗΣΑΙ
