chapter,verse,text
1,1,ΠΑΥΛΟΣ ΑΠΟΣΤΟΛΟΣ ΧΡΙΣΤΟΥ ΙΗΣΟΥ ΚΑΤΑ ΕΠΙΤΑΓΗΝ ΘΕΟΥ ΣΩΤΗΡΟΣ ΗΜΩΝ ΚΑΙ ΚΥΡΙΟΥ ΙΗΣΟΥ ΧΡΙΣΤΟΥ ΤΗΣ ΕΛΠΙΔΟΣ ΗΜΩΝ
1,2,ΤΙΜΟΘΕΩΙ ΓΝΗΣΙΩΙ ΤΕΚΝΩΙ ΕΝ ΠΙΣΤΕΙ ΧΑΡΙΣ ΕΛΕΟΣ ΕΙΡΗΝΗ ΑΠΟ ΘΕΟΥ ΠΑΤΡΟΣ ΚΑΙ ΧΡΙΣΤΟΥ ΙΗΣΟΥ ΤΟΥ ΚΥΡΙΟΥ ΗΜΩΝ
1,3,ΚΑΘΩΣ ΠΑΡΕΚΑΛΕΣΑ ΣΕ ΠΡΟΣΜΕΙΝΑΙ ΕΝ ΕΦΕΣΩΙ ΠΟΡΕΥΟΜΕΝΟΣ ΕΙΣ ΜΑΚΕΔΟΝΙΑΝ ΙΝΑ ΠΑΡΑΓΓΕΙΛΗΙΣ ΤΙΣΙΝ ΜΗ ΕΤΕΡΟΔΙΔΑΣΚΑΛΕΙΝ
1,4,ΜΗΔΕ ΠΡΟΣΕΧΕΙΝ ΜΥΘΟΙΣ ΚΑΙ ΓΕΝΕΑΛΟΓΙΑΙΣ ΑΠΕΡΑΝΤΟΙΣ ΑΙΤΙΝΕΣ ΕΚΖΗΤΗΣΕΙΣ ΠΑΡΕΧΟΥΣΙ ΜΑΛΛΟΝ Η ΟΙΚΟΝΟΜΙΑΝ ΘΕΟΥ ΤΗΝ ΕΝ ΠΙΣΤΕΙ
1,5,ΤΟ ΔΕ ΤΕΛΟΣ ΤΗΣ ΠΑΡΑΓΓΕΛΙΑΣ ΕΣΤΙΝ ΑΓΑΠΗ ΕΚ ΚΑΘΑΡΑΣ ΚΑΡΔΙΑΣ ΚΑΙ ΣΥΝΕΙΔΗΣΕΩΣ ΑΓΑΘΗΣ ΚΑΙ ΠΙΣΤΕΩΣ ΑΝΥΠΟΚΡΙΤΟΥ
1,6,ΩΝ ΤΙΝΕΣ ΑΣΤΟΧΗΣΑΝΤΕΣ ΕΞΕΤΡΑΠΗΣΑΝ ΕΙΣ ΜΑΤΑΙΟΛΟΓΙΑΝ
1,7,ΘΕΛΟΝΤΕΣ ΕΙΝΑΙ ΝΟΜΟΔΙΔΑΣΚΑΛΟΙ ΜΗ ΝΟΟΥΝΤΕΣ ΜΗΤΕ Α ΛΕΓΟΥΣΙΝ ΜΗΤΕ ΠΕΡΙ ΤΙΝΩΝ ΔΙΑΒΕΒΑΙΟΥΝΤΑΙ
1,8,ΟΙΔΑΜΕΝ ΔΕ ΟΤΙ ΚΑΛΟΣ Ο ΝΟΜΟΣ ΕΑΝ ΤΙΣ ΑΥΤΩΙ ΝΟΜΙΜΩΣ ΧΡΗΤΑΙ
1,9,ΕΙΔΩΣ ΤΟΥΤΟ ΟΤΙ ΔΙΚΑΙΩΙ ΝΟΜΟΣ ΟΥ ΚΕΙΤΑΙ ΑΝΟΜΟΙΣ ΔΕ ΚΑΙ ΑΝΥΠΟΤΑΚΤΟΙΣ ΑΣΕΒΕΣΙ ΚΑΙ ΑΜΑΡΤΩΛΟΙΣ ΑΝΟΣΙΟΙΣ ΚΑΙ ΒΕΒΗΛΟΙΣ ΠΑΤΡΟΛΩΙΑΙΣ ΚΑΙ ΜΗΤΡΟΛΩΙΑΙΣ ΑΝΔΡΟΦΟΝΟΙΣ
1,10,ΠΟΡΝΟΙΣ ΑΡΣΕΝΟΚΟΙΤΑΙΣ ΑΝΔΡΑΠΟΔΙΣΤΑΙΣ ΨΕΥΣΤΑΙΣ ΕΠΙΟΡΚΟΙΣ ΚΑΙ ΕΙ ΤΙ ΕΤΕΡΟΝ ΤΗΙ ΥΓΙΑΙΝΟΥΣΗΙ ΔΙΔΑΣΚΑΛΙΑΙ ΑΝΤΙΚΕΙΤΑΙ
1,11,ΚΑΤΑ ΤΟ ΕΥΑΓΓΕΛΙΟΝ ΤΗΣ ΔΟΞΗΣ ΤΟΥ ΜΑΚΑΡΙΟΥ ΘΕΟΥ Ο ΕΠΙΣΤΕΥΘΗΝ ΕΓΩ
1,12,ΧΑΡΙΝ ΕΧΩ ΤΩΙ ΕΝΔΥΝΑΜΩΣΑΝΤΙ ΜΕ ΧΡΙΣΤΩΙ ΙΗΣΟΥ ΤΩΙ ΚΥΡΙΩΙ ΗΜΩΝ ΟΤΙ ΠΙΣΤΟΝ ΜΕ ΗΓΗΣΑΤΟ ΘΕΜΕΝΟΣ ΕΙΣ ΔΙΑΚΟΝΙΑΝ
1,13,ΤΟ ΠΡΟΤΕΡΟΝ ΟΝΤΑ ΒΛΑΣΦΗΜΟΝ ΚΑΙ ΔΙΩΚΤΗΝ ΚΑΙ ΥΒΡΙΣΤΗΝ ΑΛΛΑ ΗΛΕΗΘΗΝ ΟΤΙ ΑΓΝΟΩΝ ΕΠΟΙΗΣΑ ΕΝ ΑΠΙΣΤΙΑΙ
1,14,ΥΠΕΡΕΠΛΕΟΝΑΣΕΝ ΔΕ Η ΧΑΡΙΣ ΤΟΥ ΚΥΡΙΟΥ ΗΜΩΝ ΜΕΤΑ ΠΙΣΤΕΩΣ ΚΑΙ ΑΓΑΠΗΣ ΤΗΣ ΕΝ ΧΡΙΣΤΩΙ ΙΗΣΟΥ
1,15,ΠΙΣΤΟΣ Ο ΛΟΓΟΣ ΚΑΙ ΠΑΣΗΣ ΑΠΟΔΟΧΗΣ ΑΞΙΟΣ ΟΤΙ ΧΡΙΣΤΟΣ ΙΗΣΟΥΣ ΗΛΘΕΝ ΕΙΣ ΤΟΝ ΚΟΣΜΟΝ ΑΜΑΡΤΩΛΟΥΣ ΣΩΣΑΙ ΩΝ ΠΡΩΤΟΣ ΕΙΜΙ ΕΓΩ
1,16,ΑΛΛΑ ΔΙΑ ΤΟΥΤΟ ΗΛΕΗΘΗΝ ΙΝΑ ΕΝ ΕΜΟΙ ΠΡΩΤΩΙ ΕΝΔΕΙΞΗΤΑΙ ΙΗΣΟΥΣ ΧΡΙΣΤΟΣ ΤΗΝ ΑΠΑΣΑΝ ΜΑΚΡΟΘΥΜΙΑΝ ΠΡΟΣ ΥΠΟΤΥΠΩΣΙΝ ΤΩΝ ΜΕΛΛΟΝΤΩΝ ΠΙΣΤΕΥΕΙΝ ΕΠΙ ΑΥΤΩΙ ΕΙΣ ΖΩΗΝ ΑΙΩΝΙΟΝ
1,17,ΤΩΙ ΔΕ ΒΑΣΙΛΕΙ ΤΩΝ ΑΙΩΝΩΝ ΑΦΘΑΡΤΩΙ ΑΟΡΑΤΩΙ ΜΟΝΩΙ ΘΕΩΙ ΤΙΜΗ ΚΑΙ ΔΟΞΑ ΕΙΣ ΤΟΥΣ ΑΙΩΝΑΣ ΤΩΝ ΑΙΩΝΩΝ ΑΜΗΝ
1,18,ΤΑΥΤΗΝ ΤΗΝ ΠΑΡΑΓΓΕΛΙΑΝ ΠΑΡΑΤΙΘΕΜΑΙ ΣΟΙ ΤΕΚΝΟΝ ΤΙΜΟΘΕΕ ΚΑΤΑ ΤΑΣ ΠΡΟΑΓΟΥΣΑΣ ΕΠΙ ΣΕ ΠΡΟΦΗΤΕΙΑΣ ΙΝΑ ΣΤΡΑΤΕΥΗΙ ΕΝ ΑΥΤΑΙΣ ΤΗΝ ΚΑΛΗΝ ΣΤΡΑΤΕΙΑΝ
1,19,ΕΧΩΝ ΠΙΣΤΙΝ ΚΑΙ ΑΓΑΘΗΝ ΣΥΝΕΙΔΗΣΙΝ ΗΝ ΤΙΝΕΣ ΑΠΩΣΑΜΕΝΟΙ ΠΕΡΙ ΤΗΝ ΠΙΣΤΙΝ ΕΝΑΥΑΓΗΣΑΝ
1,20,ΩΝ ΕΣΤΙΝ ΥΜΕΝΑΙΟΣ ΚΑΙ ΑΛΕΞΑΝΔΡΟΣ ΟΥΣ ΠΑΡΕΔΩΚΑ ΤΩΙ ΣΑΤΑΝΑΙ ΙΝΑ ΠΑΙΔΕΥΘΩΣΙ ΜΗ ΒΛΑΣΦΗΜΕΙΝ
2,1,ΠΑΡΑΚΑΛΩ ΟΥΝ ΠΡΩΤΟΝ ΠΑΝΤΩΝ ΠΟΙΕΙΣΘΑΙ ΔΕΗΣΕΙΣ ΠΡΟΣΕΥΧΑΣ ΕΝΤΕΥΞΕΙΣ ΕΥΧΑΡΙΣΤΙΑΣ ΥΠΕΡ ΠΑΝΤΩΝ ΑΝΘΡΩΠΩΝ
2,2,ΥΠΕΡ ΒΑΣΙΛΕΩΝ ΚΑΙ ΠΑΝΤΩΝ ΤΩΝ ΕΝ ΥΠΕΡΟΧΗΙ ΟΝΤΩΝ ΙΝΑ ΗΡΕΜΟΝ ΚΑΙ ΗΣΥΧΙΟΝ ΒΙΟΝ ΔΙΑΓΩΜΕΝ ΕΝ ΠΑΣΗΙ ΕΥΣΕΒΕΙΑΙ ΚΑΙ ΣΕΜΝΟΤΗΤΙ
2,3,ΤΟΥΤΟ ΚΑΛΟΝ ΚΑΙ ΑΠΟΔΕΚΤΟΝ ΕΝΩΠΙΟΝ ΤΟΥ ΣΩΤΗΡΟΣ ΗΜΩΝ ΘΕΟΥ
2,4,ΟΣ ΠΑΝΤΑΣ ΑΝΘΡΩΠΟΥΣ ΘΕΛΕΙ ΣΩΘΗΝΑΙ ΚΑΙ ΕΙΣ ΕΠΙΓΝΩΣΙΝ ΑΛΗΘΕΙΑΣ ΕΛΘΕΙΝ
2,5,ΕΙΣ ΓΑΡ ΘΕΟΣ ΕΙΣ ΚΑΙ ΜΕΣΙΤΗΣ ΘΕΟΥ ΚΑΙ ΑΝΘΡΩΠΩΝ ΑΝΘΡΩΠΟΣ ΧΡΙΣΤΟΣ ΙΗΣΟΥΣ
2,6,Ο ΔΟΥΣ ΕΑΥΤΟΝ ΑΝΤΙΛΥΤΡΟΝ ΥΠΕΡ ΠΑΝΤΩΝ ΤΟ ΜΑΡΤΥΡΙΟΝ ΚΑΙΡΟΙΣ ΙΔΙΟΙΣ
2,7,ΕΙΣ Ο ΕΤΕΘΗΝ ΕΓΩ ΚΗΡΥΞ ΚΑΙ ΑΠΟΣΤΟΛΟΣ ΑΛΗΘΕΙΑΝ ΛΕΓΩ ΕΝ ΧΡΙΣΤΩΙ ΟΥ ΨΕΥΔΟΜΑΙ ΔΙΔΑΣΚΑΛΟΣ ΕΘΝΩΝ ΕΝ ΠΙΣΤΕΙ ΚΑΙ ΑΛΗΘΕΙΑΙ
2,8,ΒΟΥΛΟΜΑΙ ΟΥΝ ΠΡΟΣΕΥΧΕΣΘΑΙ ΤΟΥΣ ΑΝΔΡΑΣ ΕΝ ΠΑΝΤΙ ΤΟΠΩΙ ΕΠΑΙΡΟΝΤΑΣ ΟΣΙΟΥΣ ΧΕΙΡΑΣ ΧΩΡΙΣ ΟΡΓΗΣ ΚΑΙ ΔΙΑΛΟΓΙΣΜΟΥ
2,9,ΩΣΑΥΤΩΣ ΓΥΝΑΙΚΑΣ ΕΝ ΚΑΤΑΣΤΟΛΗΙ ΚΟΣΜΙΩΙ ΜΕΤΑ ΑΙΔΟΥΣ ΚΑΙ ΣΩΦΡΟΣΥΝΗΣ ΚΟΣΜΕΙΝ ΕΑΥΤΑΣ ΜΗ ΕΝ ΠΛΕΓΜΑΣΙΝ ΚΑΙ ΧΡΥΣΩΙ Η ΜΑΡΓΑΡΙΤΑΙΣ Η ΙΜΑΤΙΣΜΩΙ ΠΟΛΥΤΕΛΕΙ
2,10,ΑΛΛΑ Ο ΠΡΕΠΕΙ ΓΥΝΑΙΞΙΝ ΕΠΑΓΓΕΛΛΟΜΕΝΑΙΣ ΘΕΟΣΕΒΕΙΑΝ ΔΙΑ ΕΡΓΩΝ ΑΓΑΘΩΝ
2,11,ΓΥΝΗ ΕΝ ΗΣΥΧΙΑΙ ΜΑΝΘΑΝΕΤΩ ΕΝ ΠΑΣΗΙ ΥΠΟΤΑΓΗΙ
2,12,ΔΙΔΑΣΚΕΙΝ ΔΕ ΓΥΝΑΙΚΙ ΟΥΚ ΕΠΙΤΡΕΠΩ ΟΥΔΕ ΑΥΘΕΝΤΕΙΝ ΑΝΔΡΟΣ ΑΛΛΑ ΕΙΝΑΙ ΕΝ ΗΣΥΧΙΑΙ
2,13,ΑΔΑΜ ΓΑΡ ΠΡΩΤΟΣ ΕΠΛΑΣΘΗ ΕΙΤΑ ΕΥΑ
2,14,ΚΑΙ ΑΔΑΜ ΟΥΚ ΗΠΑΤΗΘΗ Η ΔΕ ΓΥΝΗ ΕΞΑΠΑΤΗΘΕΙΣΑ ΕΝ ΠΑΡΑΒΑΣΕΙ ΓΕΓΟΝΕΝ
2,15,ΣΩΘΗΣΕΤΑΙ ΔΕ ΔΙΑ ΤΗΣ ΤΕΚΝΟΓΟΝΙΑΣ ΕΑΝ ΜΕΙΝΩΣΙΝ ΕΝ ΠΙΣΤΕΙ ΚΑΙ ΑΓΑΠΗΙ ΚΑΙ ΑΓΙΑΣΜΩΙ ΜΕΤΑ ΣΩΦΡΟΣΥΝΗΣ
3,1,ΠΙΣΤΟΣ Ο ΛΟΓΟΣ ΕΙ ΤΙΣ ΕΠΙΣΚΟΠΗΣ ΟΡΕΓΕΤΑΙ ΚΑΛΟΥ ΕΡΓΟΥ ΕΠΙΘΥΜΕΙ
3,2,ΔΕΙ ΟΥΝ ΤΟΝ ΕΠΙΣΚΟΠΟΝ ΑΝΕΠΙΛΗΜΠΤΟΝ ΕΙΝΑΙ ΜΙΑΣ ΓΥΝΑΙΚΟΣ ΑΝΔΡΑ ΝΗΦΑΛΙΟΝ ΣΩΦΡΟΝΑ ΚΟΣΜΙΟΝ ΦΙΛΟΞΕΝΟΝ ΔΙΔΑΚΤΙΚΟΝ
3,3,ΜΗ ΠΑΡΟΙΝΟΝ ΜΗ ΠΛΗΚΤΗΝ ΑΛΛΑ ΕΠΙΕΙΚΗ ΑΜΑΧΟΝ ΑΦΙΛΑΡΓΥΡΟΝ
3,4,ΤΟΥ ΙΔΙΟΥ ΟΙΚΟΥ ΚΑΛΩΣ ΠΡΟΙΣΤΑΜΕΝΟΝ ΤΕΚΝΑ ΕΧΟΝΤΑ ΕΝ ΥΠΟΤΑΓΗΙ ΜΕΤΑ ΠΑΣΗΣ ΣΕΜΝΟΤΗΤΟΣ
3,5,ΕΙ ΔΕ ΤΙΣ ΤΟΥ ΙΔΙΟΥ ΟΙΚΟΥ ΠΡΟΣΤΗΝΑΙ ΟΥΚ ΟΙΔΕΝ ΠΩΣ ΕΚΚΛΗΣΙΑΣ ΘΕΟΥ ΕΠΙΜΕΛΗΣΕΤΑΙ
3,6,ΜΗ ΝΕΟΦΥΤΟΝ ΙΝΑ ΜΗ ΤΥΦΩΘΕΙΣ ΕΙΣ ΚΡΙΜΑ ΕΜΠΕΣΗΙ ΤΟΥ ΔΙΑΒΟΛΟΥ
3,7,ΔΕΙ ΔΕ ΚΑΙ ΜΑΡΤΥΡΙΑΝ ΚΑΛΗΝ ΕΧΕΙΝ ΑΠΟ ΤΩΝ ΕΞΩΘΕΝ ΙΝΑ ΜΗ ΕΙΣ ΟΝΕΙΔΙΣΜΟΝ ΕΜΠΕΣΗΙ ΚΑΙ ΠΑΓΙΔΑ ΤΟΥ ΔΙΑΒΟΛΟΥ
3,8,ΔΙΑΚΟΝΟΥΣ ΩΣΑΥΤΩΣ ΣΕΜΝΟΥΣ ΜΗ ΔΙΛΟΓΟΥΣ ΜΗ ΟΙΝΩΙ ΠΟΛΛΩΙ ΠΡΟΣΕΧΟΝΤΑΣ ΜΗ ΑΙΣΧΡΟΚΕΡΔΕΙΣ
3,9,ΕΧΟΝΤΑΣ ΤΟ ΜΥΣΤΗΡΙΟΝ ΤΗΣ ΠΙΣΤΕΩΣ ΕΝ ΚΑΘΑΡΑΙ ΣΥΝΕΙΔΗΣΕΙ
3,10,ΚΑΙ ΟΥΤΟΙ ΔΕ ΔΟΚΙΜΑΖΕΣΘΩΣΑΝ ΠΡΩΤΟΝ ΕΙΤΑ ΔΙΑΚΟΝΕΙΤΩΣΑΝ ΑΝΕΓΚΛΗΤΟΙ ΟΝΤΕΣ
3,11,ΓΥΝΑΙΚΑΣ ΩΣΑΥΤΩΣ ΣΕΜΝΑΣ ΜΗ ΔΙΑΒΟΛΟΥΣ ΝΗΦΑΛΙΟΥΣ ΠΙΣΤΑΣ ΕΝ ΠΑΣΙΝ
3,12,ΔΙΑΚΟΝΟΙ ΕΣΤΩΣΑΝ ΜΙΑΣ ΓΥΝΑΙΚΟΣ ΑΝΔΡΕΣ ΤΕΚΝΩΝ ΚΑΛΩΣ ΠΡΟΙΣΤΑΜΕΝΟΙ ΚΑΙ ΤΩΝ ΙΔΙΩΝ ΟΙΚΩΝ
3,13,ΟΙ ΓΑΡ ΚΑΛΩΣ ΔΙΑΚΟΝΗΣΑΝΤΕΣ ΒΑΘΜΟΝ ΕΑΥΤΟΙΣ ΚΑΛΟΝ ΠΕΡΙΠΟΙΟΥΝΤΑΙ ΚΑΙ ΠΟΛΛΗΝ ΠΑΡΡΗΣΙΑΝ ΕΝ ΠΙΣΤΕΙ ΤΗΙ ΕΝ ΧΡΙΣΤΩΙ ΙΗΣΟΥ
3,14,ΤΑΥΤΑ ΣΟΙ ΓΡΑΦΩ ΕΛΠΙΖΩΝ ΕΛΘΕΙΝ ΠΡΟΣ ΣΕ ΕΝ ΤΑΧΕΙ
3,15,ΕΑΝ ΔΕ ΒΡΑΔΥΝΩ ΙΝΑ ΕΙΔΗΙΣ ΠΩΣ ΔΕΙ ΕΝ ΟΙΚΩΙ ΘΕΟΥ ΑΝΑΣΤΡΕΦΕΣΘΑΙ ΗΤΙΣ ΕΣΤΙΝ ΕΚΚΛΗΣΙΑ ΘΕΟΥ ΖΩΝΤΟΣ ΣΤΥΛΟΣ ΚΑΙ ΕΔΡΑΙΩΜΑ ΤΗΣ ΑΛΗΘΕΙΑΣ
3,16,ΚΑΙ ΟΜΟΛΟΓΟΥΜΕΝΩΣ ΜΕΓΑ ΕΣΤΙΝ ΤΟ ΤΗΣ ΕΥΣΕΒΕΙΑΣ ΜΥΣΤΗΡΙΟΝ ΟΣ ΕΦΑΝΕΡΩΘΗ ΕΝ ΣΑΡΚΙ ΕΔΙΚΑΙΩΘΗ ΕΝ ΠΝΕΥΜΑΤΙ ΩΦΘΗ ΑΓΓΕΛΟΙΣ ΕΚΗΡΥΧΘΗ ΕΝ ΕΘΝΕΣΙΝ ΕΠΙΣΤΕΥΘΗ ΕΝ ΚΟΣΜΩΙ ΑΝΕΛΗΜΦΘΗ ΕΝ ΔΟΞΗΙ
4,1,ΤΟ ΔΕ ΠΝΕΥΜΑ ΡΗΤΩΣ ΛΕΓΕΙ ΟΤΙ ΕΝ ΥΣΤΕΡΟΙΣ ΚΑΙΡΟΙΣ ΑΠΟΣΤΗΣΟΝΤΑΙ ΤΙΝΕΣ ΤΗΣ ΠΙΣΤΕΩΣ ΠΡΟΣΕΧΟΝΤΕΣ ΠΝΕΥΜΑΣΙ ΠΛΑΝΟΙΣ ΚΑΙ ΔΙΔΑΣΚΑΛΙΑΙΣ ΔΑΙΜΟΝΙΩΝ
4,2,ΕΝ ΥΠΟΚΡΙΣΕΙ ΨΕΥΔΟΛΟΓΩΝ ΚΕΚΑΥΣΤΗΡΙΑΣΜΕΝΩΝ ΤΗΝ ΙΔΙΑΝ ΣΥΝΕΙΔΗΣΙΝ
4,3,ΚΩΛΥΟΝΤΩΝ ΓΑΜΕΙΝ ΑΠΕΧΕΣΘΑΙ ΒΡΩΜΑΤΩΝ Α Ο ΘΕΟΣ ΕΚΤΙΣΕΝ ΕΙΣ ΜΕΤΑΛΗΜΨΙΝ ΜΕΤΑ ΕΥΧΑΡΙΣΤΙΑΣ ΤΟΙΣ ΠΙΣΤΟΙΣ ΚΑΙ ΕΠΕΓΝΩΚΟΣΙ ΤΗΝ ΑΛΗΘΕΙΑΝ
4,4,ΟΤΙ ΠΑΝ ΚΤΙΣΜΑ ΘΕΟΥ ΚΑΛΟΝ ΚΑΙ ΟΥΔΕΝ ΑΠΟΒΛΗΤΟΝ ΜΕΤΑ ΕΥΧΑΡΙΣΤΙΑΣ ΛΑΜΒΑΝΟΜΕΝΟΝ
4,5,ΑΓΙΑΖΕΤΑΙ ΓΑΡ ΔΙΑ ΛΟΓΟΥ ΘΕΟΥ ΚΑΙ ΕΝΤΕΥΞΕΩΣ
4,6,ΤΑΥΤΑ ΥΠΟΤΙΘΕΜΕΝΟΣ ΤΟΙΣ ΑΔΕΛΦΟΙΣ ΚΑΛΟΣ ΕΣΗΙ ΔΙΑΚΟΝΟΣ ΧΡΙΣΤΟΥ ΙΗΣΟΥ ΕΝΤΡΕΦΟΜΕΝΟΣ ΤΟΙΣ ΛΟΓΟΙΣ ΤΗΣ ΠΙΣΤΕΩΣ ΚΑΙ ΤΗΣ ΚΑΛΗΣ ΔΙΔΑΣΚΑΛΙΑΣ ΗΙ ΠΑΡΗΚΟΛΟΥΘΗΚΑΣ
4,7,ΤΟΥΣ ΔΕ ΒΕΒΗΛΟΥΣ ΚΑΙ ΓΡΑΩΔΕΙΣ ΜΥΘΟΥΣ ΠΑΡΑΙΤΟΥ ΓΥΜΝΑΖΕ ΔΕ ΣΕΑΥΤΟΝ ΠΡΟΣ ΕΥΣΕΒΕΙΑΝ
4,8,Η ΓΑΡ ΣΩΜΑΤΙΚΗ ΓΥΜΝΑΣΙΑ ΠΡΟΣ ΟΛΙΓΟΝ ΕΣΤΙΝ ΩΦΕΛΙΜΟΣ Η ΔΕ ΕΥΣΕΒΕΙΑ ΠΡΟΣ ΠΑΝΤΑ ΩΦΕΛΙΜΟΣ ΕΣΤΙΝ ΕΠΑΓΓΕΛΙΑΝ ΕΧΟΥΣΑ ΖΩΗΣ ΤΗΣ ΝΥΝ ΚΑΙ ΤΗΣ ΜΕΛΛΟΥΣΗΣ
4,9,ΠΙΣΤΟΣ Ο ΛΟΓΟΣ ΚΑΙ ΠΑΣΗΣ ΑΠΟΔΟΧΗΣ ΑΞΙΟΣ
4,10,ΕΙΣ ΤΟΥΤΟ ΓΑΡ ΚΟΠΙΩΜΕΝ ΚΑΙ ΑΓΩΝΙΖΟΜΕΘΑ ΟΤΙ ΗΛΠΙΚΑΜΕΝ ΕΠΙ ΘΕΩΙ ΖΩΝΤΙ ΟΣ ΕΣΤΙΝ ΣΩΤΗΡ ΠΑΝΤΩΝ ΑΝΘΡΩΠΩΝ ΜΑΛΙΣΤΑ ΠΙΣΤΩΝ
4,11,ΠΑΡΑΓΓΕΛΛΕ ΤΑΥΤΑ ΚΑΙ ΔΙΔΑΣΚΕ
4,12,ΜΗΔΕΙΣ ΣΟΥ ΤΗΣ ΝΕΟΤΗΤΟΣ ΚΑΤΑΦΡΟΝΕΙΤΩ ΑΛΛΑ ΤΥΠΟΣ ΓΙΝΟΥ ΤΩΝ ΠΙΣΤΩΝ ΕΝ ΛΟΓΩΙ ΕΝ ΑΝΑΣΤΡΟΦΗΙ ΕΝ ΑΓΑΠΗΙ ΕΝ ΠΙΣΤΕΙ ΕΝ ΑΓΝΙΑΙ
4,13,ΕΩΣ ΕΡΧΟΜΑΙ ΠΡΟΣΕΧΕ ΤΗΙ ΑΝΑΓΝΩΣΕΙ ΤΗΙ ΠΑΡΑΚΛΗΣΕΙ ΤΗΙ ΔΙΔΑΣΚΑΛΙΑΙ
4,14,ΜΗ ΑΜΕΛΕΙ ΤΟΥ ΕΝ ΣΟΙ ΧΑΡΙΣΜΑΤΟΣ Ο ΕΔΟΘΗ ΣΟΙ ΔΙΑ ΠΡΟΦΗΤΕΙΑΣ ΜΕΤΑ ΕΠΙΘΕΣΕΩΣ ΤΩΝ ΧΕΙΡΩΝ ΤΟΥ ΠΡΕΣΒΥΤΕΡΙΟΥ
4,15,ΤΑΥΤΑ ΜΕΛΕΤΑ ΕΝ ΤΟΥΤΟΙΣ ΙΣΘΙ ΙΝΑ ΣΟΥ Η ΠΡΟΚΟΠΗ ΦΑΝΕΡΑ ΗΙ ΠΑΣΙΝ
4,16,ΕΠΕΧΕ ΣΕΑΥΤΩΙ ΚΑΙ ΤΗΙ ΔΙΔΑΣΚΑΛΙΑΙ ΕΠΙΜΕΝΕ ΑΥΤΟΙΣ ΤΟΥΤΟ ΓΑΡ ΠΟΙΩΝ ΚΑΙ ΣΕΑΥΤΟΝ ΣΩΣΕΙΣ ΚΑΙ ΤΟΥΣ ΑΚΟΥΟΝΤΑΣ ΣΟΥ
5,1,ΠΡΕΣΒΥΤΕΡΩΙ ΜΗ ΕΠΙΠΛΗΞΗΙΣ ΑΛΛΑ ΠΑΡΑΚΑΛΕΙ ΩΣ ΠΑΤΕΡΑ ΝΕΩΤΕΡΟΥΣ ΩΣ ΑΔΕΛΦΟΥΣ
5,2,ΠΡΕΣΒΥΤΕΡΑΣ ΩΣ ΜΗΤΕΡΑΣ ΝΕΩΤΕΡΑΣ ΩΣ ΑΔΕΛΦΑΣ ΕΝ ΠΑΣΗΙ ΑΓΝΙΑΙ
5,3,ΧΗΡΑΣ ΤΙΜΑ ΤΑΣ ΟΝΤΩΣ ΧΗΡΑΣ
5,4,ΕΙ ΔΕ ΤΙΣ ΧΗΡΑ ΤΕΚΝΑ Η ΕΚΓΟΝΑ ΕΧΕΙ ΜΑΝΘΑΝΕΤΩΣΑΝ ΠΡΩΤΟΝ ΤΟΝ ΙΔΙΟΝ ΟΙΚΟΝ ΕΥΣΕΒΕΙΝ ΚΑΙ ΑΜΟΙΒΑΣ ΑΠΟΔΙΔΟΝΑΙ ΤΟΙΣ ΠΡΟΓΟΝΟΙΣ ΤΟΥΤΟ ΓΑΡ ΕΣΤΙΝ ΑΠΟΔΕΚΤΟΝ ΕΝΩΠΙΟΝ ΤΟΥ ΘΕΟΥ
5,5,Η ΔΕ ΟΝΤΩΣ ΧΗΡΑ ΚΑΙ ΜΕΜΟΝΩΜΕΝΗ ΗΛΠΙΚΕΝ ΕΠΙ ΘΕΟΝ ΚΑΙ ΠΡΟΣΜΕΝΕΙ ΤΑΙΣ ΔΕΗΣΕΣΙΝ ΚΑΙ ΤΑΙΣ ΠΡΟΣΕΥΧΑΙΣ ΝΥΚΤΟΣ ΚΑΙ ΗΜΕΡΑΣ
5,6,Η ΔΕ ΣΠΑΤΑΛΩΣΑ ΖΩΣΑ ΤΕΘΝΗΚΕΝ
5,7,ΚΑΙ ΤΑΥΤΑ ΠΑΡΑΓΓΕΛΛΕ ΙΝΑ ΑΝΕΠΙΛΗΜΠΤΟΙ ΩΣΙΝ
5,8,ΕΙ ΔΕ ΤΙΣ ΤΩΝ ΙΔΙΩΝ ΚΑΙ ΜΑΛΙΣΤΑ ΟΙΚΕΙΩΝ ΟΥ ΠΡΟΝΟΕΙ ΤΗΝ ΠΙΣΤΙΝ ΗΡΝΗΤΑΙ ΚΑΙ ΕΣΤΙΝ ΑΠΙΣΤΟΥ ΧΕΙΡΩΝ
5,9,ΧΗΡΑ ΚΑΤΑΛΕΓΕΣΘΩ ΜΗ ΕΛΑΤΤΟΝ ΕΤΩΝ ΕΞΗΚΟΝΤΑ ΓΕΓΟΝΥΙΑ ΕΝΟΣ ΑΝΔΡΟΣ ΓΥΝΗ
5,10,ΕΝ ΕΡΓΟΙΣ ΚΑΛΟΙΣ ΜΑΡΤΥΡΟΥΜΕΝΗ ΕΙ ΕΤΕΚΝΟΤΡΟΦΗΣΕΝ ΕΙ ΕΞΕΝΟΔΟΧΗΣΕΝ ΕΙ ΑΓΙΩΝ ΠΟΔΑΣ ΕΝΙΨΕΝ ΕΙ ΘΛΙΒΟΜΕΝΟΙΣ ΕΠΗΡΚΕΣΕΝ ΕΙ ΠΑΝΤΙ ΕΡΓΩΙ ΑΓΑΘΩΙ ΕΠΗΚΟΛΟΥΘΗΣΕΝ
5,11,ΝΕΩΤΕΡΑΣ ΔΕ ΧΗΡΑΣ ΠΑΡΑΙΤΟΥ ΟΤΑΝ ΓΑΡ ΚΑΤΑΣΤΡΗΝΙΑΣΩΣΙΝ ΤΟΥ ΧΡΙΣΤΟΥ ΓΑΜΕΙΝ ΘΕΛΟΥΣΙΝ
5,12,ΕΧΟΥΣΑΙ ΚΡΙΜΑ ΟΤΙ ΤΗΝ ΠΡΩΤΗΝ ΠΙΣΤΙΝ ΗΘΕΤΗΣΑΝ
5,13,ΑΜΑ ΔΕ ΚΑΙ ΑΡΓΑΙ ΜΑΝΘΑΝΟΥΣΙΝ ΠΕΡΙΕΡΧΟΜΕΝΑΙ ΤΑΣ ΟΙΚΙΑΣ ΟΥ ΜΟΝΟΝ ΔΕ ΑΡΓΑΙ ΑΛΛΑ ΚΑΙ ΦΛΥΑΡΟΙ ΚΑΙ ΠΕΡΙΕΡΓΟΙ ΛΑΛΟΥΣΑΙ ΤΑ ΜΗ ΔΕΟΝΤΑ
5,14,ΒΟΥΛΟΜΑΙ ΟΥΝ ΝΕΩΤΕΡΑΣ ΓΑΜΕΙΝ ΤΕΚΝΟΓΟΝΕΙΝ ΟΙΚΟΔΕΣΠΟΤΕΙΝ ΜΗΔΕΜΙΑΝ ΑΦΟΡΜΗΝ ΔΙΔΟΝΑΙ ΤΩΙ ΑΝΤΙΚΕΙΜΕΝΩΙ ΛΟΙΔΟΡΙΑΣ ΧΑΡΙΝ
5,15,ΗΔΗ ΓΑΡ ΤΙΝΕΣ ΕΞΕΤΡΑΠΗΣΑΝ ΟΠΙΣΩ ΤΟΥ ΣΑΤΑΝΑ
5,16,ΕΙ ΤΙΣ ΠΙΣΤΗ ΕΧΕΙ ΧΗΡΑΣ ΕΠΑΡΚΕΙΤΩ ΑΥΤΑΙΣ ΚΑΙ ΜΗ ΒΑΡΕΙΣΘΩ Η ΕΚΚΛΗΣΙΑ ΙΝΑ ΤΑΙΣ ΟΝΤΩΣ ΧΗΡΑΙΣ ΕΠΑΡΚΕΣΗΙ
5,17,ΟΙ ΚΑΛΩΣ ΠΡΟΕΣΤΩΤΕΣ ΠΡΕΣΒΥΤΕΡΟΙ ΔΙΠΛΗΣ ΤΙΜΗΣ ΑΞΙΟΥΣΘΩΣΑΝ ΜΑΛΙΣΤΑ ΟΙ ΚΟΠΙΩΝΤΕΣ ΕΝ ΛΟΓΩΙ ΚΑΙ ΔΙΔΑΣΚΑΛΙΑΙ
5,18,ΛΕΓΕΙ ΓΑΡ Η ΓΡΑΦΗ ΒΟΥΝ ΑΛΟΩΝΤΑ ΟΥ ΦΙΜΩΣΕΙΣ ΚΑΙ ΑΞΙΟΣ Ο ΕΡΓΑΤΗΣ ΤΟΥ ΜΙΣΘΟΥ ΑΥΤΟΥ
5,19,ΚΑΤΑ ΠΡΕΣΒΥΤΕΡΟΥ ΚΑΤΗΓΟΡΙΑΝ ΜΗ ΠΑΡΑΔΕΧΟΥ ΕΚΤΟΣ ΕΙ ΜΗ ΕΠΙ ΔΥΟ Η ΤΡΙΩΝ ΜΑΡΤΥΡΩΝ
5,20,ΤΟΥΣ ΑΜΑΡΤΑΝΟΝΤΑΣ ΕΝΩΠΙΟΝ ΠΑΝΤΩΝ ΕΛΕΓΧΕ ΙΝΑ ΚΑΙ ΟΙ ΛΟΙΠΟΙ ΦΟΒΟΝ ΕΧΩΣΙΝ
5,21,ΔΙΑΜΑΡΤΥΡΟΜΑΙ ΕΝΩΠΙΟΝ ΤΟΥ ΘΕΟΥ ΚΑΙ ΧΡΙΣΤΟΥ ΙΗΣΟΥ ΚΑΙ ΤΩΝ ΕΚΛΕΚΤΩΝ ΑΓΓΕΛΩΝ ΙΝΑ ΤΑΥΤΑ ΦΥΛΑΞΗΙΣ ΧΩΡΙΣ ΠΡΟΚΡΙΜΑΤΟΣ ΜΗΔΕΝ ΠΟΙΩΝ ΚΑΤΑ ΠΡΟΣΚΛΙΣΙΝ
5,22,ΧΕΙΡΑΣ ΤΑΧΕΩΣ ΜΗΔΕΝΙ ΕΠΙΤΙΘΕΙ ΜΗΔΕ ΚΟΙΝΩΝΕΙ ΑΜΑΡΤΙΑΙΣ ΑΛΛΟΤΡΙΑΙΣ ΣΕΑΥΤΟΝ ΑΓΝΟΝ ΤΗΡΕΙ
5,23,ΜΗΚΕΤΙ ΥΔΡΟΠΟΤΕΙ ΑΛΛΑ ΟΙΝΩΙ ΟΛΙΓΩΙ ΧΡΩ ΔΙΑ ΤΟΝ ΣΤΟΜΑΧΟΝ ΚΑΙ ΤΑΣ ΠΥΚΝΑΣ ΣΟΥ ΑΣΘΕΝΕΙΑΣ
5,24,ΤΙΝΩΝ ΑΝΘΡΩΠΩΝ ΑΙ ΑΜΑΡΤΙΑΙ ΠΡΟΔΗΛΟΙ ΕΙΣΙΝ ΠΡΟΑΓΟΥΣΑΙ ΕΙΣ ΚΡΙΣΙΝ ΤΙΣΙΝ ΔΕ ΚΑΙ ΕΠΑΚΟΛΟΥΘΟΥΣΙΝ
5,25,ΩΣΑΥΤΩΣ ΚΑΙ ΤΑ ΕΡΓΑ ΤΑ ΚΑΛΑ ΠΡΟΔΗΛΑ ΚΑΙ ΤΑ ΑΛΛΩΣ ΕΧΟΝΤΑ ΚΡΥΒΗΝΑΙ ΟΥ ΔΥΝΑΤΑΙ
6,1,ΟΣΟΙ ΕΙΣΙΝ ΥΠΟ ΖΥΓΟΝ ΔΟΥΛΟΙ ΤΟΥΣ ΙΔΙΟΥΣ ΔΕΣΠΟΤΑΣ ΠΑΣΗΣ ΤΙΜΗΣ ΑΞΙΟΥΣ ΗΓΕΙΣΘΩΣΑΝ ΙΝΑ ΜΗ ΤΟ ΟΝΟΜΑ ΤΟΥ ΘΕΟΥ ΚΑΙ Η ΔΙΔΑΣΚΑΛΙΑ ΒΛΑΣΦΗΜΗΤΑΙ
6,2,ΟΙ ΔΕ ΠΙΣΤΟΥΣ ΕΧΟΝΤΕΣ ΔΕΣΠΟΤΑΣ ΜΗ ΚΑΤΑΦΡΟΝΕΙΤΩΣΑΝ ΟΤΙ ΑΔΕΛΦΟΙ ΕΙΣΙΝ ΑΛΛΑ ΜΑΛΛΟΝ ΔΟΥΛΕΥΕΤΩΣΑΝ ΟΤΙ ΠΙΣΤΟΙ ΕΙΣΙΝ ΚΑΙ ΑΓΑΠΗΤΟΙ ΟΙ ΤΗΣ ΕΥΕΡΓΕΣΙΑΣ ΑΝΤΙΛΑΜΒΑΝΟΜΕΝΟΙ ΤΑΥΤΑ ΔΙΔΑΣΚΕ ΚΑΙ ΠΑΡΑΚΑΛΕΙ
6,3,ΕΙ ΤΙΣ ΕΤΕΡΟΔΙΔΑΣΚΑΛΕΙ ΚΑΙ ΜΗ ΠΡΟΣΕΡΧΕΤΑΙ ΥΓΙΑΙΝΟΥΣΙ ΛΟΓΟΙΣ ΤΟΙΣ ΤΟΥ ΚΥΡΙΟΥ ΗΜΩΝ ΙΗΣΟΥ ΧΡΙΣΤΟΥ ΚΑΙ ΤΗΙ ΚΑΤΑ ΕΥΣΕΒΕΙΑΝ ΔΙΔΑΣΚΑΛΙΑΙ
6,4,ΤΕΤΥΦΩΤΑΙ ΜΗΔΕΝ ΕΠΙΣΤΑΜΕΝΟΣ ΑΛΛΑ ΝΟΣΩΝ ΠΕΡΙ ΖΗΤΗΣΕΙΣ ΚΑΙ ΛΟΓΟΜΑΧΙΑΣ ΕΞ ΩΝ ΓΙΝΕΤΑΙ ΦΘΟΝΟΣ ΕΡΙΣ ΒΛΑΣΦΗΜΙΑΙ ΥΠΟΝΟΙΑΙ ΠΟΝΗΡΑΙ
6,5,ΔΙΑΠΑΡΑΤΡΙΒΑΙ ΔΙΕΦΘΑΡΜΕΝΩΝ ΑΝΘΡΩΠΩΝ ΤΟΝ ΝΟΥΝ ΚΑΙ ΑΠΕΣΤΕΡΗΜΕΝΩΝ ΤΗΣ ΑΛΗΘΕΙΑΣ ΝΟΜΙΖΟΝΤΩΝ ΠΟΡΙΣΜΟΝ ΕΙΝΑΙ ΤΗΝ ΕΥΣΕΒΕΙΑΝ
6,6,ΕΣΤΙΝ ΔΕ ΠΟΡΙΣΜΟΣ ΜΕΓΑΣ Η ΕΥΣΕΒΕΙΑ ΜΕΤΑ ΑΥΤΑΡΚΕΙΑΣ
6,7,ΟΥΔΕΝ ΓΑΡ ΕΙΣΗΝΕΓΚΑΜΕΝ ΕΙΣ ΤΟΝ ΚΟΣΜΟΝ ΟΤΙ ΟΥΔΕ ΕΞΕΝΕΓΚΕΙΝ ΤΙ ΔΥΝΑΜΕΘΑ
6,8,ΕΧΟΝΤΕΣ ΔΕ ΔΙΑΤΡΟΦΑΣ ΚΑΙ ΣΚΕΠΑΣΜΑΤΑ ΤΟΥΤΟΙΣ ΑΡΚΕΣΘΗΣΟΜΕΘΑ
6,9,ΟΙ ΔΕ ΒΟΥΛΟΜΕΝΟΙ ΠΛΟΥΤΕΙΝ ΕΜΠΙΠΤΟΥΣΙΝ ΕΙΣ ΠΕΙΡΑΣΜΟΝ ΚΑΙ ΠΑΓΙΔΑ ΚΑΙ ΕΠΙΘΥΜΙΑΣ ΠΟΛΛΑΣ ΑΝΟΗΤΟΥΣ ΚΑΙ ΒΛΑΒΕΡΑΣ ΑΙΤΙΝΕΣ ΒΥΘΙΖΟΥΣΙ ΤΟΥΣ ΑΝΘΡΩΠΟΥΣ ΕΙΣ ΟΛΕΘΡΟΝ ΚΑΙ ΑΠΩΛΕΙΑΝ
6,10,ΡΙΖΑ ΓΑΡ ΠΑΝΤΩΝ ΤΩΝ ΚΑΚΩΝ ΕΣΤΙΝ Η ΦΙΛΑΡΓΥΡΙΑ ΗΣ ΤΙΝΕΣ ΟΡΕΓΟΜΕΝΟΙ ΑΠΕΠΛΑΝΗΘΗΣΑΝ ΑΠΟ ΤΗΣ ΠΙΣΤΕΩΣ ΚΑΙ ΕΑΥΤΟΥΣ ΠΕΡΙΕΠΕΙΡΑΝ ΟΔΥΝΑΙΣ ΠΟΛΛΑΙΣ
6,11,ΣΥ ΔΕ Ω ΑΝΘΡΩΠΕ ΘΕΟΥ ΤΑΥΤΑ ΦΕΥΓΕ ΔΙΩΚΕ ΔΕ ΔΙΚΑΙΟΣΥΝΗΝ ΕΥΣΕΒΕΙΑΝ ΠΙΣΤΙΝ ΑΓΑΠΗΝ ΥΠΟΜΟΝΗΝ ΠΡΑΥΠΑΘΙΑΝ
6,12,ΑΓΩΝΙΖΟΥ ΤΟΝ ΚΑΛΟΝ ΑΓΩΝΑ ΤΗΣ ΠΙΣΤΕΩΣ ΕΠΙΛΑΒΟΥ ΤΗΣ ΑΙΩΝΙΟΥ ΖΩΗΣ ΕΙΣ ΗΝ ΕΚΛΗΘΗΣ ΚΑΙ ΩΜΟΛΟΓΗΣΑΣ ΤΗΝ ΚΑΛΗΝ ΟΜΟΛΟΓΙΑΝ ΕΝΩΠΙΟΝ ΠΟΛΛΩΝ ΜΑΡΤΥΡΩΝ
6,13,ΠΑΡΑΓΓΕΛΛΩ ΣΟΙ ΕΝΩΠΙΟΝ ΤΟΥ ΘΕΟΥ ΤΟΥ ΖΩΙΟΠΟΙΟΥΝΤΟΣ ΤΑ ΠΑΝΤΑ ΚΑΙ ΧΡΙΣΤΟΥ ΙΗΣΟΥ ΤΟΥ ΜΑΡΤΥΡΗΣΑΝΤΟΣ ΕΠΙ ΠΟΝΤΙΟΥ ΠΕΙΛΑΤΟΥ ΤΗΝ ΚΑΛΗΝ ΟΜΟΛΟΓΙΑΝ
6,14,ΤΗΡΗΣΑΙ ΣΕ ΤΗΝ ΕΝΤΟΛΗΝ ΑΣΠΙΛΟΝ ΑΝΕΠΙΛΗΜΠΤΟΝ ΜΕΧΡΙ ΤΗΣ ΕΠΙΦΑΝΕΙΑΣ ΤΟΥ ΚΥΡΙΟΥ ΗΜΩΝ ΙΗΣΟΥ ΧΡΙΣΤΟΥ
6,15,ΗΝ ΚΑΙΡΟΙΣ ΙΔΙΟΙΣ ΔΕΙΞΕΙ Ο ΜΑΚΑΡΙΟΣ ΚΑΙ ΜΟΝΟΣ ΔΥΝΑΣΤΗΣ Ο ΒΑΣΙΛΕΥΣ ΤΩΝ ΒΑΣΙΛΕΥΟΝΤΩΝ ΚΑΙ ΚΥΡΙΟΣ ΤΩΝ ΚΥΡΙΕΥΟΝΤΩΝ
6,16,Ο ΜΟΝΟΣ ΕΧΩΝ ΑΘΑΝΑΣΙΑΝ ΦΩΣ ΟΙΚΩΝ ΑΠΡΟΣΙΤΟΝ ΟΝ ΕΙΔΕΝ ΟΥΔΕΙΣ ΑΝΘΡΩΠΩΝ ΟΥΔΕ ΙΔΕΙΝ ΔΥΝΑΤΑΙ ΩΙ ΤΙΜΗ ΚΑΙ ΚΡΑΤΟΣ ΑΙΩΝΙΟΝ ΑΜΗΝ
6,17,ΤΟΙΣ ΠΛΟΥΣΙΟΙΣ ΕΝ ΤΩΙ ΝΥΝ ΑΙΩΝΙ ΠΑΡΑΓΓΕΛΛΕ ΜΗ ΥΨΗΛΟΦΡΟΝΕΙΝ ΜΗΔΕ ΗΛΠΙΚΕΝΑΙ ΕΠΙ ΠΛΟΥΤΟΥ ΑΔΗΛΟΤΗΤΙ ΑΛΛΑ ΕΠΙ ΘΕΩΙ ΤΩΙ ΠΑΡΕΧΟΝΤΙ ΗΜΙΝ ΠΑΝΤΑ ΠΛΟΥΣΙΩΣ ΕΙΣ ΑΠΟΛΑΥΣΙΝ
6,18,ΑΓΑΘΟΕΡΓΕΙΝ ΠΛΟΥΤΕΙΝ ΕΝ ΕΡΓΟΙΣ ΚΑΛΟΙΣ ΕΥΜΕΤΑΔΟΤΟΥΣ ΕΙΝΑΙ ΚΟΙΝΩΝΙΚΟΥΣ
6,19,ΑΠΟΘΗΣΑΥΡΙΖΟΝΤΑΣ ΕΑΥΤΟΙΣ ΘΕΜΕΛΙΟΝ ΚΑΛΟΝ ΕΙΣ ΤΟ ΜΕΛΛΟΝ ΙΝΑ ΕΠΙΛΑΒΩΝΤΑΙ ΤΗΣ ΟΝΤΩΣ ΖΩΗΣ
6,20,Ω ΤΙΜΟΘΕΕ ΤΗΝ ΠΑΡΑΘΗΚΗΝ ΦΥΛΑΞΟΝ ΕΚΤΡΕΠΟΜΕΝΟΣ ΤΑΣ ΒΕΒΗΛΟΥΣ ΚΕΝΟΦΩΝΙΑΣ ΚΑΙ ΑΝΤΙΘΕΣΕΙΣ ΤΗΣ ΨΕΥΔΩΝΥΜΟΥ ΓΝΩΣΕΩΣ
6,21,ΗΝ ΤΙΝΕΣ ΕΠΑΓΓΕΛΛΟΜΕΝΟΙ ΠΕΡΙ ΤΗΝ ΠΙΣΤΙΝ ΗΣΤΟΧΗΣΑΝ Η ΧΑΡΙΣ ΜΕΤΑ ΥΜΩΝ
